title,url,time,source
“在上海，找到主场！”互联网优质内容创作者如是说,https://www.thepaper.cn/newsDetail_forward_32394080,2026-01-15 13:58:27,澎湃新闻
金龙鱼拟向玛氏中国转让家乐氏上海和家乐氏昆山各50%股权,https://www.thepaper.cn/newsDetail_forward_32393330,2026-01-15 13:55:40,澎湃新闻
上海搭建医企交流平台，推动创新药械更快更好应用于临床,https://www.thepaper.cn/newsDetail_forward_32393818,2026-01-15 13:31:27,澎湃新闻
报告：2025年上海甲级办公楼市场需求逐季递增，2026年供应压力有望边际缓解,https://www.thepaper.cn/newsDetail_forward_32393415,2026-01-15 13:19:02,澎湃新闻
上海28条新政让服务消费更有“含金量”,https://www.thepaper.cn/newsDetail_forward_32393771,2026-01-15 13:05:40,长三角日报
提高人民生活品质，提升宜居安居水平！陈吉宁龚正在奉贤闵行调研城中村改造,https://www.thepaper.cn/newsDetail_forward_32393322,2026-01-15 12:44:08,澎湃新闻
沪剧声声入民心！沪剧大赏陪伴吴淞居民迎新春,https://www.thepaper.cn/newsDetail_forward_32394699,2026-01-15 12:32:00,上海宝山
市场监管总局修订发布《网络市场监管与服务示范区创建管理办法》（附一图读懂）,https://www.thepaper.cn/newsDetail_forward_32394698,2026-01-15 12:32:00,上海宝山
【走进政协•闵行情】你小时候滚过铁环吗？,https://www.thepaper.cn/newsDetail_forward_32394781,2026-01-15 12:20:00,闵行区政协
【委员说】 高科技飞速发展的同时，如何促进就业？,https://www.thepaper.cn/newsDetail_forward_32394780,2026-01-15 12:20:00,闵行区政协
【建证美好 筑梦未来】中建八局短视频大赛优秀作品展播平台上线,https://www.thepaper.cn/newsDetail_forward_32394802,2026-01-15 12:05:00,中建八局
上海长宁：去年人均GDP全市第二，人均公园绿地面积位居中心城区首位,https://www.thepaper.cn/newsDetail_forward_32392705,2026-01-15 11:59:21,澎湃新闻
2025年上海全市二手房市场成交24.4万套,https://www.thepaper.cn/newsDetail_forward_32392756,2026-01-15 11:51:08,东方财经浦东频道
华师大二附中可持续发展项目启动 赋能教育创新发展,https://www.thepaper.cn/newsDetail_forward_32392754,2026-01-15 11:51:07,东方财经浦东频道
令人动容！贺娇龙“最后的告白”,https://www.thepaper.cn/newsDetail_forward_32393342,2026-01-15 11:45:00,青春上海
2026届春运选手们注意啦！这些信息有必要提前知晓！这些服务也请提前准备！,https://www.thepaper.cn/newsDetail_forward_32394679,2026-01-15 11:39:00,市民云
台风生成！上海将迎“坠崖式”降温！降幅超20℃！未来雨雪来袭！,https://www.thepaper.cn/newsDetail_forward_32394677,2026-01-15 11:39:00,市民云
著名书法家张晓明辞世，一生创研书艺，育人不悔 ▸缅怀◂,https://www.thepaper.cn/newsDetail_forward_32393699,2026-01-15 11:38:00,上海文联
喜报！杨浦6人获评上海首批人力资源专业人才高级职称,https://www.thepaper.cn/newsDetail_forward_32393765,2026-01-15 11:31:00,上海杨浦
投资于人 蝶变向新丨上海杨桥十九年，以信赖书写“人力之桥”时代答卷,https://www.thepaper.cn/newsDetail_forward_32393762,2026-01-15 11:31:00,上海杨浦
名中医下沉到农村，泥城镇马厂村卫生室“灸”出圈,https://www.thepaper.cn/newsDetail_forward_32395333,2026-01-15 11:24:00,浦东卫生计生
浦东新区卫生健康工作党委2025年度书记抓基层党建工作述职评议会召开,https://www.thepaper.cn/newsDetail_forward_32395332,2026-01-15 11:24:00,浦东卫生计生
今年第1号台风“洛鞍”已生成！未来上海天气……,https://www.thepaper.cn/newsDetail_forward_32393414,2026-01-15 11:22:00,上海长宁
普陀区举行第32届“蓝天下的至爱”暨社会救助工作成果展示活动,https://www.thepaper.cn/newsDetail_forward_32393649,2026-01-15 11:14:00,上海普陀
今天“上观碰碰头·秋秋不睡午觉”关注养老话题，普陀的答案是……,https://www.thepaper.cn/newsDetail_forward_32393648,2026-01-15 11:14:00,上海普陀
转发收藏！2026年考试日历来了,https://www.thepaper.cn/newsDetail_forward_32393865,2026-01-15 11:05:00,上海海洋大学
吕晨飞当选上海崇明区人民政府区长,https://www.thepaper.cn/newsDetail_forward_32392543,2026-01-15 11:02:35,澎湃新闻
别错过！青浦炙手可热的创业项目，都在这次路演~,https://www.thepaper.cn/newsDetail_forward_32393692,2026-01-15 10:43:00,绿色青浦
定了！2026年长宁区为民办实事项目出炉→,https://www.thepaper.cn/newsDetail_forward_32393412,2026-01-15 10:38:00,上海长宁
网友建议上海轨交22号线延伸至广兰路，市交通委回应,https://www.thepaper.cn/newsDetail_forward_32392475,2026-01-15 10:37:17,澎湃新闻
梅毒又上热搜了？关于梅毒，这些你都要知道｜闵小卫说健康,https://www.thepaper.cn/newsDetail_forward_32394360,2026-01-15 10:36:00,闵行卫生
春运务工人员车票，已启动受理！,https://www.thepaper.cn/newsDetail_forward_32393456,2026-01-15 10:32:00,上铁集团
亮点多多！长三角铁路1月26日起实施新图,https://www.thepaper.cn/newsDetail_forward_32393451,2026-01-15 10:32:00,上铁集团
【安居】110天实现品质跃升，居民声音从未缺席,https://www.thepaper.cn/newsDetail_forward_32393069,2026-01-15 10:32:00,上海住房城乡建设管理
激活虹口开发开放新动能，区领导走访虹口海关,https://www.thepaper.cn/newsDetail_forward_32393393,2026-01-15 10:29:00,上海虹口
这笔补助即将发放，预计惠及约5.6万人次→,https://www.thepaper.cn/newsDetail_forward_32393392,2026-01-15 10:29:00,上海虹口
区情 | 外高桥“丝路电商”朋友圈扩大至20国，全链条服务助力海外优品高效触达消费者,https://www.thepaper.cn/newsDetail_forward_32395303,2026-01-15 10:06:00,投资上海
聚焦 | “上海环球美食汇”带动知名餐饮店客流增幅超20%！,https://www.thepaper.cn/newsDetail_forward_32395302,2026-01-15 10:06:00,投资上海
Shanghai unveils 28 measures to upgrade services and expand demand,https://www.thepaper.cn/newsDetail_forward_32395301,2026-01-15 10:06:00,投资上海
关注 | FORVIA佛瑞亚集团与中国石化资本携手驱动中国氢能产业发展,https://www.thepaper.cn/newsDetail_forward_32395299,2026-01-15 10:06:00,投资上海
一个男孩儿的“蝶变”——心理评估管理系统为迷途少年精准“导航”丨创新工作阶段性成果展示,https://www.thepaper.cn/newsDetail_forward_32392833,2026-01-15 09:59:00,上海宝山检察
“活力虹口、有为青年”——虹口全面推进青年发展型城区建设,https://www.thepaper.cn/newsDetail_forward_32392836,2026-01-15 09:57:00,虹口青年微生活
翰墨飘香迎新春 政协送福暖民心——区政协主席刘豫峰出席写春联送福活动,https://www.thepaper.cn/newsDetail_forward_32395265,2026-01-15 09:43:00,金山区政协
区政协主席刘豫峰赴高新区社区开展“四百”大走访,https://www.thepaper.cn/newsDetail_forward_32395264,2026-01-15 09:43:00,金山区政协
浦东：河道焕彩展新颜，生态宜居绘新篇,https://www.thepaper.cn/newsDetail_forward_32392978,2026-01-15 09:38:00,上海水务海洋
水利部发布2项水利行业标准,https://www.thepaper.cn/newsDetail_forward_32392977,2026-01-15 09:38:00,上海水务海洋
振兴有“医”靠 服务零距离 ——柘林镇政协委员工作站2026年首场健康咨询活动,https://www.thepaper.cn/newsDetail_forward_32395282,2026-01-15 09:34:00,奉贤柘林
奉浦大桥为何要“长高”近9米？答案就在这条大动脉→丨策马“十五五”,https://www.thepaper.cn/newsDetail_forward_32395281,2026-01-15 09:34:00,奉贤柘林
柘林镇举行2026年“蓝天下的至爱”慈善一日捐活动,https://www.thepaper.cn/newsDetail_forward_32395280,2026-01-15 09:34:00,奉贤柘林
今年春节闵行哪里可以放烟花？?,https://www.thepaper.cn/newsDetail_forward_32393535,2026-01-15 09:27:00,警民直通车-闵行
这下好了，跨省“老熟人”再续“缘”,https://www.thepaper.cn/newsDetail_forward_32393534,2026-01-15 09:27:00,警民直通车-闵行
“大零号湾”带头冲刺，闵行南部如何接好“下一棒”？,https://www.thepaper.cn/newsDetail_forward_32393533,2026-01-15 09:27:00,警民直通车-闵行
春节期间，上海郊区这些区域禁止燃放烟花爆竹,https://www.thepaper.cn/newsDetail_forward_32390620,2026-01-15 09:23:55,澎湃新闻
理论应用 | 上海消费者预期“一升一降”：物价升温与利率转向的经济新信号,https://www.thepaper.cn/newsDetail_forward_32392052,2026-01-15 09:20:01,上海统计
上海市崇明区政协原党组副书记、副主席张荣严重违纪违法被开除党籍,https://www.thepaper.cn/newsDetail_forward_32392027,2026-01-15 09:17:33,澎湃新闻
本市召开限额以下小型房建工程安全工作约谈会,https://www.thepaper.cn/newsDetail_forward_32393074,2026-01-15 09:17:00,上海住房城乡建设管理
【聚焦】从算法优化到智慧航运：青年科技工作者王绍函的创新之路——上海建设交通行业东方英才系列专访㉔,https://www.thepaper.cn/newsDetail_forward_32393073,2026-01-15 09:17:00,上海住房城乡建设管理
【一江一河】开建了！苏州河将再添一座人行桥！附近居民：以后方便多了,https://www.thepaper.cn/newsDetail_forward_32393070,2026-01-15 09:17:00,上海住房城乡建设管理
卫健聚焦 | 聚力打造有温度、有韧性的健康虹口！这场通气会倾听代表委员金点子,https://www.thepaper.cn/newsDetail_forward_32395331,2026-01-15 09:16:00,健康虹口
“医”线速递 | 事关2026年“育儿补贴”，已有新手父母中招,https://www.thepaper.cn/newsDetail_forward_32395329,2026-01-15 09:16:00,健康虹口
