title,url,time,source
“清朗浦江·2026”网络生态治理旬邀您携手共筑良好生态,https://www.thepaper.cn/newsDetail_forward_32685502,2026-03-03 01:55:41,澎湃新闻
区卫生健康委召开2026年卫生健康系统后勤工作会议,https://www.thepaper.cn/newsDetail_forward_32898163,2026-04-03 15:00:00,宝山卫生健康
在上海之春提琴展看350年前大师之作，还有中国最早小提琴,https://www.thepaper.cn/newsDetail_forward_32893983,2026-04-03 14:07:44,澎湃新闻
抢抓机遇，奋力再跳，为“老城焕新、新城崛起”多作贡献！区领导调研盈浦街道,https://www.thepaper.cn/newsDetail_forward_32897969,2026-04-03 14:01:00,绿色青浦
@青浦家长，青浦新增爱心科普筛查角，免费筛查孩子生长发育,https://www.thepaper.cn/newsDetail_forward_32897147,2026-04-03 14:01:00,绿色青浦
区人大常委会党组开展树立和践行正确政绩观学习教育集中学习,https://www.thepaper.cn/newsDetail_forward_32896996,2026-04-03 14:01:00,上海虹口
普陀区第35个全国税收宣传月活动启动,https://www.thepaper.cn/newsDetail_forward_32897139,2026-04-03 13:57:00,上海普陀
上海武术队原总教练张福云逝世，享年79岁,https://www.thepaper.cn/newsDetail_forward_32895368,2026-04-03 13:41:45,澎湃新闻
融入社会的成长尝试，孤独症少年横跨上海送面包,https://www.thepaper.cn/newsDetail_forward_32895024,2026-04-03 13:18:47,澎湃新闻
全过程人民民主在虹口㊻ | 深耕养老服务，绘就“人文凉城”幸福底色,https://www.thepaper.cn/newsDetail_forward_32896994,2026-04-03 13:15:00,上海虹口
瑞虹新天地“回春本草集”升级回归，名医问诊、中药美食打造养生消费新场景,https://www.thepaper.cn/newsDetail_forward_32898129,2026-04-03 13:00:00,虹口商务
全力支持高科技企业拔节生长！龚正调研上海先导产业,https://www.thepaper.cn/newsDetail_forward_32896531,2026-04-03 12:21:00,上海市工商联
国务院办公厅印发《关于建立企业信用状况综合评价体系的实施方案》,https://www.thepaper.cn/newsDetail_forward_32896530,2026-04-03 12:21:00,上海市工商联
都用上AI了，阅读还有用吗？——来嘉定听听“大家”怎么说！,https://www.thepaper.cn/newsDetail_forward_32896649,2026-04-03 12:20:00,上海嘉定
愚园路上的这场开放麦，快来参与吧~,https://www.thepaper.cn/newsDetail_forward_32897008,2026-04-03 12:17:00,上海长宁
长江十年禁渔工作推进会在上海召开,https://www.thepaper.cn/newsDetail_forward_32895002,2026-04-03 12:10:01,中国三农发布
上海临港：收到上海证监局行政监管措施决定书,https://www.thepaper.cn/newsDetail_forward_32894739,2026-04-03 12:09:17,澎湃新闻
持续推动国有资本和国有企业做强做优做大！,https://www.thepaper.cn/newsDetail_forward_32896806,2026-04-03 12:06:00,i金山
4月2日福彩开奖公告,https://www.thepaper.cn/newsDetail_forward_32895000,2026-04-03 12:05:02,上海福彩
乐享派奖惊喜 | 上海福彩3D游戏2800万元派奖活动仍在继续,https://www.thepaper.cn/newsDetail_forward_32894999,2026-04-03 12:05:02,上海福彩
双色球第2026036期：上海喜中1注一等奖,https://www.thepaper.cn/newsDetail_forward_32894997,2026-04-03 12:05:01,上海福彩
上海创芯学院启动招聘招生，由上科大、上海交大和复旦共同参与创建,https://www.thepaper.cn/newsDetail_forward_32894321,2026-04-03 11:58:32,澎湃新闻
从传统韩屋到现代公寓，上海展韩国居住文化变迁,https://www.thepaper.cn/newsDetail_forward_32891233,2026-04-03 11:56:36,澎湃新闻
长三角科研院所联盟成员大会在上海举行,https://www.thepaper.cn/newsDetail_forward_32894870,2026-04-03 11:54:53,东方财经浦东频道
探寻中国艺术的精神气韵 上海吴昌硕纪念馆新展开幕,https://www.thepaper.cn/newsDetail_forward_32894814,2026-04-03 11:54:52,东方财经浦东频道
设级而上 潮涌东方2026秋冬上海时装周打造新风尚,https://www.thepaper.cn/newsDetail_forward_32894904,2026-04-03 11:54:44,东方财经浦东频道
闵行部分社区长者食堂营业时间临时调整！,https://www.thepaper.cn/newsDetail_forward_32897601,2026-04-03 11:53:00,今日闵行
上海市委常委会传达学习习近平总书记重要讲话精神，听取市委巡视综合情况汇报,https://www.thepaper.cn/newsDetail_forward_32894673,2026-04-03 11:50:45,澎湃新闻
全球AI治理新闻No.21丨2026.03.23-2026.03.30,https://www.thepaper.cn/newsDetail_forward_32894152,2026-04-03 11:50:38,复旦发展研究院
确保群众的获得感、幸福感和安全感持续增强！区领导在基层开展下访活动,https://www.thepaper.cn/newsDetail_forward_32896661,2026-04-03 11:38:00,上海嘉定
抢抓“十五五”发展机遇，共筑更高水平区校联动新格局！杨浦区人民政府与华东理工大学签订深化战略合作框架协议,https://www.thepaper.cn/newsDetail_forward_32897177,2026-04-03 11:33:00,上海杨浦
当海派中医遇见国际青年：“体验+”开启中医药消费场景共创新篇,https://www.thepaper.cn/newsDetail_forward_32896420,2026-04-03 11:32:00,上海黄浦
守牢安全底线 护航祭扫踏青出行 上海公安全力保障清明假期平稳有序,https://www.thepaper.cn/newsDetail_forward_32896147,2026-04-03 11:30:00,警民直通车上海
国客中心码头临时封闭公告,https://www.thepaper.cn/newsDetail_forward_32896993,2026-04-03 11:27:00,上海虹口
清明踏青需要注意哪些“护关节”的细节？丨一问医答,https://www.thepaper.cn/newsDetail_forward_32897803,2026-04-03 11:25:00,闵行卫生
“让健康成为最大的炫耀”——闵行医生亮相全国爱国卫生月活动现场,https://www.thepaper.cn/newsDetail_forward_32897802,2026-04-03 11:25:00,闵行卫生
从“裙钗大会”到女飞行员，上海女性是怎么一步步走来的,https://www.thepaper.cn/newsDetail_forward_32895839,2026-04-03 11:21:00,上海女性
展会收官！“六业”融合再觅新机遇,https://www.thepaper.cn/newsDetail_forward_32895933,2026-04-03 11:15:00,绿色青浦
【最新】上海地铁双线进展来了！崇明线这条“主动脉”高速贯通！15号线“智能穿江”！,https://www.thepaper.cn/newsDetail_forward_32895966,2026-04-03 11:11:00,市民云
专窃热门玩偶，28人被抓，上海警方披露案情,https://www.thepaper.cn/newsDetail_forward_32895740,2026-04-03 11:09:00,黔微普法 
界别工作丨区政协科技、科协界别联合民建界别开展专题走访调研,https://www.thepaper.cn/newsDetail_forward_32898112,2026-04-03 11:08:00,奉贤区政协
上海发布市管干部任职前公示：徐寅之、刘斌拟任市级机关正职,https://www.thepaper.cn/newsDetail_forward_32894331,2026-04-03 11:03:46,澎湃新闻
清明假期天气如何？高速堵不堵？地铁会延时运营吗？“宁宁”全都为你整理好了→,https://www.thepaper.cn/newsDetail_forward_32897006,2026-04-03 10:51:00,上海长宁
今天，这个主题活动在宋庆龄陵园举行……,https://www.thepaper.cn/newsDetail_forward_32897005,2026-04-03 10:51:00,上海长宁
垃圾去哪儿了？长宁居民沉浸式探秘→,https://www.thepaper.cn/newsDetail_forward_32895787,2026-04-03 10:51:00,上海长宁
长途南站：共发送扫墓班线25班，临时加开热门方向班次,https://www.thepaper.cn/newsDetail_forward_32897229,2026-04-03 10:35:00,上海徐汇
充电宝新国标，来了！,https://www.thepaper.cn/newsDetail_forward_32897228,2026-04-03 10:35:00,上海徐汇
交响颂英烈，徐汇巾帼思政活动传承红色基因,https://www.thepaper.cn/newsDetail_forward_32897227,2026-04-03 10:35:00,上海徐汇
全面依法治区，金山这样干！,https://www.thepaper.cn/newsDetail_forward_32896805,2026-04-03 10:33:00,i金山
春风清明忆英烈，匠心手作传文明,https://www.thepaper.cn/newsDetail_forward_32897205,2026-04-03 10:29:00,上海静安
中化国际党委召开树立和践行正确政绩观学习教育工作推进会,https://www.thepaper.cn/newsDetail_forward_32897182,2026-04-03 10:21:00,中化国际
谁家汽车飞上天了？上海金桥镇这个标志性雕塑回归有什么变化,https://www.thepaper.cn/newsDetail_forward_32893950,2026-04-03 10:20:53,澎湃新闻
清明寻忠魂·丹心忆薪火，这场沉浸式情景剧只想让我们记得……,https://www.thepaper.cn/newsDetail_forward_32897056,2026-04-03 10:16:00,上海市莘庄工业区
请为闵行的好人打call?,https://www.thepaper.cn/newsDetail_forward_32897055,2026-04-03 10:16:00,上海市莘庄工业区
连坤明带队走访上海证券交易所,https://www.thepaper.cn/newsDetail_forward_32895782,2026-04-03 10:15:00,湖州发布
早筛早康，守护星光——上海市儿童青少年“五健”促进行动计划启动暨世界孤独症日宣传活动顺利举办,https://www.thepaper.cn/newsDetail_forward_32895621,2026-04-03 10:13:00,健康上海
报名进行时，精彩抢先看！上海乒乓球嘉年华等你来赛,https://www.thepaper.cn/newsDetail_forward_32894239,2026-04-03 10:12:18,澎湃新闻
99%的人没见过！当樱花穿上高定，整个春天都高级了,https://www.thepaper.cn/newsDetail_forward_32895589,2026-04-03 10:12:00,上海黄浦
不负春光品新茶，喝对才是真养人,https://www.thepaper.cn/newsDetail_forward_32896580,2026-04-03 10:04:00,青浦卫计新声
复旦-ZEW中国经济调查第150期报告解读：新质领跑、内需偏弱、区域深度分化,https://www.thepaper.cn/newsDetail_forward_32894101,2026-04-03 09:58:04,复旦发展研究院
孙立坚：能源命脉被扼，政策药方失灵 ——日本金融市场震荡的深层逻辑,https://www.thepaper.cn/newsDetail_forward_32894024,2026-04-03 09:57:17,复旦发展研究院
