title,url,time,source
又签三年战略协议！凯迪拉克继续冠名上海音乐厅,https://www.thepaper.cn/newsDetail_forward_32441154,2026-01-22 15:14:48,澎湃新闻
聚焦全会｜王华与委员面对面交流，协商共议进一步推动科技创新成果转化落地，打造高质量发展强劲增长极,https://www.thepaper.cn/newsDetail_forward_32445492,2026-01-22 15:06:00,徐汇区政协
聚焦全会｜会议速览：常委会会议、主席会议、现场咨询…今日大会亮点纷呈，来看→,https://www.thepaper.cn/newsDetail_forward_32445491,2026-01-22 15:06:00,徐汇区政协
中国总领馆提醒：上海没有浦西区,https://www.thepaper.cn/newsDetail_forward_32445162,2026-01-22 15:01:00,环球时报
薪无忧，冬安康，黄浦法援为农民工权益护航,https://www.thepaper.cn/newsDetail_forward_32445201,2026-01-22 14:52:00,上海市司法局
“咨询窗口”搬进会场，代表委员与政府部门面对面,https://www.thepaper.cn/newsDetail_forward_32444827,2026-01-22 14:01:00,上海徐汇
王华与委员面对面交流，协商共议进一步推动科技创新成果转化落地，打造高质量发展强劲增长极,https://www.thepaper.cn/newsDetail_forward_32444823,2026-01-22 14:01:00,上海徐汇
这项税费优惠政策将延续至2027年底！,https://www.thepaper.cn/newsDetail_forward_32444822,2026-01-22 14:01:00,上海徐汇
激发文化活力 为打造国际文化大都市注入“创新活水”,https://www.thepaper.cn/newsDetail_forward_32444821,2026-01-22 14:01:00,上海徐汇
上海首提打造“入境消费第一城”，底气是什么？新招有哪些？,https://www.thepaper.cn/newsDetail_forward_32443200,2026-01-22 13:55:47,澎湃新闻
话剧《无墙》今日首演｜你为什么不回家？,https://www.thepaper.cn/newsDetail_forward_32444578,2026-01-22 13:41:00,上海话剧艺术中心
89万涉企纠纷，如何高效化解？,https://www.thepaper.cn/newsDetail_forward_32445200,2026-01-22 13:40:00,上海市司法局
融媒会客厅｜政协委员俞俊：强化科技赋能，增强城市安全韧性,https://www.thepaper.cn/newsDetail_forward_32445014,2026-01-22 13:35:58,宝山区政协
为宝山奋力打造新时代现代化转型样本作出更大贡献！区政协九届六次会议期间共收到提案217件,https://www.thepaper.cn/newsDetail_forward_32445013,2026-01-22 13:35:58,宝山区政协
融媒会客厅｜政协委员黄东：以法治之笔，绘就基层治理新蓝图,https://www.thepaper.cn/newsDetail_forward_32445012,2026-01-22 13:35:58,宝山区政协
2026年上海市科技创新工作推进会暨市科技系统党政负责干部会召开,https://www.thepaper.cn/newsDetail_forward_32445276,2026-01-22 13:30:00,上海科技
代表委员说｜区政协委员李双：锚定创新生态，深耕人才服务,https://www.thepaper.cn/newsDetail_forward_32444828,2026-01-22 13:28:00,上海徐汇
代表委员说｜区人大代表钱晓雍：以AI创新与生态治理，勾勒徐汇绿色发展路径,https://www.thepaper.cn/newsDetail_forward_32444826,2026-01-22 13:28:00,上海徐汇
刘健在朱泾镇开展“四百”大走访,https://www.thepaper.cn/newsDetail_forward_32445324,2026-01-22 13:26:00,i金山
缅北之旅：生死逃亡路,https://www.thepaper.cn/newsDetail_forward_32445202,2026-01-22 13:20:00,上海市司法局
速来围观！浦东法院这些案例上央媒啦,https://www.thepaper.cn/newsDetail_forward_32445422,2026-01-22 13:06:06,上海浦东法院
单次20吨发酵“拯救”3000头鲨鱼！生物制造注入“中国芯”,https://www.thepaper.cn/newsDetail_forward_32444057,2026-01-22 13:05:00,华东理工大学
【政策】《浦东新区推进张江人工智能创新小镇建设工作方案》印发,https://www.thepaper.cn/newsDetail_forward_32444505,2026-01-22 13:04:00,投资上海Invest Shanghai
【热点】2026临港科创城大会成功举行,https://www.thepaper.cn/newsDetail_forward_32444256,2026-01-22 13:04:00,投资上海Invest Shanghai
【区域】航贸数字化场景建设、超高清视听产业发展现场推进会举行,https://www.thepaper.cn/newsDetail_forward_32444255,2026-01-22 13:04:00,投资上海Invest Shanghai
产融携手筑未来 ——“投资上海”重点项目产融对接会成功召开（未来产业领域专场）,https://www.thepaper.cn/newsDetail_forward_32444254,2026-01-22 13:04:00,投资上海Invest Shanghai
微信看电视丨2026年1月22日《嘉定新闻》,https://www.thepaper.cn/newsDetail_forward_32445124,2026-01-22 13:03:00,上海嘉定
一场庭审、一份指引、一次对话……黄浦涉外知产保护再升级！,https://www.thepaper.cn/newsDetail_forward_32444798,2026-01-22 13:00:00,上海黄浦
明天起，来上海汽车博览公园赶一场年味大集,https://www.thepaper.cn/newsDetail_forward_32445125,2026-01-22 12:45:00,上海嘉定
产城融合再进一步！嘉定汽车芯片设计产业园二期年内建成,https://www.thepaper.cn/newsDetail_forward_32445122,2026-01-22 12:45:00,上海嘉定
浦东政协开展现场咨询活动 幸福观察员小提案实现“落地”,https://www.thepaper.cn/newsDetail_forward_32442595,2026-01-22 12:37:01,东方财经浦东频道
吴金城参加川沙新镇代表团审议时强调 民之所向 政必有为,https://www.thepaper.cn/newsDetail_forward_32442568,2026-01-22 12:36:48,东方财经浦东频道
李政参加张江镇 合庆镇代表团审议  干字当头奋力再跳 为全国全市发展大局作出浦东贡献,https://www.thepaper.cn/newsDetail_forward_32442512,2026-01-22 12:35:55,东方财经浦东频道
一起闯关，解锁理性购彩防骗技能,https://www.thepaper.cn/newsDetail_forward_32440874,2026-01-22 12:30:09,上海福彩
上海美术馆展出130余件曾成钢雕塑作品,https://www.thepaper.cn/newsDetail_forward_32439469,2026-01-22 12:18:17,澎湃新闻
一图了解2025年度上海市普陀区人民法院工作报告,https://www.thepaper.cn/newsDetail_forward_32444900,2026-01-22 12:10:56,上海市普陀区人民法院
您关心的事，福彩快问快答 | 彩票资金的构成,https://www.thepaper.cn/newsDetail_forward_32440865,2026-01-22 12:03:27,上海福彩
闵行这家医院，入选减重“国家队”！,https://www.thepaper.cn/newsDetail_forward_32445304,2026-01-22 11:48:34,今日闵行
喜欢边洗澡边唱歌的注意了！,https://www.thepaper.cn/newsDetail_forward_32442960,2026-01-22 11:46:00,青春上海
巨幅春联已挂上！明天开始，年味隔空投送，网友纷纷晒图，迫不及待了！,https://www.thepaper.cn/newsDetail_forward_32444803,2026-01-22 11:40:00,上海黄浦
市林业总站第三期“绿动思享会”开讲 青年英才共探林业“兴业”新路径,https://www.thepaper.cn/newsDetail_forward_32445346,2026-01-22 11:39:00,上海林业
上海并无浦西区！中国驻珀斯总领馆发布提醒,https://www.thepaper.cn/newsDetail_forward_32443546,2026-01-22 11:39:00,甘肃发布
舒适诊疗，从“无痛”开始——浦东新区老年医院打造有温度的医院,https://www.thepaper.cn/newsDetail_forward_32443949,2026-01-22 11:36:00,浦东卫生计生
蒋蕊当选上海虹口区区长，马玮玮当选虹口区检察院检察长,https://www.thepaper.cn/newsDetail_forward_32441894,2026-01-22 11:27:18,澎湃新闻
各地动态丨上海海事局全力应对连续冬雾强风天气,https://www.thepaper.cn/newsDetail_forward_32443607,2026-01-22 11:27:00,中国海事
上海并无浦西区！中国驻珀斯总领馆发布提醒,https://www.thepaper.cn/newsDetail_forward_32443650,2026-01-22 11:25:00,央视网
上海这个区以科创支撑GDP破四千亿元，区长：继续加快成果转化,https://www.thepaper.cn/newsDetail_forward_32441576,2026-01-22 11:22:26,澎湃新闻
“新家”示范项目｜以心筑家，让城市建设者暖心安居——金山卫公寓“新时代城市建设者管理者之家”,https://www.thepaper.cn/newsDetail_forward_32445340,2026-01-22 11:21:12,上海住房城乡建设管理
【聚焦】践行供水人初心使命 守护上海市民饮水健康——上海建设交通行业东方英才系列专访㉖,https://www.thepaper.cn/newsDetail_forward_32445339,2026-01-22 11:21:12,上海住房城乡建设管理
多区低温&霜冻预警，下周有两场雨,https://www.thepaper.cn/newsDetail_forward_32445253,2026-01-22 11:03:16,上海水务海洋
50万元已入账，我怎么还是被骗了？,https://www.thepaper.cn/newsDetail_forward_32443519,2026-01-22 11:03:00,警民直通车上海
大会发言（八）丨区工商联：关于“十五五”期间推动静安区民营经济高质量发展的建议,https://www.thepaper.cn/newsDetail_forward_32445490,2026-01-22 10:43:27,静安区政协
大会发言（五）丨农工党：打造科技与消费深度融合的新场景，提升“美创静界”成果市场转化率,https://www.thepaper.cn/newsDetail_forward_32445489,2026-01-22 10:43:27,静安区政协
华东师大获12项市级荣誉，有没有你的辅导员？,https://www.thepaper.cn/newsDetail_forward_32444651,2026-01-22 10:26:00,华东师范大学
去年上海接待入境游客量创新高，韩国、泰国、俄罗斯游客增长明显,https://www.thepaper.cn/newsDetail_forward_32441200,2026-01-22 10:15:55,澎湃新闻
上海江浦路街道2026年重点企业新春恳谈会召开,https://www.thepaper.cn/newsDetail_forward_32441585,2026-01-22 10:10:53,澎湃上海
涉企行政检查 | 中国青年报：全国涉企行政检查总量下降逾三成 检查精准度大幅提升,https://www.thepaper.cn/newsDetail_forward_32444090,2026-01-22 10:10:00,虹口区司法局
刘其龙参加政协委员分组讨论,https://www.thepaper.cn/newsDetail_forward_32443248,2026-01-22 10:09:00,上海松江
赵汝青参加佘山代表团审议,https://www.thepaper.cn/newsDetail_forward_32443244,2026-01-22 10:09:00,上海松江
上海外国语大学召开年度校领导班子民主生活会,https://www.thepaper.cn/newsDetail_forward_32444041,2026-01-22 10:08:00,上海外国语大学
