title,url,time,source
跨越山海，只为银龄课堂更精彩​——宁夏老年大学教师首次跨省赴沪研修侧记,https://www.thepaper.cn/newsDetail_forward_33348404,2026-06-10 03:10:21,华兴时报
上海市政府发布会丨介绍2026陆家嘴论坛有关情况,https://www.thepaper.cn/newsDetail_forward_33348076,2026-06-10 02:54:43,澎湃新闻
曾国藩李鸿章康有为用过的墨在上海展出,https://www.thepaper.cn/newsDetail_forward_33324678,2026-06-10 02:46:44,澎湃新闻
从实验室分子到消费者面霜，上海静安如何突破美妆产业壁垒？,https://www.thepaper.cn/newsDetail_forward_33348071,2026-06-10 02:44:58,澎湃新闻
黄晓明“二战”上戏博士，以总成绩271.34分上岸,https://www.thepaper.cn/newsDetail_forward_33348073,2026-06-10 02:33:14,澎湃新闻
上海市铸牢中华民族共同体意识主题宣传活动暨2026年上海市民族宗教政策法规宣传学习月启动,https://www.thepaper.cn/newsDetail_forward_33347818,2026-06-10 02:15:07,澎湃新闻
上海公安新媒体2026年5月佳作展示,https://www.thepaper.cn/newsDetail_forward_33348383,2026-06-10 02:00:00,警民直通车上海
财晓得丨美妆行业的“壁垒”，谁在突破？,https://www.thepaper.cn/newsDetail_forward_33303125,2026-06-10 01:57:29,澎湃新闻
黄晓明上戏考博“上岸”，大学对所有终身学习者敞开大门,https://www.thepaper.cn/newsDetail_forward_33344691,2026-06-10 01:37:42,澎湃新闻
黄晓明二战上戏博士，上岸！,https://www.thepaper.cn/newsDetail_forward_33341922,2026-06-10 01:31:51,澎湃新闻
探讨新使命与全球治理新作为，“上海合作组织25周年”国际学术研讨会在沪举行,https://www.thepaper.cn/newsDetail_forward_33344428,2026-06-10 01:25:26,澎湃新闻
排查隐患风险 筑牢平安防线 | 金山区住房保障事务中心开展保租房项目防汛防台专项检查,https://www.thepaper.cn/newsDetail_forward_33347997,2026-06-10 01:05:00,上海房管
宝山区房管局召开区住宅老旧电梯更新工作培训会,https://www.thepaper.cn/newsDetail_forward_33347996,2026-06-10 01:05:00,上海房管
魔都眼｜上博“肇兴中国”特展：328套文物还原秦大一统之路,https://www.thepaper.cn/newsDetail_forward_33344132,2026-06-10 00:43:14,澎湃新闻
B站关联公司上海幻电信息科技被列为被执行人，执行标的16.2万元,https://www.thepaper.cn/newsDetail_forward_33347536,2026-06-10 00:30:01,东烽财经
患者重获“新”声，费用更加普惠！徐汇这家医院听力重建诊疗领域实现新突破,https://www.thepaper.cn/newsDetail_forward_33347762,2026-06-10 00:08:00,上海徐汇
上海公安治安部门为2026年高考保驾护航,https://www.thepaper.cn/newsDetail_forward_33347748,2026-06-10 00:01:00,警民直通车上海
设施升级精准治堵，奉贤12处路口新设提示牌规范非机动车左转通行,https://www.thepaper.cn/newsDetail_forward_33347753,2026-06-10 00:00:00,上海奉贤
近60万粉丝的B站UP主竟然在青浦做这些？,https://www.thepaper.cn/newsDetail_forward_33347741,2026-06-10 00:00:00,绿色青浦
人民日报关注：上海持续改造提升“一江一河”沿线公共空间,https://www.thepaper.cn/newsDetail_forward_33346941,2026-06-09 23:36:50,澎湃新闻
更年期别硬扛！松江这位社区医生帮女性从容度过人生关键期,https://www.thepaper.cn/newsDetail_forward_33347511,2026-06-09 22:30:00,上海松江
早安杨浦 | 重回30℃+！下一场雨在什么时候？,https://www.thepaper.cn/newsDetail_forward_33347242,2026-06-09 22:30:00,上海杨浦
早安青浦丨“文化DNA”已觉醒，去触摸时光留下的温度吧～,https://www.thepaper.cn/newsDetail_forward_33347740,2026-06-09 22:00:00,绿色青浦
现场丨“虽有荣观，燕处超然”，高考结束遇见有爱的上海家庭,https://www.thepaper.cn/newsDetail_forward_33345383,2026-06-09 14:46:51,澎湃新闻
普陀区召开2026年精神文明建设工作会议暨专项工作机制全体会议,https://www.thepaper.cn/newsDetail_forward_33345527,2026-06-09 14:11:00,上海普陀
“中东-上海”双向投资开辟新通道，一批合作平台在东方枢纽落地,https://www.thepaper.cn/newsDetail_forward_33344953,2026-06-09 14:04:21,澎湃新闻
2026“我的铁路风景——坐着高铁游长三角”诗歌、游记、摄影、短视频作品大赛第一期优秀作品展示,https://www.thepaper.cn/newsDetail_forward_33345083,2026-06-09 13:59:18,澎湃新闻
上海垣信首颗手机直连试验星成功发射,https://www.thepaper.cn/newsDetail_forward_33345958,2026-06-09 13:42:00,上海松江
“爱与未来·梦起航”第三届儿童戏剧邀请展在黄浦剧场启幕,https://www.thepaper.cn/newsDetail_forward_33345957,2026-06-09 13:34:00,上海黄浦
上海高考收官：考生聊起考后规划，同窗专程赶来送祝福,https://www.thepaper.cn/newsDetail_forward_33344427,2026-06-09 13:30:51,澎湃新闻
健康问题都能问！青浦学生身边多了位“医生朋友”,https://www.thepaper.cn/newsDetail_forward_33346155,2026-06-09 13:25:00,绿色青浦
2026年上海高考成绩6月23日公布！招生系列咨询活动即将开始,https://www.thepaper.cn/newsDetail_forward_33346158,2026-06-09 12:48:00,绿色青浦
上海2026年高中学业水平等级考成绩明天18点可查！,https://www.thepaper.cn/newsDetail_forward_33346154,2026-06-09 12:48:00,绿色青浦
4+1！上海司法行政“三微”大赛获奖！,https://www.thepaper.cn/newsDetail_forward_33344814,2026-06-09 12:44:00,上海市司法局
五百秦文物恢宏呈现，上博大展追问“秦大一统”之路,https://www.thepaper.cn/newsDetail_forward_33342992,2026-06-09 12:35:09,澎湃新闻
档案与时代同行 浦东新区国际档案日主题活动举行,https://www.thepaper.cn/newsDetail_forward_33343796,2026-06-09 12:25:48,东方财经浦东频道
莫兰迪《静物》上海开箱：这是他独有的灰与白,https://www.thepaper.cn/newsDetail_forward_33343831,2026-06-09 12:09:19,澎湃新闻
防汛备汛工作 | 松江区房管局开展房管系统防汛防台专项检查,https://www.thepaper.cn/newsDetail_forward_33346424,2026-06-09 11:59:00,上海防汛
书记区长查防汛 | 金山区主要领导检查防汛防台工作,https://www.thepaper.cn/newsDetail_forward_33346422,2026-06-09 11:59:00,上海防汛
防汛备汛工作 | 浦东新区防汛办开展应急物资储备中心库工地防汛检查,https://www.thepaper.cn/newsDetail_forward_33346421,2026-06-09 11:59:00,上海防汛
上海“潦草小狗”，AI版夏装提前泄“绿”了  ,https://www.thepaper.cn/newsDetail_forward_33343101,2026-06-09 11:52:31,澎湃新闻
日喀则在上技所实现技术贸易首单！从买乐器到授技能再到转要素，一把扎念琴背后的沪藏“双向奔赴”,https://www.thepaper.cn/newsDetail_forward_33344206,2026-06-09 11:46:00,上海援藏
“让乡村孩子被点亮”，这项乡村教师科教赋能项目又有新动作,https://www.thepaper.cn/newsDetail_forward_33342505,2026-06-09 11:28:49,澎湃上海
秦文物集结上海，彩绘俑头、商鞅方升展出,https://www.thepaper.cn/newsDetail_forward_33342983,2026-06-09 11:21:05,澎湃新闻
擦亮“时尚消费”名片，这场重磅活动在长宁举办,https://www.thepaper.cn/newsDetail_forward_33345929,2026-06-09 11:20:00,上海长宁
一图读懂丨《上海市人民防空工程建设管理从业主体系列合规指引（2026版）》,https://www.thepaper.cn/newsDetail_forward_33343812,2026-06-09 11:19:00,上海国防动员
金融惠企百业兴！宝山区持续优化融资信用服务,https://www.thepaper.cn/newsDetail_forward_33345540,2026-06-09 11:05:00,上海宝山
双向8快2慢，青浦这座桥迎来新进展！,https://www.thepaper.cn/newsDetail_forward_33346157,2026-06-09 11:01:00,绿色青浦
草坪音乐会+篝火，大小朋友在青浦这里玩嗨啦！,https://www.thepaper.cn/newsDetail_forward_33346156,2026-06-09 11:01:00,绿色青浦
聚焦院前急救，闵行区携手上海健康医学院，打造医工融合新样板,https://www.thepaper.cn/newsDetail_forward_33343837,2026-06-09 10:56:00,闵行卫生
莫兰迪大展上海开箱：安静的瓶子与窗外的风景,https://www.thepaper.cn/newsDetail_forward_33340183,2026-06-09 10:45:34,澎湃新闻
第31个全国“爱眼日”上海市儿童青少年眼健康主题活动顺利举办,https://www.thepaper.cn/newsDetail_forward_33347030,2026-06-09 10:42:00,浦东卫生计生
看演唱会、换身份证、学新技能，来看看高考考生的愿望清单,https://www.thepaper.cn/newsDetail_forward_33342655,2026-06-09 10:33:21,澎湃新闻
世界海洋日丨“沪水云课堂” 全国海洋宣传日特辑上线啦！快来参与答题，了解海洋知识～,https://www.thepaper.cn/newsDetail_forward_33343511,2026-06-09 10:33:00,上海水务海洋
上海市政府发布一组人事任免信息：吕南停任市政府办公厅副主任,https://www.thepaper.cn/newsDetail_forward_33342659,2026-06-09 10:16:34,澎湃新闻
上海政协之友社开展庆祝中国共产党成立105周年活动，赵雯出席,https://www.thepaper.cn/newsDetail_forward_33346412,2026-06-09 10:15:00,九三学社上海市委
外商 | 《外企聊营商》强生：选择上海，一台高速运转的创新引擎,https://www.thepaper.cn/newsDetail_forward_33346416,2026-06-09 10:00:00,投资上海
【“免”去奔波， “陪”伴在身边】宝山区免陪照护服务惠民纪实（五）,https://www.thepaper.cn/newsDetail_forward_33345529,2026-06-09 10:00:00,宝山卫生健康
和谐用工，法治护航！上海普陀法院联动多部门筑牢劳资“平安线”,https://www.thepaper.cn/newsDetail_forward_33344818,2026-06-09 10:00:00,上海市普陀区人民法院
探访上海绿色化工与工业催化全国重点实验室：分子筛何以撬动万亿级化工产业,https://www.thepaper.cn/newsDetail_forward_33343493,2026-06-09 10:00:00,上海科技
