title,url,time,source
“清朗浦江·2026”网络生态治理旬邀您携手共筑良好生态,https://www.thepaper.cn/newsDetail_forward_32685502,2026-03-03 01:55:41,澎湃新闻
双色球今晚开奖，奖池17.99亿余元,https://www.thepaper.cn/newsDetail_forward_32987018,2026-04-16 13:35:01,上海福彩
应长明出任中共上海市金融工作委员会副书记,https://www.thepaper.cn/newsDetail_forward_32986691,2026-04-16 13:19:50,澎湃新闻
区领导接待上海银行党委书记、董事长顾建忠一行,https://www.thepaper.cn/newsDetail_forward_32987099,2026-04-16 13:11:00,上海奉贤
为实现高水平科技自立自强贡献上海力量！龚正调研在沪国家重大科技基础设施,https://www.thepaper.cn/newsDetail_forward_32987189,2026-04-16 13:10:00,上海科技
微信看电视丨2026年4月16日《嘉定新闻》,https://www.thepaper.cn/newsDetail_forward_32987526,2026-04-16 13:03:00,上海嘉定
为实现高水平科技自立自强贡献上海力量！龚正调研在沪国家重大科技基础设施,https://www.thepaper.cn/newsDetail_forward_32986760,2026-04-16 12:57:30,澎湃新闻
免签红利引爆客流，上海入境游“热浪”来袭,https://www.thepaper.cn/newsDetail_forward_32986617,2026-04-16 12:30:02,长三角日报
胡俊峰带队走访上海外服（江西）人力资源服务有限公司,https://www.thepaper.cn/newsDetail_forward_32988060,2026-04-16 12:27:00,大美东太湖
2025年上海市法治为民办实事项目纪实：《人民城市 法治守护》,https://www.thepaper.cn/newsDetail_forward_32987108,2026-04-16 12:15:00,上海市司法局
园林艺术延续40年友城情，上海国际花卉节“汉堡园”正式揭幕,https://www.thepaper.cn/newsDetail_forward_32985831,2026-04-16 12:00:34,澎湃新闻
“汽车智能网联技术创新联合体”在金桥启动 浦东金杨立足产业定位 持续优化营商环境,https://www.thepaper.cn/newsDetail_forward_32986206,2026-04-16 11:59:23,东方财经浦东频道
巴斯夫创迈思赋能“上海硅巷”！这场技术交流会在长宁举行,https://www.thepaper.cn/newsDetail_forward_32987051,2026-04-16 11:59:00,上海长宁
花粉飞絮惹人恼，科学防护享春光丨上海健康播报,https://www.thepaper.cn/newsDetail_forward_32987852,2026-04-16 11:44:00,闵行卫生
上海地铁22号线（崇明线）首列车下线，设计时速120公里,https://www.thepaper.cn/newsDetail_forward_32985822,2026-04-16 11:06:34,澎湃新闻
旋转木马、情绪花园……上海市中心这场花展把治愈和浪漫拉满,https://www.thepaper.cn/newsDetail_forward_32985452,2026-04-16 10:55:15,澎湃新闻
观澜书香｜集聚功能优势 打造国际航空城——浦东新区政协观澜书香“月月讲”活动举行,https://www.thepaper.cn/newsDetail_forward_32988494,2026-04-16 10:30:00,浦东新区政协
防汛备汛工作 | 嘉定区防汛办检查排水队伍,https://www.thepaper.cn/newsDetail_forward_32987046,2026-04-16 09:48:00,上海防汛
“医”线速递 | 虹口这两家社卫中心将开设夜间门诊服务！提供哪些服务？来看→,https://www.thepaper.cn/newsDetail_forward_32986986,2026-04-16 09:38:00,健康虹口
孙立坚：从上海物价“温差”看经济变局与新动能突围,https://www.thepaper.cn/newsDetail_forward_32985435,2026-04-16 09:30:28,复旦发展研究院
刚刚，上海气象台紧急提醒！上海人赶紧回家,https://www.thepaper.cn/newsDetail_forward_32985464,2026-04-16 09:30:00,市民云
叶卫东任上海建工集团党委书记，并提名任董事长,https://www.thepaper.cn/newsDetail_forward_32985444,2026-04-16 09:18:13,澎湃新闻
“国央企+大厂”直聘！徐汇就业集市等你来！,https://www.thepaper.cn/newsDetail_forward_32986450,2026-04-16 09:18:00,上海徐汇
面对面“把脉”，徐汇法院“知产问诊室”为企业定制“法律锦囊”,https://www.thepaper.cn/newsDetail_forward_32986446,2026-04-16 09:18:00,上海徐汇
专委动态｜区政协社法委赴长宁区开展课题调研活动,https://www.thepaper.cn/newsDetail_forward_32987358,2026-04-16 09:12:00,徐汇区政协
2026年3月份70城房价出炉！,https://www.thepaper.cn/newsDetail_forward_32985423,2026-04-16 09:10:01,上海统计
上海中心气象台紧急提醒！晚高峰有点难了……,https://www.thepaper.cn/newsDetail_forward_32986036,2026-04-16 09:05:00,上海黄浦
一次上门同步办结两件事！松江首个消防验收和开业检查“协同办理”项目落地,https://www.thepaper.cn/newsDetail_forward_32986048,2026-04-16 09:00:00,上海松江
一场理“响”接力，让青春之声在校园回响,https://www.thepaper.cn/newsDetail_forward_32985139,2026-04-16 08:46:36,澎湃上海
民建上海市委、上海天使会联合打造的“天使投资 青创引擎”第五期顺利举办,https://www.thepaper.cn/newsDetail_forward_32986552,2026-04-16 08:29:00,民建上海市委
【提示】2026年上海市初中学业水平考试英语听说测试线上模拟练习平台即将开通,https://www.thepaper.cn/newsDetail_forward_32985555,2026-04-16 08:22:00,上海普陀
【一江一河】锚定世界级滨水区，上海徐汇滨江“十五五”新蓝图已定,https://www.thepaper.cn/newsDetail_forward_32985597,2026-04-16 08:06:00,上海住房城乡建设管理
2026年上海市海绵城市建设工作部署会召开,https://www.thepaper.cn/newsDetail_forward_32985596,2026-04-16 08:06:00,上海住房城乡建设管理
农工党上海市委文化体育工作委员会赴青浦调研,https://www.thepaper.cn/newsDetail_forward_32985738,2026-04-16 08:02:00,农工党上海市委
超全剧透！持续23天！全上海人都在围观，人流即将涌入……,https://www.thepaper.cn/newsDetail_forward_32986322,2026-04-16 08:00:00,上海女性
上海男子点麦当劳汉堡一口咬到生鸡肉 涉事餐厅：纯属意外，已赔偿消费者1000元,https://www.thepaper.cn/newsDetail_forward_32984780,2026-04-16 07:50:46,信网
27个教学点、47门课程，崇明市民艺术夜校春季班火热开课,https://www.thepaper.cn/newsDetail_forward_32986051,2026-04-16 07:49:00,上海崇明
2026年崇明西沙明珠湖观鸟挑战赛参赛队伍抽签结果出炉,https://www.thepaper.cn/newsDetail_forward_32985268,2026-04-16 07:49:00,上海崇明
阅读走进街头巷尾，百余场活动点亮首个“全民阅读活动周”,https://www.thepaper.cn/newsDetail_forward_32984535,2026-04-16 07:40:30,澎湃新闻
67天生命接力！复旦大学附属金山医院以“五指相扣”诠释医患守望的力量丨医患同心真情故事,https://www.thepaper.cn/newsDetail_forward_32985306,2026-04-16 07:40:00,健康上海
为什么要选择黄浦的幼儿园？,https://www.thepaper.cn/newsDetail_forward_32985264,2026-04-16 07:39:00,上海黄浦
戏说中超第6轮！山东泰山VS上海海港！,https://www.thepaper.cn/newsDetail_forward_32967419,2026-04-16 07:15:56,体坛落叶球
上海高校团队迭代新材料研发智能平台，已有近百款潜在新材料成功合成验证,https://www.thepaper.cn/newsDetail_forward_32978604,2026-04-16 07:09:09,澎湃新闻
从徐汇到香格里拉，她用“铁脚板”丈量公益之路,https://www.thepaper.cn/newsDetail_forward_32986448,2026-04-16 07:05:00,上海徐汇
守护好群众“看病钱”“救命钱” 上海警方严厉打击医保诈骗违法犯罪,https://www.thepaper.cn/newsDetail_forward_32986648,2026-04-16 06:59:00,警民直通车上海
江南迹|上海的江宁路,https://www.thepaper.cn/newsDetail_forward_32982664,2026-04-16 05:50:14,江南时报
上海旅居⑬｜法国人倪可乐：一切都充满生机，层次丰富又触手可及,https://www.thepaper.cn/newsDetail_forward_32976252,2026-04-16 05:38:43,澎湃新闻
传承红色基因 筑牢安全防线 | 奉贤区房管局机关支部、物管中心支部、档案中心支部联合开展“国家安全教育日”党日活动,https://www.thepaper.cn/newsDetail_forward_32984302,2026-04-16 05:34:00,上海房管
田锋已任上海青浦区委常委、区人武部部长,https://www.thepaper.cn/newsDetail_forward_32983694,2026-04-16 05:29:44,澎湃新闻
2026上海帆船公开赛扬帆开赛，世界顶级船员从滴水湖扬帆,https://www.thepaper.cn/newsDetail_forward_32983403,2026-04-16 05:17:21,澎湃新闻
在崇明校园，这件事从娃娃抓起,https://www.thepaper.cn/newsDetail_forward_32985269,2026-04-16 05:01:00,上海崇明
3月一线城市二手房价格环比普涨：上海涨0.4%，已连续两个月上涨,https://www.thepaper.cn/newsDetail_forward_32983079,2026-04-16 04:56:36,澎湃新闻
涉案金额超3000万元，去年以来上海侦破医保诈骗案件60余起,https://www.thepaper.cn/newsDetail_forward_32982818,2026-04-16 03:57:02,澎湃新闻
上海仲轩2026迎春拍圆满收官,https://www.thepaper.cn/newsDetail_forward_32976599,2026-04-16 03:52:59,雅昌拍卖图录
中法文化之春20周年上海启幕，“瓷婚”为喻共赴跨越山海的文化之约,https://www.thepaper.cn/newsDetail_forward_32978776,2026-04-16 03:52:59,上海戏剧
丝芭传媒创始人王子杰突发心源性疾病去世，享年63岁，曾创立女子偶像组合SNH48，获“上海市白玉兰纪念奖”,https://www.thepaper.cn/newsDetail_forward_32984327,2026-04-16 03:49:00,红星资本局
著名画家、上海市文联原主席施大畏去世，享年76岁,https://www.thepaper.cn/newsDetail_forward_32983093,2026-04-16 03:47:10,澎湃新闻
著名画家、上海市文联原主席施大畏去世，享年76岁,https://www.thepaper.cn/newsDetail_forward_32983054,2026-04-16 03:37:31,澎湃新闻
原上海市美协主席施大畏因病辞世：从油漆工人开始的艺术之路,https://www.thepaper.cn/newsDetail_forward_32982734,2026-04-16 03:32:22,澎湃新闻
全市第一！虹口19名学子入选~,https://www.thepaper.cn/newsDetail_forward_32983470,2026-04-16 03:31:00,上海虹口
长三角议事厅｜长三角创新活力来自要素流动而非“拉平”,https://www.thepaper.cn/newsDetail_forward_32982536,2026-04-16 03:29:02,澎湃新闻
