title,url,time,source
2026年合肥X澎湃“浪花计划”融媒体实战能力培训正式启动：协同发展，相互赋能,https://www.thepaper.cn/newsDetail_forward_33435074,2026-06-23 09:53:29,澎湃新闻
刘洪建与中国科学院院士、上海交通大学李政道研究所副所长丁洪一行座谈,https://www.thepaper.cn/newsDetail_forward_33440152,2026-06-23 16:00:00,昆明发布
赵宏宇会见上海期货交易所党委书记、理事长田向阳一行 李可参加,https://www.thepaper.cn/newsDetail_forward_33440064,2026-06-23 15:06:00,鹤壁日报
上海援疆莎车分指团队推出科普漫画专栏！,https://www.thepaper.cn/newsDetail_forward_33440709,2026-06-23 15:01:00,上海援疆
在推动上海（长三角）国际科创中心建设中冲在前打头阵！陈吉宁调研市科委,https://www.thepaper.cn/newsDetail_forward_33439787,2026-06-23 14:54:25,澎湃新闻
服务保障金融开放与创新发展，上海金融法院临港新片区巡回审判站揭牌,https://www.thepaper.cn/newsDetail_forward_33439949,2026-06-23 14:45:00,上海高院
【企业】专访科思创：在上海化工区这片沃土上，种子与土壤相互成就,https://www.thepaper.cn/newsDetail_forward_33440712,2026-06-23 14:05:00,投资上海Invest Shanghai
【项目】低空通航企业落户闵行，打造长三角空中生鲜通道,https://www.thepaper.cn/newsDetail_forward_33440711,2026-06-23 14:05:00,投资上海Invest Shanghai
视听行业，AI和超高清正在改变什么？,https://www.thepaper.cn/newsDetail_forward_33438092,2026-06-23 13:49:25,澎湃新闻
“中国扇”首次打开 上海大歌剧院打造世界级地标性剧院综合体,https://www.thepaper.cn/newsDetail_forward_33438389,2026-06-23 13:10:03,东方财经浦东频道
青浦再添AI新平台！甲骨文（上海）AI人才创智中心正式投用,https://www.thepaper.cn/newsDetail_forward_33440699,2026-06-23 13:05:00,绿色青浦
上海一科技企业审计自查后发现，上百万条核心数据被内部人员提取，很可能被用于境外项目研究,https://www.thepaper.cn/newsDetail_forward_33439247,2026-06-23 13:05:00,上游新闻
“输血”更“造血” ，第十二批第一轮上海援疆巴楚分指医疗队续写健康守护新篇章,https://www.thepaper.cn/newsDetail_forward_33439603,2026-06-23 12:50:00,上海静安
智启新程，跨界共生！第31届上海电视节国际影视市场新质视听产业发展大会在静安举行,https://www.thepaper.cn/newsDetail_forward_33439601,2026-06-23 12:50:00,上海静安
共话合作新图景！UWA“菁彩视听·静见未来”国际交流活动在静安举办,https://www.thepaper.cn/newsDetail_forward_33439600,2026-06-23 12:50:00,上海静安
【惠企政策通】关于开展闵行区中小企业数字化转型试点城市数字化改造政策申报的通知,https://www.thepaper.cn/newsDetail_forward_33440704,2026-06-23 12:02:00,闵行区政协
观澜书香｜浦东政协“观澜书香·委员评书荐书”读书分享,https://www.thepaper.cn/newsDetail_forward_33438963,2026-06-23 11:52:00,浦东新区政协
华安基金两单商业不动产REITs获批，上海国资盘活存量资产再添实践案例,https://www.thepaper.cn/newsDetail_forward_33438085,2026-06-23 11:51:20,澎湃新闻
人人讲安全、个个会应急——第25个全国“安全生产月”，上海林业在行动,https://www.thepaper.cn/newsDetail_forward_33438961,2026-06-23 11:50:00,上海林业
区卫健工作党委赴青浦劳模工匠馆开展理论学习中心组（扩大）学习会,https://www.thepaper.cn/newsDetail_forward_33440230,2026-06-23 11:46:00,青浦卫计新声
“用药有方，银龄安康”浦东新区启动2026年老年健康宣传周活动,https://www.thepaper.cn/newsDetail_forward_33440626,2026-06-23 11:32:00,浦东卫生计生
青蓝交响启新程，薪火相传育人才——松江法院 “青・蓝交响纪”人才培育项目正式启动,https://www.thepaper.cn/newsDetail_forward_33440945,2026-06-23 11:21:00,上海松江法院
初心闪耀传薪火！徐汇区域离退休干部庆祝中国共产党成立105周年,https://www.thepaper.cn/newsDetail_forward_33438410,2026-06-23 11:15:00,上海徐汇
上海建设管理部门进一步做好本市建筑工地夏季高温安全防范和防汛防台工作,https://www.thepaper.cn/newsDetail_forward_33436916,2026-06-23 11:11:08,澎湃新闻
《上海市燃气条例》系列宣传④：燃气器具判废有标准，这些淘汰设备必须换,https://www.thepaper.cn/newsDetail_forward_33436968,2026-06-23 11:10:17,澎湃新闻
"《上海市燃气条例》系列宣传③：燃气设施保护红线碰不得
",https://www.thepaper.cn/newsDetail_forward_33436963,2026-06-23 11:09:33,澎湃新闻
《上海市燃气条例》系列宣传②：不要擅改燃气管，专业人干专业事,https://www.thepaper.cn/newsDetail_forward_33436971,2026-06-23 11:09:14,澎湃新闻
《上海市燃气条例》系列宣传①：火眼金睛查隐患，免费安检很有用,https://www.thepaper.cn/newsDetail_forward_33436940,2026-06-23 11:08:13,澎湃新闻
免手术康复！七旬印尼患者在闵行告别8年膝痛,https://www.thepaper.cn/newsDetail_forward_33438117,2026-06-23 11:02:00,闵行卫生
上海周四到周日有阳光串场，雨水明夜起减少→,https://www.thepaper.cn/newsDetail_forward_33438397,2026-06-23 11:00:00,市民云
购买沪惠保立享！这项权益千万别错过！ai中医舌诊手机里直接免费用！,https://www.thepaper.cn/newsDetail_forward_33438395,2026-06-23 11:00:00,市民云
南北开战！“街超”再燃战火，杨浦“草根足球”何以生生不息？,https://www.thepaper.cn/newsDetail_forward_33437829,2026-06-23 10:47:00,上海杨浦
杨浦公证护航全球热门IP“小猪佩奇”，构建跨境维权“证据铁壁”,https://www.thepaper.cn/newsDetail_forward_33440944,2026-06-23 10:41:00,上海市杨浦区司法局
上海2026年高考分数线公布,https://www.thepaper.cn/newsDetail_forward_33440701,2026-06-23 10:37:00,绿色青浦
双色球今晚开奖，奖池4.38亿余元,https://www.thepaper.cn/newsDetail_forward_33437382,2026-06-23 10:30:01,上海福彩
协商在一线丨区政协侨联界别、致公党界别、民族宗教和港澳台侨委联合开展“以侨为桥，提升‘上海之根’IP国际影响力”专题协商,https://www.thepaper.cn/newsDetail_forward_33438965,2026-06-23 10:19:00,松江区政协
协商在一线丨区政协召开“科学规划老沪昆铁路用地，释放城市发展空间”对口协商会,https://www.thepaper.cn/newsDetail_forward_33438964,2026-06-23 10:19:00,松江区政协
支持生物医药外资企业高能级项目落地，上海出台若干措施→,https://www.thepaper.cn/newsDetail_forward_33437811,2026-06-23 10:07:00,上海科技
上海高考录取分数线公布！,https://www.thepaper.cn/newsDetail_forward_33437460,2026-06-23 10:06:00,环球时报
受贿1.39亿余元！上海市委原常委朱芝松一审被判死缓,https://www.thepaper.cn/newsDetail_forward_33437626,2026-06-23 10:04:00,黔微普法 
关注 | 上海波音航空改装维修基地项目正式开业 洋山特殊综合保税区航空产业发展再启新程,https://www.thepaper.cn/newsDetail_forward_33440351,2026-06-23 10:00:00,投资上海
上海高考分数线公布！,https://www.thepaper.cn/newsDetail_forward_33437458,2026-06-23 09:57:00,央视网
受贿1.39亿余元！上海市委原常委朱芝松一审被判死缓,https://www.thepaper.cn/newsDetail_forward_33437463,2026-06-23 09:52:00,经济日报
市政府常务会议研究战兴产业和数字上海“十五五”规划，部署促进民间投资发展,https://www.thepaper.cn/newsDetail_forward_33437212,2026-06-23 09:51:00,上海市工商联
嘉定区工商联、区税务局联合举办最新增值税政策培训,https://www.thepaper.cn/newsDetail_forward_33437210,2026-06-23 09:51:00,上海市工商联
金山区工商联（总商会）举行“鑫商荟·沙龙”活动,https://www.thepaper.cn/newsDetail_forward_33437208,2026-06-23 09:51:00,上海市工商联
青浦主场免费！小朋友才做选择，两场都要看！,https://www.thepaper.cn/newsDetail_forward_33437814,2026-06-23 09:49:00,绿色青浦
受贿1.39亿余元，上海市委原常委朱芝松一审被判死缓,https://www.thepaper.cn/newsDetail_forward_33437456,2026-06-23 09:45:00,上游新闻
沪游双周报｜2026上海漫夏潮玩季开启，多项活动精彩纷呈,https://www.thepaper.cn/newsDetail_forward_33435272,2026-06-23 09:44:10,澎湃新闻
上海五角场如何迈向数智创新？请看《澎湃城市报告》第37期,https://www.thepaper.cn/newsDetail_forward_33435137,2026-06-23 09:43:41,澎湃新闻
高效应对暑假业务高峰，出入境办证夜间专场来了！徐汇办证地点→,https://www.thepaper.cn/newsDetail_forward_33437248,2026-06-23 09:41:00,上海徐汇
上海高考分数线公布,https://www.thepaper.cn/newsDetail_forward_33436918,2026-06-23 09:40:28,澎湃新闻
上海2026年高考本科各批次录取控制分数线公布！,https://www.thepaper.cn/newsDetail_forward_33437245,2026-06-23 09:37:00,上海黄浦
《上海市燃气条例》系列宣传⑤，瓶装气这样用才合规,https://www.thepaper.cn/newsDetail_forward_33436141,2026-06-23 09:30:09,澎湃新闻
​奉贤区中医医院推出夏日限定“生津版”与“降脂版”代茶饮,https://www.thepaper.cn/newsDetail_forward_33438404,2026-06-23 09:30:00,奉贤柘林
千里赴沪，只为一双好膝盖！这家医院让老人重新迈开步子,https://www.thepaper.cn/newsDetail_forward_33437203,2026-06-23 09:30:00,上海杨浦
系统化落实海绵城市理念，浦东新区听潮豪园应急调蓄工程缓解片区内涝问题,https://www.thepaper.cn/newsDetail_forward_33436130,2026-06-23 09:29:50,澎湃新闻
上海召开建筑工地安全生产工作会议,https://www.thepaper.cn/newsDetail_forward_33436149,2026-06-23 09:29:10,澎湃新闻
护航中考｜长宁消防设立中考爱心护考驿站,https://www.thepaper.cn/newsDetail_forward_33437206,2026-06-23 09:19:00,上海消防
圈粉海内外从业者，上海科技影都亮相2026年上海国际影视市场,https://www.thepaper.cn/newsDetail_forward_33438988,2026-06-23 09:18:00,上海松江
