title,url,time,source
“清朗浦江·2026”网络生态治理旬邀您携手共筑良好生态,https://www.thepaper.cn/newsDetail_forward_32685502,2026-03-03 01:55:41,澎湃新闻
暴跌11℃！降雨+降温+大风！上海明天迎“换季式”降温！五一假期要“泡汤”...,https://www.thepaper.cn/newsDetail_forward_33062460,2026-04-27 09:40:00,市民云
游客劝阻吸烟竟被打？上海迪士尼：除指定吸烟区，乐园或迪士尼小镇禁止吸烟,https://www.thepaper.cn/newsDetail_forward_33062141,2026-04-27 09:22:49,澎湃新闻
全市统计法治征文作品展示（上）,https://www.thepaper.cn/newsDetail_forward_33062404,2026-04-27 09:10:00,上海统计
上海迪士尼小镇游客称劝阻吸烟被打，对方赔钱和解，警方：打人是违法的，在处理中，区卫健委：不属于禁烟区域，但有“游烟”相关倡议,https://www.thepaper.cn/newsDetail_forward_33062579,2026-04-27 08:51:00,红星新闻
线上预约两天抢光！在闵行，有什么堪比抢演唱会门票？,https://www.thepaper.cn/newsDetail_forward_33062552,2026-04-27 08:45:00,上海市莘庄工业区
上海迎来今年首个30℃+，今夜起风有雨周三全天不足15℃,https://www.thepaper.cn/newsDetail_forward_33062147,2026-04-27 08:39:38,澎湃新闻
上海市闵行区委原常委、副区长汪向阳受贿案一审宣判,https://www.thepaper.cn/newsDetail_forward_33062108,2026-04-27 08:39:08,澎湃新闻
为数据跨境流动按下“加速键”，上海全域推广“负面清单”,https://www.thepaper.cn/newsDetail_forward_33061740,2026-04-27 08:38:45,澎湃新闻
检察日报 | 上海：以办案质效分析研判为抓手，强化检委会宏观管理职能,https://www.thepaper.cn/newsDetail_forward_33062558,2026-04-27 08:31:00,上海检察
上海发文力推“游戏+”，普陀这家企业亮出成绩单：5张器械证、7000人认定……,https://www.thepaper.cn/newsDetail_forward_33062298,2026-04-27 08:16:00,上海普陀
新疆兵地融合发展草湖项目区代表团一行来徐汇考察对接对口支援工作,https://www.thepaper.cn/newsDetail_forward_33062343,2026-04-27 08:10:00,上海徐汇
集成服务、共享与办公三大功能，东上海人才港在上海杨浦启用,https://www.thepaper.cn/newsDetail_forward_33061711,2026-04-27 07:33:12,澎湃新闻
上海社会科学院发布《2026上海蓝皮书·奉贤经济》,https://www.thepaper.cn/newsDetail_forward_33061646,2026-04-27 07:30:11,澎湃新闻
【聚焦】沪京携手共促审批提速——北京市政务服务和数据管理局来沪调研工程建设项目审批制度改革,https://www.thepaper.cn/newsDetail_forward_33062329,2026-04-27 07:21:00,上海住房城乡建设管理
虹口国动：无线电测向、水上救援、战术沙盘……上海初中校园上演“硬核”国防演练,https://www.thepaper.cn/newsDetail_forward_33062340,2026-04-27 07:18:00,上海国防动员
中国青年五四奖章暨新时代青年先锋奖揭晓，上海的获奖者有哪些亮点？,https://www.thepaper.cn/newsDetail_forward_33061395,2026-04-27 06:44:49,澎湃新闻
致公党奉贤区总支举行“贤城诵读”读书分享会,https://www.thepaper.cn/newsDetail_forward_33062075,2026-04-27 06:44:00,致公党上海市委
上海迪士尼游客疑因劝阻吸烟遭掌掴、脚踢，客服回应称园区没有禁烟，有专属吸烟点，警方介入；被打男子发声：对方已赔钱和解,https://www.thepaper.cn/newsDetail_forward_33061966,2026-04-27 06:43:00,红星新闻
上海市消防救援局发布“五一”假期消防安全提示,https://www.thepaper.cn/newsDetail_forward_33062008,2026-04-27 06:40:00,上海消防
上海交大教授掌舵，图灵量子一连融资10亿,https://www.thepaper.cn/newsDetail_forward_33060714,2026-04-27 06:25:17,投资界
一所学校十余位世界冠军，乒乓球嘉年华校园组在巨一小学挥拍,https://www.thepaper.cn/newsDetail_forward_33061175,2026-04-27 05:49:21,澎湃新闻
5·22国际生物多样性日活动将在上海市崇明区举办,https://www.thepaper.cn/newsDetail_forward_33061139,2026-04-27 05:14:45,澎湃新闻
独居老人日付50元请外卖小哥敲门？这是“三无”老故事！现实中上海如何守护空巢老人,https://www.thepaper.cn/newsDetail_forward_33058787,2026-04-27 04:47:36,澎湃新闻
爆火！“非遗+环保”解锁上海国际花卉节新看点,https://www.thepaper.cn/newsDetail_forward_33061378,2026-04-27 03:20:00,上海徐汇
普陀明天再迎人才盛会！从政策到生态，沿沪宁“桥头堡”将有新动作,https://www.thepaper.cn/newsDetail_forward_33061320,2026-04-27 03:11:00,上海普陀
从岭南到江南，广东粤剧院两部精品剧目将亮相上海、金华,https://www.thepaper.cn/newsDetail_forward_33060731,2026-04-27 02:48:11,澎湃广东
蛋行好事，爱心大使吴敏霞再次为爱加油，第16届“一个鸡蛋的暴走”在沪温暖启程,https://www.thepaper.cn/newsDetail_forward_33044950,2026-04-27 02:17:51,澎湃新闻
以学促干强本领 服务为民提质效 | 青浦区房管局“房管业务大讲堂”正式开讲,https://www.thepaper.cn/newsDetail_forward_33061069,2026-04-27 01:03:00,上海房管
浦东保租房又上新，服务范围更大,https://www.thepaper.cn/newsDetail_forward_33061067,2026-04-27 01:03:00,上海房管
【新华社】“我是来自上海的大姐姐，想和你交个朋友”,https://www.thepaper.cn/newsDetail_forward_33061032,2026-04-27 00:47:42,微昭通
白玉兰戏剧嘉年华，助推传统戏曲破圈破壁,https://www.thepaper.cn/newsDetail_forward_33056572,2026-04-27 00:44:38,澎湃新闻
《女武神》观众的反馈，显示上海歌剧文化正走向成熟,https://www.thepaper.cn/newsDetail_forward_33050708,2026-04-27 00:09:59,澎湃新闻
陈丹燕：“我就是属于上海”,https://www.thepaper.cn/newsDetail_forward_33057203,2026-04-27 00:09:33,澎湃新闻
银针解郁安神魄，艾火温经入梦乡——南翔镇社区卫生服务中心不寐病专病门诊丨上海市中医特色专病专科（社区）专栏,https://www.thepaper.cn/newsDetail_forward_33060709,2026-04-27 00:03:00,健康上海
“魅力上海”走进伦敦，进一步推动中英城市人文交流,https://www.thepaper.cn/newsDetail_forward_33057891,2026-04-27 00:00:12,澎湃新闻
上海地铁48小时内连发两起自燃事故！事后当事人均称“不清楚”,https://www.thepaper.cn/newsDetail_forward_33060461,2026-04-26 23:04:00,江西消防
早安杨浦 | 今直冲28℃！接下来骤降10℃，还有风雨“到访”……,https://www.thepaper.cn/newsDetail_forward_33060203,2026-04-26 22:30:00,上海杨浦
克服免疫治疗耐药性！上海中医药大学/上海交通大学合作发文：有前景的癌症治疗策略,https://www.thepaper.cn/newsDetail_forward_33057607,2026-04-26 22:07:09,转化医学网
全球生殖遗传大会在沪举办，生殖专家解读第三代试管婴儿技术,https://www.thepaper.cn/newsDetail_forward_33058979,2026-04-26 14:48:14,澎湃新闻
当玉兰花香，成为这座城市的戏剧呼吸,https://www.thepaper.cn/newsDetail_forward_33056571,2026-04-26 14:31:56,澎湃新闻
第四届中国（安徽）科技创新成果转化交易会今日开幕，上海担任主宾省（市）,https://www.thepaper.cn/newsDetail_forward_33059530,2026-04-26 14:06:00,上海科技
1名医生1分钟给3人“看病”26次？上海警方斩断骗保“黑手”,https://www.thepaper.cn/newsDetail_forward_33060039,2026-04-26 13:56:00,观察者网
双色球第2026045期：中出一等奖12注，筹集公益金1.42亿元,https://www.thepaper.cn/newsDetail_forward_33058785,2026-04-26 13:25:04,上海福彩
福马献瑞 彩运当头 | 上海福彩开启2026年首场路演活动,https://www.thepaper.cn/newsDetail_forward_33058771,2026-04-26 13:25:00,上海福彩
双色球今晚开奖，奖池15.59亿余元,https://www.thepaper.cn/newsDetail_forward_33058762,2026-04-26 13:05:00,上海福彩
因举报虐猫者，上海女子和家人均遭遇“开盒”，还被造谣卖淫整容，当事人：家人因此搬家，自己也确诊重度抑郁,https://www.thepaper.cn/newsDetail_forward_33059921,2026-04-26 12:40:00,上游新闻
免费住宿、创业补贴...金山乡村，让打工人告别996⁉️,https://www.thepaper.cn/newsDetail_forward_33060001,2026-04-26 12:37:00,i金山
“以鸭充牛”，上海通报！,https://www.thepaper.cn/newsDetail_forward_33059775,2026-04-26 12:03:00,黔微普法 
晴雨转换快，上海下周降温又降雨,https://www.thepaper.cn/newsDetail_forward_33058410,2026-04-26 12:01:39,澎湃新闻
上海野生动物园上新：熊猫“小姨”、非洲象“千金”都亮相了,https://www.thepaper.cn/newsDetail_forward_33058408,2026-04-26 12:01:25,澎湃新闻
2026上海乒乓球嘉年华奉贤区预选赛总决赛结果速览！,https://www.thepaper.cn/newsDetail_forward_33060090,2026-04-26 11:46:00,上海奉贤
自由贸易试验区、国家服务业扩大开放综合试点地区（上海）数据出境负面清单管理办法及负面清单（2025版）答记者问,https://www.thepaper.cn/newsDetail_forward_33060164,2026-04-26 11:31:00,上海虹口
28℃降至14℃！雨多、风大！未来一周变化看这里→,https://www.thepaper.cn/newsDetail_forward_33058896,2026-04-26 11:14:00,市民云
首场“闵行健康开放麦”来了！健康干货变成“热梗”和“金句”，笑到肚子疼,https://www.thepaper.cn/newsDetail_forward_33059693,2026-04-26 11:08:00,今日闵行
上海援疆携手混知多渠道多形式讲好喀什故事,https://www.thepaper.cn/newsDetail_forward_33060707,2026-04-26 11:02:00,上海援疆
今天，樊登在长宁开讲！,https://www.thepaper.cn/newsDetail_forward_33060168,2026-04-26 11:02:00,上海长宁
“我是来自上海的大姐姐，想和你交个朋友”,https://www.thepaper.cn/newsDetail_forward_33058618,2026-04-26 11:01:00,西双版纳发布
福建霞浦东壁日落滩涂渔排潮汐光影与海岸色谱漫游记,https://www.thepaper.cn/newsDetail_forward_33058342,2026-04-26 10:50:34,庆云融媒体
奉贤区中医医院血透室成立十周年，守护三百余患者 “生命之路”,https://www.thepaper.cn/newsDetail_forward_33059102,2026-04-26 10:49:00,奉贤柘林
