title,url,time,source
在上海，遇见另一种新可能,https://www.thepaper.cn/newsDetail_forward_33628504,2026-07-22 09:08:30,澎湃新闻
上海第七次综合交通调查成果发布 轨交出行占比超六成,https://www.thepaper.cn/newsDetail_forward_33638490,2026-07-23 02:16:43,东方财经浦东频道
绿色制造智能体全国首发 呈现产业绿色低碳转型上海实践,https://www.thepaper.cn/newsDetail_forward_33638489,2026-07-23 02:16:25,东方财经浦东频道
空中救护车来了，黑飞无人机有了克星！上海低空博览会看点拉满,https://www.thepaper.cn/newsDetail_forward_33638445,2026-07-23 02:15:19,长三角日报
“践行人民城市理念 高质量推进城市更新工作”座谈会在上海召开,https://www.thepaper.cn/newsDetail_forward_33642023,2026-07-23 02:10:20,中国房地产报
住建部在沪召开座谈会，芜湖作城市更新交流发言,https://www.thepaper.cn/newsDetail_forward_33641833,2026-07-23 01:30:01,大江资讯
告别爬楼难！崇明这个小区将全面通梯,https://www.thepaper.cn/newsDetail_forward_33642079,2026-07-23 01:06:00,上海房管
赋能青年安居 筑牢民生保障 | 静安区房管局组织开展全区新就业青年安居支持政策培训及保障性租赁住房供应管理工作会议,https://www.thepaper.cn/newsDetail_forward_33642078,2026-07-23 01:06:00,上海房管
上海发布中心城区高温黄警：预计今日大部最高气温将超35℃,https://www.thepaper.cn/newsDetail_forward_33641669,2026-07-23 01:03:58,澎湃新闻
直播丨上海警方通报打击新型涉税犯罪方面的阶段性成效和典型案例,https://www.thepaper.cn/newsDetail_forward_33634429,2026-07-23 01:01:29,澎湃新闻
3000余起诈骗被拦下！徐汇13个街镇反诈中心，守住居民“钱袋子”,https://www.thepaper.cn/newsDetail_forward_33641792,2026-07-23 00:10:00,上海徐汇
制度、人才、服务、监管！来看陪诊服务的“杨浦实践”,https://www.thepaper.cn/newsDetail_forward_33642081,2026-07-22 23:53:00,上海杨浦
65门课、1.6万人次！2026市民艺术夜校杨浦分校春季班结课,https://www.thepaper.cn/newsDetail_forward_33642080,2026-07-22 23:53:00,上海杨浦
喜报！黄浦少体校排球队2026全国小排球锦标赛长兴站斩获佳绩,https://www.thepaper.cn/newsDetail_forward_33641780,2026-07-22 23:30:00,上海黄浦
大暑至！在静安解锁味觉、体感、精神三重清凉！,https://www.thepaper.cn/newsDetail_forward_33641777,2026-07-22 23:30:00,上海静安
历史上的今天｜1921年7月23日，中共一大在上海开幕,https://www.thepaper.cn/newsDetail_forward_33622369,2026-07-22 23:28:48,澎湃新闻
上海“五个新城”发展注入新动能：有特色产业，更有美好生活,https://www.thepaper.cn/newsDetail_forward_33639303,2026-07-22 23:03:17,澎湃新闻
公益电影、文艺演出，还有消费券！松江大学城的夏夜这么玩→,https://www.thepaper.cn/newsDetail_forward_33641783,2026-07-22 22:30:00,上海松江
早安杨浦 | 高温连击开启！今年国家级气象站出现首个50℃！桑拿天哪里将被“蒸”服→,https://www.thepaper.cn/newsDetail_forward_33641570,2026-07-22 22:30:00,上海杨浦
不收一分钱，连办8年！金山这个小区，让人羡慕…,https://www.thepaper.cn/newsDetail_forward_33641776,2026-07-22 22:00:00,i金山
上海劳力士大师赛7月30日开票，“超级挚友”费德勒将亮相,https://www.thepaper.cn/newsDetail_forward_33640284,2026-07-22 16:04:44,澎湃新闻
中央安全生产考核巡查组第六组明查暗访上海市见面会在沪召开,https://www.thepaper.cn/newsDetail_forward_33641534,2026-07-22 15:24:00,上海城管
藏蓝新力量集结！2026年上海司法行政监狱、戒毒新警初任培训正式开班,https://www.thepaper.cn/newsDetail_forward_33640408,2026-07-22 15:20:00,上海市司法局
夏夜“光影局”，青浦这里的夜生活“上新”啦→,https://www.thepaper.cn/newsDetail_forward_33640416,2026-07-22 15:03:00,绿色青浦
【聚焦】2026年度长三角区域工程建设标准一体化发展工作会议暨标准国际化研讨会在沪召开,https://www.thepaper.cn/newsDetail_forward_33641572,2026-07-22 15:00:00,上海住房城乡建设管理
抓好“最后一公里”、夯实“基层第一线”， 上海法院人民法庭工作会议召开,https://www.thepaper.cn/newsDetail_forward_33640144,2026-07-22 14:45:00,上海高院
【项目】时的科技扎根上海，携手打造世界eVTOL之都！,https://www.thepaper.cn/newsDetail_forward_33640858,2026-07-22 14:44:00,投资上海Invest Shanghai
2026国际低空经济博览会主题活动暨“投资上海”重点低空经济企业圆桌会成功举办,https://www.thepaper.cn/newsDetail_forward_33640857,2026-07-22 14:44:00,投资上海Invest Shanghai
【园区】投资嘉定探园视频首期走进科嘉示范园！,https://www.thepaper.cn/newsDetail_forward_33640856,2026-07-22 14:44:00,投资上海Invest Shanghai
在上海，遇见另一种新可能,https://www.thepaper.cn/newsDetail_forward_33640415,2026-07-22 14:18:00,绿色青浦
哈萨克斯坦少女跨国来喀会诊 沪喀远程协作搭建就医新通道,https://www.thepaper.cn/newsDetail_forward_33640849,2026-07-22 13:57:00,上海援疆
"深海生态、全光芯片……上海交大“十大科技进展”揭晓
",https://www.thepaper.cn/newsDetail_forward_33638735,2026-07-22 13:45:46,澎湃新闻
范小红任上海市第一人民医院党委书记,https://www.thepaper.cn/newsDetail_forward_33638488,2026-07-22 13:34:38,澎湃新闻
金山近800平方米展区亮相，看点揭晓！,https://www.thepaper.cn/newsDetail_forward_33640121,2026-07-22 13:00:00,i金山
普陀区召开老同志区情通报会,https://www.thepaper.cn/newsDetail_forward_33640091,2026-07-22 12:50:00,上海普陀
守密护企促创新，普陀区保密宣教主题活动护航民营经济高质量发展,https://www.thepaper.cn/newsDetail_forward_33640090,2026-07-22 12:50:00,上海普陀
见证奥运冠军与市民挥拍，中建八局护航2026上海乒乓球嘉年华,https://www.thepaper.cn/newsDetail_forward_33639653,2026-07-22 12:21:00,中建八局
上海涉外法律服务人才紧缺，浦东推出系列方案政策破解人才引育难题,https://www.thepaper.cn/newsDetail_forward_33640847,2026-07-22 12:17:00,上海市浦东新区司法局
上海：到2030年，海洋产业增加值不低于3500亿元,https://www.thepaper.cn/newsDetail_forward_33637851,2026-07-22 12:10:11,澎湃新闻
第12批集采7月31日上海开标：65个品种，设三大规则,https://www.thepaper.cn/newsDetail_forward_33637427,2026-07-22 11:58:39,澎湃新闻
金山预警又来了！这次是…,https://www.thepaper.cn/newsDetail_forward_33640119,2026-07-22 11:56:00,i金山
黄浦区首个AI赋能养护院，有哪些新科技？｜申活万象,https://www.thepaper.cn/newsDetail_forward_33640132,2026-07-22 11:49:00,上海黄浦
上海首个，落地黄浦！,https://www.thepaper.cn/newsDetail_forward_33640126,2026-07-22 11:49:00,上海黄浦
聚焦韧性安全城区建设丨2026年杨浦区防汛专题培训会举行,https://www.thepaper.cn/newsDetail_forward_33640079,2026-07-22 11:45:00,上海杨浦
中共上海市青浦区委常委会决定：六届区委十二次全会7月30日召开,https://www.thepaper.cn/newsDetail_forward_33640412,2026-07-22 11:40:00,绿色青浦
技术筑基、场景破局！杨浦企业亮相2026世界人工智能大会，筑牢AI产业创新应用高地,https://www.thepaper.cn/newsDetail_forward_33640082,2026-07-22 11:30:00,上海杨浦
把健康良方说进笑声里——宝山区“健康脱口秀”展播精彩来袭（一）,https://www.thepaper.cn/newsDetail_forward_33639662,2026-07-22 11:30:00,宝山卫生健康
上海黄浦互联网优质内容创作集聚区扩容，百年建筑江川大楼“加入”,https://www.thepaper.cn/newsDetail_forward_33637253,2026-07-22 11:21:43,澎湃新闻
上海市委深改委会议研究家政服务业员工制转型、公共数据开发利用、养老服务业创新发展等事项,https://www.thepaper.cn/newsDetail_forward_33637314,2026-07-22 11:05:15,澎湃新闻
当前双预警高挂！杨浦将出现一小时雨量20-30毫米的短时强降水！,https://www.thepaper.cn/newsDetail_forward_33640083,2026-07-22 11:04:00,上海杨浦
上海知名男演员吐槽的这件事↗很多金山人有同款困扰…,https://www.thepaper.cn/newsDetail_forward_33640118,2026-07-22 11:00:00,i金山
澎湃漫评｜对凡人善举也当做好“兜底”保障,https://www.thepaper.cn/newsDetail_forward_33636178,2026-07-22 10:59:44,澎湃新闻
《弈棋耍大牌》上海三打一巡回赛首站开赛，选手：“比赛完还能逛逛苏河、吃吃食堂，太灵了！”,https://www.thepaper.cn/newsDetail_forward_33639673,2026-07-22 10:53:00,上海静安
上海男子因夫妻矛盾，多次在小学儿子班级群、家长群用情绪极端的语言发布家庭隐私、贬损言论，儿子在同学面前抬不起头，法院：构成家暴,https://www.thepaper.cn/newsDetail_forward_33639436,2026-07-22 10:51:00,云岭政法
“数实·博超”首秀今日启幕，让工业文化流入寻常百姓家,https://www.thepaper.cn/newsDetail_forward_33637195,2026-07-22 10:49:55,澎湃新闻
深化医防协同 促进医防融合——闵行区卫生健康委开展医防协同医防融合项目中期评审｜闵卫医事,https://www.thepaper.cn/newsDetail_forward_33638044,2026-07-22 10:47:00,闵行卫生
锚定目标 压实奋进——杨浦区召开2026年司法行政系统年中工作会议,https://www.thepaper.cn/newsDetail_forward_33641283,2026-07-22 10:29:00,上海市杨浦区司法局
崇明：日落江上，收集西沙湿地的每一帧浪漫,https://www.thepaper.cn/newsDetail_forward_33637730,2026-07-22 10:15:00,上海水务海洋
长宁：荷风逐浪、野趣滨河！邂逅纵泾港的夏日限定美景,https://www.thepaper.cn/newsDetail_forward_33637729,2026-07-22 10:15:00,上海水务海洋
《上海市加快国际航运中心建设“十五五”规划》发布，一起来看解读→,https://www.thepaper.cn/newsDetail_forward_33639658,2026-07-22 10:07:00,上海市工商联
青浦卫健说 | 头疼、脸疼却查不出问题？可能是你脸上的“小房间”堵了,https://www.thepaper.cn/newsDetail_forward_33640727,2026-07-22 10:04:00,青浦卫计新声
