title,url,time,source
“清朗浦江·2026”网络生态治理旬邀您携手共筑良好生态,https://www.thepaper.cn/newsDetail_forward_32685502,2026-03-03 01:55:41,澎湃新闻
与上海共生长，人生每一处都是“主场”,https://www.thepaper.cn/newsDetail_forward_32826989,2026-03-25 02:13:12,澎湃新闻
上海警方通报女子当街被打，白某（39岁）因家庭纠纷殴打妻子！已被刑拘,https://www.thepaper.cn/newsDetail_forward_32827062,2026-03-25 01:55:17,冀安在线
上海迪士尼蒸包套餐卖70元：有人大呼不值，有人称明码标价决定权在自己,https://www.thepaper.cn/newsDetail_forward_32826852,2026-03-25 01:55:11,澎湃新闻
外国鸟友在上海寻找震旦鸦雀：观鸟是大自然给予的惊喜,https://www.thepaper.cn/newsDetail_forward_32823008,2026-03-25 00:49:37,澎湃新闻
从“呛人”到“宜人”？看TA们如何用“查、溯、改”温情化解油烟纠纷,https://www.thepaper.cn/newsDetail_forward_32826743,2026-03-24 23:31:00,上海静安
安全抵达！沪上路口上演“极速救援”,https://www.thepaper.cn/newsDetail_forward_32826742,2026-03-24 23:31:00,上海静安
中青报关注上海浦东青年夜校：最火课程2秒售罄，课程对味服务走心,https://www.thepaper.cn/newsDetail_forward_32825702,2026-03-24 23:23:01,澎湃新闻
2026“创·在上海”大赛启动，创业者眼中上海为何是“首选地”,https://www.thepaper.cn/newsDetail_forward_32822265,2026-03-24 23:00:46,澎湃新闻
国际旅游巨头高管看好上海入境游：去年游客增长近四成只是开始,https://www.thepaper.cn/newsDetail_forward_32821893,2026-03-24 23:00:35,澎湃新闻
区政府常务会议召开,https://www.thepaper.cn/newsDetail_forward_32825819,2026-03-24 15:03:00,上海普陀
上海结核病疫情呈稳步下降态势，去年报告发病率处于全国最低水平,https://www.thepaper.cn/newsDetail_forward_32821904,2026-03-24 14:14:56,澎湃新闻
精准诊断与高效协作，为患者抢抓治疗先机,https://www.thepaper.cn/newsDetail_forward_32825502,2026-03-24 14:04:00,上海黄浦
雨要停了？洗洗晒晒抓紧安排→,https://www.thepaper.cn/newsDetail_forward_32824998,2026-03-24 14:01:00,上海宝山
2026区长话未来｜上海市松江区区长王婧：诚邀全球企业家、投资者投资松江，共创美好未来,https://www.thepaper.cn/newsDetail_forward_32822273,2026-03-24 13:47:30,澎湃新闻
上海市与全国社保基金理事会签署战略合作框架协议，陈吉宁龚正会见社保基金会理事长刘昆,https://www.thepaper.cn/newsDetail_forward_32821895,2026-03-24 13:47:08,澎湃新闻
2026区长话未来｜上海市青浦区区长金晓明：诚邀全球企业家、投资者聚势在青浦，共赢在未来,https://www.thepaper.cn/newsDetail_forward_32822276,2026-03-24 13:46:16,澎湃新闻
收获南北半球观众的爱，上海交响乐团亚太巡演收官,https://www.thepaper.cn/newsDetail_forward_32821180,2026-03-24 13:39:02,澎湃新闻
白某（男，39岁）因家庭纠纷当街殴打妻子，上海警方通报：刑拘！,https://www.thepaper.cn/newsDetail_forward_32823982,2026-03-24 13:29:00,红网
长三角企业代表，为何齐聚金山？,https://www.thepaper.cn/newsDetail_forward_32825847,2026-03-24 13:08:00,i金山
金山这场活动，为直播电商划重点,https://www.thepaper.cn/newsDetail_forward_32825460,2026-03-24 13:08:00,i金山
【喜报】宝山区卫生健康工作党委案例获评第三届上海城市基层党建创新案例最佳案例,https://www.thepaper.cn/newsDetail_forward_32825670,2026-03-24 13:01:00,宝山卫生健康
明天阳光再现，周四夜间又有雨！,https://www.thepaper.cn/newsDetail_forward_32825290,2026-03-24 12:59:00,上海长宁
区政府召开常务会议，传达学习贯彻市政府常务会议精神，调度我区1—2月经济运行情况,https://www.thepaper.cn/newsDetail_forward_32823134,2026-03-24 12:59:00,上海长宁
AI守护萤火虫？青浦这家企业这样做→,https://www.thepaper.cn/newsDetail_forward_32822892,2026-03-24 12:56:00,绿色青浦
闵行区召开七届区委第七轮巡察集中反馈会议,https://www.thepaper.cn/newsDetail_forward_32825841,2026-03-24 12:47:00,今日闵行
上线3天，热度破1700万！这部在闵行拍摄的短剧你看过了吗？,https://www.thepaper.cn/newsDetail_forward_32825447,2026-03-24 12:47:00,今日闵行
从杨浦出发，向军旗报到！杨浦区2026年上半年新兵欢送大会举行,https://www.thepaper.cn/newsDetail_forward_32825462,2026-03-24 12:37:00,上海杨浦
春季宠物防疫不松懈，科学免疫更安心,https://www.thepaper.cn/newsDetail_forward_32826272,2026-03-24 12:36:00,上海宝山
上海入境游“首站效应”凸显，“海洋光谱号”两个航次外籍宾客占比突破80%,https://www.thepaper.cn/newsDetail_forward_32825514,2026-03-24 12:36:00,上海宝山
春季高发，多人已中招！眼睛出现这些症状，千万别乱揉→,https://www.thepaper.cn/newsDetail_forward_32824997,2026-03-24 12:36:00,上海宝山
魔都怎么样｜两个英格兰青年在上海“加新”,https://www.thepaper.cn/newsDetail_forward_32821209,2026-03-24 12:34:56,澎湃新闻
本市住建行业“人工智能+”行动公开征集建议，诚邀您参与！,https://www.thepaper.cn/newsDetail_forward_32824519,2026-03-24 12:34:00,上海城管
带上1TB的胃，外滩源美食嘉年华等你来！,https://www.thepaper.cn/newsDetail_forward_32825878,2026-03-24 12:32:00,上海黄浦
不打针不吃药，高性价比的抗衰老竟然是……护牙！,https://www.thepaper.cn/newsDetail_forward_32827054,2026-03-24 12:22:00,闵行卫生
复兴岛向全球创客发出邀请，2026“创·在上海”大赛杨浦启幕,https://www.thepaper.cn/newsDetail_forward_32823306,2026-03-24 12:07:00,上海杨浦
上海玄鸟1/4决赛首战明晚在青浦打响！,https://www.thepaper.cn/newsDetail_forward_32825438,2026-03-24 12:05:00,绿色青浦
占地约1.8万平方米！青浦这座公园预计今年下半年开放,https://www.thepaper.cn/newsDetail_forward_32823272,2026-03-24 12:05:00,绿色青浦
青浦这家医院给女同胞们开了个“瘦身外挂”~,https://www.thepaper.cn/newsDetail_forward_32823271,2026-03-24 12:05:00,绿色青浦
熬夜危害知多少？中医视角下的健康警示,https://www.thepaper.cn/newsDetail_forward_32825887,2026-03-24 12:02:00,上海徐汇
明日阳光重返申城，周四夜间雨水再度来袭,https://www.thepaper.cn/newsDetail_forward_32825886,2026-03-24 12:02:00,上海徐汇
多部门联动宣传，虹口区年内实现“无结核社区”建设全覆盖！,https://www.thepaper.cn/newsDetail_forward_32825282,2026-03-24 11:59:00,上海虹口
第十四届中国数控机床展览会下月将在浦东举行,https://www.thepaper.cn/newsDetail_forward_32821528,2026-03-24 11:55:17,东方财经浦东频道
海关专项支持措施持续发力 上海化妆品出口实现开门红,https://www.thepaper.cn/newsDetail_forward_32821533,2026-03-24 11:55:10,东方财经浦东频道
上海顾村公园发布文明游园公告：勿携带各类高凳、折叠伸缩梯等入园,https://www.thepaper.cn/newsDetail_forward_32821513,2026-03-24 11:47:58,澎湃新闻
@上海大学生，实习前必看！试用期规定要知道！这些实用服务也请收好→,https://www.thepaper.cn/newsDetail_forward_32825858,2026-03-24 11:47:00,市民云
密密麻麻！上海市民注意：高发期来了！破坏性极强！很多人家里“被吃空”！,https://www.thepaper.cn/newsDetail_forward_32825857,2026-03-24 11:47:00,市民云
在上海，遇到交通违法行为，怎么举报？这样操作就行！,https://www.thepaper.cn/newsDetail_forward_32823924,2026-03-24 11:47:00,市民云
上海市2026年节水减排专项扶持申报工作开始啦！,https://www.thepaper.cn/newsDetail_forward_32824441,2026-03-24 11:35:00,上海水务海洋
中国水周丨绘水网画卷 亮节水初心——上海“千城地标亮节水”主题活动焕新启幕,https://www.thepaper.cn/newsDetail_forward_32824440,2026-03-24 11:35:00,上海水务海洋
防控有 “度” 守护有 “温”——上海监狱筑牢结核防治安全网,https://www.thepaper.cn/newsDetail_forward_32822750,2026-03-24 11:28:00,上海市监狱管理局
松江区2026年上半年入伍新兵欢送仪式暨全民国防教育进校园主题活动举行,https://www.thepaper.cn/newsDetail_forward_32825510,2026-03-24 11:27:00,上海松江
28年用坏10把剪，7800人次，未收一分钱！“长根爷叔”温暖整个社区,https://www.thepaper.cn/newsDetail_forward_32825888,2026-03-24 11:19:00,上海徐汇
堆了30年的杂物清了！这个街道凝聚人心筑平安,https://www.thepaper.cn/newsDetail_forward_32825517,2026-03-24 11:19:00,上海徐汇
小手牵大手，共护社区一平米绿意,https://www.thepaper.cn/newsDetail_forward_32825516,2026-03-24 11:19:00,上海徐汇
【城管执法】城管进社区 居住环境变得更美了,https://www.thepaper.cn/newsDetail_forward_32826732,2026-03-24 11:05:00,上海住房城乡建设管理
“四亮”服务：以信息公开推动小区治理共建共治共享,https://www.thepaper.cn/newsDetail_forward_32824522,2026-03-24 11:05:00,上海住房城乡建设管理
【最新】从“有没有”转向“好不好” 让儿童友好可感可触可及,https://www.thepaper.cn/newsDetail_forward_32824521,2026-03-24 11:05:00,上海住房城乡建设管理
【城管执法】城管进社区 居住环境变得更美了,https://www.thepaper.cn/newsDetail_forward_32824520,2026-03-24 11:05:00,上海住房城乡建设管理
林间野趣｜申城“春日寻堇记”——紫花地丁、长萼堇菜、犁头草，一眼分清～,https://www.thepaper.cn/newsDetail_forward_32822938,2026-03-24 11:04:00,上海林业
买菜的工夫，钱包就不翼而飞？静安警方30分钟快速破案→,https://www.thepaper.cn/newsDetail_forward_32824980,2026-03-24 11:02:10,上海静安
