title,url,time,source
双色球第2026064期：中出一等奖15注，筹集公益金1.53亿元,https://www.thepaper.cn/newsDetail_forward_33334651,2026-06-08 10:20:01,上海福彩
【服务】外企聊营商｜乐高：守护每一“粒”创意，乐业在上海,https://www.thepaper.cn/newsDetail_forward_33335445,2026-06-08 10:20:00,投资上海Invest Shanghai
【关注】18亿建全球研发总部，正大天晴落子闵行，将打造跨界孵化园区,https://www.thepaper.cn/newsDetail_forward_33335444,2026-06-08 10:20:00,投资上海Invest Shanghai
世界海洋日丨上海市2026年“世界海洋日暨全国海洋宣传日”主场活动暨上海海洋论坛在宝山举行,https://www.thepaper.cn/newsDetail_forward_33335413,2026-06-08 10:17:00,上海水务海洋
世界海洋日丨一图读懂：2025年上海市海洋生态预警监测公报,https://www.thepaper.cn/newsDetail_forward_33335411,2026-06-08 10:17:00,上海水务海洋
世界海洋日丨中国第一、世界前三，蓝皮书显示上海初步建成中国特色海洋强国建设引领区,https://www.thepaper.cn/newsDetail_forward_33335410,2026-06-08 10:17:00,上海水务海洋
在公园玩着上心理课！“心有乐园 自在长大”韧性小孩心理成长嘉年华在浦东限时快乐开园,https://www.thepaper.cn/newsDetail_forward_33334391,2026-06-08 10:04:41,澎湃新闻
上海5作品入选！第二届法治中国“三微”作品发布,https://www.thepaper.cn/newsDetail_forward_33335427,2026-06-08 10:00:00,上海检察
凝心聚力谋发展 倾听诉求解难题 宝山区工商联召开基层商会调研座谈会,https://www.thepaper.cn/newsDetail_forward_33335401,2026-06-08 09:59:00,上海市工商联
民企“铸”绿 “碳”启未来 浦东新区工商联绿色低碳委员会首届民营企业产业协同交流活动顺利举办,https://www.thepaper.cn/newsDetail_forward_33335399,2026-06-08 09:59:00,上海市工商联
15分钟！杨浦警方为高考生开启“极速通道”,https://www.thepaper.cn/newsDetail_forward_33334658,2026-06-08 09:43:00,上海杨浦
完成新一轮数亿元融资！从杨浦起步的这家企业，抢跑人类终极能源赛道 | 数智经济在杨浦,https://www.thepaper.cn/newsDetail_forward_33334656,2026-06-08 09:43:00,上海杨浦
中国建设行业贸促会国际规则研究委员会正式入驻黄浦区办公,https://www.thepaper.cn/newsDetail_forward_33334707,2026-06-08 09:34:00,上海市黄浦区司法局
雨走了，暖来了！周二起连续多云，最高29℃！但早晚别急着减衣丨“上海奉贤”小编在线,https://www.thepaper.cn/newsDetail_forward_33335405,2026-06-08 09:33:00,奉贤柘林
别了，老朋友八莫！国内最长寿圈养雄性亚洲象在沪离世，与上海相伴53载,https://www.thepaper.cn/newsDetail_forward_33335422,2026-06-08 09:25:00,上海长宁
长宁这个只有40户居民的小区，时隔多年终于有物业啦！,https://www.thepaper.cn/newsDetail_forward_33335420,2026-06-08 09:25:00,上海长宁
区人大常委会组织市十六届人大奉贤代表组代表开展集中联系社区活动,https://www.thepaper.cn/newsDetail_forward_33335430,2026-06-08 09:17:00,上海奉贤
文明实践丨崇明区“石榴籽城乡健康直通车”开进央企,https://www.thepaper.cn/newsDetail_forward_33334071,2026-06-08 09:07:20,澎湃上海
不止是采摘！在青浦，遇见魔都版“阿那亚”的田园牧歌,https://www.thepaper.cn/newsDetail_forward_33335391,2026-06-08 09:07:00,绿色青浦
奉贤美食挑战赛再“燃”战火，端午小吃等你来“巡”,https://www.thepaper.cn/newsDetail_forward_33335428,2026-06-08 09:00:00,上海奉贤
中国（上海）自贸试验区管委会金桥管理局原党组书记、局长吕东胜被公诉,https://www.thepaper.cn/newsDetail_forward_33333932,2026-06-08 08:55:22,澎湃新闻
徐汇这场法治文化节，“国际范+安全感”拉满,https://www.thepaper.cn/newsDetail_forward_33333903,2026-06-08 08:37:49,澎湃上海
石库门前同上思政课，上师大附属黄浦梅溪小学“树德课堂·黄浦区红色周一大思政课”,https://www.thepaper.cn/newsDetail_forward_33335435,2026-06-08 08:33:00,上海黄浦
落笔致青春 守岗践初心——上海监狱民警以高考为题诠释监管改造使命,https://www.thepaper.cn/newsDetail_forward_33335431,2026-06-08 08:18:00,上海市监狱管理局
浦东：人文关怀+硬核科技  托举银发经济未来,https://www.thepaper.cn/newsDetail_forward_33333627,2026-06-08 08:10:07,东方财经浦东频道
崇明VS长宁，打出青春的力量与勇气,https://www.thepaper.cn/newsDetail_forward_33335437,2026-06-08 08:00:00,上海崇明
世界海洋日丨携手看海去：2026年世界海洋日上海青少年海洋知识传播行动正式启航！,https://www.thepaper.cn/newsDetail_forward_33333788,2026-06-08 07:41:00,上海水务海洋
这两天，金山天气太夯了！不过，周日气温又将升至…,https://www.thepaper.cn/newsDetail_forward_33334697,2026-06-08 07:30:00,i金山
最不像学校的学校，最接近教育本质的学校,https://www.thepaper.cn/newsDetail_forward_33315951,2026-06-08 07:23:33,兜兜大上海
提问，上海夏天去哪里避暑？,https://www.thepaper.cn/newsDetail_forward_33328215,2026-06-08 07:23:32,ShanghaiLOOK
上海博物馆藏《折桂图轴》，祝高考生从容应战，折桂而归！,https://www.thepaper.cn/newsDetail_forward_33330988,2026-06-08 07:23:30,上海博物馆
怎样让魔都成为“中国特产、上海定制”的首选地？,https://www.thepaper.cn/newsDetail_forward_33331567,2026-06-08 07:23:30,上海转型发布
依法打击新型网络犯罪典型案例，浦东法院这起案件入选！,https://www.thepaper.cn/newsDetail_forward_33334681,2026-06-08 07:20:00,上海浦东法院
美国“卷王”来上海了！中国大陆第一家↗这味道有人爱，有人闻到就想吐...,https://www.thepaper.cn/newsDetail_forward_33333792,2026-06-08 07:12:00,上海女性
【城管执法】上海城管“城”意满满，全力以“护”护航高考！,https://www.thepaper.cn/newsDetail_forward_33333786,2026-06-08 07:05:00,上海住房城乡建设管理
2026进博会上海会议活动申报工作启动！,https://www.thepaper.cn/newsDetail_forward_33334170,2026-06-08 06:45:00,虹口商务
官宣！2026上海国际游艇生活嘉年华定档6月！,https://www.thepaper.cn/newsDetail_forward_33334169,2026-06-08 06:45:00,虹口商务
世界杯竞彩湃｜上海《安心购彩世界杯》MV：小小期待才最美,https://www.thepaper.cn/newsDetail_forward_33333184,2026-06-08 06:43:35,澎湃新闻
共建同福，一座古桥情系浦江与浦东丨乃清叙史,https://www.thepaper.cn/newsDetail_forward_33333794,2026-06-08 06:40:00,上海市莘庄工业区
政策速览｜闵行区经委关于组织申报2026年技术改造专项的通知,https://www.thepaper.cn/newsDetail_forward_33333486,2026-06-08 06:40:00,上海市莘庄工业区
致公党市委领导走访上海大剧院艺术中心党委,https://www.thepaper.cn/newsDetail_forward_33333477,2026-06-08 06:10:00,致公党上海市委
“赤子艺心——中国留学生的文化艺术报国之路”专题展在上海中国留学生博物馆(致公之家)开幕,https://www.thepaper.cn/newsDetail_forward_33333476,2026-06-08 06:10:00,致公党上海市委
沪未来•松苗儿,https://www.thepaper.cn/newsDetail_forward_33333487,2026-06-08 06:00:00,上海检察
“雨呱呱”从奉贤“回家”！雨蛙生态农场打造乡村文旅新场景,https://www.thepaper.cn/newsDetail_forward_33333798,2026-06-08 05:45:00,上海奉贤
记忆 | 上海文化名人眼里的邬达克 | 马信芳,https://www.thepaper.cn/newsDetail_forward_33327174,2026-06-08 05:38:08,上海纪实
一周文艺：唐弢奖在沪颁出，文学纪录片《走近这片海》将播，爱潜水的乌贼开新文,https://www.thepaper.cn/newsDetail_forward_33331923,2026-06-08 05:35:04,文学报
实地排查除隐患 未雨绸缪护平安 | 松江区房管局开展房管系统防汛防台专项检查,https://www.thepaper.cn/newsDetail_forward_33333138,2026-06-08 05:34:00,上海房管
【江浙沪】六月份有什么好看的展览？（第1期）,https://www.thepaper.cn/newsDetail_forward_33308666,2026-06-08 05:27:05,博物馆 | 看展览
上海地铁13号线自然博物馆站变“猫猫站”了？这是送给儿童的礼物,https://www.thepaper.cn/newsDetail_forward_33332636,2026-06-08 05:18:45,澎湃新闻
紫色小麦你见过吗？崇明试种成功，正探索深层开发,https://www.thepaper.cn/newsDetail_forward_33333497,2026-06-08 05:00:00,上海崇明
持续至本周末！逛非遗市集、玩指尖造物、享视听盛宴……静安苏河新增夜间消费好去处→,https://www.thepaper.cn/newsDetail_forward_33334180,2026-06-08 04:33:00,上海静安
【新闻眼】土操场变绿茵场，返沪教师“重回”课堂……上海宝山教育援疆团队，在叶城种下“看见光”的希望,https://www.thepaper.cn/newsDetail_forward_33335408,2026-06-08 04:31:00,宝山教育
一周图片｜崇启公铁长江大桥合龙：启东至上海25分钟！,https://www.thepaper.cn/newsDetail_forward_33328744,2026-06-08 04:12:29,澎湃新闻
罗别根别墅、上海动物园、哈密路小学……哈密路这些地标以前长这样的→,https://www.thepaper.cn/newsDetail_forward_33333144,2026-06-08 04:12:00,上海长宁
闵行区中医医院（龙华医院闵行分院）12月底试运行！记者提前探访,https://www.thepaper.cn/newsDetail_forward_33333135,2026-06-08 04:02:00,今日闵行
 “玉兰花开旗 韵绽放”6·6上海海派旗袍月开场演出,https://www.thepaper.cn/newsDetail_forward_33331558,2026-06-08 03:33:41,上海市市立幼儿园
从巴黎到上海，王羽佳“与火共舞”探索古典音乐与科技融合新样态,https://www.thepaper.cn/newsDetail_forward_33319349,2026-06-08 03:33:34,经典947
高考：上海考生们自信奔赴考场,https://www.thepaper.cn/newsDetail_forward_33327982,2026-06-08 03:30:29,中国教育报
沪未来 | 守护童年的，不该只有童话,https://www.thepaper.cn/newsDetail_forward_33332484,2026-06-08 03:30:00,上海检察
安全生产月丨2026年上海市危险化学品安全知识线上个人竞赛，可模拟练习！,https://www.thepaper.cn/newsDetail_forward_33332481,2026-06-08 03:23:00,上海应急守护
