title,url,time,source
“清朗浦江·2026”网络生态治理旬邀您携手共筑良好生态,https://www.thepaper.cn/newsDetail_forward_32685502,2026-03-03 01:55:41,澎湃新闻
公益市集开启，“AI小老师”上岗……学雷锋日沪上活动形式多样,https://www.thepaper.cn/newsDetail_forward_32706693,2026-03-05 12:57:41,澎湃新闻
浦东启动2026年内陆水域打击非法捕捞联合执法行动,https://www.thepaper.cn/newsDetail_forward_32706688,2026-03-05 11:35:16,东方财经浦东频道
深化落实浦东新区法规 浦东法院为优化营商环境注入司法动能,https://www.thepaper.cn/newsDetail_forward_32706686,2026-03-05 11:33:12,东方财经浦东频道
节日快乐！妇女节专属福利活动来袭！快来掏掏小申的万能魔法口袋，可获得惊喜好礼哟～,https://www.thepaper.cn/newsDetail_forward_32706151,2026-03-05 11:13:23,市民云
乘势而上、全面发力，转型升级、攻坚突破！陈吉宁参加上海代表团审议政府工作报告,https://www.thepaper.cn/newsDetail_forward_32706524,2026-03-05 11:02:25,澎湃新闻
区政府常务会议召开，研究统计工作等事项,https://www.thepaper.cn/newsDetail_forward_32706787,2026-03-05 10:09:00,上海宝山
吃红肉能补铁，怎么搭配能让铁的吸收率更高？,https://www.thepaper.cn/newsDetail_forward_32706611,2026-03-05 10:09:00,上海宝山
要闻 | 2026年上海商务情况通报会成功举办！,https://www.thepaper.cn/newsDetail_forward_32706935,2026-03-05 10:06:00,投资上海
区情 | 全球创新医疗器械展览培训中心在虹桥揭牌,https://www.thepaper.cn/newsDetail_forward_32706933,2026-03-05 10:06:00,投资上海
 教AI、结对子，上海小学生这样“学雷锋”，老人们乐开了花,https://www.thepaper.cn/newsDetail_forward_32705885,2026-03-05 09:28:48,澎湃新闻
关于领取2025年度统计专业技术资格证书的通知,https://www.thepaper.cn/newsDetail_forward_32706126,2026-03-05 09:10:02,上海统计
上海金山这场别开生面的“开学第一课”，让孩子们全方面学习到了……,https://www.thepaper.cn/newsDetail_forward_32706130,2026-03-05 09:09:37,澎湃上海
上海的市花曾是棉花？而她的石像又为何能矗立在上海县政府所在地？丨闵行情,https://www.thepaper.cn/newsDetail_forward_32706505,2026-03-05 09:08:00,上海市莘庄工业区
开学了，这份预防指南请收好！,https://www.thepaper.cn/newsDetail_forward_32706502,2026-03-05 09:08:00,上海市莘庄工业区
茸城她故事｜毋冬梅：星海“织网人”，攻坚“定盘星”,https://www.thepaper.cn/newsDetail_forward_32707053,2026-03-05 09:06:00,上海松江
相约东方枢纽，2026上海投促大会让全球投资者遇见想见的人,https://www.thepaper.cn/newsDetail_forward_32705829,2026-03-05 08:56:08,澎湃新闻
法治志愿“锋”采，绘就平安春色,https://www.thepaper.cn/newsDetail_forward_32707093,2026-03-05 08:56:00,上海市闵行区司法局
春节期间值班8天，一员工索要3倍工资被拒，把公司告上法庭，法院：每天打完卡就玩手机，不支持,https://www.thepaper.cn/newsDetail_forward_32707092,2026-03-05 08:56:00,上海市闵行区司法局
保险箱完好无损，里面存放的600克黄金没了！女子报警后在儿子女友衣柜中发现同款首饰！警方提醒：这一细节很容易被忽略,https://www.thepaper.cn/newsDetail_forward_32706812,2026-03-05 08:56:00,上海市闵行区司法局
惊险！S20外环高速上，数吨钢卷滚落！司机已被刑拘,https://www.thepaper.cn/newsDetail_forward_32706811,2026-03-05 08:56:00,上海市闵行区司法局
双色球今晚开奖，奖池25.92亿余元,https://www.thepaper.cn/newsDetail_forward_32705887,2026-03-05 08:45:02,上海福彩
二十四节气·岁时记 | 惊蛰,https://www.thepaper.cn/newsDetail_forward_32705884,2026-03-05 08:45:02,上海福彩
3月4日福彩开奖公告,https://www.thepaper.cn/newsDetail_forward_32705882,2026-03-05 08:45:01,上海福彩
赠票有惊喜！上海3D赠票活动今晚继续,https://www.thepaper.cn/newsDetail_forward_32705875,2026-03-05 08:45:00,上海福彩
社情民意工作丨2026年2月社情民意信息播报,https://www.thepaper.cn/newsDetail_forward_32707191,2026-03-05 08:40:00,奉贤区政协
2026年上海增设11个专科高等职业教育—应用本科教育贯通培养模式专业,https://www.thepaper.cn/newsDetail_forward_32706778,2026-03-05 08:32:00,上海宝山
在金罗店，我们共同写就的那首光影诗已悄然成册！,https://www.thepaper.cn/newsDetail_forward_32706762,2026-03-05 08:32:00,上海宝山
宝山警方多措并举，护航元宵游园灯会,https://www.thepaper.cn/newsDetail_forward_32706756,2026-03-05 08:32:00,上海宝山
春暖三月学雷锋 法治温情满车站——区法援中心参加“3·5”学雷锋志愿服务活动,https://www.thepaper.cn/newsDetail_forward_32706617,2026-03-05 08:24:00,静安区法律援助中心
在嘉过大年，年味满全城！2026嘉定春节活动精彩回顾,https://www.thepaper.cn/newsDetail_forward_32705803,2026-03-05 08:03:01,澎湃上海
灯映元宵承文脉，情暖实践聚民心——长宁区新时代文明实践中心元宵活动预告,https://www.thepaper.cn/newsDetail_forward_32705796,2026-03-05 07:55:51,澎湃上海
上海发布去年控烟状况：法定禁烟场所吸烟发生率降至12.6%,https://www.thepaper.cn/newsDetail_forward_32705551,2026-03-05 07:54:06,澎湃新闻
拼多多一招商经理4年间受贿200余万，上海法院一审判了,https://www.thepaper.cn/newsDetail_forward_32701040,2026-03-05 07:43:59,上海法治报
上海海港官宣二人离队,https://www.thepaper.cn/newsDetail_forward_32687295,2026-03-05 07:09:27,五星体育
2026赛季上海申花一线队35人名单出炉,https://www.thepaper.cn/newsDetail_forward_32699748,2026-03-05 07:09:26,五星体育
“职”点迷津 | 双休日包含在年休假享受的天数中吗？,https://www.thepaper.cn/newsDetail_forward_32574916,2026-03-05 07:05:39,市民云
“惊蛰三宝”，你吃了吗？,https://www.thepaper.cn/newsDetail_forward_32705924,2026-03-05 07:05:00,上海黄浦
才耀松江·人才说｜侯锋：扎根三十余年，我的“再创业”之旅,https://www.thepaper.cn/newsDetail_forward_32707051,2026-03-05 07:00:00,上海松江
16400毫升！驻松部队官兵撸起袖子献热血,https://www.thepaper.cn/newsDetail_forward_32706753,2026-03-05 07:00:00,上海松江
青浦：沿着水乡经典线，赴一场春日之约,https://www.thepaper.cn/newsDetail_forward_32706329,2026-03-05 06:59:00,上海水务海洋
月亏3万到营收翻倍，上海老店抖音破局,https://www.thepaper.cn/newsDetail_forward_32705263,2026-03-05 06:16:03,澎湃新闻
上海首个心理健康院企合作项目落户徐家汇,https://www.thepaper.cn/newsDetail_forward_32705966,2026-03-05 06:13:00,上海徐汇
践行初心学雷锋！徐汇健康集市提供暖心服务,https://www.thepaper.cn/newsDetail_forward_32705960,2026-03-05 06:13:00,上海徐汇
出道30年，歌手梁咏琪在上海话剧首秀,https://www.thepaper.cn/newsDetail_forward_32704017,2026-03-05 06:03:00,澎湃新闻
惊蛰膳谱：疏肝健脾・清肺润燥,https://www.thepaper.cn/newsDetail_forward_32707062,2026-03-05 06:03:00,上海宝山
【吴淞口日出指数】3月6日3级 云雾蔽日×烟雨笼江,https://www.thepaper.cn/newsDetail_forward_32706776,2026-03-05 06:03:00,上海宝山
辛柏青时隔半年回到舞台，《苏堤春晓》揭幕国话上海演出季,https://www.thepaper.cn/newsDetail_forward_32704442,2026-03-05 06:02:03,澎湃新闻
中国女子冰壶青年队时隔八年再获铜牌！上海班底闪耀世青赛,https://www.thepaper.cn/newsDetail_forward_32705238,2026-03-05 06:01:52,澎湃新闻
2026巴西“中国·上海电影周”圣保罗开幕，沪产影片再出海,https://www.thepaper.cn/newsDetail_forward_32704735,2026-03-05 06:01:47,澎湃新闻
梅花盛放！上海这片“香雪海”，美成了早春的天花板,https://www.thepaper.cn/newsDetail_forward_32706513,2026-03-05 05:38:00,上海奉贤
从“各美其美”到“美美与共”！奉贤与静安美妆产业协同发展为何如此惹人注目？丨策马“十五五”,https://www.thepaper.cn/newsDetail_forward_32706512,2026-03-05 05:38:00,上海奉贤
F1点燃上海赛事经济：330元到42800元门票全售罄，周边多家酒店一房难求,https://www.thepaper.cn/newsDetail_forward_32701016,2026-03-05 05:33:03,蓝鲸新闻
崇明玉兰花，上线！,https://www.thepaper.cn/newsDetail_forward_32705972,2026-03-05 05:02:00,上海崇明
扎根金山17年，年产值超240亿元！,https://www.thepaper.cn/newsDetail_forward_32706363,2026-03-05 04:35:00,i金山
上海美术馆 | 朵云轩库藏珍品展，值得一看,https://www.thepaper.cn/newsDetail_forward_32700395,2026-03-05 04:34:02,美学时空漫游指南
【媒体报道】袁雯：完善劳动力市场技能需求信息采集，提高高等教育人才供需适配度,https://www.thepaper.cn/newsDetail_forward_32706056,2026-03-05 04:16:00,致公党上海市委
读书市场 | 寻找女性灵魂深处的力量：女性成长主题图书分享会,https://www.thepaper.cn/newsDetail_forward_32691236,2026-03-05 04:15:00,微阅读行走
春“锋”送暖 “汇心”同行——看南汇监狱青年如何“暖”出圈,https://www.thepaper.cn/newsDetail_forward_32706283,2026-03-05 04:13:00,上海市监狱管理局
养老金月最低标准再提高20元！落实带薪错峰休假！政府工作报告极简版来了！,https://www.thepaper.cn/newsDetail_forward_32704082,2026-03-05 04:06:10,市民云
开票啦！聆听柴可夫斯基，赴一场俄式浪漫之约~,https://www.thepaper.cn/newsDetail_forward_32706784,2026-03-05 04:01:00,上海宝山
