title,url,time,source
“上海价格”输出境外成熟期货市场，上期所向LME授权热轧卷板期货结算价,https://www.thepaper.cn/newsDetail_forward_33402458,2026-06-17 14:39:44,澎湃新闻
CNS Korea韩语信息服务平台上线,https://www.thepaper.cn/newsDetail_forward_33393022,2026-06-17 14:14:54,澎湃新闻
"上海“街超”来了！体现社区足球本质拒绝纯职业，欢迎老外
",https://www.thepaper.cn/newsDetail_forward_33402313,2026-06-17 14:14:06,澎湃新闻
未成年人检察工作40周年座谈会在上海召开 陈文清出席并讲话,https://www.thepaper.cn/newsDetail_forward_33402540,2026-06-17 13:59:33,司法部
上海等八地电商协会发布“618”倡议：杜绝“先涨后降”“明降暗升”等套路,https://www.thepaper.cn/newsDetail_forward_33401660,2026-06-17 13:43:34,澎湃新闻
龚正市长会见缅甸总统敏昂莱，为两国务实合作作出上海积极贡献,https://www.thepaper.cn/newsDetail_forward_33402111,2026-06-17 13:29:46,澎湃新闻
五月上海离境退税销售额同比增长超八成，消费券杠杆效应显现,https://www.thepaper.cn/newsDetail_forward_33401423,2026-06-17 13:17:52,澎湃新闻
2026陆家嘴论坛开幕，何立峰陈吉宁出席,https://www.thepaper.cn/newsDetail_forward_33402030,2026-06-17 13:16:06,澎湃新闻
“超级场景+超级IP”双轮驱动 儒意电影打造超级娱乐空间2.0,https://www.thepaper.cn/newsDetail_forward_33401024,2026-06-17 13:06:08,东方财经浦东频道
申花球星吴曦助阵 FIFA世界杯联想嘉年华上海站启幕,https://www.thepaper.cn/newsDetail_forward_33401000,2026-06-17 13:06:07,东方财经浦东频道
潮涌东方论坛在上海财大举行 推动数智时代金融服务实体,https://www.thepaper.cn/newsDetail_forward_33400980,2026-06-17 13:06:07,东方财经浦东频道
警银企社协作织密金融防护网 浦东开启2026反诈宣传月,https://www.thepaper.cn/newsDetail_forward_33400976,2026-06-17 13:06:07,东方财经浦东频道
科创突围、消费焕新！上海打造民营经济发展新高地,https://www.thepaper.cn/newsDetail_forward_33401816,2026-06-17 13:00:02,长三角日报
中国太保董事长傅帆：为中国的海外利益提供保障，正是沪港保险协同的发力点,https://www.thepaper.cn/newsDetail_forward_33401329,2026-06-17 12:52:21,澎湃新闻
金融监管总局：注册在浦东新区的商业银行或者注册在浦东新区的商业银行分支机构可承销自贸离岸债,https://www.thepaper.cn/newsDetail_forward_33401109,2026-06-17 12:33:48,澎湃新闻
香港财政司司长：未来沪港可以加快推动“产业在上海，境外财资在香港”的协同组合,https://www.thepaper.cn/newsDetail_forward_33401104,2026-06-17 12:32:55,澎湃新闻
2026上海体育文化生活季•长宁站：缤纷体育文化活动，燃动全城,https://www.thepaper.cn/newsDetail_forward_33401101,2026-06-17 12:03:02,澎湃上海
沪疆“银龄行动”志愿服务队入选全国“四个100”优秀典型,https://www.thepaper.cn/newsDetail_forward_33396952,2026-06-17 11:24:19,澎湃新闻
【提示】快收藏！徐汇区属医疗机构端午节期间门诊安排→,https://www.thepaper.cn/newsDetail_forward_33401840,2026-06-17 11:19:00,徐汇卫生计生
“医警救”联动！闵行启动儿童危重症急救专项行动,https://www.thepaper.cn/newsDetail_forward_33401135,2026-06-17 11:06:00,闵行卫生
今夏用电更有保障，松江220千伏沈砖变电站扩建工程投运,https://www.thepaper.cn/newsDetail_forward_33402162,2026-06-17 11:02:00,上海松江
周汉民出席2026年上海留学人员创新创业独角兽研修营,https://www.thepaper.cn/newsDetail_forward_33402041,2026-06-17 11:00:00,中国丝路智谷研究院
上海大变天！大暴雨端午到！入梅时间官宣！连续10天都有雨！,https://www.thepaper.cn/newsDetail_forward_33401541,2026-06-17 11:00:00,市民云
观众招募 | 6月20日19：00长宁主场对战浦东，诚邀您现场助威！,https://www.thepaper.cn/newsDetail_forward_33401540,2026-06-17 11:00:00,市民云
媒体转载｜当“里弄洋观察”邂逅浦东水脉：15国留学生沉浸式感受上海城市温度,https://www.thepaper.cn/newsDetail_forward_33402134,2026-06-17 10:54:00,浦东新区政协
黄小蕾爆料和祖峰拍戏大尺度，现场化身恋爱导师,https://www.thepaper.cn/newsDetail_forward_33400322,2026-06-17 10:45:34,澎湃新闻
扎根青浦，深耕林果十余载！国家林草乡土专家黄伟：以匠心铺就乡村振兴路,https://www.thepaper.cn/newsDetail_forward_33402132,2026-06-17 10:40:00,上海林业
国家队和热门民企都来了，上海构筑人类“终极能源”创新生态,https://www.thepaper.cn/newsDetail_forward_33400790,2026-06-17 10:18:00,投资上海Invest Shanghai
【企业】赫力昂：在上海打造数字创新“健身房”,https://www.thepaper.cn/newsDetail_forward_33400787,2026-06-17 10:18:00,投资上海Invest Shanghai
青浦明天入梅！中考期间又将雨雨雨……,https://www.thepaper.cn/newsDetail_forward_33400691,2026-06-17 10:15:00,绿色青浦
松江区领导走访调研区内高端装备领域企业,https://www.thepaper.cn/newsDetail_forward_33400710,2026-06-17 10:01:00,上海市工商联
端午假期，杨浦公共体育设施开放信息来啦→,https://www.thepaper.cn/newsDetail_forward_33400704,2026-06-17 10:00:00,上海杨浦
防汛备汛工作 | 青浦区水务局召开水务系统防汛工作会议,https://www.thepaper.cn/newsDetail_forward_33401563,2026-06-17 09:56:00,上海防汛
防汛备汛工作 | 崇明区绿化市容局召开防汛防台减灾化解“树电矛盾”会议,https://www.thepaper.cn/newsDetail_forward_33401562,2026-06-17 09:56:00,上海防汛
防汛备汛工作 | 金山区水务局开展汛期供排水行业安全检查,https://www.thepaper.cn/newsDetail_forward_33401560,2026-06-17 09:56:00,上海防汛
防汛备汛工作 | 市绿化市容局检查浦东新区连体招牌整治及防汛防台管理工作,https://www.thepaper.cn/newsDetail_forward_33401559,2026-06-17 09:56:00,上海防汛
上海2026年高考成绩将于6月23日18点公布,https://www.thepaper.cn/newsDetail_forward_33400009,2026-06-17 09:44:43,澎湃新闻
明天入梅！奉贤入梅首场大雨在即，中考期间有阵雨，考生出行务必提前规划,https://www.thepaper.cn/newsDetail_forward_33401549,2026-06-17 09:42:00,奉贤柘林
虹口区卫健委召开2026年第二季度安全生产工作暨安全生产月专题宣讲会,https://www.thepaper.cn/newsDetail_forward_33400361,2026-06-17 09:40:00,健康虹口
卫健聚焦 | 医养融合新地标！2026上海游艇嘉年华在北外滩启幕，还能体验“国潮养生”,https://www.thepaper.cn/newsDetail_forward_33400360,2026-06-17 09:40:00,健康虹口
携手续启新征程 深耕科创助创业 ——园区与上海市大学生科技创业基金会续签合作协议,https://www.thepaper.cn/newsDetail_forward_33400734,2026-06-17 09:37:00,上海海洋大学
媒体聚焦 | 新民晚报：2026年上海市“安全宣传咨询日”主题活动举办,https://www.thepaper.cn/newsDetail_forward_33400733,2026-06-17 09:37:00,上海应急守护
媒体聚焦 | 文汇报：推动安全宣传走进群众，上海举行这项主题活动,https://www.thepaper.cn/newsDetail_forward_33400732,2026-06-17 09:37:00,上海应急守护
媒体聚焦 | 新华网：推动安全宣传走进群众，上海举行这项主题活动,https://www.thepaper.cn/newsDetail_forward_33400731,2026-06-17 09:37:00,上海应急守护
媒体聚焦 | 话匣子：筑牢城市安全防线，2026年上海市“安全宣传咨询日”暨黄浦区“铸安先锋 守护黄浦”主题活动举办,https://www.thepaper.cn/newsDetail_forward_33400729,2026-06-17 09:37:00,上海应急守护
2026上海国际游艇生活嘉年华启幕，北外滩岸线变身水岸生活乐园,https://www.thepaper.cn/newsDetail_forward_33400718,2026-06-17 09:36:00,文化虹口
2人成团、电影级视听看世界杯，上海多家影院加入世界杯赛事直播,https://www.thepaper.cn/newsDetail_forward_33394206,2026-06-17 09:33:28,蓝鲸新闻
姚明、孙俪、潘虹......一道为“上海小囡”庆祝生日,https://www.thepaper.cn/newsDetail_forward_33392376,2026-06-17 09:32:21,申江服务导报
上海构筑全域浸润的红色文化育人生态，激活培根铸魂“强磁场”,https://www.thepaper.cn/newsDetail_forward_33394245,2026-06-17 09:31:23,中国教育报
18日上海入梅！假期局部有暴雨,https://www.thepaper.cn/newsDetail_forward_33402154,2026-06-17 09:30:00,上海市莘庄工业区
2026年闵行区中考出行提示,https://www.thepaper.cn/newsDetail_forward_33402149,2026-06-17 09:30:00,上海市莘庄工业区
政策速览｜闵行区经委关于组织申报2026年技术改造专项的通知,https://www.thepaper.cn/newsDetail_forward_33402148,2026-06-17 09:30:00,上海市莘庄工业区
基层消防治理｜普陀区织密居家消防安全 “五张网”,https://www.thepaper.cn/newsDetail_forward_33400706,2026-06-17 09:22:00,上海消防
【市重大工程】180吨顶升+机器人焊接，浦东机场四期能源中心项目迎来关键节点,https://www.thepaper.cn/newsDetail_forward_33402580,2026-06-17 09:19:00,上海住房城乡建设管理
【绿色低碳】奉贤区4个项目获得绿色建筑标识认定！,https://www.thepaper.cn/newsDetail_forward_33402579,2026-06-17 09:19:00,上海住房城乡建设管理
双色球第2026068期：中出一等奖14注，筹集公益金1.36亿元,https://www.thepaper.cn/newsDetail_forward_33399619,2026-06-17 09:05:01,上海福彩
支持上海国际金融中心建设！金融监管总局围绕五个方面出台系列新举措,https://www.thepaper.cn/newsDetail_forward_33399618,2026-06-17 09:03:39,澎湃新闻
端午假期叠加毕业出行，上海松江站5天预计发送旅客14万人次,https://www.thepaper.cn/newsDetail_forward_33402163,2026-06-17 09:03:00,上海松江
松江明天入梅！端午当天有大雨局部暴雨，中考期间潮湿闷热有短时小雨,https://www.thepaper.cn/newsDetail_forward_33402161,2026-06-17 09:03:00,上海松江
湖上百桨竞渡，岸上文明同行！奉贤这场龙舟赛热火朝天,https://www.thepaper.cn/newsDetail_forward_33400765,2026-06-17 09:03:00,上海奉贤
