title,url,time,source
“清朗浦江·2026”网络生态治理旬邀您携手共筑良好生态,https://www.thepaper.cn/newsDetail_forward_32685502,2026-03-03 01:55:41,澎湃新闻
海归们：选择在青浦创业真是“太香了”！,https://www.thepaper.cn/newsDetail_forward_33021925,2026-04-21 15:11:00,绿色青浦
双色球今晚开奖，奖池16.49亿余元,https://www.thepaper.cn/newsDetail_forward_33021295,2026-04-21 15:00:02,上海福彩
上海福彩亮相婚育文化节 以公益书写城市温情,https://www.thepaper.cn/newsDetail_forward_33021279,2026-04-21 15:00:02,上海福彩
加强新兴领域知识产权保护、助力新质生产力发展，上海这样推进→,https://www.thepaper.cn/newsDetail_forward_33023156,2026-04-21 13:35:00,上海高院
纪念｜陈秋草黄幻吾联展上海中国画院,https://www.thepaper.cn/newsDetail_forward_33017616,2026-04-21 13:14:35,澎湃新闻
沪上寻藏：一杯茶，一条路，一座城,https://www.thepaper.cn/newsDetail_forward_33020461,2026-04-21 13:05:01,西藏主要新闻
上海浦东国际机场口岸单日入境外籍人员破2.5万人次，创历史新高,https://www.thepaper.cn/newsDetail_forward_33019707,2026-04-21 12:55:03,澎湃新闻
@所有市民，2026年度上海市城市体检社会调查邀您参与,https://www.thepaper.cn/newsDetail_forward_33021926,2026-04-21 12:55:00,绿色青浦
青浦这所高校用一场阅读大赛为学生“思维补钙”,https://www.thepaper.cn/newsDetail_forward_33021923,2026-04-21 12:55:00,绿色青浦
刘斌已任上海市应急管理局党委书记,https://www.thepaper.cn/newsDetail_forward_33020314,2026-04-21 12:54:40,澎湃新闻
上海机场警方严厉打击出租车驾驶员“恶意甩客”违法行为,https://www.thepaper.cn/newsDetail_forward_33023116,2026-04-21 12:50:00,警民直通车上海
浦东脑机接口 从“实验室”走向“门诊室”,https://www.thepaper.cn/newsDetail_forward_33018445,2026-04-21 12:34:07,东方财经浦东频道
我嘉超乒｜激动！嘉定和乒乓，有着这两段重磅交集！,https://www.thepaper.cn/newsDetail_forward_33023174,2026-04-21 12:31:54,上海嘉定
浦东迎来制造业“风向标”盛会 中国数控机床展“把脉”未来智造,https://www.thepaper.cn/newsDetail_forward_33019680,2026-04-21 12:30:09,东方财经浦东频道
点赞礼让，批评抢道！上海街头老人对司机态度“恩怨分明”,https://www.thepaper.cn/newsDetail_forward_33018406,2026-04-21 12:20:08,澎湃新闻
市司法局、市交通委联合召开上海航运法律共同体2026年联席会议,https://www.thepaper.cn/newsDetail_forward_33023192,2026-04-21 12:14:40,上海市司法局
机场区域“恶意甩客”，2名出租车驾驶员被警方行政拘留,https://www.thepaper.cn/newsDetail_forward_33020022,2026-04-21 12:09:42,澎湃新闻
书香润心聚文脉，文学筑梦在虹口！“相约虹口·书香润心”世界读书日专场活动举行,https://www.thepaper.cn/newsDetail_forward_33023169,2026-04-21 12:04:28,上海虹口
新貌?+新店?！上海市场提升改造有序推进→,https://www.thepaper.cn/newsDetail_forward_33021241,2026-04-21 11:58:00,涧西融媒
2026上海国际花卉节普陀赏花指南：TOP中央公园露营，半马苏河公园慢跑,https://www.thepaper.cn/newsDetail_forward_33021527,2026-04-21 11:56:00,上海普陀
全线贯通！上海崇明出发1小时到人民广场！本市首条穿越长江的地铁要来了！,https://www.thepaper.cn/newsDetail_forward_33023231,2026-04-21 11:55:18,市民云
世赛进入筹办冲刺阶段，组委会第二次全体会议在沪举行，陈吉宁王晓萍龚正出席,https://www.thepaper.cn/newsDetail_forward_33019644,2026-04-21 11:54:22,澎湃新闻
“全网最不想火”的老板“老莫”现身黄浦吃鸡！网友：“笑不活了！逃班来上海还护食”,https://www.thepaper.cn/newsDetail_forward_33022905,2026-04-21 11:35:44,上海黄浦
82轮竞价、9家竞买人争抢 上海土拍释放积极信号,https://www.thepaper.cn/newsDetail_forward_33019643,2026-04-21 11:35:02,中国房地产报
赴沪揽才，合肥“千企万岗”走进上海交大！,https://www.thepaper.cn/newsDetail_forward_33022761,2026-04-21 11:30:35,合肥发布
针对儿童青少年近视防控、心理行为发育监测等，上海发布行动计划,https://www.thepaper.cn/newsDetail_forward_33019238,2026-04-21 11:23:46,澎湃新闻
为服务国家对外工作大局贡献虹口力量，区委中心组学习（扩大）会议举行,https://www.thepaper.cn/newsDetail_forward_33021374,2026-04-21 11:18:00,上海虹口
2026上海国际花卉节丨上海植物园→西岸 步行+骑行一站式赏花打卡地图在此,https://www.thepaper.cn/newsDetail_forward_33021802,2026-04-21 11:09:00,绿色上海
2026年一季度上海乘用车销量公布，蔚来居首,https://www.thepaper.cn/newsDetail_forward_33020977,2026-04-21 11:02:00,上海嘉定
长宁区公布第二批网络餐饮食品安全专项整治典型案例,https://www.thepaper.cn/newsDetail_forward_33022428,2026-04-21 10:51:12,上海长宁
星际荣耀、蓝箭航天等头部企业齐聚长宁，共话空天产业发展,https://www.thepaper.cn/newsDetail_forward_33022089,2026-04-21 10:51:12,上海长宁
蒋锋在沪拜访阿斯利康高层并为盛合晶微上市鸣锣,https://www.thepaper.cn/newsDetail_forward_33022380,2026-04-21 10:40:24,无锡发布
【执法动态】静安区石门二路街道综合行政执法队依法处置 非法占用无障碍设施 保障出行“无碍”,https://www.thepaper.cn/newsDetail_forward_33021119,2026-04-21 10:08:00,上海城管
关注 | 1000万美元首投！百年齿科巨头首次“搬家”中国，落地上海闵行,https://www.thepaper.cn/newsDetail_forward_33019989,2026-04-21 10:01:00,投资上海
政策 | 解读《上海全球科技伙伴计划》,https://www.thepaper.cn/newsDetail_forward_33019600,2026-04-21 10:01:00,投资上海
区情 | 虹口区与森世海亚集团座谈交流,https://www.thepaper.cn/newsDetail_forward_33019597,2026-04-21 10:01:00,投资上海
《上海市推动产业互联网平台赋能产业发展行动方案（2026-2028年）》发布，一图读懂→,https://www.thepaper.cn/newsDetail_forward_33022018,2026-04-21 09:50:42,上海市工商联
【高质量发展服务月】“倾听心声，精准赋能——助力民营经济高质量发展”松江区民营经济圆桌会举行,https://www.thepaper.cn/newsDetail_forward_33022017,2026-04-21 09:50:42,上海市工商联
坚定道路自信 领航发展方向 虹口区“民营企业视点汇”每季一课活动顺利举办,https://www.thepaper.cn/newsDetail_forward_33022016,2026-04-21 09:50:42,上海市工商联
“新时代民营企业家培养计划”第六期：两位上海民营企业家获奖→,https://www.thepaper.cn/newsDetail_forward_33022015,2026-04-21 09:50:42,上海市工商联
"“上海城市变迁与妇女教育发展""系列视频课程第二集（下）",https://www.thepaper.cn/newsDetail_forward_32917315,2026-04-21 09:46:33,上海市妇女干部学校
有组织的立地研发赋能产科教融合,https://www.thepaper.cn/newsDetail_forward_33017896,2026-04-21 09:43:43,中国教育报
书香润校园 好书伴成长——首个“全民阅读活动周”现场直击,https://www.thepaper.cn/newsDetail_forward_33016712,2026-04-21 09:43:41,中国教育报
院所联动，精诚护航！虹口区检察院与上海材料研究所开展党组理论学习中心组联组学习,https://www.thepaper.cn/newsDetail_forward_33022274,2026-04-21 09:40:00,虹口区司法局
招商蛇口一日拿下上海两宗地块，徐汇植物园地块溢价率25%,https://www.thepaper.cn/newsDetail_forward_33018741,2026-04-21 09:38:39,澎湃新闻
上海芭蕾舞团×闵行博物馆联动，一场展览有了更多“打开方式”,https://www.thepaper.cn/newsDetail_forward_33022926,2026-04-21 09:26:00,上海市闵行区司法局
真爱梦想年报发布：AI赋能教育公平，计划2030年覆盖3000所县域学校,https://www.thepaper.cn/newsDetail_forward_33018379,2026-04-21 09:07:04,澎湃新闻
上海加强前沿制度研究，开展人工智能知识产权快速协同保护指南编制,https://www.thepaper.cn/newsDetail_forward_33018424,2026-04-21 08:56:41,澎湃新闻
2026年“云游金山·滦平好物”金山岭首届主播大赛招募令,https://www.thepaper.cn/newsDetail_forward_33022841,2026-04-21 08:56:24,网信滦平
只进“顶奢商场”的君佩黄金，上海首店选择大豫园！开业时间定在→,https://www.thepaper.cn/newsDetail_forward_33021139,2026-04-21 08:48:08,上海黄浦
何以嘉定 | 一件大衣，售价5位数~这个品牌的梦想，是在嘉定打造“时尚帝国”→,https://www.thepaper.cn/newsDetail_forward_33020979,2026-04-21 08:46:50,上海嘉定
全新IP形象亮相，第十二届浦东职工读书荟主题日活动举行,https://www.thepaper.cn/newsDetail_forward_33018415,2026-04-21 08:31:34,澎湃新闻
影响18万股民！国泰海通之后，又一起重磅券商合并！东方证券拟收购上海证券，总资产有望突破6000亿元,https://www.thepaper.cn/newsDetail_forward_33021894,2026-04-21 08:13:00,红星资本局
浦东：老三林港水闸顺利实现通水,https://www.thepaper.cn/newsDetail_forward_33022509,2026-04-21 08:12:11,上海水务海洋
解锁新名片！世界工业设计学会在上海复兴岛成立,https://www.thepaper.cn/newsDetail_forward_33022874,2026-04-21 08:09:32,上海杨浦
视频丨阜阳舰、千岛湖舰抵达上海，与东方明珠同框,https://www.thepaper.cn/newsDetail_forward_33018318,2026-04-21 08:05:03,澎湃新闻
上巳春禧，有缘相会！上海青年职工交友活动在奉贤圆满举办,https://www.thepaper.cn/newsDetail_forward_33022812,2026-04-21 08:03:00,上海奉贤
沪籍非沪籍都要交！2026上海小学新生必须出具这个证件！丢失马上补办！现可在线查验！,https://www.thepaper.cn/newsDetail_forward_33017897,2026-04-21 08:00:02,市民云
影像上海艺术博览会参展画廊 | 格莱斯顿画廊 Gladstone Gallery,https://www.thepaper.cn/newsDetail_forward_33001719,2026-04-21 07:53:28,PHOTOFAIRS影像艺术博览会
嘉定区经济运行调度优化工作专题会举行，调度部署下阶段经济运行重点工作,https://www.thepaper.cn/newsDetail_forward_33019729,2026-04-21 07:53:00,上海嘉定
