title,url,time,source
“清朗浦江·2026”网络生态治理旬邀您携手共筑良好生态,https://www.thepaper.cn/newsDetail_forward_32685502,2026-03-03 01:55:41,澎湃新闻
奥运冠军刘诗雯现身上海这场乒乓嘉年华，“希望大家都能享受比赛”,https://www.thepaper.cn/newsDetail_forward_33053438,2026-04-25 11:35:34,澎湃新闻
你支持的代表队晋级了吗？2026上海乒乓球嘉年华奉贤区预选赛8强出炉→,https://www.thepaper.cn/newsDetail_forward_33054229,2026-04-25 11:10:00,上海奉贤
重构的时代：创新与共治 “上海论坛2026”年会在沪开幕,https://www.thepaper.cn/newsDetail_forward_33046890,2026-04-25 11:09:40,东方财经浦东频道
以榜样力量深化思政育人 “劳模进校园” 主题活动在上海第二工业大学举行,https://www.thepaper.cn/newsDetail_forward_33046860,2026-04-25 11:09:40,东方财经浦东频道
春日美景联动萌宠经济 浦东新区文明养宠主题活动启动,https://www.thepaper.cn/newsDetail_forward_33046822,2026-04-25 11:09:40,东方财经浦东频道
聚焦加强体育知识产权司法保护 专场研讨会在浦东举行,https://www.thepaper.cn/newsDetail_forward_33046786,2026-04-25 11:07:02,东方财经浦东频道
浦东全面升级“两个100万”政策 全力打造“青创第一城”,https://www.thepaper.cn/newsDetail_forward_33046737,2026-04-25 11:07:02,东方财经浦东频道
这个五一你准备去哪里玩呢？确定不来上海吗？#,https://www.thepaper.cn/newsDetail_forward_33053561,2026-04-25 10:55:08,七彩陵城_孙松
“个头大，汁水足！”永善枇杷空降闵行，市民抢着买,https://www.thepaper.cn/newsDetail_forward_33053886,2026-04-25 10:34:00,上海市莘庄工业区
商场变赛场！世界冠军与市民趣味过招，齐聚徐汇乒乓嘉年华｜乒一记 汇来赛,https://www.thepaper.cn/newsDetail_forward_33054382,2026-04-25 10:15:00,上海徐汇
一顶“小虹帽”，三地版权桥！虹口法院知识产权司法保护品牌发布,https://www.thepaper.cn/newsDetail_forward_33054184,2026-04-25 10:02:00,上海虹口
海峡两岸携手弘扬中华文化！华风时尚·2026中华美学时尚发展大会在沪举办,https://www.thepaper.cn/newsDetail_forward_33053106,2026-04-25 09:30:06,澎湃新闻
“好房子达人计划”启动，百位内容创作者共话“杨浦生活范儿”,https://www.thepaper.cn/newsDetail_forward_33054343,2026-04-25 09:23:00,上海杨浦
桨韵苏河，逐梦前行——2026上海赛艇城市精英赛火热开赛,https://www.thepaper.cn/newsDetail_forward_33053173,2026-04-25 09:10:00,上海普陀
文化同源根脉相连，两岸深化交流共话“华风时尚”,https://www.thepaper.cn/newsDetail_forward_33052630,2026-04-25 09:07:51,澎湃新闻
韩国地方政府驻沪代表沉浸“岐黄传香”，共绘海派中医国际化新蓝图,https://www.thepaper.cn/newsDetail_forward_33054356,2026-04-25 08:46:00,上海黄浦
“万词霸屏”“数据搬运”如何定性？嘉定法院发布白皮书划清网络竞争边界,https://www.thepaper.cn/newsDetail_forward_33054205,2026-04-25 08:31:00,上海嘉定
“潮生海上·美启奉贤”——上海工业文化大讲坛登陆奉贤！共探美妆工业文化坚守与破圈之道,https://www.thepaper.cn/newsDetail_forward_33053397,2026-04-25 08:27:00,奉贤柘林
上海始祖鸟博物馆迎来全新主题展览，外骨骼软壳裤首次亮相中国,https://www.thepaper.cn/newsDetail_forward_33054352,2026-04-25 08:21:00,上海静安
别被这些说法带偏！一文拆解疫苗接种常见误区丨上海健康播报,https://www.thepaper.cn/newsDetail_forward_33048141,2026-04-25 07:36:57,沪小康-上海健康科普资源库
沪藏携手赋能高原粮仓，上海企业赴日喀则调研青稞产业深化全链条合作,https://www.thepaper.cn/newsDetail_forward_33052826,2026-04-25 07:31:00,上海援藏
【提示】普陀区敦煌路（真南路—古浪路）4月24日夜间起封闭施工,https://www.thepaper.cn/newsDetail_forward_33052566,2026-04-25 07:20:00,上海普陀
五四薪火照初心，崇明青年这样说,https://www.thepaper.cn/newsDetail_forward_33054386,2026-04-25 07:17:00,上海崇明
百余画作中的上海城市地标：从外滩到郊野公园,https://www.thepaper.cn/newsDetail_forward_33050883,2026-04-25 07:05:13,澎湃新闻
AI帮忙找工作，社区架起供需桥：嘉定交出一份春季就业“高分答卷”,https://www.thepaper.cn/newsDetail_forward_33054204,2026-04-25 07:02:00,上海嘉定
从“读书日”到“阅读周”，上海也是一座“宜读”的城市,https://www.thepaper.cn/newsDetail_forward_33051876,2026-04-25 06:58:00,澎湃新闻
《图兰朵》在上海的百年回响，上海歌剧院三场演出售罄,https://www.thepaper.cn/newsDetail_forward_33052072,2026-04-25 06:54:46,澎湃新闻
吴毅任上海对外经贸大学党委书记,https://www.thepaper.cn/newsDetail_forward_33051712,2026-04-25 06:27:37,澎湃新闻
徐汇区新增“电子警察”3套,https://www.thepaper.cn/newsDetail_forward_33054381,2026-04-25 06:02:00,上海徐汇
全市优秀！宝山区老年护理管理质控组再获肯定,https://www.thepaper.cn/newsDetail_forward_33054377,2026-04-25 06:02:00,上海宝山
上海地铁48小时内连发两起自燃事故！事后当事人均称“不清楚”,https://www.thepaper.cn/newsDetail_forward_33052448,2026-04-25 06:01:00,中国消防
中国首演来青浦，小青果请你看剧→,https://www.thepaper.cn/newsDetail_forward_33053204,2026-04-25 05:57:00,绿色青浦
免费住15天？真香！南阳姑娘亲测：来奉贤找工作，像回家一样,https://www.thepaper.cn/newsDetail_forward_33054246,2026-04-25 05:54:00,上海奉贤
整合技术资源，嘉定高精齿轮制造基地再升级！,https://www.thepaper.cn/newsDetail_forward_33054201,2026-04-25 05:31:00,上海嘉定
咳喘20年久治不愈，竟是少见病作祟！闵行开启医养无缝衔接模式,https://www.thepaper.cn/newsDetail_forward_33052182,2026-04-25 04:32:00,今日闵行
三年“数字缪斯”，为上海的城市发展带来了什么,https://www.thepaper.cn/newsDetail_forward_33043752,2026-04-25 03:15:19,澎湃新闻
镇海印社“海上问道”，展出60余巨印与原拓,https://www.thepaper.cn/newsDetail_forward_33050313,2026-04-25 03:11:27,澎湃新闻
昆山在沪举办文化产业推介交流会，发出文旅融合的江南请柬,https://www.thepaper.cn/newsDetail_forward_33050983,2026-04-25 03:03:00,澎湃江苏
“幸福生活从哪里来”？虹口师生用一场“红色读书会”作答→,https://www.thepaper.cn/newsDetail_forward_33054183,2026-04-25 03:01:00,上海虹口
“渔二代”回崇明创业，有传承有创新,https://www.thepaper.cn/newsDetail_forward_33054384,2026-04-25 02:25:00,上海崇明
上海AI实验室推出新一代蛋白质大模型书生AMix，加速生命科学发现,https://www.thepaper.cn/newsDetail_forward_33051114,2026-04-25 02:16:00,上海科技
沪上书香润喀什 阅读之光照未来——首届喀什全民阅读大会上海展区精彩亮相,https://www.thepaper.cn/newsDetail_forward_33050186,2026-04-25 01:28:06,澎湃新闻
双珠璀璨连全域，花漾奉贤焕新颜！2026上海国际花卉节奉贤会场“花开南上海”今日开展,https://www.thepaper.cn/newsDetail_forward_33054230,2026-04-25 01:14:00,上海奉贤
体坛联播｜皇马遭贝蒂斯绝平，上海男篮23连胜追平队史纪录,https://www.thepaper.cn/newsDetail_forward_33049867,2026-04-25 01:04:40,澎湃新闻
“没有盈利也侵权？”徐汇“蓝鲸”现场普法,https://www.thepaper.cn/newsDetail_forward_33053664,2026-04-25 01:03:00,上海徐汇
以书为伴不负春光，徐汇职工在阅读里积蓄力量,https://www.thepaper.cn/newsDetail_forward_33050411,2026-04-25 01:03:00,上海徐汇
美国前助理国务卿冯稼时：美国独大已成历史，特朗普冲击破坏现体系,https://www.thepaper.cn/newsDetail_forward_33046617,2026-04-25 01:02:57,澎湃新闻
市商务委来松江座谈交流,https://www.thepaper.cn/newsDetail_forward_33054371,2026-04-25 01:01:00,上海松江
守沪创新 真知卓检｜检护三农·练塘茭白：从“地里鲜”到“名片亮”的法治密码,https://www.thepaper.cn/newsDetail_forward_33051219,2026-04-25 01:00:00,青浦检察
守沪创新 真知卓检丨知产小课堂——这些“神操作”翻车了！企业避坑指南请收好,https://www.thepaper.cn/newsDetail_forward_33053500,2026-04-25 00:15:00,上海宝山检察
来静安提前“过节”！还有火到海外的永源路，好逛好买→,https://www.thepaper.cn/newsDetail_forward_33054349,2026-04-25 00:04:00,上海静安
第六届“海聚英才”全球创新创业大赛虹口区选拔赛、成都分赛区选拔赛开始报名！,https://www.thepaper.cn/newsDetail_forward_33054182,2026-04-25 00:02:00,上海虹口
倒计时3天！青创上海-2026徐汇滨江徒步行活动，现场设置4个任务打卡点，好期待→,https://www.thepaper.cn/newsDetail_forward_33050136,2026-04-24 23:58:00,上海市工商联
吴心伯谈中东局势：特朗普急于抽身，对欧洲的冷淡也很伤心,https://www.thepaper.cn/newsDetail_forward_33046989,2026-04-24 23:14:48,澎湃新闻
上海召开2026年涉外法治工作部署会,https://www.thepaper.cn/newsDetail_forward_33049574,2026-04-24 22:52:00,司法部
早安杨浦 | 周末阳光大放送！洗晒出游抓紧安排,https://www.thepaper.cn/newsDetail_forward_33049712,2026-04-24 22:31:00,上海杨浦
松江智造出海赋能！海克斯康助力哥伦比亚建设地理空间数据基础设施,https://www.thepaper.cn/newsDetail_forward_33049759,2026-04-24 22:30:00,上海松江
好看、好玩、好吃！松江这7条乡村春游线路请收好→,https://www.thepaper.cn/newsDetail_forward_33049758,2026-04-24 22:30:00,上海松江
为毕业生送上“安居大礼包”，保租房进校园专项行动走进松江大学城,https://www.thepaper.cn/newsDetail_forward_33049757,2026-04-24 22:30:00,上海松江
于佩尔获白玉兰戏剧主角奖，钟情上海助推中法戏剧交流,https://www.thepaper.cn/newsDetail_forward_33045326,2026-04-24 15:28:45,澎湃新闻
