title,url,time,source
粤产电影再突破！三篇入围金爵奖,https://www.thepaper.cn/newsDetail_forward_33306295,2026-06-04 03:46:36,广东影视头条
上海餐桌｜喝杯“阿三”送的牛奶：被遗忘的上海印度裔奶牛工,https://www.thepaper.cn/newsDetail_forward_32704675,2026-06-04 03:41:52,澎湃新闻
【通知】关于延长《上海市颠覆性技术创新项目管理暂行办法》有效期的通知,https://www.thepaper.cn/newsDetail_forward_33306235,2026-06-04 02:26:00,上海科技
“东北超”大连队迎首个主场，七天七城43景区向上海游客免费开放,https://www.thepaper.cn/newsDetail_forward_33305735,2026-06-04 02:22:57,澎湃辽宁
上海，重塑IP经济的底层逻辑,https://www.thepaper.cn/newsDetail_forward_33306258,2026-06-04 02:21:00,上海徐汇
凝心聚力谱新篇，普陀区召开2026年“桃浦地区发展”有关建议提案沟通答复会,https://www.thepaper.cn/newsDetail_forward_33306239,2026-06-04 02:13:00,上海普陀
上海工业历史纪录片《百年传动》明起全网推出,https://www.thepaper.cn/newsDetail_forward_33305624,2026-06-04 02:02:12,澎湃新闻
澎湃新闻 | 上海未检白皮书发布，近五年未成年人犯罪规模明显下降,https://www.thepaper.cn/newsDetail_forward_33306247,2026-06-04 02:00:00,上海检察
中国企业改革与发展研究会副会长范建林一行到访上海联交所,https://www.thepaper.cn/newsDetail_forward_33305636,2026-06-04 01:30:01,上海联交所
直播丨上海警方通报“治理制售假劣肉制品问题”等有关情况,https://www.thepaper.cn/newsDetail_forward_33282092,2026-06-04 01:26:11,澎湃新闻
高考倒计时！长宁警方：考点周边这些时段禁止施工→,https://www.thepaper.cn/newsDetail_forward_33306245,2026-06-04 01:17:00,上海长宁
宝山区房管局开展高层住宅消防安全防范工作实地指导,https://www.thepaper.cn/newsDetail_forward_33305874,2026-06-04 01:07:00,上海房管
市住建委、市房管局组织开展2026年上海市建、构筑物拆除行业防汛防台暨突发事件应急抢险演练,https://www.thepaper.cn/newsDetail_forward_33305872,2026-06-04 01:07:00,上海房管
黄浦区4月各街道房管机构工作动态,https://www.thepaper.cn/newsDetail_forward_33305871,2026-06-04 01:07:00,上海房管
青浦新城公司召开安全生产暨防汛工作部署会议,https://www.thepaper.cn/newsDetail_forward_33305870,2026-06-04 01:07:00,上海房管
市房管局市场监管处走访检查闵行区长租公寓日常管理工作,https://www.thepaper.cn/newsDetail_forward_33305869,2026-06-04 01:07:00,上海房管
首届内容创作者论坛在上海举行,https://www.thepaper.cn/newsDetail_forward_33305408,2026-06-04 00:52:44,澎湃新闻
上影节排片表上线，但今年的电影节功课可不只在这张表上,https://www.thepaper.cn/newsDetail_forward_33303591,2026-06-04 00:41:53,澎湃新闻
《不眠之夜》十年：一部戏撬动百亿产业，从上海到深圳，“沉浸式”如何成为一门持续的生意？,https://www.thepaper.cn/newsDetail_forward_33298256,2026-06-04 00:26:54,东西文娱
4金2银1铜！徐汇小轮车小将“骑”开得胜,https://www.thepaper.cn/newsDetail_forward_33305593,2026-06-04 00:06:00,上海徐汇
哪些花卉节艺术景观装置将继续留在长宁？| 与“宁”一起答,https://www.thepaper.cn/newsDetail_forward_33305582,2026-06-04 00:04:00,上海长宁
这天，上海中医药大学美国东北大学研修团走进了鼎丰酱园……,https://www.thepaper.cn/newsDetail_forward_33305880,2026-06-04 00:00:00,上海奉贤
下班也能办！虹口出入境夜间专场来了，全市42场次这样安排→,https://www.thepaper.cn/newsDetail_forward_33305877,2026-06-04 00:00:00,上海虹口
一湖、一城、一村：青浦的“生态三问”丨青融时评,https://www.thepaper.cn/newsDetail_forward_33305867,2026-06-04 00:00:00,绿色青浦
出入境办证夜间专场！金山是这两天…,https://www.thepaper.cn/newsDetail_forward_33305587,2026-06-04 00:00:00,i金山
这几天身份证丢了？别慌！上海警方提示→,https://www.thepaper.cn/newsDetail_forward_33305588,2026-06-03 23:30:00,上海静安
上海市中医医院2026年三伏贴已全面开启预约→,https://www.thepaper.cn/newsDetail_forward_33305371,2026-06-03 23:30:00,上海静安
对接企业真需求、触摸产业最前沿，松江“2+4”现代化产业体系进校园活动启动,https://www.thepaper.cn/newsDetail_forward_33305375,2026-06-03 22:30:00,上海松江
提供“中国方案”！上海交大医学院松江研究院多项原创成果破局医学难题,https://www.thepaper.cn/newsDetail_forward_33305374,2026-06-03 22:30:00,上海松江
把海苔卖向全球！松江这家企业的秘诀是→,https://www.thepaper.cn/newsDetail_forward_33305373,2026-06-03 22:30:00,上海松江
早安杨浦 | 局部大雨到暴雨，下到什么时候？,https://www.thepaper.cn/newsDetail_forward_33305160,2026-06-03 22:30:00,上海杨浦
在服务普陀高质量发展和上海（长三角）国际科创中心建设中展现更大作为！区领导调研大学科技园,https://www.thepaper.cn/newsDetail_forward_33303904,2026-06-03 15:43:00,上海普陀
跨越山海医教情，沪滇协作惠民生,https://www.thepaper.cn/newsDetail_forward_33303907,2026-06-03 14:50:00,上海宝山
不用写论文，上海多所高校通过实践成果让学生顺利毕业,https://www.thepaper.cn/newsDetail_forward_33303133,2026-06-03 14:41:20,澎湃新闻
扩能提质、优质高效！宝山区服务业企业座谈会召开,https://www.thepaper.cn/newsDetail_forward_33303716,2026-06-03 14:04:00,上海宝山
激活软法治理效能，做实法治为民答卷！普陀区基层治理软法指引交流推广会暨“软法赋能集市”活动举行,https://www.thepaper.cn/newsDetail_forward_33303406,2026-06-03 13:50:00,上海普陀
青浦这些地方将告别积水、漏水烦恼~,https://www.thepaper.cn/newsDetail_forward_33303903,2026-06-03 13:46:00,绿色青浦
三大创新 五项协同 未成年人审判法律援助直通护航机制在浦东启动,https://www.thepaper.cn/newsDetail_forward_33301578,2026-06-03 13:28:22,东方财经浦东频道
第十二届上交会将于6月11日至13日在浦东举办,https://www.thepaper.cn/newsDetail_forward_33301575,2026-06-03 13:28:22,东方财经浦东频道
上海交大师生眼中的顾诵芬：用粉笔勾勒机翼，为学生讲解超声速飞机设计,https://www.thepaper.cn/newsDetail_forward_33301313,2026-06-03 13:06:13,澎湃新闻
到岗即上岗，上海援疆专家与喀什团队携手共解胆道危机,https://www.thepaper.cn/newsDetail_forward_33304459,2026-06-03 13:02:00,上海援疆
闵行区召开上市公司座谈会,https://www.thepaper.cn/newsDetail_forward_33303685,2026-06-03 13:01:00,今日闵行
美国桥水投资公司首席执行官称赞上海“令人震撼”，龚正市长会见,https://www.thepaper.cn/newsDetail_forward_33300907,2026-06-03 12:57:12,澎湃新闻
第28届上海国际电影节排片表公布，线上购票攻略来了,https://www.thepaper.cn/newsDetail_forward_33302155,2026-06-03 12:52:07,澎湃新闻
九三学社上海市杨浦区第十次代表大会召开,https://www.thepaper.cn/newsDetail_forward_33302850,2026-06-03 12:51:00,上海杨浦
拆了！金山这个老旧小区大变样，惠及50多户居民?,https://www.thepaper.cn/newsDetail_forward_33303704,2026-06-03 12:31:00,i金山
暖心！“两司”群体为上海学子撑起“流动护考伞”,https://www.thepaper.cn/newsDetail_forward_33302893,2026-06-03 12:30:00,上海徐汇
当17国留学生遇见老上海……“里弄洋观察”活动在长宁举办,https://www.thepaper.cn/newsDetail_forward_33303694,2026-06-03 12:18:00,上海长宁
九三学社上海市虹口区第十次代表大会召开,https://www.thepaper.cn/newsDetail_forward_33304227,2026-06-03 12:15:00,九三学社上海市委
长三角高能级技术创新平台+1！中建一局承建的上海浦东华勤全球研发中心项目交付,https://www.thepaper.cn/newsDetail_forward_33303199,2026-06-03 12:05:00,中建一局
如何加强普法与执法，不断提升生活垃圾分类工作质效？上海市城管执法局答央广网记者问,https://www.thepaper.cn/newsDetail_forward_33303560,2026-06-03 12:03:00,上海城管
【企业】汉高：150年德企，为何把亚洲最大研发中心放在杨浦？,https://www.thepaper.cn/newsDetail_forward_33304653,2026-06-03 12:02:00,投资上海Invest Shanghai
九三学社上海市杨浦区十次代表大会召开,https://www.thepaper.cn/newsDetail_forward_33304226,2026-06-03 11:47:00,九三学社上海市委
健康备考“划重点”：四大锦囊护考，助力考生从容应战丨上海健康播报,https://www.thepaper.cn/newsDetail_forward_33303900,2026-06-03 11:35:00,绿色青浦
沉痛悼念著名演员、上海盟员魏宗万,https://www.thepaper.cn/newsDetail_forward_33304651,2026-06-03 11:20:00,民盟上海市委
共建脑机接口研究型医院，上海闵行与华山医院签战略合作协议,https://www.thepaper.cn/newsDetail_forward_33300861,2026-06-03 11:18:56,澎湃新闻
与潮水赛跑，为生命护航｜长航公安局上海分局长兴派出所民警成功救助一名轻生男子,https://www.thepaper.cn/newsDetail_forward_33305000,2026-06-03 11:12:00,长航公安上海分局
上海今夜起雨势增强！局部地区可达大雨到暴雨，大家注意防范！,https://www.thepaper.cn/newsDetail_forward_33302073,2026-06-03 11:12:00,市民云
书记区长查防汛 | 徐汇区领导检查防汛工作,https://www.thepaper.cn/newsDetail_forward_33304029,2026-06-03 11:03:00,上海防汛
防汛备汛工作 | 崇明区开展2026年防汛防台综合应急演练,https://www.thepaper.cn/newsDetail_forward_33304028,2026-06-03 11:03:00,上海防汛
