title,url,time,source
区政府常务会议召开,https://www.thepaper.cn/newsDetail_forward_32495183,2026-01-29 15:01:00,上海普陀
“潮生海上”讲座人气旺，工业文化点亮上海软实力,https://www.thepaper.cn/newsDetail_forward_32495181,2026-01-29 15:01:00,上海普陀
华东政法大学来市司法局开展座谈交流,https://www.thepaper.cn/newsDetail_forward_32495041,2026-01-29 14:55:00,上海市司法局
青春赋能普陀发展！三大品牌项目焕新发布,https://www.thepaper.cn/newsDetail_forward_32495178,2026-01-29 14:46:00,上海普陀
中央纪委国家监委通报！,https://www.thepaper.cn/newsDetail_forward_32495038,2026-01-29 14:42:00,上海市司法局
【直播间】明天下午三点，上海市科技创新券政策解读（A、C、E类）| 沪上TTO分享荟（第四十五期）,https://www.thepaper.cn/newsDetail_forward_32495248,2026-01-29 14:25:00,上海科技
小小贴纸，把安全叮咛贴进了骑手们的日常里丨走基层,https://www.thepaper.cn/newsDetail_forward_32495380,2026-01-29 14:15:00,上海黄浦
新年第一训！市戒毒管理局召开戒治能力提升工作动员部署会,https://www.thepaper.cn/newsDetail_forward_32495040,2026-01-29 14:15:00,上海市司法局
当“戏曲”邂逅年俗，这场文明实践活动让马年新春“有戏”更有心！,https://www.thepaper.cn/newsDetail_forward_32494822,2026-01-29 14:11:00,上海虹口
女子用剁椒鱼头试探网恋男友，仍被骗68万,https://www.thepaper.cn/newsDetail_forward_32494218,2026-01-29 14:09:00,青春上海
星箭场一体化发射链、空间在轨运营链……上海建设商业航天“火箭星城”,https://www.thepaper.cn/newsDetail_forward_32491221,2026-01-29 13:57:17,澎湃新闻
《2:22》首演加场开票 | 请保管好你的判断，直至凌晨钟声敲响！,https://www.thepaper.cn/newsDetail_forward_32493795,2026-01-29 13:51:00,上海话剧艺术中心
本市一款一次性使用心腔内超声成像导管获批上市,https://www.thepaper.cn/newsDetail_forward_32495247,2026-01-29 13:50:00,上海科技
主要经济指标实现两位数增长！大虹桥举办核心区企业家圆桌会,https://www.thepaper.cn/newsDetail_forward_32495284,2026-01-29 13:41:00,今日闵行
龚正参加青浦区委常委会民主生活会，要求加力统筹重大战略落实和区域整体能级提升,https://www.thepaper.cn/newsDetail_forward_32495251,2026-01-29 13:31:00,绿色青浦
全球首次“Agentic Science at Scale”研讨会在沪召开，科学研究迎来“GPT”时刻,https://www.thepaper.cn/newsDetail_forward_32491224,2026-01-29 13:27:36,澎湃上海
全力打造更优营商环境|徐汇区召开2026年规范涉企行政检查工作部署会,https://www.thepaper.cn/newsDetail_forward_32494533,2026-01-29 13:10:00,上海市徐汇区司法局
供销集市别错过！家门口一站式购遍各地年货,https://www.thepaper.cn/newsDetail_forward_32495180,2026-01-29 13:04:00,上海普陀
袁园同志简历,https://www.thepaper.cn/newsDetail_forward_32494458,2026-01-29 13:04:00,上海黄浦
微信看电视丨2026年1月29日《嘉定新闻》,https://www.thepaper.cn/newsDetail_forward_32494899,2026-01-29 13:03:00,上海嘉定
上海市民健康素养水平18年“连升”，去年哪个知识点提升得最多？,https://www.thepaper.cn/newsDetail_forward_32490966,2026-01-29 12:59:01,澎湃新闻
惊心！婴儿衣物暗藏“金属凶器”，你家娃的衣物真的安全吗？,https://www.thepaper.cn/newsDetail_forward_32494975,2026-01-29 12:56:00,上海市莘庄工业区
莘工密码｜年最大充装量36万瓶！园区这家企业医用氧瓶充装项目竣工,https://www.thepaper.cn/newsDetail_forward_32494974,2026-01-29 12:56:00,上海市莘庄工业区
这些曾属于上海县的市镇，TA们的故事你知道吗？丨闵行情,https://www.thepaper.cn/newsDetail_forward_32494973,2026-01-29 12:56:00,上海市莘庄工业区
印度尼帕病毒病暴发！对我国有何影响？最新回应,https://www.thepaper.cn/newsDetail_forward_32494972,2026-01-29 12:56:00,上海市莘庄工业区
告家长书,https://www.thepaper.cn/newsDetail_forward_32494971,2026-01-29 12:56:00,上海市莘庄工业区
岁末焕新暖夕阳，园区这份暖心服务，让长者垃圾分类“零负担”→,https://www.thepaper.cn/newsDetail_forward_32494970,2026-01-29 12:56:00,上海市莘庄工业区
龚正参加上海青浦区委常委会民主生活会，要求加力统筹重大战略落实和区域整体能级提升,https://www.thepaper.cn/newsDetail_forward_32490979,2026-01-29 12:49:11,澎湃新闻
【执法为民】为民维权不缺位！Ta们依法查办物业领域违法案件，追回经济损失,https://www.thepaper.cn/newsDetail_forward_32495332,2026-01-29 12:41:00,上海城管
市城管执法局召开全系统1月执法办案讲评调度会,https://www.thepaper.cn/newsDetail_forward_32495331,2026-01-29 12:41:00,上海城管
【联合执法】打破 “边界墙”，温暖邻里路,https://www.thepaper.cn/newsDetail_forward_32495330,2026-01-29 12:41:00,上海城管
【执法保障】坚守寒潮防线 暖心救助 筑牢安全屏障,https://www.thepaper.cn/newsDetail_forward_32495329,2026-01-29 12:41:00,上海城管
静安首家街道知识产权服务平台成立！江宁路街道招商服务一体化工作推进会启动“五联”协同机制,https://www.thepaper.cn/newsDetail_forward_32493042,2026-01-29 12:34:00,上海静安
今天你抢券了嘛？上海久光中心：不少市民提前选货，来店坐等开抢！,https://www.thepaper.cn/newsDetail_forward_32493035,2026-01-29 12:34:00,上海静安
全程1318公里，中间只停一站！探访京沪间最快列车,https://www.thepaper.cn/newsDetail_forward_32492957,2026-01-29 12:32:00,中国铁路
共叙鱼水情深 共话双拥新篇，区领导走访慰问上海武警某部,https://www.thepaper.cn/newsDetail_forward_32494821,2026-01-29 12:24:00,上海虹口
上海检察机关去年惩治医保领域欺诈骗保犯罪，依法提起公诉165人,https://www.thepaper.cn/newsDetail_forward_32490733,2026-01-29 12:15:23,澎湃新闻
工业总产值创近20年新高！闵行这里正打造一座科创与智造之城→,https://www.thepaper.cn/newsDetail_forward_32494396,2026-01-29 12:15:00,今日闵行
嘉定区政府党风廉政建设工作会议召开,https://www.thepaper.cn/newsDetail_forward_32494893,2026-01-29 12:13:00,上海嘉定
速看！在上海乘高铁，这些事项与你有关,https://www.thepaper.cn/newsDetail_forward_32494919,2026-01-29 12:12:00,上铁集团
夜览·享读丨这部小说，写透理想与现实间的人生抉择,https://www.thepaper.cn/newsDetail_forward_32495392,2026-01-29 12:02:00,上海徐汇
2025年上海市电信业务成绩单出炉，多项数据位居全国第一,https://www.thepaper.cn/newsDetail_forward_32490698,2026-01-29 11:59:26,澎湃新闻
两款新品上市！飞利浦健康生活全球体验店变身“青春焕颜站”,https://www.thepaper.cn/newsDetail_forward_32493064,2026-01-29 11:57:00,上海静安
这才是上海人过年的正确打开方式！快来这里一站式购齐老上海年味,https://www.thepaper.cn/newsDetail_forward_32493063,2026-01-29 11:57:00,上海静安
开赛在即！赛事组委会公布了这些事→,https://www.thepaper.cn/newsDetail_forward_32494843,2026-01-29 11:51:00,上海长宁
上海又要下雪了？,https://www.thepaper.cn/newsDetail_forward_32494840,2026-01-29 11:51:00,上海长宁
政企携手稳就业，“15分钟就业服务圈”帮助失业居民重回职场,https://www.thepaper.cn/newsDetail_forward_32494466,2026-01-29 11:34:00,上海黄浦
明天中雨，或将转雪！,https://www.thepaper.cn/newsDetail_forward_32494464,2026-01-29 11:34:00,上海黄浦
上海启动气象高质量发展新三年行动，这些新技术、新服务值得期待,https://www.thepaper.cn/newsDetail_forward_32490696,2026-01-29 11:33:26,澎湃新闻
上海市妇联建议：构建“生育友好型社区就业支持圈”,https://www.thepaper.cn/newsDetail_forward_32490375,2026-01-29 11:29:39,澎湃新闻
人气爆棚，上海市中心年宵花市将推迟至2月9日闭市,https://www.thepaper.cn/newsDetail_forward_32490519,2026-01-29 11:22:13,澎湃新闻
【自然有TA】猜猜我是谁？ 第114期（福利放送 ）,https://www.thepaper.cn/newsDetail_forward_32494423,2026-01-29 11:22:00,上海林业
区委书记钟晓咏参加并指导区发展改革委领导班子民主生活会,https://www.thepaper.cn/newsDetail_forward_32493621,2026-01-29 11:06:00,上海静安
宝山路街道与市北高新集团等联合举办“智汇静安·科创未来”2026科学合伙人大会暨静安科创嘉年华,https://www.thepaper.cn/newsDetail_forward_32493058,2026-01-29 11:06:00,上海静安
上海市工商联举办“护航出海助企行”专业服务对接会——税务・合规专场,https://www.thepaper.cn/newsDetail_forward_32494043,2026-01-29 11:05:00,上海市工商联
上海官宣：16个区全面落地实施“开店一件事”！超6800家经营主体受惠，开店便利度大提升,https://www.thepaper.cn/newsDetail_forward_32494042,2026-01-29 11:05:00,上海市工商联
长宁区召开2026年优化营商环境暨促进民营经济高质量发展大会,https://www.thepaper.cn/newsDetail_forward_32494041,2026-01-29 11:05:00,上海市工商联
解码经济动能 共探发展之道 工商联·经济大家讲坛首讲启幕,https://www.thepaper.cn/newsDetail_forward_32494040,2026-01-29 11:05:00,上海市工商联
上海官宣：16个区全面落地实施“开店一件事”！超6800家经营主体受惠，开店便利度大提升,https://www.thepaper.cn/newsDetail_forward_32491944,2026-01-29 11:04:00,上海奉贤
【少先队风采展示】领巾爱祖国，幸福“虹”出圈（中学篇）,https://www.thepaper.cn/newsDetail_forward_32494889,2026-01-29 10:59:00,虹口青年微生活
