title,url,time,source
2026年合肥X澎湃“浪花计划”融媒体实战能力培训正式启动：协同发展，相互赋能,https://www.thepaper.cn/newsDetail_forward_33435074,2026-06-23 09:53:29,澎湃新闻
一位客运员和一座火车站共生的二十年,https://www.thepaper.cn/newsDetail_forward_33491532,2026-07-01 03:17:08,澎湃新闻
建发绿城百亿元扫货 上海土拍收官战引爆下半年,https://www.thepaper.cn/newsDetail_forward_33492015,2026-07-01 03:00:02,中国房地产报
上海拿地热度又起？168轮激战后，建发豪掷73亿抢下静安大宁地块,https://www.thepaper.cn/newsDetail_forward_33491676,2026-07-01 02:00:03,国际金融报
聚焦重点强攻坚 系统施策求实效 | 松江区房票政策宣贯和泗泾镇城中村项目推进研讨会举行,https://www.thepaper.cn/newsDetail_forward_33492140,2026-07-01 01:04:00,上海房管
优供给、强治理、精服务，宝山区全力打造新时代城市建设者管理者安居“暖心之家”,https://www.thepaper.cn/newsDetail_forward_33492137,2026-07-01 01:04:00,上海房管
红心向党固根本 求真务实建新功 | 嘉定住房集团开展“七一”主题活动,https://www.thepaper.cn/newsDetail_forward_33492136,2026-07-01 01:04:00,上海房管
刮大风、下暴雨别慌！上海这些地方可以就近避风躲雨,https://www.thepaper.cn/newsDetail_forward_33491831,2026-07-01 00:26:00,上海徐汇
短评｜“上海脏乱差”？移花接木的虚假叙事注定破产,https://www.thepaper.cn/newsDetail_forward_33484676,2026-07-01 00:25:54,澎湃新闻
金山有家杂货店坚持了40年，76岁店主道出了他坚守的理由…,https://www.thepaper.cn/newsDetail_forward_33491499,2026-07-01 00:00:00,i金山
虹口市民驿站2026年7月活动安排来啦~,https://www.thepaper.cn/newsDetail_forward_33491487,2026-07-01 00:00:00,上海虹口
红色上海，文学在场：讲好这座光荣之城的故事,https://www.thepaper.cn/newsDetail_forward_33485678,2026-06-30 23:53:49,澎湃新闻
追光的你｜光荣之路：从石库门到滨江的105年,https://www.thepaper.cn/newsDetail_forward_33443530,2026-06-30 23:34:25,澎湃新闻
早安，长宁丨长宁外环绿道升级亮相，开放时间延长啦！,https://www.thepaper.cn/newsDetail_forward_33491489,2026-06-30 22:31:00,上海长宁
早安杨浦 | 依然有大到暴雨！这些新规今起实施！,https://www.thepaper.cn/newsDetail_forward_33491480,2026-06-30 22:30:00,上海杨浦
彰显“松江智造”硬实力，昱章电气为国家重点核电工程提供关键设备保障,https://www.thepaper.cn/newsDetail_forward_33491244,2026-06-30 22:30:00,上海松江
早安青浦丨七一，把热爱装进新的一天,https://www.thepaper.cn/newsDetail_forward_33491475,2026-06-30 22:00:00,绿色青浦
政协委员一线调研，细察青浦应急安全情况,https://www.thepaper.cn/newsDetail_forward_33489365,2026-06-30 15:30:00,绿色青浦
上海第五批集中供地成交125.72亿元，专家：竞拍热度依旧较高，市场活力明显,https://www.thepaper.cn/newsDetail_forward_33487376,2026-06-30 14:24:39,澎湃新闻
收官之约！上海市退役军人“三讲六进”之进企业主题活动在静安举行,https://www.thepaper.cn/newsDetail_forward_33489638,2026-06-30 14:23:00,上海市退役军人事务局
【喜报】宝山区卫生健康系统获5项上海市卫健委中医药科研项目立项,https://www.thepaper.cn/newsDetail_forward_33488983,2026-06-30 14:20:00,宝山卫生健康
与时偕行 微光成炬——宝山区南丁格尔志愿护理服务二季度纪实,https://www.thepaper.cn/newsDetail_forward_33488982,2026-06-30 14:20:00,宝山卫生健康
聚焦民生实事，宝山区部署推进免陪照护服务提质增效,https://www.thepaper.cn/newsDetail_forward_33488981,2026-06-30 14:20:00,宝山卫生健康
宝山区“两优一先”表彰会议举行,https://www.thepaper.cn/newsDetail_forward_33488571,2026-06-30 13:45:00,上海宝山
注意！上海多区暴雨+雷电+大风三重预警同步生效,https://www.thepaper.cn/newsDetail_forward_33489378,2026-06-30 13:31:00,上海消防
黄浦滨江！这一市级重大工程有新进展！,https://www.thepaper.cn/newsDetail_forward_33489012,2026-06-30 13:26:00,上海黄浦
黄浦区举行党员集体宣誓主题活动,https://www.thepaper.cn/newsDetail_forward_33489009,2026-06-30 13:26:00,上海黄浦
医心创先 | 15分钟走遍沪苏浙！青浦卫健牵头破壁，方厅水院跨域备案蹚出“新路子”,https://www.thepaper.cn/newsDetail_forward_33489710,2026-06-30 13:13:00,青浦卫计新声
探索产业数据可信新标准 阳雀湖樟树港辣椒数据存证在上海数交所启用,https://www.thepaper.cn/newsDetail_forward_33486609,2026-06-30 13:12:55,东方财经浦东频道
“银发族”当上“课程体验官” 上海老年教育精品课程沉浸式体验活动举行,https://www.thepaper.cn/newsDetail_forward_33486640,2026-06-30 13:12:55,东方财经浦东频道
注重创新引领、激活发展动能！宝山区举行高端新材料企业座谈会,https://www.thepaper.cn/newsDetail_forward_33488570,2026-06-30 13:07:00,上海宝山
文商旅体展融合！上海更大力度激发消费活力,https://www.thepaper.cn/newsDetail_forward_33486566,2026-06-30 12:59:38,长三角日报
黄浦区检察院第一检察部副主任莫苇菁：以检察蓝点亮少年的光,https://www.thepaper.cn/newsDetail_forward_33490312,2026-06-30 12:47:00,上海市黄浦区司法局
徐汇区委、区政府树立和践行正确政绩观学习教育第四次专题研讨举行,https://www.thepaper.cn/newsDetail_forward_33489020,2026-06-30 12:40:00,上海徐汇
【基层风采】虹口基层团组织月度工作速览（2026年6月）,https://www.thepaper.cn/newsDetail_forward_33489921,2026-06-30 12:35:00,虹口青年微生活
刚刚上海暴雨蓝色预警信号解除，全市防汛防台四级响应行动同步终止,https://www.thepaper.cn/newsDetail_forward_33489919,2026-06-30 12:35:00,上海防汛
每周②次元 Vol.032｜上海国际游戏动漫月,https://www.thepaper.cn/newsDetail_forward_33483344,2026-06-30 12:25:02,澎湃新闻
中心城区暴雨蓝色预警发布！上海多区发布雷电、暴雨、大风预警,https://www.thepaper.cn/newsDetail_forward_33489024,2026-06-30 12:22:00,上海徐汇
闵行一优质低密地块成功出让,https://www.thepaper.cn/newsDetail_forward_33488972,2026-06-30 12:16:00,今日闵行
刚刚上海发布暴雨蓝色预警信号，市防汛指挥部启动全市防汛防台四级响应行动,https://www.thepaper.cn/newsDetail_forward_33489920,2026-06-30 12:14:00,上海防汛
杨浦区树立和践行正确政绩观学习教育警示教育会召开,https://www.thepaper.cn/newsDetail_forward_33489377,2026-06-30 12:11:00,上海杨浦
【惠企政策通】关于发布上海市2026年度科技产业高质量发展计划“养老科技支撑”项目申报指南的通知,https://www.thepaper.cn/newsDetail_forward_33490755,2026-06-30 12:05:00,闵行区政协
【委员说】每500米一个换电站，已服务70万人，上海铁塔助力外卖小哥实现“换电自由”,https://www.thepaper.cn/newsDetail_forward_33490754,2026-06-30 12:05:00,闵行区政协
在上海典传艺术空间遇见“石墨青”,https://www.thepaper.cn/newsDetail_forward_33485315,2026-06-30 11:59:53,澎湃新闻
闵行区卫生健康系统庆祝中国共产党成立105周年座谈会丨闵卫医事,https://www.thepaper.cn/newsDetail_forward_33490859,2026-06-30 11:44:00,闵行卫生
京沪高铁的意义，不止于交通运输 | 光明网评论员,https://www.thepaper.cn/newsDetail_forward_33487341,2026-06-30 11:40:00,光明网
中心城区暴雨蓝色预警发布！上海多区发布雷电、暴雨、大风预警,https://www.thepaper.cn/newsDetail_forward_33486492,2026-06-30 11:35:13,澎湃新闻
“梅超疯”还没“疯”完，上海明天局部大雨到暴雨,https://www.thepaper.cn/newsDetail_forward_33485762,2026-06-30 11:24:05,澎湃新闻
松江区发布第一批场景开放清单,https://www.thepaper.cn/newsDetail_forward_33487866,2026-06-30 11:23:00,上海松江
喜报！徐汇党建引领基层治理创新实践再获佳绩,https://www.thepaper.cn/newsDetail_forward_33489019,2026-06-30 11:15:00,上海徐汇
提质堡垒丨绘就上海东站『时代答卷』,https://www.thepaper.cn/newsDetail_forward_33487678,2026-06-30 11:12:00,铁四院
“数据要素×”大赛上海分赛来了，等你报名→,https://www.thepaper.cn/newsDetail_forward_33489375,2026-06-30 11:09:00,上海杨浦
【安居】4539张床！宝山区全力打造新时代城市建设者管理者安居“暖心之家”,https://www.thepaper.cn/newsDetail_forward_33488979,2026-06-30 11:03:00,上海住房城乡建设管理
【聚焦】从“施工者”到“共创者”，解码“上海建造”出海新范式,https://www.thepaper.cn/newsDetail_forward_33488978,2026-06-30 11:03:00,上海住房城乡建设管理
松江发布雷电黄色预警，请注意防范,https://www.thepaper.cn/newsDetail_forward_33487864,2026-06-30 11:01:00,上海松江
【相约会展】浦东投促团队赴2026亚洲物流双年展进行靶向链式招商,https://www.thepaper.cn/newsDetail_forward_33490767,2026-06-30 10:49:00,投资上海Invest Shanghai
产融聚力智能电子 携手赋能数字科创——“投资上海”重点项目产融对接会成功召开（电子信息领域专场）,https://www.thepaper.cn/newsDetail_forward_33490766,2026-06-30 10:49:00,投资上海Invest Shanghai
上海地铁：暑期日均客流预计超千万人次，将新增定点加班车,https://www.thepaper.cn/newsDetail_forward_33485465,2026-06-30 10:46:02,澎湃新闻
7月1日起，买车到闵行！最高可领10000元补贴，还有养护礼包,https://www.thepaper.cn/newsDetail_forward_33487846,2026-06-30 10:45:00,上海市莘庄工业区
上海张园东区首开区揭幕，有哪些看点？,https://www.thepaper.cn/newsDetail_forward_33484633,2026-06-30 10:44:45,澎湃新闻
