title,url,time,source
“清朗浦江·2026”网络生态治理旬邀您携手共筑良好生态,https://www.thepaper.cn/newsDetail_forward_32685502,2026-03-03 01:55:41,澎湃新闻
优化营商环境服务再升级，上海发布《涉企侵权信息处理服务包3.0版》,https://www.thepaper.cn/newsDetail_forward_32802139,2026-03-20 12:54:51,澎湃新闻
2026上海中青年艺术家邀请展在浦东开幕,https://www.thepaper.cn/newsDetail_forward_32801925,2026-03-20 12:49:28,东方财经浦东频道
上海全面建设高质量幼儿园三年行动收官 “抬底部”“强内涵”成效显著,https://www.thepaper.cn/newsDetail_forward_32801923,2026-03-20 12:48:54,东方财经浦东频道
情系民生、医保护航 浦东新区召开2026年医疗保障工作会议,https://www.thepaper.cn/newsDetail_forward_32801918,2026-03-20 12:47:30,东方财经浦东频道
长三角协同发展再提速！六城深度融入上海大都市圈,https://www.thepaper.cn/newsDetail_forward_32801924,2026-03-20 12:40:01,长三角日报
粉丝奔赴、演出焕新，上海迪士尼十周年庆典启幕,https://www.thepaper.cn/newsDetail_forward_32801697,2026-03-20 12:38:20,澎湃新闻
上海​市委巡视整改工作领导小组会议暨市委常委会专题学习会举行,https://www.thepaper.cn/newsDetail_forward_32801759,2026-03-20 11:56:03,澎湃新闻
全力推动上海生态文明建设迈上新台阶！市委常委会会议暨市生态文明建设领导小组会议举行,https://www.thepaper.cn/newsDetail_forward_32801661,2026-03-20 11:42:53,澎湃新闻
两次扶起摔倒老人，上海这位外卖小哥说“只是做了该做的事”,https://www.thepaper.cn/newsDetail_forward_32801404,2026-03-20 11:24:23,澎湃新闻
2026年上海市文化科技卫生“三下乡”启动，55个项目惠及全年,https://www.thepaper.cn/newsDetail_forward_32801114,2026-03-20 10:36:28,澎湃新闻
上海发布市管干部任职前公示：张峰拟任市级群团正职,https://www.thepaper.cn/newsDetail_forward_32801417,2026-03-20 10:22:35,澎湃新闻
马上评丨这段无人驾驶网约车视频，为何火到了国外,https://www.thepaper.cn/newsDetail_forward_32801093,2026-03-20 10:08:07,澎湃新闻
十大垂直赛道，第四届“文创上海”创新创业大赛挖掘创新力量,https://www.thepaper.cn/newsDetail_forward_32799458,2026-03-20 09:49:30,澎湃新闻
“上海视听”精品亮相第30届香港国际影视展,https://www.thepaper.cn/newsDetail_forward_32796330,2026-03-20 09:36:59,澎湃新闻
专家特稿丨从碎片化治理到一体化智治：上海中山街道“一网统管”城市治理案例,https://www.thepaper.cn/newsDetail_forward_32800855,2026-03-20 09:24:04,世界城市日
上海芷江西路街道召开2026年优化营商环境暨经济高质量发展大会,https://www.thepaper.cn/newsDetail_forward_32801135,2026-03-20 09:23:59,澎湃上海
上海科技馆一展板被指存在多个错别字，馆方回应：反映属实，目前相关展板已经撤下，正在重新制作,https://www.thepaper.cn/newsDetail_forward_32802036,2026-03-20 09:23:00,上游新闻
中考细则出炉！中考推迟6天！7月14日中考出分！,https://www.thepaper.cn/newsDetail_forward_32801040,2026-03-20 09:09:54,市民云
等你来掌勺！“巡”味奉贤美食挑战赛来啦,https://www.thepaper.cn/newsDetail_forward_32801724,2026-03-20 09:04:00,上海奉贤
静安区召开老龄工作委员会全体（扩大）会议,https://www.thepaper.cn/newsDetail_forward_32801587,2026-03-20 09:03:00,上海静安
上海健康播报｜春分时节乍暖还寒，如何防范疾病之扰,https://www.thepaper.cn/newsDetail_forward_32800824,2026-03-20 08:52:09,澎湃新闻
张涛甫：全球传播新格局中的认知争夺及其中国应对,https://www.thepaper.cn/newsDetail_forward_32800817,2026-03-20 08:49:55,复旦发展研究院
江天骄解读OpenClaw智能体发展愿景及其技术治理,https://www.thepaper.cn/newsDetail_forward_32800806,2026-03-20 08:49:35,复旦发展研究院
这可能是上海最小众的博物馆,https://www.thepaper.cn/newsDetail_forward_32800122,2026-03-20 08:42:12,ShanghaiLOOK
自称为“玲娜贝儿外婆”，“60后”从江苏赶来参加上海迪士尼庆典,https://www.thepaper.cn/newsDetail_forward_32800628,2026-03-20 08:33:38,澎湃新闻
以为累着了，一查竟是……普陀专家提醒：不要忽视身体发出的异常信号！,https://www.thepaper.cn/newsDetail_forward_32801547,2026-03-20 08:33:00,上海普陀
上海普陀持续深化“我在文明实践中心上党课”活动：深学全会精神，笃行实干筑根基,https://www.thepaper.cn/newsDetail_forward_32800843,2026-03-20 08:23:42,澎湃上海
 “上海品牌”认证企业：黄浦、长宁最密集，缺少高成长企业,https://www.thepaper.cn/newsDetail_forward_32800386,2026-03-20 08:22:32,澎湃新闻
春分赏花正当时，奉贤菜花节今日启幕→,https://www.thepaper.cn/newsDetail_forward_32801729,2026-03-20 08:06:00,上海奉贤
上海2月人民币贷款增加103亿元，同比多增235亿元,https://www.thepaper.cn/newsDetail_forward_32800795,2026-03-20 08:05:30,澎湃新闻
3月19日福彩开奖公告,https://www.thepaper.cn/newsDetail_forward_32800810,2026-03-20 08:05:02,上海福彩
二十四节气·岁时记 | 春分,https://www.thepaper.cn/newsDetail_forward_32800809,2026-03-20 08:05:01,上海福彩
2026年申报博士后创新实践基地入驻单位和科研项目（法律服务领域）开始啦！,https://www.thepaper.cn/newsDetail_forward_32802042,2026-03-20 08:01:00,上海市浦东新区司法局
双色球第2026030期：中出一等奖5注，筹集公益金1.44亿元,https://www.thepaper.cn/newsDetail_forward_32800803,2026-03-20 08:00:03,上海福彩
“新学院主义”，从宁波到上海,https://www.thepaper.cn/newsDetail_forward_32795139,2026-03-20 07:57:08,艺术圈
一眼六百年，情动九重天：上海昆剧团全本《牡丹亭》何以顶流？,https://www.thepaper.cn/newsDetail_forward_32796892,2026-03-20 07:55:29,上海昆剧团
民盟市委2026年度第一批立项课题开题,https://www.thepaper.cn/newsDetail_forward_32801388,2026-03-20 07:46:00,民盟上海市委
洗头后这个习惯动作，会加重脱发！,https://www.thepaper.cn/newsDetail_forward_32801714,2026-03-20 07:34:00,上海女性
就在下周！上海首个恰巴塔盛宴来了,https://www.thepaper.cn/newsDetail_forward_32801324,2026-03-20 07:32:00,今日闵行
老广场变新空间！嘉定这座公园完成升级改造,https://www.thepaper.cn/newsDetail_forward_32801203,2026-03-20 07:31:00,上海嘉定
利好来了！上海，重大发布！,https://www.thepaper.cn/newsDetail_forward_32800615,2026-03-20 07:28:17,券商中国
利剑出击破僵局，刚柔并济护权益丨浦执先锋・集中执行篇,https://www.thepaper.cn/newsDetail_forward_32801377,2026-03-20 07:27:00,上海浦东法院
上海杨浦：红色薪火进校园，家校社共育“延小益”,https://www.thepaper.cn/newsDetail_forward_32800612,2026-03-20 07:17:47,澎湃上海
破局就医痛点：上海杨浦探索“医社联动、社志融合”新路径,https://www.thepaper.cn/newsDetail_forward_32800606,2026-03-20 07:13:49,澎湃上海
错过要等19年！转发豫园这条“穿云龙”，接住全年好兆头！,https://www.thepaper.cn/newsDetail_forward_32801365,2026-03-20 06:39:00,上海黄浦
两个月就能造出人形机器人？上海未来产业基金如何用“双轮驱动”捕获青年创新力,https://www.thepaper.cn/newsDetail_forward_32801311,2026-03-20 06:35:00,上海科技
春分养生：“五个一”把握黄金期，养足一年健康好元气！丨上海健康播报,https://www.thepaper.cn/newsDetail_forward_32801726,2026-03-20 06:31:00,上海奉贤
世界水日丨新版水知识宣传手册出炉，小江小海带你探秘水世界！,https://www.thepaper.cn/newsDetail_forward_32801297,2026-03-20 06:28:00,上海水务海洋
水美·节气丨“春”漾碧波兴水岸，“分”引清流润民生,https://www.thepaper.cn/newsDetail_forward_32801296,2026-03-20 06:28:00,上海水务海洋
文明集市暖人心 上海外冈镇开展“3·5”学雷锋文明实践主题活动,https://www.thepaper.cn/newsDetail_forward_32800416,2026-03-20 06:26:54,澎湃上海
【文明实践】少年声动光影，初心映照征程——“少年说・光影红”首场红色电影映前导讲精彩开讲！,https://www.thepaper.cn/newsDetail_forward_32800409,2026-03-20 06:20:32,澎湃上海
【提示】飞沫传播、传染性强！中疾控专家：警惕疫情输入风险,https://www.thepaper.cn/newsDetail_forward_32801054,2026-03-20 06:15:00,徐汇卫生计生
致公党浦东区委多支部联合开展“助农兴乡・致公同行”系列活动,https://www.thepaper.cn/newsDetail_forward_32801018,2026-03-20 06:11:00,致公党上海市委
万里相会，进站上海！回顾2026F1中国大奖赛的难忘瞬间,https://www.thepaper.cn/newsDetail_forward_32800381,2026-03-20 06:09:19,澎湃新闻
普法 | 海外同胞警惕！升级版公检法诈骗,https://www.thepaper.cn/newsDetail_forward_32801512,2026-03-20 06:02:00,上海检察
一纸退费公告藏陷阱，盲发快递沦为电诈引流通道,https://www.thepaper.cn/newsDetail_forward_32801511,2026-03-20 06:02:00,上海检察
筑牢安全防线 压实主体责任 | 大柏树物业公司开展一季度非居住房屋安全生产专项检查,https://www.thepaper.cn/newsDetail_forward_32801334,2026-03-20 06:01:00,上海房管
今天开始，不要忘了这个“头”等大事,https://www.thepaper.cn/newsDetail_forward_32801017,2026-03-20 05:46:00,上海应急守护
平时“走”得勤，难时“救”得急！社区织密为老“应急网”,https://www.thepaper.cn/newsDetail_forward_32800950,2026-03-20 05:33:00,上海徐汇
为什么以前不过敏，今年却过敏？专家解答,https://www.thepaper.cn/newsDetail_forward_32800945,2026-03-20 05:33:00,上海徐汇
