title,url,time,source
上海市经信工作党委、上海航天局：《把名字写进星河里》,https://www.thepaper.cn/newsDetail_forward_31932337,2025-11-10 07:56:53,澎湃新闻
非全日制博士学费开出78万元天价！上海交大回应,https://www.thepaper.cn/newsDetail_forward_31936550,2025-11-10 13:49:00,红网
上海U18男篮大胜辽宁，主帅调侃要给朱正剪光头,https://www.thepaper.cn/newsDetail_forward_31935185,2025-11-10 13:44:11,澎湃新闻
陈芋汐每一跳都拼尽全力，为国家和上海扛起责任,https://www.thepaper.cn/newsDetail_forward_31935079,2025-11-10 13:34:45,澎湃新闻
聚焦前沿赛道 “推介官”与浦东共成长,https://www.thepaper.cn/newsDetail_forward_31914677,2025-11-10 13:29:47,东方财经浦东频道
浦东加速建设全球供应链管理中心,https://www.thepaper.cn/newsDetail_forward_31916562,2025-11-10 13:29:47,东方财经浦东频道
五年砥砺前行 引领破局探路 浦东引领区建设5周年宣传片全球上线,https://www.thepaper.cn/newsDetail_forward_31934799,2025-11-10 13:29:47,东方财经浦东频道
市 区领导调研浦东引领区5周年政协提案和社情民意信息成果展,https://www.thepaper.cn/newsDetail_forward_31934783,2025-11-10 13:29:47,东方财经浦东频道
中国卫生健康思想政治工作促进会副会长兼秘书长刘世东一行莅临宝山区专题调研,https://www.thepaper.cn/newsDetail_forward_31936939,2025-11-10 12:59:00,宝山卫生健康
打好“三张牌”，探索基层中医药高质量发展新路径,https://www.thepaper.cn/newsDetail_forward_31936936,2025-11-10 12:59:00,宝山卫生健康
罗马人来了！上海古罗马大展亮点抢先看,https://www.thepaper.cn/newsDetail_forward_31933702,2025-11-10 12:42:16,澎湃新闻
新现场高清“回归”上海，茉莉花剧场和美琪大戏院开启放映,https://www.thepaper.cn/newsDetail_forward_31933404,2025-11-10 12:37:42,澎湃新闻
从巨型宙斯到沉睡的维纳斯，古罗马大展上海揭幕,https://www.thepaper.cn/newsDetail_forward_31933893,2025-11-10 12:37:06,澎湃新闻
每一片“小叶子”都有成为大树的那一天,https://www.thepaper.cn/newsDetail_forward_31935947,2025-11-10 12:29:00,青春上海
全市110警情同比下降7.9%，上海警方完成进博会安保任务,https://www.thepaper.cn/newsDetail_forward_31933943,2025-11-10 12:16:19,澎湃新闻
上海市公安局圆满完成第八届进博会安保任务,https://www.thepaper.cn/newsDetail_forward_31935518,2025-11-10 12:13:00,警民直通车上海
确认了：上海火车站重磅改造！,https://www.thepaper.cn/newsDetail_forward_31935023,2025-11-10 11:58:00,市民云
医生提醒：严重会致死！熬夜千万不能过这4条红线！,https://www.thepaper.cn/newsDetail_forward_31935022,2025-11-10 11:58:00,市民云
事关中小学教师，教育部发布8条重磅措施！,https://www.thepaper.cn/newsDetail_forward_31935021,2025-11-10 11:58:00,市民云
冷空气+台风！外围环流将影响上海！降温降雨来了→,https://www.thepaper.cn/newsDetail_forward_31935020,2025-11-10 11:58:00,市民云
男子在上海苏州河放生牛蛙？当地回应：严禁放生外来物种,https://www.thepaper.cn/newsDetail_forward_31934657,2025-11-10 11:52:00,红网
医疗龙头实控人周炜犯单位行贿罪，一审获刑一年半，曾被指涉原创业板发审委委员受贿案，90后儿子火速提名非独董，现任上海大区常务副总,https://www.thepaper.cn/newsDetail_forward_31934667,2025-11-10 11:37:00,红星资本局
连续八届参展进博会，德国永恒力深耕中国市场信心足,https://www.thepaper.cn/newsDetail_forward_31935830,2025-11-10 11:31:00,绿色青浦
抢到消费券的你，“剁手”了吗？,https://www.thepaper.cn/newsDetail_forward_31934922,2025-11-10 11:31:00,绿色青浦
酷！杨浦滨江这场Citywalk“科技感”十足,https://www.thepaper.cn/newsDetail_forward_31936532,2025-11-10 11:29:00,上海杨浦
“吴姥姥”开课啦！2025科创盛典点亮少年创新梦想,https://www.thepaper.cn/newsDetail_forward_31936528,2025-11-10 11:29:00,上海杨浦
进博会的珠宝销售如何高效清关？ | 进博会时刻,https://www.thepaper.cn/newsDetail_forward_31936510,2025-11-10 11:29:00,上海杨浦
“两大袋子哗啦倒进去了”上海苏州河有人放生牛蛙？当地回应：严禁放生外来物种，市民可提供相关线索,https://www.thepaper.cn/newsDetail_forward_31934633,2025-11-10 11:25:00,上游新闻
【城市印象】上海近代现代主义建筑——技术功能与美学的先锋性表达,https://www.thepaper.cn/newsDetail_forward_31936544,2025-11-10 11:24:00,上海住房城乡建设管理
静安市北高新园区顺利通过上海市三星级绿色生态城区验收,https://www.thepaper.cn/newsDetail_forward_31936535,2025-11-10 11:24:00,上海住房城乡建设管理
打造开源开放创新高地，开展公益林划定管理……上海市政府常务会议研究了这些重要事项,https://www.thepaper.cn/newsDetail_forward_31933740,2025-11-10 11:23:19,澎湃新闻
上海专项整治电动自行车非法改装，今年已查处3.1万余起,https://www.thepaper.cn/newsDetail_forward_31933363,2025-11-10 10:58:25,澎湃新闻
【国旗下成长】青春向国旗致敬，担当为海洋强国,https://www.thepaper.cn/newsDetail_forward_31934696,2025-11-10 10:58:00,虹口青年微生活
青浦：环城水系公园，家门口的“会客厅”等你来打卡！,https://www.thepaper.cn/newsDetail_forward_31934103,2025-11-10 10:51:00,上海水务海洋
受冷空气和台风“凤凰”外围共同影响，本周风雨来袭,https://www.thepaper.cn/newsDetail_forward_31934102,2025-11-10 10:51:00,上海水务海洋
12支队伍轮番展风采，松江这里的社区春晚选拔赛热闹极了！,https://www.thepaper.cn/newsDetail_forward_31935131,2025-11-10 10:33:00,上海松江
台风“凤凰”将影响松江，周三有风雨天气,https://www.thepaper.cn/newsDetail_forward_31935129,2025-11-10 10:33:00,上海松江
第二届“松江少年说” | 十强故事选手曹宇涵,https://www.thepaper.cn/newsDetail_forward_31935128,2025-11-10 10:33:00,上海松江
要闻｜区政协领导开展进博会巡馆，走访浦东参展企业,https://www.thepaper.cn/newsDetail_forward_31936166,2025-11-10 10:32:00,浦东新区政协
要闻｜市、区领导调研区政协打造社会主义现代化建设引领区5周年政协提案和社情民意信息成果展,https://www.thepaper.cn/newsDetail_forward_31936165,2025-11-10 10:32:00,浦东新区政协
要闻｜浦东打造社会主义现代化建设引领区5周年政协提案和社情民意故事分享会举行,https://www.thepaper.cn/newsDetail_forward_31936164,2025-11-10 10:32:00,浦东新区政协
观演｜音乐苍穹下的华彩乐章，林肯中心室内乐六重奏解构浪漫主义的万千面相,https://www.thepaper.cn/newsDetail_forward_31934852,2025-11-10 10:31:00,中国上海国际艺术节
【闵协撷影】 亮阅薪传，进润初心——中华传统文化进校园专题协商暨闵行区政协“亮吧书房”授牌活动,https://www.thepaper.cn/newsDetail_forward_31935397,2025-11-10 10:26:00,闵行区政协
【委员说】做细服务保障，护航进博盛会,https://www.thepaper.cn/newsDetail_forward_31935396,2025-11-10 10:26:00,闵行区政协
《消防说》第十三期完整版,https://www.thepaper.cn/newsDetail_forward_31935047,2025-11-10 10:25:00,上海消防
消防说｜农村自建房火灾 “危机”启示录,https://www.thepaper.cn/newsDetail_forward_31935046,2025-11-10 10:25:00,上海消防
专委会视察丨农村美、农民富，绘就和美乡村新画卷,https://www.thepaper.cn/newsDetail_forward_31935395,2025-11-10 10:22:00,奉贤区政协
人民时评丨读懂城市发展的“中国视角”,https://www.thepaper.cn/newsDetail_forward_31932982,2025-11-10 10:14:04,世界城市日
自然在身边丨球宿根植物的生存密码,https://www.thepaper.cn/newsDetail_forward_31934700,2025-11-10 10:13:00,上海植物园
人大代表显担当，护航进博展风采,https://www.thepaper.cn/newsDetail_forward_31935837,2025-11-10 10:11:00,绿色青浦
坚守岗位彰显担当，护航进博会“越办越好”！区领导分组慰问进博会青浦服务保障人员,https://www.thepaper.cn/newsDetail_forward_31935836,2025-11-10 10:11:00,绿色青浦
进博会“数字结界”开启！长三角市场监管网络直播buff叠满！,https://www.thepaper.cn/newsDetail_forward_31935833,2025-11-10 10:11:00,绿色青浦
家里“毛孩子”脖子僵硬？后肢行走不利？小心是椎间盘在求救！,https://www.thepaper.cn/newsDetail_forward_31935650,2025-11-10 10:09:00,上海市莘庄工业区
美到了！闵行这里有座彩虹桥,https://www.thepaper.cn/newsDetail_forward_31935649,2025-11-10 10:09:00,上海市莘庄工业区
进博时间｜全球首发！园区企业在进博会上发布首款医用特种硅橡胶,https://www.thepaper.cn/newsDetail_forward_31935648,2025-11-10 10:09:00,上海市莘庄工业区
“创新引领，智控未来”这家企业扎根园区25周年,https://www.thepaper.cn/newsDetail_forward_31935647,2025-11-10 10:09:00,上海市莘庄工业区
市域嘉闵线又有新进展！,https://www.thepaper.cn/newsDetail_forward_31935646,2025-11-10 10:09:00,上海市莘庄工业区
三十而“励”｜挥拍竞风采，谁“羽”争锋！园区这场比赛演绎运动激情→,https://www.thepaper.cn/newsDetail_forward_31935644,2025-11-10 10:09:00,上海市莘庄工业区
近邻医事 | 深化“医养结合”系列报道（一）河滨大楼老人有了健康“医”靠,https://www.thepaper.cn/newsDetail_forward_31936278,2025-11-10 10:08:00,健康虹口
“医”线速递 | 本市满13周岁女孩可免费接种人乳头瘤病毒（HPV）疫苗（附预约方式）,https://www.thepaper.cn/newsDetail_forward_31936276,2025-11-10 10:08:00,健康虹口
签约家医享优先，专家号源更周全！,https://www.thepaper.cn/newsDetail_forward_31935498,2025-11-10 10:07:00,浦东卫生计生
