title,url,time,source
2025·“智造上海” | 上海智能终端“开箱”：电脑会思考，手办有“心跳”,https://www.thepaper.cn/newsDetail_forward_31992081,2025-11-18 13:11:51,澎湃新闻
浦东新区“检府校”机制签约 首次法治课程进校园,https://www.thepaper.cn/newsDetail_forward_31999552,2025-11-19 12:18:52,东方财经浦东频道
第十二届上海童书展暨儿童健康展在浦东落幕,https://www.thepaper.cn/newsDetail_forward_31999554,2025-11-19 12:18:52,东方财经浦东频道
浦东培育中试平台 打通成果转化“最后一公里”,https://www.thepaper.cn/newsDetail_forward_31998963,2025-11-19 12:13:17,东方财经浦东频道
助力上海国际喜剧节，笑果15场演出汇聚旗下脱口秀明星厂牌,https://www.thepaper.cn/newsDetail_forward_31998789,2025-11-19 11:46:47,澎湃新闻
中共一大纪念馆：情景剧《红色中枢》,https://www.thepaper.cn/newsDetail_forward_31939455,2025-11-12 11:23:27,澎湃新闻
中共一大纪念馆：《“孤岛”上的选择》,https://www.thepaper.cn/newsDetail_forward_31932309,2025-11-10 08:36:25,澎湃新闻
上海发布一组人事任免信息：宣锋任市政府驻北京办事处主任,https://www.thepaper.cn/newsDetail_forward_31999237,2025-11-19 10:36:59,澎湃新闻
上海2600余座专人看管公厕免费供纸，1756座环卫公厕24小时开放,https://www.thepaper.cn/newsDetail_forward_31998972,2025-11-19 10:17:54,澎湃新闻
深一度｜42年再上领奖台，这是热血、青春的上海女乒,https://www.thepaper.cn/newsDetail_forward_31999217,2025-11-19 10:17:45,澎湃新闻
中西亚18个国家的现代艺术，首次集结在上海,https://www.thepaper.cn/newsDetail_forward_31992422,2025-11-19 09:56:24,澎湃新闻
2025·“智造上海”｜擘画千亿蓝图，上海如何锻造世界级能源装备产业集群？,https://www.thepaper.cn/newsDetail_forward_31998406,2025-11-19 08:58:32,澎湃新闻
上海与世界｜建设国际大都市需要二元竞争力,https://www.thepaper.cn/newsDetail_forward_31988143,2025-11-19 08:57:00,澎湃新闻
上海轨交崇明线，试运营时间有消息了！30分钟到金桥，1小时到人民广场,https://www.thepaper.cn/newsDetail_forward_31999451,2025-11-19 08:51:00,青春上海
英国驻上海总领事包迈岫：沪伦共享河流带来的机遇与挑战,https://www.thepaper.cn/newsDetail_forward_31992305,2025-11-19 08:44:15,澎湃新闻
把4K版上海博物馆带回家,https://www.thepaper.cn/newsDetail_forward_31995533,2025-11-19 08:42:08,澎湃新闻
2026年度上海文化行业线上人才招聘会即日启动！,https://www.thepaper.cn/newsDetail_forward_31998736,2025-11-19 08:21:56,澎湃新闻
眼泪、自责和决心……这枚银牌对上海U20女排弥足珍贵,https://www.thepaper.cn/newsDetail_forward_31998719,2025-11-19 08:20:47,澎湃新闻
上海Art Walk：艺术不止，步履不停,https://www.thepaper.cn/newsDetail_forward_31992398,2025-11-19 08:18:18,iWeekly周末画报
上海警方通告：事关中心城区部分道路临时交通管制，具体区域、措施公布→,https://www.thepaper.cn/newsDetail_forward_31998720,2025-11-19 08:15:02,市民云
上海新规！事关电动自行车！最高罚款1万元！,https://www.thepaper.cn/newsDetail_forward_31998713,2025-11-19 08:10:02,市民云
11月18日福彩开奖公告,https://www.thepaper.cn/newsDetail_forward_31998635,2025-11-19 07:55:07,上海福彩
看福利彩票如何讲好责任故事,https://www.thepaper.cn/newsDetail_forward_31998628,2025-11-19 07:55:03,上海福彩
双色球第2025133期：中出一等奖21注，筹集公益金1.31亿元,https://www.thepaper.cn/newsDetail_forward_31998581,2025-11-19 07:50:03,上海福彩
上海轨交崇明线预计2026年底开通试运营,https://www.thepaper.cn/newsDetail_forward_31998422,2025-11-19 07:45:31,澎湃新闻
中国企业出海，学日本模式还是走美国的路？,https://www.thepaper.cn/newsDetail_forward_31997845,2025-11-19 07:44:38,福卡智库
军事变革新突破，未来的主战场在……,https://www.thepaper.cn/newsDetail_forward_31997830,2025-11-19 07:44:38,福卡智库
喜报！上海健儿吴俊杰一骑绝尘，摘得十五运会场地自行车男子全能赛冠军！,https://www.thepaper.cn/newsDetail_forward_31978520,2025-11-19 07:27:09,五星体育
上海骄傲！唐钱婷女子50蛙夺金！,https://www.thepaper.cn/newsDetail_forward_31990068,2025-11-19 07:27:08,五星体育
祝贺！上海选手黄瑞厅摘得十五运会场地自行车男子凯林赛铜牌,https://www.thepaper.cn/newsDetail_forward_31988812,2025-11-19 07:27:08,五星体育
杨浦区平凉街道社区卫生保洁服务站刘伟、吕艳培：快自查，别让蚊子来你家生宝宝,https://www.thepaper.cn/newsDetail_forward_31988033,2025-11-19 07:20:58,健康脱口秀
把展台变成洽谈桌！松江积极承接进博会溢出效应,https://www.thepaper.cn/newsDetail_forward_31999124,2025-11-19 07:12:00,上海松江
第二届“松江少年说” 丨十强故事选手刘羽晗,https://www.thepaper.cn/newsDetail_forward_31999123,2025-11-19 07:12:00,上海松江
一起来种地吧！九亭这里新开发了一处户外生态基地,https://www.thepaper.cn/newsDetail_forward_31999122,2025-11-19 07:12:00,上海松江
虹口首辆“新国标”电动自行车上牌成功！记者实地探访，带您了解最新变化,https://www.thepaper.cn/newsDetail_forward_31998808,2025-11-19 07:03:00,上海虹口
读书市场 | 从安第斯文明起源到文明交融《穿行秘鲁五千年》图书分享活动,https://www.thepaper.cn/newsDetail_forward_31998126,2025-11-19 07:01:20,微阅读行走
说案 | 共享充电宝合作现漏洞，两渠道商篡改订单骗分成获刑,https://www.thepaper.cn/newsDetail_forward_31999288,2025-11-19 07:01:00,上海检察
读书市场 | 神奇的发酵，记录地方的风土《发酵中国：云南 贵州》分享会,https://www.thepaper.cn/newsDetail_forward_31998021,2025-11-19 07:00:55,微阅读行走
从包公故里到黄浦江畔，庐剧《铁面无私》亮相上海国际艺术节,https://www.thepaper.cn/newsDetail_forward_31996630,2025-11-19 06:56:30,澎湃新闻
沪游对话｜精文投资虞玮洁：单机游戏基金主投在沪中小项目,https://www.thepaper.cn/newsDetail_forward_31987070,2025-11-19 06:39:18,澎湃新闻
民生改善与风貌保护，如何实现最优解？｜一平方米的改变有多难,https://www.thepaper.cn/newsDetail_forward_31839115,2025-11-19 06:23:33,澎湃新闻
从6G高地到智造标杆，松江以全链条实力交出新质生产力“答卷”,https://www.thepaper.cn/newsDetail_forward_31997728,2025-11-19 05:50:22,长三角日报
关于召开2025机械科技创新发展大会暨机械工业科学技术奖励大会的通知,https://www.thepaper.cn/newsDetail_forward_31999375,2025-11-19 05:34:00,上海市机械工程学会
助力跨境电商发展，致公党闵行区委海外联络专委会赴浙江义乌开展专题调研,https://www.thepaper.cn/newsDetail_forward_31998647,2025-11-19 05:20:00,致公党上海市委
致公党松江区总支参政议政专委会联合致公党工程大支部开展参政议政工作交流会,https://www.thepaper.cn/newsDetail_forward_31998645,2025-11-19 05:20:00,致公党上海市委
致公党上海市委领导会见哥斯达黎加社团代表,https://www.thepaper.cn/newsDetail_forward_31998644,2025-11-19 05:20:00,致公党上海市委
“职”点迷津 | 年休假能跨年休吗？官方解答来了,https://www.thepaper.cn/newsDetail_forward_31995368,2025-11-19 05:18:40,市民云
主打科技教育特色！松江两所学校全新亮相,https://www.thepaper.cn/newsDetail_forward_31999128,2025-11-19 05:12:00,上海松江
松江枢纽停车从从容容，游刃有余！这份非机动车停车指南请收好→,https://www.thepaper.cn/newsDetail_forward_31999121,2025-11-19 05:12:00,上海松江
未按照规定开展培训，罚！,https://www.thepaper.cn/newsDetail_forward_31997927,2025-11-19 05:07:00,上海应急守护
天花板上“倒挂”一颗脑袋！竟是来“偷”彩票的？,https://www.thepaper.cn/newsDetail_forward_31998025,2025-11-19 05:05:00,青春上海
沪上文艺青年新据点！来这里能创作、能发呆、还能当上主理人→,https://www.thepaper.cn/newsDetail_forward_31997723,2025-11-19 04:58:00,上海长宁
我的长宁·我的家 | 来看看“长宁F4”的日常……,https://www.thepaper.cn/newsDetail_forward_31997719,2025-11-19 04:58:00,上海长宁
30年间服务企业4869家！青浦这家老牌招商机构以专业服务赋能区域发展,https://www.thepaper.cn/newsDetail_forward_31998223,2025-11-19 04:57:00,绿色青浦
每天与一件国宝相遇！《国宝时刻·珐华彩贴金应龙纹梅瓶》揭秘釉彩深处的海上丝路,https://www.thepaper.cn/newsDetail_forward_31997853,2025-11-19 04:57:00,绿色青浦
政产学研集结绿洲智谷！这场“AI+低碳”联姻将如何重塑未来能源？,https://www.thepaper.cn/newsDetail_forward_31997852,2025-11-19 04:57:00,绿色青浦
句句不说爱但处处都是爱，男子来沪打工收到父母的快递，除了衣物还藏着260元钱,https://www.thepaper.cn/newsDetail_forward_31995539,2025-11-19 04:56:01,澎湃新闻
为上海体育事业谱写新的辉煌，市体校输送运动员闪耀全运赛场,https://www.thepaper.cn/newsDetail_forward_31996669,2025-11-19 04:53:24,澎湃上海
蒸蒸日上迎新市集伙伴招募！上赛场黄金点位等你入驻→,https://www.thepaper.cn/newsDetail_forward_31997790,2025-11-19 04:40:00,上海嘉定
酒后发生口角竟踢踹豪车泄愤，男子因寻衅滋事被上海警方刑拘,https://www.thepaper.cn/newsDetail_forward_31995811,2025-11-19 04:38:00,澎湃新闻
行以致远｜6G与3D打印，如何构建上海松江的产业发展新样本？,https://www.thepaper.cn/newsDetail_forward_31995590,2025-11-19 04:37:19,澎湃新闻
