title,url,time,source
理解长三角｜让南通每寸土地成为融入长三角一体化的“热血主场”,https://www.thepaper.cn/newsDetail_forward_31061154,2025-06-29 07:35:17,澎湃新闻
今年6月上海有9个高温日历史罕见，未来十天热浪更强,https://www.thepaper.cn/newsDetail_forward_31067291,2025-06-30 10:07:38,澎湃新闻
“彩票大师”能预测中奖号码？别信！,https://www.thepaper.cn/newsDetail_forward_31067055,2025-06-30 09:51:56,上海福彩
上海机场：充电宝不属于召回批次、信息清晰、无外观破损，可暂存7天,https://www.thepaper.cn/newsDetail_forward_31067273,2025-06-30 09:34:39,澎湃新闻
为了上海母亲河的清澈（上篇） | 赵丽宏,https://www.thepaper.cn/newsDetail_forward_31065961,2025-06-30 09:22:42,上海纪实
荷全保险资管筹备组获批成立，接受上海金融监管局监督指导,https://www.thepaper.cn/newsDetail_forward_31066699,2025-06-30 09:16:16,澎湃新闻
镁信健康向港交所递表，上海医药、蚂蚁集团等为重要股东,https://www.thepaper.cn/newsDetail_forward_31066346,2025-06-30 09:05:43,澎湃新闻
6月29日福彩开奖公告,https://www.thepaper.cn/newsDetail_forward_31067062,2025-06-30 09:00:00,上海福彩
社区“舞台”上，这样展现睦邻生活！,https://www.thepaper.cn/newsDetail_forward_31067116,2025-06-30 08:19:09,上海杨浦
17条防癌细节，看完受益一辈子,https://www.thepaper.cn/newsDetail_forward_31067115,2025-06-30 08:19:09,上海杨浦
即将开启！中医药文化与你零距离！,https://www.thepaper.cn/newsDetail_forward_31067111,2025-06-30 08:19:09,上海杨浦
最后1天！2024年度个人所得税综合所得汇算清缴今日截止！,https://www.thepaper.cn/newsDetail_forward_31066467,2025-06-30 08:11:41,市民云
下半年还会发餐饮消费券吗？上海市商务委正在研究可行方案,https://www.thepaper.cn/newsDetail_forward_31066293,2025-06-30 08:11:19,澎湃新闻
上海市政协机关庆祝建党104周年会议暨“光荣在党50年”纪念章颁发仪式举行,https://www.thepaper.cn/newsDetail_forward_31066344,2025-06-30 08:10:29,政协联线
胃不舒服就乱吃药？这些误区正在悄悄伤胃,https://www.thepaper.cn/newsDetail_forward_31065374,2025-06-30 08:08:35,上海徐浦中医医院
不可忽视的慢性萎缩性胃炎：你的胃可能正在 “悄悄求救”,https://www.thepaper.cn/newsDetail_forward_31066014,2025-06-30 08:07:31,上海徐浦中医医院
喜报 |《永远的行走·与中国相遇 第三季》荣获第30届上海电视节国际传播奖,https://www.thepaper.cn/newsDetail_forward_31056554,2025-06-30 08:06:48,纪实人文频道
2500公里外的店，开到上海了！,https://www.thepaper.cn/newsDetail_forward_31061665,2025-06-30 08:06:48,魔都吃货小分队
山寨阿那亚礼堂被拆除，斯佳丽约翰逊空降上海,https://www.thepaper.cn/newsDetail_forward_31065925,2025-06-30 08:06:47,外滩TheBund
师生党员同上一堂“行走的党课”！陈云纪念馆与上海对外经贸大学联合举办庆祝建党104周年主题活动,https://www.thepaper.cn/newsDetail_forward_31050998,2025-06-30 08:05:50,陈云纪念馆
上海博物馆“让文物活起来·文物党课”第四季，开讲啦！,https://www.thepaper.cn/newsDetail_forward_31047099,2025-06-30 08:05:50,上海博物馆
快来世博主题营，做一架属于自己的电容飞机吧！,https://www.thepaper.cn/newsDetail_forward_31048534,2025-06-30 08:05:49,世博会博物馆
更新·街区丨上海硅巷：街区引领城市科技新浪潮,https://www.thepaper.cn/newsDetail_forward_31050816,2025-06-30 08:05:49,上海城市空间艺术季
官方影像记录团队：郭静工作室 | 深入记录复兴岛复兴故事，为上海发展留下可贵影像档案,https://www.thepaper.cn/newsDetail_forward_31050833,2025-06-30 08:05:49,纪实人文频道
今天起，上观也能“随申办”！首批32个高频服务功能嵌入,https://www.thepaper.cn/newsDetail_forward_31067053,2025-06-30 07:53:59,今日闵行
他们，是社区里的“暖心夫妻”，也是孤老的“贴心儿女”,https://www.thepaper.cn/newsDetail_forward_31067049,2025-06-30 07:53:59,今日闵行
闵行这里新建道路桥梁，即将通车！,https://www.thepaper.cn/newsDetail_forward_31067047,2025-06-30 07:53:59,今日闵行
水科普丨洪峰、削峰、错峰……都是什么意思？,https://www.thepaper.cn/newsDetail_forward_31066950,2025-06-30 07:34:11,上海水务海洋
一图读懂丨《上海市供水调度管理细则》,https://www.thepaper.cn/newsDetail_forward_31066949,2025-06-30 07:34:11,上海水务海洋
上海辟谣平台发布6月谣言榜,https://www.thepaper.cn/newsDetail_forward_31066638,2025-06-30 07:31:19,上海网络辟谣
易青护航 遇见未来——上海交易集团团委承办华师大四附中2025年“遇见未来的自己”职业体验活动,https://www.thepaper.cn/newsDetail_forward_31066451,2025-06-30 07:15:00,上海联交所
市纪委监委驻市农业农村委纪检监察组组长吴春调研上海农交所,https://www.thepaper.cn/newsDetail_forward_31066443,2025-06-30 07:15:00,上海联交所
上海交易集团党委副书记、总裁管小军带队拜访普陀区委、区政府,https://www.thepaper.cn/newsDetail_forward_31066438,2025-06-30 07:15:00,上海联交所
南京钢铁集团董事长黄一新一行到访上海交易集团,https://www.thepaper.cn/newsDetail_forward_31066433,2025-06-30 07:10:01,上海联交所
锚定目标 实干争先——上海交易集团组织开展第二季度直属党组织书记例会暨“书记例会进一线”活动,https://www.thepaper.cn/newsDetail_forward_31066427,2025-06-30 07:10:01,上海联交所
上海交易集团参与主办的第三届“申动杯”上海市职工羽毛球团体赛总决赛圆满成功,https://www.thepaper.cn/newsDetail_forward_31066422,2025-06-30 07:10:00,上海联交所
宜游更宜居！闵行出发半小时，这个宝藏度假地“常来常熟”丨乐游长三角,https://www.thepaper.cn/newsDetail_forward_31067052,2025-06-30 07:09:17,今日闵行
一线“杨”帆 启新同行丨杨浦区庆祝中国共产党成立104周年暨“一线工作法”20周年工作成果总结活动…,https://www.thepaper.cn/newsDetail_forward_31067108,2025-06-30 07:04:29,上海杨浦
7月1日起，上海失业金上调！,https://www.thepaper.cn/newsDetail_forward_31066161,2025-06-30 06:45:16,市民云
注意查收！7月，你的账户将多一笔钱→,https://www.thepaper.cn/newsDetail_forward_31066168,2025-06-30 06:45:15,市民云
7月1日起，上海调整最低生活保障等社会救助相关标准,https://www.thepaper.cn/newsDetail_forward_31066199,2025-06-30 06:45:15,市民云
2025年度职工医保个人账户资金7月1日计入到位，“封顶线”调高至65万元！,https://www.thepaper.cn/newsDetail_forward_31066250,2025-06-30 06:45:15,市民云
【安全生产月】查找身边隐患，共筑安全防线——高境戒毒所护航场所安全进行中... ...,https://www.thepaper.cn/newsDetail_forward_31066826,2025-06-30 06:42:37,上海戒毒
【安全生产月】青东戒毒所：锻造勇于担当本领过硬的“应急铁军”,https://www.thepaper.cn/newsDetail_forward_31066825,2025-06-30 06:42:37,上海戒毒
【安全生产月】崧泽戒毒所安全生产月活动纪实，全方位守护安全防线！,https://www.thepaper.cn/newsDetail_forward_31066823,2025-06-30 06:42:37,上海戒毒
好有梗！上戏院长黄昌勇的毕业讲话爆火，全文来了,https://www.thepaper.cn/newsDetail_forward_31067051,2025-06-30 06:39:51,今日闵行
志愿者招募中！带你零距离接触顶尖吉他艺术家,https://www.thepaper.cn/newsDetail_forward_31067050,2025-06-30 06:39:51,今日闵行
小区门口的“提拉米苏”摊不打游击啦！合法安家→,https://www.thepaper.cn/newsDetail_forward_31067046,2025-06-30 06:39:51,今日闵行
这款APP也能办理“随申办”业务啦！,https://www.thepaper.cn/newsDetail_forward_31066776,2025-06-30 06:30:40,i金山
什么？最高温近40℃！这可不是危言耸听！,https://www.thepaper.cn/newsDetail_forward_31066775,2025-06-30 06:30:40,i金山
上海市政协举行十四届常委会第十九次会议，胡文容出席并讲话,https://www.thepaper.cn/newsDetail_forward_31066299,2025-06-30 06:25:07,政协联线
中超第16轮！长春亚泰VS上海申花！,https://www.thepaper.cn/newsDetail_forward_31061160,2025-06-30 06:21:17,体坛落叶球
2小将造3球！海港大胜英博的背后，是希望也是漫长等待的开始！,https://www.thepaper.cn/newsDetail_forward_31049264,2025-06-30 06:21:17,体坛落叶球
中超第15轮！上海海港VS大连英博！,https://www.thepaper.cn/newsDetail_forward_31047311,2025-06-30 06:21:16,体坛落叶球
这些数据，展现我国工业经济高质量发展活力,https://www.thepaper.cn/newsDetail_forward_31067010,2025-06-30 06:19:06,绿色青浦
7月1日起，沪昆高铁杭长段复兴号动车组列车实行常态化时速350公里高标运行,https://www.thepaper.cn/newsDetail_forward_31067005,2025-06-30 06:19:06,绿色青浦
上海文化影视产业集聚区“枝繁叶茂”，“徐泾影视”亮相2025上海国际影视市场→,https://www.thepaper.cn/newsDetail_forward_31067004,2025-06-30 06:19:06,绿色青浦
浦东：曹路镇的河道有多美？一起来云赏~,https://www.thepaper.cn/newsDetail_forward_31066948,2025-06-30 06:16:52,上海水务海洋
【活动快讯】“携手看海去”Ocean Go实地科普考察活动之探秘中国救捞陈列馆顺利开展！,https://www.thepaper.cn/newsDetail_forward_31066943,2025-06-30 06:16:52,上海水务海洋
筑巢引凤！奉发未来：让新市民、青年人安居更安心！,https://www.thepaper.cn/newsDetail_forward_31067069,2025-06-30 06:14:39,上海房管
筑牢安居防线 守护幸福家园 | 崇明区房管中心组织开展直管公房防汛安全专项检查行动,https://www.thepaper.cn/newsDetail_forward_31067067,2025-06-30 06:14:39,上海房管
