title,url,time,source
全国敬业道德模范王育竹：以原子之光丈量强国之路,https://www.thepaper.cn/newsDetail_forward_31075008,2025-07-01 07:57:41,澎湃新闻
277家涉“直销黑产”电商店铺被关，上海让电商平台和直销企业“对话”,https://www.thepaper.cn/newsDetail_forward_31087106,2025-07-02 13:45:47,澎湃新闻
上海乐高乐园怎么去更便捷，铁路班次增加、往返直通车上线……,https://www.thepaper.cn/newsDetail_forward_31086993,2025-07-02 12:32:16,澎湃新闻
数智赋能民主立法，普陀区举行“曹杨立法民意直通车”网络平台工作推进会,https://www.thepaper.cn/newsDetail_forward_31087871,2025-07-02 12:21:20,上海普陀
泰国文官委员会代表团到普陀考察交流,https://www.thepaper.cn/newsDetail_forward_31087870,2025-07-02 12:21:20,上海普陀
普陀少年“红途行”暨普陀大学堂（公益学堂）高中生志愿服务社会实践活动举行,https://www.thepaper.cn/newsDetail_forward_31087869,2025-07-02 12:21:20,上海普陀
【普陀民企·苏河扬帆】扎根普陀多年，致达集团以党建为引领，为发展聚力赋能,https://www.thepaper.cn/newsDetail_forward_31087868,2025-07-02 12:21:20,上海普陀
62岁地产大亨遭清华学霸儿子发文“炮轰”？起底明园集团李松坚的商业往事：从潮汕赴上海创业，曾提出“…,https://www.thepaper.cn/newsDetail_forward_31088667,2025-07-02 12:15:59,红星资本局
做好防汛防台防暑和安全生产各项工作，碳市场全面深化改革……今天的上海市政府常务会议研究了这些重要事项,https://www.thepaper.cn/newsDetail_forward_31087095,2025-07-02 12:15:22,澎湃新闻
上海陆家嘴商圈、南京东路商圈等11个商圈将场景化改造,https://www.thepaper.cn/newsDetail_forward_31086900,2025-07-02 12:14:15,澎湃新闻
境外游客退税更便利，上海这三个退付点提供“全市退付”服务,https://www.thepaper.cn/newsDetail_forward_31086914,2025-07-02 11:56:58,澎湃新闻
携手迈进 共创未来——2025沪滇科技合作交流活动举行,https://www.thepaper.cn/newsDetail_forward_31087984,2025-07-02 11:54:40,上海科技
浦东新区国动办举办人防教师培训,https://www.thepaper.cn/newsDetail_forward_31088225,2025-07-02 11:52:46,上海国防动员
第四届上海市房屋修缮技能比武大赛闭幕,https://www.thepaper.cn/newsDetail_forward_31088202,2025-07-02 11:34:38,上海住房城乡建设管理
上海童话节启幕，覆盖全市199个儿童友好城市阅读新空间,https://www.thepaper.cn/newsDetail_forward_31086594,2025-07-02 11:34:23,澎湃新闻
全市首个！在闵行上线,https://www.thepaper.cn/newsDetail_forward_31088104,2025-07-02 11:33:51,今日闵行
时机、禁忌、搭配...夏令膏方的服用秘诀都在这→,https://www.thepaper.cn/newsDetail_forward_31092031,2025-07-02 11:27:37,健康嘉定
学习教育 | 小嘉说党的作风建设（1）,https://www.thepaper.cn/newsDetail_forward_31092029,2025-07-02 11:27:37,健康嘉定
久坐不动，你的身体正在悄悄崩溃！,https://www.thepaper.cn/newsDetail_forward_31092028,2025-07-02 11:27:37,健康嘉定
7月中下旬蚊虫密度将明显上升！这份防蚊指南请收好,https://www.thepaper.cn/newsDetail_forward_31092027,2025-07-02 11:27:37,健康嘉定
【书香政协】共读《上海小史》连载（六十五）,https://www.thepaper.cn/newsDetail_forward_31092130,2025-07-02 11:27:19,闵行区政协
【委员培训】踏寻红色足迹，感悟精神力量----红旗渠委员培训班心得分享（二）,https://www.thepaper.cn/newsDetail_forward_31092128,2025-07-02 11:27:19,闵行区政协
【走进政协•闵行情】闵行这个遗址发掘改写了上海考古史，影响长三角历史走向！,https://www.thepaper.cn/newsDetail_forward_31092124,2025-07-02 11:27:19,闵行区政协
冲上热搜！“中华田园犬禁养”为何不能养？上海可以吗？,https://www.thepaper.cn/newsDetail_forward_31088242,2025-07-02 11:24:41,市民云
重磅！上海医保、人社、民政三部门发声：统统上调！上海市民快来领钱了！,https://www.thepaper.cn/newsDetail_forward_31088240,2025-07-02 11:24:41,市民云
发钱了！你有一笔钱将到账！,https://www.thepaper.cn/newsDetail_forward_31088227,2025-07-02 11:24:41,市民云
上海交大学生与校外人员发生冲突，学校回应,https://www.thepaper.cn/newsDetail_forward_31087036,2025-07-02 11:24:15,光明日报
2025夏令热线丨关于道路施工扬尘、无证设摊、停车位紧缺等问题，泖港镇镇长张然春这样回应,https://www.thepaper.cn/newsDetail_forward_31089220,2025-07-02 11:22:04,上海松江
一线大调研，用心解难题丨诗意栖居、幸福泖田！泖港“15分钟社区生活圈”“圈”出田园新生活,https://www.thepaper.cn/newsDetail_forward_31089216,2025-07-02 11:22:04,上海松江
急救党员陆磊：暮色中用专业与担当点亮生命之光｜发现好服务,https://www.thepaper.cn/newsDetail_forward_31092090,2025-07-02 11:21:24,健康奉贤
薪火相传 勇挑重担丨区中心医院新一批援滇医疗队出发,https://www.thepaper.cn/newsDetail_forward_31092088,2025-07-02 11:21:24,健康奉贤
开车总腰痛？这几个小妙招让疼痛退退退！｜贤医健康说,https://www.thepaper.cn/newsDetail_forward_31092076,2025-07-02 11:21:24,健康奉贤
奉贤区卫生健康系统开展落实陈吉宁书记在奉调研时部署要求大讨论活动（社区卫生服务中心篇②）,https://www.thepaper.cn/newsDetail_forward_31092075,2025-07-02 11:21:24,健康奉贤
2025年奉贤区托幼（育）机构新晋保健人员上岗培训圆满结束,https://www.thepaper.cn/newsDetail_forward_31092046,2025-07-02 11:21:24,健康奉贤
登革热高发季！做好防蚊，守护全家健康刻不容缓！｜贤医健康说,https://www.thepaper.cn/newsDetail_forward_31092045,2025-07-02 11:21:24,健康奉贤
以创新治理守护网络生态，走近这位网络安全防线的“检察尖兵”,https://www.thepaper.cn/newsDetail_forward_31088961,2025-07-02 11:16:45,上海静安
锚点 | 今晚十点东方卫视：大模型的提出者，怎么看大模型的发展？,https://www.thepaper.cn/newsDetail_forward_31087985,2025-07-02 11:10:49,上海科技
预计销售价格与去年相当！上海地产桃2025年市场信息分析来了→,https://www.thepaper.cn/newsDetail_forward_31088015,2025-07-02 11:06:50,绿色青浦
青浦首家嵌入为老服务中心的社区“宝宝屋”正式开放，让快乐成长与颐养天年相融共生,https://www.thepaper.cn/newsDetail_forward_31088013,2025-07-02 11:06:50,绿色青浦
青浦人请注意，这份事关民生保障和品质生活的问卷邀您一起来参与,https://www.thepaper.cn/newsDetail_forward_31092015,2025-07-02 11:05:09,青浦卫计新声
2025年上海市未成年人暑期活动项目信息平台上线，等你来参加！,https://www.thepaper.cn/newsDetail_forward_31089278,2025-07-02 11:04:59,上海宝山
宝山爱优特深耕绿色低碳领域，“电净化”产品让空气可以深呼吸,https://www.thepaper.cn/newsDetail_forward_31089270,2025-07-02 11:04:59,上海宝山
揭晓幸运观众！高铁宝山站慢直播留言赢好礼！,https://www.thepaper.cn/newsDetail_forward_31089264,2025-07-02 11:04:59,上海宝山
玩转草本“YOUNG”起来！主题市集激活健康消费新引擎,https://www.thepaper.cn/newsDetail_forward_31088203,2025-07-02 11:02:20,上海杨浦
沪滇藏同台亮相！民族团结主题展“杨浦时刻”开幕,https://www.thepaper.cn/newsDetail_forward_31088200,2025-07-02 11:02:20,上海杨浦
癌症高发，世卫组织说电饭煲是“帮凶”？医生紧急提醒：真正致癌的是这6种常见行为！,https://www.thepaper.cn/newsDetail_forward_31088198,2025-07-02 11:02:20,上海杨浦
医讯速达｜普陀区举办家医签约与医养结合工作培训会，推动基层医疗服务高质量发展,https://www.thepaper.cn/newsDetail_forward_31092007,2025-07-02 10:57:57,健康普陀医立方
【复议杨声】打牌娱乐or违法赌博？这些红线要分清！,https://www.thepaper.cn/newsDetail_forward_31089707,2025-07-02 10:53:07,上海市杨浦区司法局
莘庄公园里不仅有梅，还有正在盛开的……寄托着对母亲的爱！,https://www.thepaper.cn/newsDetail_forward_31088106,2025-07-02 10:52:44,今日闵行
第八个高温日！后面还有……,https://www.thepaper.cn/newsDetail_forward_31088102,2025-07-02 10:52:44,今日闵行
"快来报名！解锁SISU""微专业""",https://www.thepaper.cn/newsDetail_forward_31088918,2025-07-02 10:50:46,上海外国语大学
【主题教育】致公党上海市委召开理论学习中心组学习（扩大）会,https://www.thepaper.cn/newsDetail_forward_31092132,2025-07-02 10:40:49,致公党上海市委
致公党上海九届市委常委会十七次会议召开,https://www.thepaper.cn/newsDetail_forward_31092129,2025-07-02 10:40:49,致公党上海市委
浦江潮涌庆七一，黄浦时刻闪耀中华民族共同体体验馆,https://www.thepaper.cn/newsDetail_forward_31086151,2025-07-02 10:33:55,澎湃新闻
晚上也要30度？！,https://www.thepaper.cn/newsDetail_forward_31089074,2025-07-02 10:33:14,上海黄浦
2025上海市《国家体育锻炼标准》达标赛黄浦区分站赛开幕！,https://www.thepaper.cn/newsDetail_forward_31089070,2025-07-02 10:33:14,上海黄浦
奥特曼要来黄浦上班啦！,https://www.thepaper.cn/newsDetail_forward_31089048,2025-07-02 10:33:14,上海黄浦
文化广角镜｜馨巢书屋：劈开那座名为“从来如此”的山,https://www.thepaper.cn/newsDetail_forward_31089046,2025-07-02 10:33:14,上海黄浦
“物业+”助力社区治理“拧成绳”,https://www.thepaper.cn/newsDetail_forward_31089260,2025-07-02 10:33:10,上海徐汇
从激烈对峙到互谅互让，“三合一庭”巧解多年纠纷,https://www.thepaper.cn/newsDetail_forward_31089233,2025-07-02 10:33:10,上海徐汇
