title,url,time,source
浦发银行上海分行落地展业改革跨境人民币业务，优质客户“凭指令秒办”跨境结算,https://www.thepaper.cn/newsDetail_forward_31624110,2025-09-17 04:00:19,澎湃新闻
“职”点迷津 | 法定节假日加班，公司能用补休替代加班工资吗？,https://www.thepaper.cn/newsDetail_forward_31624054,2025-09-17 03:47:12,市民云
直播丨上海国防教育公开课——人民城市 英雄力量,https://www.thepaper.cn/newsDetail_forward_31612930,2025-09-17 03:41:57,澎湃新闻
上海已开启流感疫苗接种，老年人可防重症流感肺炎,https://www.thepaper.cn/newsDetail_forward_31623341,2025-09-17 03:36:15,康复杂志
蔡医生话肝胆：聊聊肿瘤免疫治疗,https://www.thepaper.cn/newsDetail_forward_31621057,2025-09-17 03:36:14,浩子医生
上海53个高温日刷新历史第二纪录，今天是高温最后的倔强吗？,https://www.thepaper.cn/newsDetail_forward_31624049,2025-09-17 03:36:03,澎湃新闻
上海今年查处超标“炸街”车辆240余起，其中涉及非法改装76起,https://www.thepaper.cn/newsDetail_forward_31624011,2025-09-17 03:31:57,澎湃新闻
上海地铁崇明线新进展：浦东段盾构区间全部贯通,https://www.thepaper.cn/newsDetail_forward_31623921,2025-09-17 03:31:37,澎湃新闻
地区生产总值突破3000亿关口！看上海市静安区“十四五”如何高质量发展,https://www.thepaper.cn/newsDetail_forward_31623963,2025-09-17 02:50:00,国际金融报
普陀、浦东两位购彩者已完成大乐透第25106期一等奖领奖,https://www.thepaper.cn/newsDetail_forward_31623885,2025-09-17 02:43:00,澎湃新闻
赛艇女将奥运夺金后“换赛道”，期待在上海创造更多历史,https://www.thepaper.cn/newsDetail_forward_31623864,2025-09-17 02:42:42,澎湃新闻
“肠享健康 乐享生活”炎症性肠病（IBD）患者健康项目在上海、山东召开两场患教活动,https://www.thepaper.cn/newsDetail_forward_31623940,2025-09-17 02:40:03,中国红十字基金会
沪深A股双双收阳  科创50指数创反弹新高 赛道股活跃下关注低价股补涨机会,https://www.thepaper.cn/newsDetail_forward_31621101,2025-09-17 02:22:31,大众证券报
这场趣味普法活动“点亮”孩子们的开学季~,https://www.thepaper.cn/newsDetail_forward_31624144,2025-09-17 02:20:53,上海长宁
他重回上海交大攻读硕士学位，不久前在九三阅兵方阵中光荣受阅,https://www.thepaper.cn/newsDetail_forward_31623809,2025-09-17 02:15:15,澎湃新闻
海外观察 | 荷兰以“控制点”问鼎全球价值链,https://www.thepaper.cn/newsDetail_forward_31623805,2025-09-17 01:40:00,前滩综研
上海摄影师康正平后人捐赠一批80年前抗战胜利和名人照片,https://www.thepaper.cn/newsDetail_forward_31488811,2025-09-17 01:38:08,澎湃新闻
上海天气马上大转折！下午大到暴雨携凉风来袭！还有新台风正在酝酿…,https://www.thepaper.cn/newsDetail_forward_31623780,2025-09-17 01:30:00,市民云
小区树木该怎么修剪？上海鼓励设常规修剪与回缩修剪“样板树”,https://www.thepaper.cn/newsDetail_forward_31623741,2025-09-17 01:24:41,澎湃新闻
上海市政府发布会丨介绍2025世界设计之都大会筹备进展等情况,https://www.thepaper.cn/newsDetail_forward_31612918,2025-09-17 01:24:16,澎湃新闻
上海赛艇世锦赛准备就绪！奥运冠军齐赞赛事，惦念上海味道,https://www.thepaper.cn/newsDetail_forward_31621143,2025-09-17 00:04:54,澎湃新闻
蚊子“藏身地”都在哪？社区防控七问七答来啦！,https://www.thepaper.cn/newsDetail_forward_31624149,2025-09-16 23:34:08,上海嘉定
服务站、助餐点…金山推进“嵌入式”养老服务设施均衡布局,https://www.thepaper.cn/newsDetail_forward_31623685,2025-09-16 22:05:05,i金山
空地立体巡检+人防关键排查，他们为防空安全“保驾护航”,https://www.thepaper.cn/newsDetail_forward_31623682,2025-09-16 22:05:05,i金山
早安青浦丨嘴角上扬，做自己的小太阳！,https://www.thepaper.cn/newsDetail_forward_31623701,2025-09-16 22:03:41,绿色青浦
努力在“科技-产业-金融”高水平循环中发挥样板作用！龚正调研上海国投,https://www.thepaper.cn/newsDetail_forward_31622942,2025-09-16 15:16:08,上海科技
区领导调研四团镇经济社会发展情况,https://www.thepaper.cn/newsDetail_forward_31623688,2025-09-16 15:15:08,上海奉贤
为区域高质量发展提供坚实交通支撑！市交通委来奉开展座谈交流,https://www.thepaper.cn/newsDetail_forward_31622479,2025-09-16 15:08:25,上海奉贤
国务院办公厅关于进一步加强旅游市场综合监管的通知,https://www.thepaper.cn/newsDetail_forward_31622533,2025-09-16 14:52:24,上海市司法局
2025年杨浦区行政机关负责人出庭、旁听、讲评“三合一”暨行政争议化解服务点揭牌活动举行,https://www.thepaper.cn/newsDetail_forward_31623139,2025-09-16 14:38:53,上海杨浦
从3次复议到满意而归，青浦复议调解为民解忧,https://www.thepaper.cn/newsDetail_forward_31622536,2025-09-16 14:38:03,上海市司法局
又热出新纪录！再熬一天就降温，明日局部地区仍有雨,https://www.thepaper.cn/newsDetail_forward_31622304,2025-09-16 14:27:05,上海长宁
关乎国防教育，这场巅峰对决入脑入心！,https://www.thepaper.cn/newsDetail_forward_31622298,2025-09-16 14:27:05,上海长宁
守护居民“舌尖上的安全”！天山路街道开展食品安全宣传月活动~,https://www.thepaper.cn/newsDetail_forward_31622295,2025-09-16 14:27:05,上海长宁
2025“最虹桥”嘉年华来啦！14场精彩活动抢先看→,https://www.thepaper.cn/newsDetail_forward_31622291,2025-09-16 14:27:05,上海长宁
努力在“科技-产业-金融”高水平循环中发挥样板作用！龚正调研上海国投,https://www.thepaper.cn/newsDetail_forward_31621050,2025-09-16 14:23:20,澎湃新闻
 一图读懂｜国家网络安全事件报告管理办法,https://www.thepaper.cn/newsDetail_forward_31620967,2025-09-16 14:15:00,上海统计
金山区党政代表团赴杨浦区学习考察,https://www.thepaper.cn/newsDetail_forward_31622402,2025-09-16 14:03:17,i金山
刘健在区科委开展工作调研,https://www.thepaper.cn/newsDetail_forward_31622400,2025-09-16 14:03:17,i金山
上海电力9年跨国并购长跑告吹，但重组预期下近两月股价涨超130%,https://www.thepaper.cn/newsDetail_forward_31620935,2025-09-16 13:53:32,澎湃新闻
新修订的仲裁法自2026年3月1日起施行,https://www.thepaper.cn/newsDetail_forward_31622532,2025-09-16 13:48:12,上海市司法局
推进内河航运绿色低碳转型，上海首艘集散两用纯电动智能船舶吉水投用,https://www.thepaper.cn/newsDetail_forward_31620800,2025-09-16 13:47:02,澎湃新闻
金山区党政代表团来杨浦区考察交流,https://www.thepaper.cn/newsDetail_forward_31623136,2025-09-16 13:46:33,上海杨浦
央视关注｜示范区14项改革任务落地见效，制度创新成果持续彰显,https://www.thepaper.cn/newsDetail_forward_31622960,2025-09-16 13:43:17,绿色青浦
“百年梦想家”展厅即将开放！千年水乡记忆，点亮长三角文化新窗口,https://www.thepaper.cn/newsDetail_forward_31622959,2025-09-16 13:43:17,绿色青浦
在“浦江之窗”携手共建全球科技共同体——写在2025浦江创新论坛启幕之际,https://www.thepaper.cn/newsDetail_forward_31622941,2025-09-16 13:40:59,上海科技
上海试点“马路救援”，首批30名医务人员私家车将配备AED设备,https://www.thepaper.cn/newsDetail_forward_31620371,2025-09-16 13:36:49,澎湃新闻
「党建阅读」《中国浦东干部学院学报》正式入选长安街读书会干部学习核心来源期刊,https://www.thepaper.cn/newsDetail_forward_31620197,2025-09-16 13:27:31,长安街读书会
区领导调研区体育局,https://www.thepaper.cn/newsDetail_forward_31622846,2025-09-16 13:25:45,上海普陀
“党建+法治”，长宁华阳多元擘画“上海硅巷”科创街区营商环境新图景｜法治赋能基层治理,https://www.thepaper.cn/newsDetail_forward_31622531,2025-09-16 13:22:55,上海市司法局
学院开启2.0时代 新任院长表示将培养引领新金融发展中坚力量,https://www.thepaper.cn/newsDetail_forward_31620372,2025-09-16 13:21:51,东方财经浦东频道
浦东非法客运整治宣传进楼宇,https://www.thepaper.cn/newsDetail_forward_31620412,2025-09-16 13:21:51,东方财经浦东频道
17岁心衰少年病情危重，在沪接受“不停跳”人工心脏植入术,https://www.thepaper.cn/newsDetail_forward_31619776,2025-09-16 13:10:03,澎湃新闻
上海多校的午餐虾仁鸡蛋臭了？当地教育局：的确有撤菜，正在进行调查,https://www.thepaper.cn/newsDetail_forward_31622109,2025-09-16 13:08:33,上游新闻
微信看电视丨2025年9月16日《嘉定新闻》,https://www.thepaper.cn/newsDetail_forward_31622322,2025-09-16 13:05:19,上海嘉定
上海外滩FTC揭牌两个月，为内容创作者带来了什么？,https://www.thepaper.cn/newsDetail_forward_31619790,2025-09-16 12:55:10,澎湃新闻
区司法局召开党委（扩大）会议总结深入贯彻中央八项规定精神学习教育，部署推进作风建设常态化长效化,https://www.thepaper.cn/newsDetail_forward_31622535,2025-09-16 12:44:06,上海市长宁区司法局
国家网信办发布《国家网络安全事件报告管理办法》,https://www.thepaper.cn/newsDetail_forward_31622534,2025-09-16 12:44:06,上海市长宁区司法局
"""自动续费""？警惕这种来电！上海已有市民被转空百万存款！",https://www.thepaper.cn/newsDetail_forward_31623177,2025-09-16 12:35:25,市民云
