title,url,time,source
扣响青春力，体彩公益金助力上海明日之星排球争霸赛圆满完赛,https://www.thepaper.cn/newsDetail_forward_31246901,2025-07-25 04:16:20,澎湃新闻
八年同行，共创未来：徐汇与WAIC共筑全球AI创新高地,https://www.thepaper.cn/newsDetail_forward_31246863,2025-07-25 03:36:38,澎湃新闻
进博“速度”让距离不再遥远，这些外企为何选择上海、扎根临港？,https://www.thepaper.cn/newsDetail_forward_31246497,2025-07-25 03:25:17,澎湃新闻
中卫硒砂瓜赴上海推介：宁夏美味将走进更多上海家庭,https://www.thepaper.cn/newsDetail_forward_31246715,2025-07-25 02:30:21,澎湃宁夏
积极响应“沪九条”，澎湃启动“创潮”专业内容创作者赋能行动,https://www.thepaper.cn/newsDetail_forward_31245992,2025-07-25 01:51:40,澎湃新闻
沪通对话共建“芯”生态：南通创新区紫琅硅谷推介会暨首期创新创业大赛走进上海张江,https://www.thepaper.cn/newsDetail_forward_31246500,2025-07-25 00:53:58,澎湃江苏
上海图书馆珍藏宋拓孤本《许真人井铭》复制出版,https://www.thepaper.cn/newsDetail_forward_31246099,2025-07-25 00:04:06,澎湃新闻
AI新势力集结上海！2025世界人工智能大会明日开幕，百余款重磅新品集中亮相,https://www.thepaper.cn/newsDetail_forward_31246355,2025-07-24 23:48:37,澎湃新闻
“高净值人士”踊跃进入上海大宗物业交易市场，机构：小规模项目活跃度会越来越高,https://www.thepaper.cn/newsDetail_forward_31240930,2025-07-24 23:46:15,澎湃新闻
一对母子，决心摘去命运的“巨痣”,https://www.thepaper.cn/newsDetail_forward_31230352,2025-07-24 23:15:27,澎湃新闻
这8位上海艺术大家联袂受聘，携手成为上海“文化大使”,https://www.thepaper.cn/newsDetail_forward_31246266,2025-07-24 15:12:25,澎湃新闻
上海第六批集中供地首日成交额185.3亿元，中海118.88亿元斩获静安普陀两幅重磅地块,https://www.thepaper.cn/newsDetail_forward_31242153,2025-07-24 13:58:44,澎湃新闻
上海五个新城明确首批6条产业细分赛道，龚正市长调研南汇新城,https://www.thepaper.cn/newsDetail_forward_31246278,2025-07-24 13:48:29,澎湃新闻
歇脚、优惠餐饮……上海为新就业群体打造超7000个友好阵地,https://www.thepaper.cn/newsDetail_forward_31246234,2025-07-24 13:42:36,澎湃新闻
上海市委财经委会议传达总书记重要讲话精神，调度部署下半年经济运行重点工作,https://www.thepaper.cn/newsDetail_forward_31246255,2025-07-24 13:24:48,澎湃新闻
上海五个新城一批重点项目发布，涉大飞机、脑机接口等,https://www.thepaper.cn/newsDetail_forward_31246208,2025-07-24 13:20:21,澎湃新闻
上海市退役军人事务局与澎湃新闻签署战略合作协议,https://www.thepaper.cn/newsDetail_forward_31246151,2025-07-24 12:58:22,澎湃新闻
上海住建行业职业技能大赛开启，11个比赛项目等你来参加,https://www.thepaper.cn/newsDetail_forward_31242789,2025-07-24 12:43:36,澎湃新闻
从扰民到成为新顶流，北上海这个美食夜市经历了什么？,https://www.thepaper.cn/newsDetail_forward_31246181,2025-07-24 12:29:10,澎湃新闻
上海第六批土地出让：莘庄一地块以36.89亿元成交,https://www.thepaper.cn/newsDetail_forward_31246107,2025-07-24 11:36:31,澎湃新闻
聚焦中国近现代艺术文献如何数字转型,https://www.thepaper.cn/newsDetail_forward_31182707,2025-07-24 11:17:46,澎湃新闻
三个台风扎堆！今年第9号台风“罗莎”刚刚生成！,https://www.thepaper.cn/newsDetail_forward_31242670,2025-07-24 10:48:20,市民云
倒计时7天！2025版“沪惠保”双险参保通道，将于7月31日全面关闭！,https://www.thepaper.cn/newsDetail_forward_31242156,2025-07-24 10:48:20,市民云
联合国人居署执行主任罗斯巴赫：中国经验为全球城市可持续发展提供智慧方案,https://www.thepaper.cn/newsDetail_forward_31245663,2025-07-24 10:34:10,世界城市日
2025年本市退休人员和城乡居保人员涨养老金啦！,https://www.thepaper.cn/newsDetail_forward_31245950,2025-07-24 10:32:58,市民云
上海：2025年退休人员和城乡居保人员养老金上涨 ,https://www.thepaper.cn/newsDetail_forward_31246036,2025-07-24 10:19:10,澎湃新闻
机器人“交警”亮相外滩？上海警方：还在训练阶段，未正式投用,https://www.thepaper.cn/newsDetail_forward_31246040,2025-07-24 10:15:44,澎湃新闻
上海疾控：本市目前无本土基孔肯雅热病例报告，市民需要注意什么,https://www.thepaper.cn/newsDetail_forward_31245431,2025-07-24 10:15:37,澎湃新闻
机器人“交警”亮相外滩？上海警方：还在训练未正式使用 ,https://www.thepaper.cn/newsDetail_forward_31244147,2025-07-24 09:45:59,澎湃新闻
罗华品已任上海徐汇区委常委、副区长,https://www.thepaper.cn/newsDetail_forward_31245967,2025-07-24 09:44:22,澎湃新闻
上海首个！崇明获国际湿地城市认证,https://www.thepaper.cn/newsDetail_forward_31245987,2025-07-24 09:40:01,澎湃新闻
上海新店2025年上半年巡礼：探寻从旗舰到街角中生长的新意,https://www.thepaper.cn/newsDetail_forward_31228779,2025-07-24 09:01:51,RQ商业观察室
商务部：上海等五大国际消费中心城市离境退税销售额占全国七成,https://www.thepaper.cn/newsDetail_forward_31243095,2025-07-24 08:53:04,澎湃新闻
溢价率30%触顶，安徽高速地产36.887亿元竞得上海闵行莘庄宅地,https://www.thepaper.cn/newsDetail_forward_31241776,2025-07-24 08:21:59,澎湃新闻
联发集团年内第二次在上海拿地：21.948亿元竞得青浦新城商住地块组合,https://www.thepaper.cn/newsDetail_forward_31241886,2025-07-24 08:16:31,澎湃新闻
近期猛增！浏览量已破百万！上海“夜门诊”为什么爆火？,https://www.thepaper.cn/newsDetail_forward_31172326,2025-07-24 08:10:00,市民云
直播丨“打飞的”游上海！复兴岛⇋虹桥枢纽航线试飞，解锁魔都空中新视角,https://www.thepaper.cn/newsDetail_forward_31240855,2025-07-24 08:00:25,澎湃新闻
展现青少年探索自然科学风采，环球自然日全国总决选在沪举行,https://www.thepaper.cn/newsDetail_forward_31241872,2025-07-24 07:46:08,澎湃新闻
【上观智库】当城市开抢“大V”，上海不拼补贴，拼什么？（内附各地政策梳理）,https://www.thepaper.cn/newsDetail_forward_31200530,2025-07-24 07:35:00,上观数据
陈勇已任上海徐汇区副区长,https://www.thepaper.cn/newsDetail_forward_31242178,2025-07-24 07:31:19,澎湃新闻
央行上海总部：通过挖掘更多“小切口”，提升民企融资获得感,https://www.thepaper.cn/newsDetail_forward_31242157,2025-07-24 07:22:23,澎湃新闻
察哈尔读书会第30期：《善与人交 久而敬之——上海公共外交实践》,https://www.thepaper.cn/newsDetail_forward_31241851,2025-07-24 07:17:38,察哈尔学会
央行上海总部：将继续顺应市场需求，大力推进人民币跨境使用,https://www.thepaper.cn/newsDetail_forward_31241914,2025-07-24 07:08:10,澎湃新闻
央行上海总部：上海个人房贷需求回升，融资成本稳中有降,https://www.thepaper.cn/newsDetail_forward_31241892,2025-07-24 06:44:33,澎湃新闻
央行上海总部：积极探索数字人民币在离岸贸易结算中的应用,https://www.thepaper.cn/newsDetail_forward_31241876,2025-07-24 06:39:26,澎湃新闻
暑你会玩丨全球首套“陨石编磬”、纯陨铁金箍棒亮相！来魔都这个展瞧瞧,https://www.thepaper.cn/newsDetail_forward_31240521,2025-07-24 06:28:09,澎湃新闻
溢价率10.1%，中海53.6亿元竞得静安一地块,https://www.thepaper.cn/newsDetail_forward_31241721,2025-07-24 06:27:57,乐居财经
解密细胞核仁结构，上海科学家揭开RNA高效加工之谜,https://www.thepaper.cn/newsDetail_forward_31241821,2025-07-24 06:17:42,澎湃新闻
魔都眼｜17.5亿美元订单引爆国际低空经济博览会,https://www.thepaper.cn/newsDetail_forward_31241438,2025-07-24 06:08:11,澎湃新闻
中国海外发展53.63亿元竞得静安东斯文里片区商住地块，楼板价90390元/平米,https://www.thepaper.cn/newsDetail_forward_31241548,2025-07-24 05:59:02,澎湃新闻
跟随这份书单，探寻城市文化密码,https://www.thepaper.cn/newsDetail_forward_31218315,2025-07-24 05:56:48,同济大学出版社
一图读懂丨上海市建筑工程领域建筑工人工资支付管理办法,https://www.thepaper.cn/newsDetail_forward_31211092,2025-07-24 05:47:58,澎湃新闻
十轮点球鏖战！河南三扑点斩落中超领头羊，小将刘诚宇再陷心魔！,https://www.thepaper.cn/newsDetail_forward_31241087,2025-07-24 05:45:56,体坛落叶球
上海第六批土地出让已成交三幅，静安地块可售住宅楼面价11.44万/㎡,https://www.thepaper.cn/newsDetail_forward_31241796,2025-07-24 05:38:05,澎湃新闻
“变革·新生”2025外滩新媒体年会将在上海举行,https://www.thepaper.cn/newsDetail_forward_31241680,2025-07-24 05:06:09,澎湃新闻
561米“云端魔盒”如何打开？上海最高观景台纪录被刷新,https://www.thepaper.cn/newsDetail_forward_31241619,2025-07-24 05:02:25,澎湃新闻
双台风共舞！今年第8号台风“竹节草”已生成,https://www.thepaper.cn/newsDetail_forward_31241611,2025-07-24 04:51:36,市民云
上海某互联网企业高管韩某被抓，涉案金额达4000余万元,https://www.thepaper.cn/newsDetail_forward_31241744,2025-07-24 04:46:59,澎湃新闻
上海的艺术家们｜石至莹：石与海之间的凝视,https://www.thepaper.cn/newsDetail_forward_31220762,2025-07-24 04:34:33,澎湃新闻
上海市建设项目“开工一件事”工作方案发布,https://www.thepaper.cn/newsDetail_forward_31237527,2025-07-24 04:08:15,澎湃新闻
