title,url,time,source
抗战回望50︱兆芳照相馆拍摄的1937年的上海影像,https://www.thepaper.cn/newsDetail_forward_31514348,2025-09-02 03:02:15,澎湃新闻
中国－上海合作组织能源合作平台揭牌仪式在北京举办,https://www.thepaper.cn/newsDetail_forward_31528866,2025-09-02 03:00:46,澎湃新闻
上海交易集团召开第一届工会会员代表大会第二次会议暨职工代表第一次会议,https://www.thepaper.cn/newsDetail_forward_31528732,2025-09-02 02:15:00,上海联交所
上海交易集团党委副书记、总裁管小军带队走访中信银行上海分行,https://www.thepaper.cn/newsDetail_forward_31528727,2025-09-02 02:15:00,上海联交所
上海交易集团与上海银行举行工作会谈,https://www.thepaper.cn/newsDetail_forward_31528724,2025-09-02 02:15:00,上海联交所
潮涌黄海畔，沪如同城时 | 如东“苏超赛事＋”解锁文旅消费新场景,https://www.thepaper.cn/newsDetail_forward_31528739,2025-09-02 02:12:16,澎湃江苏
上海交易集团国资不动产租赁服务班组获评2022-2024年度“上海市三八红旗集体”,https://www.thepaper.cn/newsDetail_forward_31528717,2025-09-02 02:10:00,上海联交所
商务部解读《上海合作组织元首理事会关于支持多边贸易体制的声明》,https://www.thepaper.cn/newsDetail_forward_31528646,2025-09-02 01:49:21,澎湃新闻
上合组织天津峰会|习近平主持上海合作组织成员国元首理事会第二十五次会议并发表重要讲话,https://www.thepaper.cn/newsDetail_forward_31528624,2025-09-02 01:25:00,好客山东
电梯“罢工”九旬老人困楼下，3名消防员轮番接力将其背回24楼家中,https://www.thepaper.cn/newsDetail_forward_31524626,2025-09-02 00:17:37,澎湃新闻
上海合作组织成员国元首理事会关于支持多边贸易体制的声明,https://www.thepaper.cn/newsDetail_forward_31528751,2025-09-02 00:06:47,商务微新闻
记者蹲守“养生直播间”70余天：老年人这样被天价产品步步套牢,https://www.thepaper.cn/newsDetail_forward_31527625,2025-09-01 23:53:19,上海网络辟谣
为安全护航，他们是专业的,https://www.thepaper.cn/newsDetail_forward_31527865,2025-09-01 22:04:45,i金山
人均消费100元！金山女生的专属快乐（还有免费活动…）,https://www.thepaper.cn/newsDetail_forward_31527861,2025-09-01 22:04:45,i金山
早安青浦丨有我早安，你不孤单～,https://www.thepaper.cn/newsDetail_forward_31528232,2025-09-01 22:04:41,绿色青浦
上海合作组织成员国元首理事会关于支持多边贸易体制的声明,https://www.thepaper.cn/newsDetail_forward_31527586,2025-09-01 18:48:11,外交部
上海合作组织成员国元首理事会关于第二次世界大战胜利和联合国成立80周年的声明,https://www.thepaper.cn/newsDetail_forward_31527583,2025-09-01 18:38:35,外交部
王毅同上海合作组织秘书长共见记者,https://www.thepaper.cn/newsDetail_forward_31527581,2025-09-01 18:37:22,外交部
上海合作组织成员国元首理事会关于进一步加强科技创新合作的声明,https://www.thepaper.cn/newsDetail_forward_31525309,2025-09-01 18:27:59,澎湃新闻
上海合作组织成员国元首理事会关于有效处理和应对世界毒品问题的声明,https://www.thepaper.cn/newsDetail_forward_31525099,2025-09-01 18:14:25,澎湃新闻
上海合作组织成员国元首理事会关于进一步深化人工智能国际合作的声明,https://www.thepaper.cn/newsDetail_forward_31525023,2025-09-01 18:08:52,澎湃新闻
上海合作组织成员国元首理事会关于绿色产业合作的声明,https://www.thepaper.cn/newsDetail_forward_31525021,2025-09-01 17:56:48,澎湃新闻
上海合作组织成员国元首理事会关于能源可持续发展的声明,https://www.thepaper.cn/newsDetail_forward_31525018,2025-09-01 17:38:22,澎湃新闻
上海合作组织成员国元首理事会关于加强数字经济发展的声明,https://www.thepaper.cn/newsDetail_forward_31525016,2025-09-01 17:25:46,澎湃新闻
中国担任上海合作组织2024－2025年轮值主席国工作成果清单,https://www.thepaper.cn/newsDetail_forward_31525014,2025-09-01 17:11:54,澎湃新闻
演出的金秋开始了，上海各大剧院新演出季周末扎堆开幕,https://www.thepaper.cn/newsDetail_forward_31522763,2025-09-01 16:04:45,澎湃新闻
奥赛博物馆主席阿米克去世，6月曾来上海为浦美奥赛展开幕,https://www.thepaper.cn/newsDetail_forward_31524977,2025-09-01 15:22:29,澎湃新闻
区领导调研民生实事项目推进情况,https://www.thepaper.cn/newsDetail_forward_31528370,2025-09-01 15:07:46,上海杨浦
出发吧！和书包里的“小怪兽”一起闯荡校园新世界～,https://www.thepaper.cn/newsDetail_forward_31528225,2025-09-01 15:02:42,绿色青浦
王毅同上海合作组织秘书长共见记者,https://www.thepaper.cn/newsDetail_forward_31524973,2025-09-01 15:02:14,澎湃新闻
市委网信办举办上海MCN机构合规指导市级示范场活动,https://www.thepaper.cn/newsDetail_forward_31524962,2025-09-01 14:55:00,沪小信来普法
视频 | 彭丽媛同出席2025年上海合作组织峰会外方领导人夫人游览天津海河,https://www.thepaper.cn/newsDetail_forward_31527375,2025-09-01 14:36:33,上游新闻
中央纪委国家监委通报！,https://www.thepaper.cn/newsDetail_forward_31527952,2025-09-01 14:36:29,上海市司法局
习近平主持“上海合作组织+”会议并发表重要讲话,https://www.thepaper.cn/newsDetail_forward_31524955,2025-09-01 14:35:10,澎湃新闻
逐梦上财，扬帆启航 | 2025年新进教职工岗前培训正式启动,https://www.thepaper.cn/newsDetail_forward_31527677,2025-09-01 14:19:52,上海财经大学
善用资源开放日① | 走进山东、上海、广东、甘肃企业，开启多元“企”妙之旅～～,https://www.thepaper.cn/newsDetail_forward_31528332,2025-09-01 14:10:39,中国建材集团
“弘扬上海精神 共筑命运共同体”——中国驻斯里兰卡使馆开展“上合组织进智库进校园”活动,https://www.thepaper.cn/newsDetail_forward_31525063,2025-09-01 14:08:21,亚洲雄风
许昕也“逃不过”开学季，赛后从新疆赶回上海送儿女上学,https://www.thepaper.cn/newsDetail_forward_31523446,2025-09-01 14:04:10,澎湃新闻
【历史未远，吾辈自强】（一）叩开时空之门,https://www.thepaper.cn/newsDetail_forward_31527950,2025-09-01 14:02:06,上海市司法局
主打一个随缘治愈，医院电梯操作员给的情绪价值到位,https://www.thepaper.cn/newsDetail_forward_31522867,2025-09-01 14:00:39,澎湃新闻
区领导调研重点科技企业,https://www.thepaper.cn/newsDetail_forward_31528220,2025-09-01 13:58:46,绿色青浦
青吴嘉老干部纪念中国人民抗日战争暨世界反法西斯战争胜利80周年主题活动在青浦举办,https://www.thepaper.cn/newsDetail_forward_31528215,2025-09-01 13:58:46,绿色青浦
上海交通大学附属嘉定实验学校新校舍启用！,https://www.thepaper.cn/newsDetail_forward_31527764,2025-09-01 13:43:11,上海嘉定
“小电驴”新国标，今起实施！有哪些变化？旧车还能骑吗？如何选购？详见↓,https://www.thepaper.cn/newsDetail_forward_31527951,2025-09-01 13:39:32,上海市司法局
彭丽媛同出席2025年上海合作组织峰会外方领导人夫人游览天津海河,https://www.thepaper.cn/newsDetail_forward_31524818,2025-09-01 13:39:07,环球时报
上海徐汇、普陀、嘉定迎来新任区委常委,https://www.thepaper.cn/newsDetail_forward_31523887,2025-09-01 13:35:47,澎湃新闻
来自紫隄村的他，乐善好施、高风亮节丨闵行情,https://www.thepaper.cn/newsDetail_forward_31528269,2025-09-01 13:33:50,今日闵行
人工智能生成合成内容标识工作交流会在沪举行,https://www.thepaper.cn/newsDetail_forward_31524635,2025-09-01 13:28:58,澎湃新闻
解决老旧小区“老大难”，开展沉浸式普法……长宁区仙霞新村街道绘就平安社区新图景,https://www.thepaper.cn/newsDetail_forward_31527949,2025-09-01 13:23:38,上海市长宁区司法局
长宁区首批民营企业“法律明白人”“法治带头人”队伍成立,https://www.thepaper.cn/newsDetail_forward_31527948,2025-09-01 13:23:38,上海市长宁区司法局
“媒眼”里的62天，这些故事值得回望！,https://www.thepaper.cn/newsDetail_forward_31527782,2025-09-01 13:20:09,上铁集团
客发1.84亿人次，货发3692万吨！快看这份暑运成绩单！,https://www.thepaper.cn/newsDetail_forward_31527773,2025-09-01 13:20:09,上铁集团
《人民法院报》：销售ODS，备案就可以吗？,https://www.thepaper.cn/newsDetail_forward_31525038,2025-09-01 13:18:47,上海高院
《法治日报》丨妻子正备孕租到“甲醛房”？法院：全额退款！,https://www.thepaper.cn/newsDetail_forward_31525037,2025-09-01 13:18:47,上海高院
从6岁起食发，18岁少女胃中取出巨大毛发结石,https://www.thepaper.cn/newsDetail_forward_31524104,2025-09-01 13:11:47,澎湃新闻
上海合作组织成员国元首理事会关于第二次世界大战胜利和联合国成立80周年的声明,https://www.thepaper.cn/newsDetail_forward_31524812,2025-09-01 13:10:41,环球时报
彭丽媛同出席2025年上海合作组织峰会外方领导人夫人游览天津海河,https://www.thepaper.cn/newsDetail_forward_31528076,2025-09-01 13:04:16,北京女性
微信看电视丨2025年9月1日《嘉定新闻》,https://www.thepaper.cn/newsDetail_forward_31527763,2025-09-01 13:04:15,上海嘉定
中国通号在线灵活编组技术荣获上海市科技进步奖,https://www.thepaper.cn/newsDetail_forward_31528334,2025-09-01 12:59:04,中国通号
高温终于要暂停了，但午后强对流天气还在,https://www.thepaper.cn/newsDetail_forward_31527729,2025-09-01 12:58:15,上海长宁
