title,url,time,source
2025亚洲体育产业峰会即将启幕，共绘体育产业高质量发展新蓝图,https://www.thepaper.cn/newsDetail_forward_31825564,2025-10-23 00:26:58,澎湃新闻
产业发展向高向新，上海宝山如何打造转型样本？,https://www.thepaper.cn/newsDetail_forward_31826279,2025-10-23 04:04:25,澎湃新闻
周爱华：霜降时节，这些方面要注意,https://www.thepaper.cn/newsDetail_forward_31826127,2025-10-23 03:57:44,上海徐浦中医医院
上海有景区招人演“野人”？景区辟谣了,https://www.thepaper.cn/newsDetail_forward_31826423,2025-10-23 03:49:35,上海网络辟谣
上海前三季度，集成电路制造业“成绩单”亮眼,https://www.thepaper.cn/newsDetail_forward_31824036,2025-10-23 03:36:01,半导体产业纵横
虹桥论坛嘉宾说丨欧加隆全球首席执行官黎恺文视频寄语,https://www.thepaper.cn/newsDetail_forward_31826321,2025-10-23 03:34:30,虹桥国际经济论坛
虹桥论坛嘉宾说丨中国社会科学院世界经济与政治研究所所长廖凡视频寄语,https://www.thepaper.cn/newsDetail_forward_31824221,2025-10-23 03:34:30,虹桥国际经济论坛
虹桥论坛嘉宾说丨2001年诺贝尔经济学奖得主约瑟夫·斯蒂格利茨视频寄语,https://www.thepaper.cn/newsDetail_forward_31824239,2025-10-23 03:34:30,虹桥国际经济论坛
看展 | 梵高之路：在浦东美术馆收集时光的羽毛与灵魂的回响,https://www.thepaper.cn/newsDetail_forward_31824410,2025-10-23 03:33:34,美学时空漫游指南
虹桥论坛嘉宾说丨伦敦经济与商业政策署原署长罗思义视频寄语,https://www.thepaper.cn/newsDetail_forward_31824240,2025-10-23 03:31:59,虹桥国际经济论坛
助力“双碳”战略落实，浦东不断推进绿色低碳产业高质量发展,https://www.thepaper.cn/newsDetail_forward_31826249,2025-10-23 03:31:59,浦东发布
GDP同比增长5.5%！今年前三季度上海国民经济运行情况发布,https://www.thepaper.cn/newsDetail_forward_31826247,2025-10-23 03:31:59,浦东发布
大河奔涌 合作共赢——2025亚欧大河流域合作对话会在沪举行,https://www.thepaper.cn/newsDetail_forward_31826330,2025-10-23 03:31:44,澎湃上海
全球超300个品牌集结，百余家机构跨界组合！第十届陆家嘴国际咖啡文化节演绎美好生活嘉年华,https://www.thepaper.cn/newsDetail_forward_31826243,2025-10-23 03:27:13,浦东发布
杨浦暖流丨娃减重、老人控糖，上海杨浦这个志愿团队全包了,https://www.thepaper.cn/newsDetail_forward_31823141,2025-10-23 03:20:42,澎湃新闻
“何以敦煌”大展重返上海，5座经典洞窟复制窟有何看点？,https://www.thepaper.cn/newsDetail_forward_31826072,2025-10-23 02:11:22,澎湃新闻
上海工程技术大学新校标发布：三旋翼结构象征学科交叉融合,https://www.thepaper.cn/newsDetail_forward_31826032,2025-10-23 02:11:13,澎湃新闻
全球工程师看上海｜斯洛伐克教授：在这里看到了工程技术的世界前沿,https://www.thepaper.cn/newsDetail_forward_31824450,2025-10-23 02:10:44,澎湃新闻
10月21日福彩开奖公告,https://www.thepaper.cn/newsDetail_forward_31826073,2025-10-23 01:50:06,上海福彩
双色球第2025121期：中出一等奖13注，筹集公益金1.27亿元,https://www.thepaper.cn/newsDetail_forward_31826067,2025-10-23 01:50:02,上海福彩
上海市政府发布会丨“勇担转型重任，勇当科创尖兵，打造新时代现代化转型样本”宝山区专场,https://www.thepaper.cn/newsDetail_forward_31817944,2025-10-23 01:48:17,澎湃新闻
上海四平路街道公益生态圈：从“公益嘉年华”到“小红花好事地图”,https://www.thepaper.cn/newsDetail_forward_31826024,2025-10-23 01:23:50,澎湃上海
上海一家丽江游4岁女儿高反急返沪，父亲订错票：1分钟纠错被扣两千元退票费,https://www.thepaper.cn/newsDetail_forward_31825889,2025-10-23 00:49:59,澎湃新闻
房东收房时拍了张照，为何惊动了警方？,https://www.thepaper.cn/newsDetail_forward_31826274,2025-10-23 00:36:56,青春上海
捷廖什金娜32个挥鞭转炸场，马林斯基《海盗》令全场欢呼,https://www.thepaper.cn/newsDetail_forward_31824452,2025-10-23 00:28:15,澎湃新闻
银行卡要被清？钱会没吗？忘卡数这样查,https://www.thepaper.cn/newsDetail_forward_31826009,2025-10-23 00:05:36,上海网络辟谣
从《雄狮少年》到《英歌》，大湾区非遗的破圈之路,https://www.thepaper.cn/newsDetail_forward_31820382,2025-10-22 23:48:37,澎湃新闻
跨越百年的文化姻缘，岭南文化绽放上海,https://www.thepaper.cn/newsDetail_forward_31820234,2025-10-22 23:42:55,澎湃新闻
机器人“组团”盖机场？上海这个超级工程藏着未来建筑的答案,https://www.thepaper.cn/newsDetail_forward_31823740,2025-10-22 23:34:11,澎湃新闻
郭轩扬｜所有权在数据场景中终结了吗？——数据平行所有权论,https://www.thepaper.cn/newsDetail_forward_31826457,2025-10-22 23:34:02,上海市法学会
上海前三季度GDP同比增长5.5%,https://www.thepaper.cn/newsDetail_forward_31823779,2025-10-22 22:06:40,蓝鲸新闻
降温了，那就用美食温暖身心吧！,https://www.thepaper.cn/newsDetail_forward_31825657,2025-10-22 22:05:47,i金山
“3个3000亿”！上海嘉定“十四五”跑出“嘉速度”,https://www.thepaper.cn/newsDetail_forward_31824435,2025-10-22 15:55:05,国际金融报
打通产权、权责、流程三大堵点，普陀这个老旧小区破解“充电难”,https://www.thepaper.cn/newsDetail_forward_31825688,2025-10-22 14:56:44,上海市司法局
“和谐劳动关系建设大家说”首场分享会在长宁举行！,https://www.thepaper.cn/newsDetail_forward_31824759,2025-10-22 13:53:32,上海长宁
浦东花木法治护航会展经济高质量发展｜法治赋能基层治理,https://www.thepaper.cn/newsDetail_forward_31826494,2025-10-22 13:44:35,上海市司法局
上海宝山区生物医药重点项目集中签约，17个项目总投资超20亿元,https://www.thepaper.cn/newsDetail_forward_31824241,2025-10-22 13:40:39,澎湃新闻
“沪六红色场馆联盟”成立，两地将共同推动红色资源共享,https://www.thepaper.cn/newsDetail_forward_31824194,2025-10-22 13:24:13,澎湃新闻
上海一景区招“野人”NPC日薪500元？回应：并无此类招聘,https://www.thepaper.cn/newsDetail_forward_31824190,2025-10-22 13:20:47,澎湃新闻
上海奉贤创新法治校园工作室，健强文明“小手”牵起守法“大手”,https://www.thepaper.cn/newsDetail_forward_31826492,2025-10-22 13:20:33,上海市司法局
区领导调研住宅小区物业治理和绿化市容管理工作,https://www.thepaper.cn/newsDetail_forward_31825679,2025-10-22 13:18:41,上海奉贤
虹桥论坛嘉宾说丨2001年诺贝尔经济学奖得主迈克尔·斯宾塞视频寄语,https://www.thepaper.cn/newsDetail_forward_31824209,2025-10-22 13:05:21,虹桥国际经济论坛
虹桥论坛嘉宾说丨欧莱雅北亚总裁及中国首席执行官博万尚视频寄语,https://www.thepaper.cn/newsDetail_forward_31824211,2025-10-22 13:05:21,虹桥国际经济论坛
虹桥论坛嘉宾说丨全球化智库副主任高志凯视频寄语,https://www.thepaper.cn/newsDetail_forward_31824185,2025-10-22 13:05:21,虹桥国际经济论坛
虹桥论坛嘉宾说丨2013年诺贝尔化学奖得主迈克尔·莱维特视频寄语,https://www.thepaper.cn/newsDetail_forward_31824203,2025-10-22 13:03:16,虹桥国际经济论坛
常州金坛在沪举办文化产业推介会，签约多个项目唱响“双城记”,https://www.thepaper.cn/newsDetail_forward_31824234,2025-10-22 12:59:49,澎湃江苏
传递城市文明“好声音”,https://www.thepaper.cn/newsDetail_forward_31825660,2025-10-22 12:52:23,i金山
长宁与上海交大签约！涉及教育、医疗、卫生等领域……,https://www.thepaper.cn/newsDetail_forward_31824753,2025-10-22 12:40:42,上海长宁
区人大常委会召开主任会议，聚焦多项重点工作,https://www.thepaper.cn/newsDetail_forward_31824743,2025-10-22 12:40:32,上海虹口
上海陆家嘴咖啡节第十年举办：打造联名文创，已成产业孵化器,https://www.thepaper.cn/newsDetail_forward_31824101,2025-10-22 12:34:17,澎湃新闻
浦东聚焦长者智慧康养 共绘老龄社区新蓝图,https://www.thepaper.cn/newsDetail_forward_31824135,2025-10-22 12:14:45,东方财经浦东频道
上海现代服务业联合会大健康服务银发产业合作示范基地揭牌,https://www.thepaper.cn/newsDetail_forward_31824133,2025-10-22 12:14:45,东方财经浦东频道
【普法宣传】付费即免责？不存在的！,https://www.thepaper.cn/newsDetail_forward_31825195,2025-10-22 12:04:11,上海住房城乡建设管理
上海发布三项通告，加强第八届进博会期间安全检查和安全管理,https://www.thepaper.cn/newsDetail_forward_31824102,2025-10-22 11:40:52,澎湃新闻
黄河几字弯的文化“活化石”与鄂尔多斯民俗,https://www.thepaper.cn/newsDetail_forward_31822773,2025-10-22 11:40:19,澎湃新闻
第八届进博会临近，虹口商务外事联络官团队实战出击！,https://www.thepaper.cn/newsDetail_forward_31824746,2025-10-22 11:36:45,上海虹口
工伤如何认定？康复要注意什么？“奔跑者” 们快收好这份 “平安礼包”,https://www.thepaper.cn/newsDetail_forward_31824744,2025-10-22 11:36:45,上海虹口
观察｜上海经济数据里的“大城韧劲”,https://www.thepaper.cn/newsDetail_forward_31823959,2025-10-22 11:12:45,澎湃新闻
沪苏浙交界的这座小镇，基层立法联系点成为广纳民意大舞台,https://www.thepaper.cn/newsDetail_forward_31823911,2025-10-22 11:07:44,澎湃新闻
“没有一顿火锅解决不了的事！嗯？原来老祖宗也这么想......”,https://www.thepaper.cn/newsDetail_forward_31824710,2025-10-22 10:59:38,青春上海
