title,url,time,source
多位院士集聚上海城市空间艺术季，讨论“量子城市”议题,https://www.thepaper.cn/newsDetail_forward_31753304,2025-10-12 04:02:31,澎湃新闻
青春能量点燃上海静安，“热爱次元”动漫运动主题草地音乐节正式亮相,https://www.thepaper.cn/newsDetail_forward_31763245,2025-10-12 03:21:49,澎湃新闻
推动本土深耕与全球拓展，创新药械企业在浦东按下发展“加速键”,https://www.thepaper.cn/newsDetail_forward_31763249,2025-10-12 03:15:08,浦东发布
沪苏湖高铁通车近一年，你坐过吗？丨喇叭头里的乡音,https://www.thepaper.cn/newsDetail_forward_31763431,2025-10-12 02:25:20,上海市莘庄工业区
来势汹汹，传染高发期！有人全家“中招”,https://www.thepaper.cn/newsDetail_forward_31763427,2025-10-12 02:25:20,上海市莘庄工业区
专坑老年人！“1元鸡蛋”、免费菜都被查了，上海公布典型案例,https://www.thepaper.cn/newsDetail_forward_31763239,2025-10-12 02:04:19,上海网络辟谣
上海书评周刊,https://www.thepaper.cn/newsDetail_forward_2006977,2025-10-12 01:50:32,澎湃新闻
浪尖争锋，2025全国索道滑水锦标赛奉贤启幕,https://www.thepaper.cn/newsDetail_forward_31763441,2025-10-12 01:11:57,上海奉贤
在深圳一带一路音乐季，上海爱乐首演交响曲《上海》,https://www.thepaper.cn/newsDetail_forward_31760132,2025-10-12 00:33:54,澎湃新闻
“好可爱的大学生！”女生找回手机后，发现相册多了一段视频……,https://www.thepaper.cn/newsDetail_forward_31763173,2025-10-12 00:29:44,青春上海
长宁这家菜市场焕新归来！居民直呼：便宜、新鲜、放心！,https://www.thepaper.cn/newsDetail_forward_31763393,2025-10-12 00:21:21,上海长宁
东航国内“空中快线”宽体机Wi-Fi全部免费！,https://www.thepaper.cn/newsDetail_forward_31763390,2025-10-12 00:21:21,上海长宁
寄修手机丢失如何维权？长宁区消保委提醒→,https://www.thepaper.cn/newsDetail_forward_31763388,2025-10-12 00:21:21,上海长宁
“以赛取证”，养老护理人才又多一条职业晋升通道,https://www.thepaper.cn/newsDetail_forward_31763379,2025-10-12 00:07:13,上海虹口
一个操作就致伤！厨房常见餐具藏“隐形危险”,https://www.thepaper.cn/newsDetail_forward_31763179,2025-10-12 00:05:54,上海网络辟谣
上海市彭浦镇社区卫生服务中心中医全科家庭医生严正的一天（下）,https://www.thepaper.cn/newsDetail_forward_31759016,2025-10-11 23:43:14,医璐同行
上海市彭浦镇社区卫生服务中心中医全科家庭医生严正的一天（上）,https://www.thepaper.cn/newsDetail_forward_31759011,2025-10-11 23:43:14,医璐同行
快速看上海市彭浦镇社区卫生服务中心中医全科家庭医生严正的一天,https://www.thepaper.cn/newsDetail_forward_31759020,2025-10-11 23:43:14,医璐同行
“冠军教练团”走进嘉定校园，为孩子们开起“轮滑小灶”,https://www.thepaper.cn/newsDetail_forward_31763403,2025-10-11 23:33:08,上海嘉定
早安，嘉定,https://www.thepaper.cn/newsDetail_forward_31762993,2025-10-11 22:33:40,上海嘉定
距乐高乐园仅800米，这里美翻了~,https://www.thepaper.cn/newsDetail_forward_31763422,2025-10-11 22:04:32,i金山
公园里的新装备，能买水，还能“买时间”,https://www.thepaper.cn/newsDetail_forward_31763011,2025-10-11 22:04:32,i金山
布局这些重点发展领域，启动未来产业集聚区建设……今天这场发布会解析上海如何推动未来产业发展,https://www.thepaper.cn/newsDetail_forward_31763051,2025-10-11 15:38:58,上海科技
公益骑行跨欧亚 沪上圆梦架心桥  比利时六旬抗癌勇士用车轮传递希望与绿色,https://www.thepaper.cn/newsDetail_forward_31760123,2025-10-11 15:35:00,中国城市报
第二届上海国际光影节青浦分会场：品味光影故事，解码华章注脚！,https://www.thepaper.cn/newsDetail_forward_31763056,2025-10-11 14:39:05,绿色青浦
一整个月的诗意与烟火等你相约！嘉定远香湖艺术月启幕,https://www.thepaper.cn/newsDetail_forward_31763402,2025-10-11 14:36:05,上海嘉定
区领导开展生态环保问题检查督导与食品供应安全检查工作,https://www.thepaper.cn/newsDetail_forward_31762997,2025-10-11 14:36:05,上海嘉定
医美纠纷中的常见法律问题,https://www.thepaper.cn/newsDetail_forward_31762300,2025-10-11 14:29:38,上海市长宁区司法局
长宁区开展互联网医院跨部门综合监管,https://www.thepaper.cn/newsDetail_forward_31762299,2025-10-11 14:29:38,上海市长宁区司法局
陈吉宁会见来沪参加IBLAC的国际企业家代表,https://www.thepaper.cn/newsDetail_forward_31760028,2025-10-11 14:20:31,澎湃新闻
抓紧抓实抓细各项任务，决战决胜抓冲刺！区委区政府季度工作会议召开,https://www.thepaper.cn/newsDetail_forward_31762511,2025-10-11 14:20:12,上海普陀
最高检党组会审议推进检察机关作风建设常态化长效化举措,https://www.thepaper.cn/newsDetail_forward_31762244,2025-10-11 14:02:40,上海检察
为区域高质量发展注入新动能！区领导调研市工业综合开发区,https://www.thepaper.cn/newsDetail_forward_31762275,2025-10-11 13:55:00,上海奉贤
上海发布老年人数字素养报告：女性在应用下载能力等方面均优于男性,https://www.thepaper.cn/newsDetail_forward_31759009,2025-10-11 13:49:54,澎湃新闻
德约科维奇不敌“超级黑马”，上海大师赛决赛对阵出炉,https://www.thepaper.cn/newsDetail_forward_31759465,2025-10-11 13:44:24,澎湃新闻
开往艺术的列车，上海国际艺术节江浙皖分会场专列首发,https://www.thepaper.cn/newsDetail_forward_31757995,2025-10-11 13:30:20,澎湃新闻
浦东旗舰店-积分商城又上新了！,https://www.thepaper.cn/newsDetail_forward_31762698,2025-10-11 13:16:08,市民云
要跌破20°了？！上海未来将迎降温，秋凉要来了～,https://www.thepaper.cn/newsDetail_forward_31762691,2025-10-11 13:16:08,市民云
摸黑刷手机可能致盲？！这些人一定要注意→,https://www.thepaper.cn/newsDetail_forward_31762924,2025-10-11 13:06:25,青春上海
微信看电视丨2025年10月11日《嘉定新闻》,https://www.thepaper.cn/newsDetail_forward_31762999,2025-10-11 13:05:30,上海嘉定
TOP级燃爆！2025上海Top Run 10公里精英赛报名个人通道已爆满！团队报名攻略速存,https://www.thepaper.cn/newsDetail_forward_31762514,2025-10-11 13:02:18,上海普陀
“海聚英才”活动添新篇，普陀人才服务关怀再升级,https://www.thepaper.cn/newsDetail_forward_31762509,2025-10-11 13:02:18,上海普陀
四方聚力，共绘量子产业发展新蓝图——《协同推进上海量子城市（复兴岛）建设战略合作协议》正式签署,https://www.thepaper.cn/newsDetail_forward_31762664,2025-10-11 12:57:57,上海杨浦
司法部、国家卫生健康委负责人就《生物医学新技术临床研究和临床转化应用管理条例》答记者问,https://www.thepaper.cn/newsDetail_forward_31762298,2025-10-11 12:32:53,上海市司法局
李强签署国务院令 公布《生物医学新技术临床研究和临床转化应用管理条例》,https://www.thepaper.cn/newsDetail_forward_31762297,2025-10-11 12:32:53,上海市司法局
增开货物列车、调整运行径路……这次调图货运有哪些变化？,https://www.thepaper.cn/newsDetail_forward_31762148,2025-10-11 12:32:01,上铁集团
串联山水与非遗，这条高铁开通一周年啦！,https://www.thepaper.cn/newsDetail_forward_31762147,2025-10-11 12:32:01,上铁集团
【专项执法】严格执法强监管 扬尘治理再升级,https://www.thepaper.cn/newsDetail_forward_31763074,2025-10-11 12:24:05,上海城管
【执法保障】宝山“蓝精邻”整治设摊“亮硬招” 精绣市容见真章,https://www.thepaper.cn/newsDetail_forward_31762679,2025-10-11 12:24:05,上海城管
【智慧城管】“拍一拍”就能解决问题？看静安城管如何用一张小卡片圈粉无数,https://www.thepaper.cn/newsDetail_forward_31759596,2025-10-11 12:24:05,上海城管
龚正市长会见出席市长咨询会议的6位“洋高参”，期待为上海发展贡献智慧力量,https://www.thepaper.cn/newsDetail_forward_31758919,2025-10-11 12:23:49,澎湃新闻
百年钟声回响！海关大楼里究竟有什么？｜澎友好会花,https://www.thepaper.cn/newsDetail_forward_31759402,2025-10-11 12:23:06,澎友好会花
新纪录诞生！明天还会更热……,https://www.thepaper.cn/newsDetail_forward_31762107,2025-10-11 12:21:07,上海长宁
水上特别节目！沿着新泾港、周家浜、外环西河，泛舟游长宁~,https://www.thepaper.cn/newsDetail_forward_31762097,2025-10-11 12:21:07,上海长宁
2025上海敬老月启动仪式暨长宁区九九购物节主题活动举办,https://www.thepaper.cn/newsDetail_forward_31762094,2025-10-11 12:21:07,上海长宁
上海发文明确：鼓励有条件的景区、部分乡村、郊野公园提供露营服务,https://www.thepaper.cn/newsDetail_forward_31758947,2025-10-11 12:02:11,澎湃新闻
全过程人民民主在虹口㉑ |听民声、聚民智、汇民力，“三重实践”破解民生难题！,https://www.thepaper.cn/newsDetail_forward_31762990,2025-10-11 11:52:35,上海虹口
动感滨江，活力宝山,https://www.thepaper.cn/newsDetail_forward_31758847,2025-10-11 11:52:24,澎湃新闻
《关于加快推动前沿技术创新与未来产业培育的若干措施》发布、上海国际生物医药产业周即将开幕| 魔都壹…,https://www.thepaper.cn/newsDetail_forward_31762562,2025-10-11 11:37:51,上海科技
在家门口尝到了“文化盛宴”，第八届戏剧嘉年华燃动南上海黄金周,https://www.thepaper.cn/newsDetail_forward_31762272,2025-10-11 11:36:45,上海奉贤
