title,url,time,source
这场技术转移大会在沪开幕：发布万项需求，企业投资超200亿元,https://www.thepaper.cn/newsDetail_forward_31651166,2025-09-22 03:48:14,澎湃新闻
让“糊涂账”变得公开透明，上海物业开展“四亮”服务成效初显,https://www.thepaper.cn/newsDetail_forward_31629113,2025-09-22 03:39:01,澎湃新闻
用平凡的行动书写不平凡的故事，10位先进个人和集体荣获2025“感动上海”年度人物称号,https://www.thepaper.cn/newsDetail_forward_31651173,2025-09-22 03:36:13,澎湃新闻
共创区域协同新未来，首届长三角品牌与广告生态大会在沪举办,https://www.thepaper.cn/newsDetail_forward_31651175,2025-09-22 03:20:14,澎湃上海
直抵高校、读懂专业，深度匹配城市、产业所需：看深圳如何精准带岗入沪,https://www.thepaper.cn/newsDetail_forward_31650834,2025-09-22 03:00:35,澎湃新闻
两年保质期的西兰花能吃？关键看冷冻方式,https://www.thepaper.cn/newsDetail_forward_31651131,2025-09-22 02:41:41,上海网络辟谣
致敬！2025“感动上海”年度人物揭晓,https://www.thepaper.cn/newsDetail_forward_31651075,2025-09-22 02:10:37,警民直通车上海
外高桥港成功实施长江干线首单甲醇燃料船对船同步加注,https://www.thepaper.cn/newsDetail_forward_31646863,2025-09-22 02:08:00,浦东发布
全球最长单程航线！上海浦东—奥克兰—布宜诺斯艾利斯航线要来了,https://www.thepaper.cn/newsDetail_forward_31646859,2025-09-22 02:08:00,浦东发布
第二届上海国际光影节启幕，浦东分会场活动亮点看过来→,https://www.thepaper.cn/newsDetail_forward_31646858,2025-09-22 02:08:00,浦东发布
“2025感动上海人物”揭晓，虹口的他上榜！,https://www.thepaper.cn/newsDetail_forward_31651328,2025-09-22 02:01:09,上海虹口
垂直攀升展活力！2025上海垂直登高大奖赛白玉兰广场站热力开赛,https://www.thepaper.cn/newsDetail_forward_31651324,2025-09-22 02:01:09,上海虹口
宁波鄞州二院挂牌上海中医药大学宁波医院,https://www.thepaper.cn/newsDetail_forward_31650590,2025-09-22 01:50:01,甬派客户端
WeStart2025创业投资大会在沪启幕，会场内外密集开展创投对接,https://www.thepaper.cn/newsDetail_forward_31650562,2025-09-22 01:49:23,澎湃新闻
跨越科技成果转化死亡之谷：上海高质量孵化器建设的四个启示,https://www.thepaper.cn/newsDetail_forward_31635368,2025-09-22 01:44:12,澎湃新闻
从五个创新要素看上海高质量孵化器建设,https://www.thepaper.cn/newsDetail_forward_31635363,2025-09-22 01:43:52,澎湃新闻
对话 | 是什么样的体育赛事，让霍震霆爱上了上海和嘉定,https://www.thepaper.cn/newsDetail_forward_31647276,2025-09-22 01:42:46,澎湃新闻
平民英雄、忠诚卫士、深潜勇士……2025“感动上海”年度人物揭晓,https://www.thepaper.cn/newsDetail_forward_31650482,2025-09-22 01:22:35,澎湃新闻
回首烽火路，上海市民以歌声致敬抗战胜利80周年,https://www.thepaper.cn/newsDetail_forward_31648989,2025-09-22 01:20:55,澎湃新闻
《人民法院报》：解纷路上的“双向奔赴”,https://www.thepaper.cn/newsDetail_forward_31651073,2025-09-22 01:00:11,上海高院
起猛了！你说这位帅哥机器人是我的同学？！帅哥：“师傅，来一份鱼香肉丝”,https://www.thepaper.cn/newsDetail_forward_31650730,2025-09-22 00:38:23,青春上海
最高单价32万元/平米！上海黄浦区120套豪宅“日光”，单日收金近百亿元,https://www.thepaper.cn/newsDetail_forward_31646903,2025-09-22 00:23:35,澎湃新闻
92年后，鲁迅曾聆听过的这支乐团奏响了他的文字,https://www.thepaper.cn/newsDetail_forward_31645142,2025-09-22 00:15:27,澎湃新闻
科学奇妙周末，这场科技嘉年华活动圆满落幕,https://www.thepaper.cn/newsDetail_forward_31651320,2025-09-22 00:05:32,上海虹口
大增242.42%！,https://www.thepaper.cn/newsDetail_forward_31651318,2025-09-22 00:05:32,上海虹口
一周展讯｜上海罗丹大展临近尾声,https://www.thepaper.cn/newsDetail_forward_31635097,2025-09-22 00:03:22,澎湃新闻
2025“感动上海”年度人物揭晓：他们是平民英雄、忠诚卫士、深潜勇士……,https://www.thepaper.cn/newsDetail_forward_31645134,2025-09-22 00:00:03,澎湃新闻
沪喀同心｜光影还乡，看上海摄影家的20年新疆行,https://www.thepaper.cn/newsDetail_forward_31646930,2025-09-21 23:43:23,澎湃新闻
我的科学观｜上海交大武庆庆：好奇心是宝贵的科学素质,https://www.thepaper.cn/newsDetail_forward_31629162,2025-09-21 23:42:31,澎湃新闻
我的科学观｜武庆庆：智能反射面如何实现6G的低成本、低功耗的覆盖,https://www.thepaper.cn/newsDetail_forward_31629103,2025-09-21 23:39:41,澎湃新闻
走出商场，IP痛街正在上海兴起,https://www.thepaper.cn/newsDetail_forward_31644837,2025-09-21 22:04:45,新声Pro
为何总是最后时刻丢球，斯卢茨基称阵容不整影响球队,https://www.thepaper.cn/newsDetail_forward_31646953,2025-09-21 14:50:46,澎湃新闻
百年赛艇赛事首次来到中国，让更多人看到上海的美,https://www.thepaper.cn/newsDetail_forward_31646925,2025-09-21 14:26:31,澎湃新闻
中超争冠最关键一夜，申花遭遇绝平，蓉城登顶榜首,https://www.thepaper.cn/newsDetail_forward_31646913,2025-09-21 14:18:19,澎湃新闻
在上海，这些“老字号”突变排队爆款,https://www.thepaper.cn/newsDetail_forward_31646924,2025-09-21 13:45:00,国际金融报
昭通市党政代表团赴上海调研对接东西部协作工作,https://www.thepaper.cn/newsDetail_forward_31651299,2025-09-21 13:35:53,微昭通
张杰院士：三步走，2045建成上海首个聚变商业电站,https://www.thepaper.cn/newsDetail_forward_31646910,2025-09-21 13:21:35,澎湃新闻
上海量子人工智能联合体、上海量子科技装备产业创新联盟成立,https://www.thepaper.cn/newsDetail_forward_31646852,2025-09-21 13:12:13,澎湃新闻
联合国教科文组织国际STEM教育研究所在上海成立,https://www.thepaper.cn/newsDetail_forward_31646827,2025-09-21 13:09:51,澎湃新闻
破浪成光，桨动水乡，2025世界赛艇锦标赛在上海开幕,https://www.thepaper.cn/newsDetail_forward_31646898,2025-09-21 13:08:51,澎湃新闻
每年都问“要不要打流感疫苗”，今天一次说清楚！,https://www.thepaper.cn/newsDetail_forward_31650727,2025-09-21 13:05:41,青春上海
上海未来启点社区正式发布：发现能够影响中国未来10年的创业者,https://www.thepaper.cn/newsDetail_forward_31646649,2025-09-21 13:04:04,澎湃新闻
上海下周最高气温30℃，周三前后可能有一次明显降雨过程,https://www.thepaper.cn/newsDetail_forward_31646624,2025-09-21 11:56:46,澎湃新闻
第25届工博会将在沪开幕，展出392项“五极”展品,https://www.thepaper.cn/newsDetail_forward_31646580,2025-09-21 10:53:43,澎湃新闻
联合国教科文组织国际STEM教育研究所在上海正式成立,https://www.thepaper.cn/newsDetail_forward_31651084,2025-09-21 10:33:40,微言教育
上海发布人形机器人数据集标准，人形机器人有了统一数据语言,https://www.thepaper.cn/newsDetail_forward_31645512,2025-09-21 09:38:31,澎湃新闻
上海量子人工智能联合体成立，将培育量子人工智能交叉人才团队,https://www.thepaper.cn/newsDetail_forward_31645768,2025-09-21 09:36:57,澎湃新闻
上海优化调整个人住房房产税：此类可予退还,https://www.thepaper.cn/newsDetail_forward_31634725,2025-09-21 09:33:08,乐居财经
“国社之镜·世纪光影之人民必胜”艺术展国际和平日主题分享会举办,https://www.thepaper.cn/newsDetail_forward_31651323,2025-09-21 09:04:17,上海虹口
光影映虹口，夜赛焕活力！三区联动城市夜间定向赛热力开赛！,https://www.thepaper.cn/newsDetail_forward_31651321,2025-09-21 09:04:17,上海虹口
联合国教科文组织国际STEM教育研究所在上海正式成立,https://www.thepaper.cn/newsDetail_forward_31645550,2025-09-21 08:35:59,澎湃新闻
世界赛艇锦标赛、上海国际光影节青浦分会场、青浦楼市……青浦这些新鲜事你知道吗？,https://www.thepaper.cn/newsDetail_forward_31646819,2025-09-21 08:32:53,绿色青浦
复旦大学附属中学青浦分校举行建校十周年主题活动,https://www.thepaper.cn/newsDetail_forward_31646818,2025-09-21 08:32:53,绿色青浦
蘑菇王国探秘记，一场让大小朋友都惊呼“原来如此”的探秘之旅→,https://www.thepaper.cn/newsDetail_forward_31646758,2025-09-21 08:16:59,上海奉贤
大手握小手，点亮亲子时光！奉贤亲子夜校开学啦,https://www.thepaper.cn/newsDetail_forward_31646756,2025-09-21 08:16:59,上海奉贤
杨浦国动：探秘地下“生命堡垒”！看老工程焕新变身科普新阵地→,https://www.thepaper.cn/newsDetail_forward_31646083,2025-09-21 08:04:32,上海国防动员
上海将建第一座激光聚变能电站，2045年商业运营，成本只有美国一半 | 浦江创新论坛,https://www.thepaper.cn/newsDetail_forward_31645943,2025-09-21 08:04:02,上海科技
【民警手记】只要自己不放弃，就永远有人在为你点亮一盏灯,https://www.thepaper.cn/newsDetail_forward_31646768,2025-09-21 08:03:21,上海市监狱管理局
“感觉到家一样的温暖”，巴西残奥选手为上海赛艇世锦赛点赞,https://www.thepaper.cn/newsDetail_forward_31645545,2025-09-21 08:02:33,澎湃新闻
总投资超3.7亿元！这个项目计划2027年交付使用,https://www.thepaper.cn/newsDetail_forward_31646735,2025-09-21 07:53:50,上海嘉定
