title,url,time,section,subsection,summary
大众写科幻，带来了什么？,https://www.jfdaily.com/news/detail?id=1049658,2026-01-09 23:53:13,文化,文旅乐游,科幻是一种更多元的现实主义。
上海交响乐团3月13日开启亚太巡演：让世界通过音乐听见当代中国,https://www.jfdaily.com/news/detail?id=1049674,2026-01-09 23:53:03,文化,文旅乐游,1月9日，由余隆执棒，上交与王健、王雅伦在上海率先奏响本次巡演的预演
源头防控冬季火灾隐患，上海警方严厉打击假冒伪劣家用电器,https://www.jfdaily.com/news/detail?id=1049677,2026-01-09 23:42:53,政情,交汇点,市民群众要进一步提高防火用电安全意识
“我还会再来！”中共一大纪念馆去年共接待境外观众近10万人次,https://www.jfdaily.com/news/detail?id=1049651,2026-01-09 23:42:29,政情,交汇点,在静默的文物与活跃的对话中，持续传递着初心的力量与发展的回响
上海推出“时间银行”管理办法，1小时服务可赚取1个时间币,https://www.jfdaily.com/news/detail?id=1049679,2026-01-09 23:29:34,政情,市政厅,“沪助养老时光汇”，是指通过建立服务时间储蓄与兑换机制，实现互助式养老的服务项目。
外卖行业“内卷”加剧，国家再度出手了,https://www.jfdaily.com/news/detail?id=1049652,2026-01-09 23:11:05,经济,流量研究所,推动外卖行业竞争规范化。
【演界】跨越山河，余隆、王健、王雅伦与上海交响乐团联袂献演，预备启航,https://www.jfdaily.com/news/detail?id=1049639,2026-01-09 22:47:01,视觉,见识录,从中国当代创作延展至俄罗斯浪漫主义经典。
【场面】春运将至，“苏超”版反诈科普寓教于乐,https://www.jfdaily.com/news/detail?id=1049529,2026-01-09 22:46:06,视觉,见识录,上海警方反诈宣传不断创新。
【场面】大学校园设点“人人写春联”，挥洒笔墨迎马年,https://www.jfdaily.com/news/detail?id=1049525,2026-01-09 22:45:58,视觉,见识录,师生们铺展红纸、研磨挥毫，在横竖撇捺间体悟文化之美，以笔墨传递奋进力量、送出新春祝福。
AI仅用1小时破译500年未解的“天书”，再次降维打击人类？,https://www.jfdaily.com/news/detail?id=1049645,2026-01-09 22:38:01,教卫,文汇教育,AI的介入正引发越来越多学者对文科研究范式变革的深度思考。
美妆品牌全球化“通关攻略”来了！大家汇聚“美创静界”深度对话,https://www.jfdaily.com/news/detail?id=1049648,2026-01-09 22:22:32,区情,Yeah！上海,大宁功能区将以“美创静界”为平台，致力于打造全球美妆会客厅
上海交响乐团将开启澳大利亚、新西兰、新加坡三国巡演,https://www.jfdaily.com/news/detail?id=1049636,2026-01-09 22:22:17,文化,文化观澜,音乐沟通世界
2026年上海环球美食汇启动，欧陆风味季开启全年“美食+”盛宴,https://www.jfdaily.com/news/detail?id=1049643,2026-01-09 22:21:16,经济,市场解码,1月9日晚，2026年“上海环球美食汇”暨“欧陆风味季”启动仪式在沪举行。
漫步苏河皓司，拆艺术的盲盒,https://www.jfdaily.com/news/detail?id=1049649,2026-01-09 22:21:14,视频,饭小兔的美学洞窟,艺术让生活更美好
2026上海环球美食汇启幕！欧陆风味来袭，一起来吃“漂亮饭”,https://www.jfdaily.com/news/detail?id=1049646,2026-01-09 22:19:13,经济,城生活,6折起套餐+10条寻味路线解锁城市美味。
上海藏着这么多好吃的意大利餐厅！“上海环球美食汇”暨“欧陆风味季”启幕！,https://www.jfdaily.com/news/detail?id=1049638,2026-01-09 22:18:05,经济,市场,“上海环球美食汇”暨“欧陆风味季”启幕，全球消费者点赞上海“意大利菜太地道”。
市委常委会研究“三农”工作、民心工程为民办实事、“十五五”规划编制等事项,https://www.jfdaily.com/news/detail?id=1049641,2026-01-09 22:15:58,政情,@康平路,要牢牢把握上海发展的政治站位、总体定位、实践落位，高质量谋划好编制好我市“十五五”规划《纲要》。
全市首例！静安以“专员陪同、跨省联办”助力长三角外籍人才跨区域流动,https://www.jfdaily.com/news/detail?id=1049611,2026-01-09 22:11:09,区情,浦江眼,这是全市首例通过“专员陪同、跨省联办”模式办理的长三角外籍人才跨区域流动登记。
沪指时隔10年站上4100点，MiniMax港交所上市大涨，带动A股共振,https://www.jfdaily.com/news/detail?id=1049429,2026-01-09 21:53:53,经济,金融区块链,A股有望延续“开门红”行情。
融媒体出版物持续热销，让红色文化与思政教育鲜活触达青少年,https://www.jfdaily.com/news/detail?id=1049595,2026-01-09 21:49:36,区情,Yeah！上海,让红色文化传播更具时代特质与感染力
如何兼顾技术创新与惩治犯罪？静安检察院发布“十条意见”,https://www.jfdaily.com/news/detail?id=1048759,2026-01-09 21:48:11,区情,Yeah！上海,努力在法治轨道上当好科技创新的“护航者”
在27座海外博物馆中读懂中国文物的百年离散,https://www.jfdaily.com/news/detail?id=1049283,2026-01-09 21:42:19,副刊,文汇读书,文物不言，却可足以见证历史和时代变迁。
“古镇+市集”，新场古镇开启一站式养生新体验,https://www.jfdaily.com/news/detail?id=1049601,2026-01-09 21:39:03,区情,十六区,老宅的活化利用，让深邃的中医智慧从典籍中“走”出来，变成可感知、可参与、可享用的生活方式。
衡复风貌区商业载体大批上新，70余名韩国潮牌主理人CityWalk寻商机,https://www.jfdaily.com/news/detail?id=1049589,2026-01-09 21:38:44,区情,十六区,或许，他们很快将成为MUSINSA、Wiggle Wiggle等韩国“老乡”的安福路新邻居。
多国“差评”美国退群，力挺多边主义,https://www.jfdaily.com/news/detail?id=1049631,2026-01-09 21:31:00,天下,纵览,
韩国前总统尹锡悦涉嫌发动内乱案结案庭审延期,https://www.jfdaily.com/news/detail?id=1049613,2026-01-09 21:28:27,天下,纵览,
中央宣传部、公安部联合发布2025年“最美基层民警”,https://www.jfdaily.com/news/detail?id=1049627,2026-01-09 21:21:56,要闻,时政要闻,
主播说联播丨3.6亿人次背后 冰雪旅游的三重“破圈”,https://www.jfdaily.com/news/detail?id=1049628,2026-01-09 21:21:31,要闻,时政要闻,
各地重点工程开足马力刷新“进度条”奋战“开门红” 高质量发展添动能,https://www.jfdaily.com/news/detail?id=1049629,2026-01-09 21:21:06,要闻,时政要闻,
宝山区泗塘一村居民家中突发火灾 消防及时到场扑救,https://www.jfdaily.com/news/detail?id=1049501,2026-01-09 21:20:54,社会,上海滩,起火部位位于小区某号楼2楼的一户居民家中。
天下霸唱：是讲民间故事的人，也是“老二次元”｜深度访谈,https://www.jfdaily.com/news/detail?id=1049325,2026-01-09 21:16:31,文学报,文学现场,天下霸唱回顾了写作《鬼吹灯》系列时的创作状态，以及读者最关心的他近年为何转型现实题材写作的背后故事。
碧水映苍山，洱海走出人水和谐之路,https://www.jfdaily.com/news/detail?id=1049625,2026-01-09 21:16:05,要闻,时政要闻,
【新思想引领新征程】科技创新活力涌动 新质生产力加速汇聚,https://www.jfdaily.com/news/detail?id=1049624,2026-01-09 21:15:43,要闻,时政要闻,
壹视界·任平文章解读｜“为人民出政绩、以实干出政绩”,https://www.jfdaily.com/news/detail?id=1049623,2026-01-09 21:15:31,要闻,时政要闻,
美方正在加勒比海扣押一艘油轮,https://www.jfdaily.com/news/detail?id=1049612,2026-01-09 21:13:44,天下,纵览,
“火星合日”来了 火星“失联”会影响日常生活吗？,https://www.jfdaily.com/news/detail?id=1049614,2026-01-09 21:11:48,天下,纵览,
