title,url,time,source
这9人成为今年首场总理座谈会“座上宾”，他们都是谁？,https://www.jfdaily.com/news/detail?id=1054678,2026-01-20 04:44:00,转载摘编
中领馆：南非警方解救一名被绑架中国公民，8名嫌犯被捕,https://www.jfdaily.com/news/detail?id=1054677,2026-01-20 04:41:55,转载摘编
寒潮天气冲浪被困礁石，消防、公安火速集结实施专业救援,https://www.jfdaily.com/news/detail?id=1054673,2026-01-20 04:31:24,自采原创
烈士孙女用家书与老照片，还原谍战英雄的峥嵘岁月,https://www.jfdaily.com/news/detail?id=1054493,2026-01-20 04:31:04,自采原创
中央批准跨省履新后，副部级张迎春有新职！同日一地副省长被免去职务,https://www.jfdaily.com/news/detail?id=1054675,2026-01-20 04:28:50,整合改编
雪中暖心事：上海一3岁女孩光脚迷路，民警用警服裹住了她,https://www.jfdaily.com/news/detail?id=1054631,2026-01-20 04:23:13,自采原创
上海下雪啦！早高峰道路通行情况正常，风雪中他们坚守岗位,https://www.jfdaily.com/news/detail?id=1054641,2026-01-20 04:23:01,自采原创
上海开展消防安全知识宣传进社区进农村进家庭主题日活动,https://www.jfdaily.com/news/detail?id=1054671,2026-01-20 04:16:56,自采原创
【麻栗子】网络新词的前世今生②,https://www.jfdaily.com/news/detail?id=1014356,2026-01-20 04:12:54,约组外稿
高晓松辟谣带货：系AI合成嗓音，“人在家中坐，锅从梁上来”,https://www.jfdaily.com/news/detail?id=1054667,2026-01-20 04:12:41,整合改编
危地马拉全国戒严30天；日本首相高市早苗宣布2月8日举行众议院选举,https://www.jfdaily.com/news/detail?id=1054472,2026-01-20 04:10:03,自采原创
大肆收钱敛财，“老虎”高以忱被开除党籍,https://www.jfdaily.com/news/detail?id=1054666,2026-01-20 04:08:19,整合改编
铺设防滑草垫、布设限速标识，上海警方迎战寒潮保早高峰通行,https://www.jfdaily.com/news/detail?id=1054665,2026-01-20 04:07:49,自采原创
2月1日起，“随申办”App可一站式完成无人机登记、飞行申报、体验区预约,https://www.jfdaily.com/news/detail?id=1054661,2026-01-20 04:04:35,自采原创
让创意点亮“衣食住行娱”的未来,https://www.jfdaily.com/news/detail?id=1054566,2026-01-20 04:03:01,自采原创
新民体育丨国足，将防守进行到底？,https://www.jfdaily.com/news/detail?id=1054567,2026-01-20 04:01:25,自采原创
新民艺评｜谢冕：以长笛奏海韵——叶玉琳《入海的长笛》读后感,https://www.jfdaily.com/news/detail?id=1054138,2026-01-20 03:59:42,自采原创
为一个节，赴一座城！中国上海国际艺术节去年拉动综合消费44.25亿元,https://www.jfdaily.com/news/detail?id=1054625,2026-01-20 03:59:29,自采原创
上海再添文旅新地标！澳康达解锁工业旅游和汽车文化新玩法,https://www.jfdaily.com/news/detail?id=1054484,2026-01-20 03:58:19,自采原创
三部门：将个人消费贷款财政贴息政策实施期限延长至2026年底,https://www.jfdaily.com/news/detail?id=1054658,2026-01-20 03:57:40,转载摘编
国家发展改革委：多措并举扩大“两新”政策拉动效益,https://www.jfdaily.com/news/detail?id=1054659,2026-01-20 03:57:27,转载摘编
微言 | 警惕网购“先用后付”变成“先用后负”,https://www.jfdaily.com/news/detail?id=1054626,2026-01-20 03:51:03,自采原创
申城下雪！社区温暖守护,https://www.jfdaily.com/news/detail?id=1054646,2026-01-20 03:45:31,自采原创
品牌价值超23亿元，这个艺术节凭什么跻身世界一流？,https://www.jfdaily.com/news/detail?id=1054619,2026-01-20 03:42:16,自采原创
“高中生抄起凳子砸同学”，官方发布情况通报,https://www.jfdaily.com/news/detail?id=1054644,2026-01-20 03:39:47,自采原创
梁小龙死因公开：因心脏衰竭离世；家属澄清外界对其年龄误解，实际享年75岁,https://www.jfdaily.com/news/detail?id=1054635,2026-01-20 03:37:01,整合改编
3岁女童光脚出门看雪迷路，民警携手暖心接力,https://www.jfdaily.com/news/detail?id=1054624,2026-01-20 03:36:38,自采原创
中央批准跨省履新后，张迎春任自治区副主席，此前任湖南省委常委,https://www.jfdaily.com/news/detail?id=1054645,2026-01-20 03:35:46,整合改编
大寒！寒潮继续影响南方地区,https://www.jfdaily.com/news/detail?id=1054634,2026-01-20 03:23:32,转载摘编
特朗普：若无格陵兰岛问题协议，必对欧加征关税,https://www.jfdaily.com/news/detail?id=1054633,2026-01-20 03:21:13,转载摘编
韩国总统李在明：向朝鲜放飞无人机“无异于向朝鲜境内开枪”，属严重违法行为,https://www.jfdaily.com/news/detail?id=1054629,2026-01-20 03:19:34,整合改编
温州今日官宣预计破万亿，成长三角第10座“万亿之城”！徐州明天会官宣吗？,https://www.jfdaily.com/news/detail?id=1050603,2026-01-20 03:13:14,自采原创
原中央防范和处理邪教问题领导小组办公室副主任高以忱被开除党籍,https://www.jfdaily.com/news/detail?id=1054628,2026-01-20 03:06:49,转载摘编
习近平致电祝贺图瓦德拉当选连任中非共和国总统,https://www.jfdaily.com/news/detail?id=1054627,2026-01-20 03:05:36,转载摘编
深视频｜箭在弦上？美军飞机即将抵达格陵兰！,https://www.jfdaily.com/news/detail?id=1054591,2026-01-20 02:53:29,自采原创
真相实验室：今年2月“823年一遇”？算给你看！,https://www.jfdaily.com/news/detail?id=1054300,2026-01-20 02:48:46,自采原创
2026年2月是823年才能遇到一次的“特殊月份”？小学生都能来辟谣,https://www.jfdaily.com/news/detail?id=1054249,2026-01-20 02:48:39,自采原创
著名相声表演艺术家杨振华逝世！首开吉他相声先河，代表作家喻户晓,https://www.jfdaily.com/news/detail?id=1054617,2026-01-20 02:47:02,整合改编
六旬老伯赴聚会，在地铁站突然倒地，艰难拨通120！公共场所急救要点速看,https://www.jfdaily.com/news/detail?id=1054597,2026-01-20 02:44:52,自采原创
全国首个机器人职称评价办法落地北京，7月启动首次评审,https://www.jfdaily.com/news/detail?id=1054515,2026-01-20 02:44:36,自采原创
【场面】今晨上海市区雨夹雪,https://www.jfdaily.com/news/detail?id=1054553,2026-01-20 02:43:41,自采原创
天冷了，我给中环“做美容”,https://www.jfdaily.com/news/detail?id=1054616,2026-01-20 02:35:01,自采原创
国家发展改革委表示今年将研究制定出台2026—2030年扩大内需战略实施方案,https://www.jfdaily.com/news/detail?id=1054606,2026-01-20 02:26:32,转载摘编
中美民间交流，怎样抽象为好？,https://www.jfdaily.com/news/detail?id=1054604,2026-01-20 02:25:45,自采原创
上观乐享|寒假知识充电计划已开启，每日登录赢好礼！,https://www.jfdaily.com/news/detail?id=1054221,2026-01-20 02:16:00,自采原创
水质更稳定、更安全、更具抗风险韧性，上海自来水100%实现水厂深度处理,https://www.jfdaily.com/news/detail?id=1054487,2026-01-20 02:12:34,自采原创
在南澳领略巴伐利亚风情？没错，这里守护着时光的馈赠,https://www.jfdaily.com/news/detail?id=1054092,2026-01-20 02:00:19,约组外稿
新民节气·大寒｜大寒遭遇“冰箱”模式，申城认真下雪了！,https://www.jfdaily.com/news/detail?id=1054583,2026-01-20 01:54:56,自采原创
“内推”高校行政岗？免面试直录还能转编制？9个月内15人被骗180余万元,https://www.jfdaily.com/news/detail?id=1054569,2026-01-20 01:51:27,自采原创
学生疑似用凳子砸中同学后脑！当地通报：被打学生身体无碍，打人学生已被劝退,https://www.jfdaily.com/news/detail?id=1054584,2026-01-20 01:50:02,整合改编
“上观碰碰头·秋秋不睡午觉”：上海雪景,https://www.jfdaily.com/news/detail?id=1054587,2026-01-20 01:48:26,自采原创
卢浮宫劫案3个月后，法国电视台首次播出监控画面,https://www.jfdaily.com/news/detail?id=1054585,2026-01-20 01:46:07,转载摘编
朝“问”健康丨防三寒、护双眼 收好这份大寒时节养生指南,https://www.jfdaily.com/news/detail?id=1054578,2026-01-20 01:44:30,转载摘编
上海认真下雪啦，多区雪量惊人！预警持续、轮渡停航！近期这类患者明显增多…,https://www.jfdaily.com/news/detail?id=1054577,2026-01-20 01:39:11,整合改编
寒潮已来袭，安全须牢记！你会安全用水、用电、用气吗？,https://www.jfdaily.com/news/detail?id=1054519,2026-01-20 01:38:44,自采原创
中国公民1死1重伤！一中餐馆附近突发爆炸，中使馆再发提醒：暂勿前往阿富汗,https://www.jfdaily.com/news/detail?id=1054579,2026-01-20 01:28:49,整合改编
“先买后付”模式兴起 “无感”消费后需防范这些风险,https://www.jfdaily.com/news/detail?id=1054576,2026-01-20 01:25:57,转载摘编
万芾“花鸟世界”中的二十四节气：大寒,https://www.jfdaily.com/news/detail?id=1054573,2026-01-20 01:24:40,转载摘编
不收版面费的国产生命科学顶刊Vita即将上线！李党生、施一公任主编,https://www.jfdaily.com/news/detail?id=1054505,2026-01-20 01:23:04,自采原创
解读5.0%增长背后：去年中国GDP何以首破140万亿元关口,https://www.jfdaily.com/news/detail?id=1054525,2026-01-20 01:21:06,自采原创
