title,url,time,source
没报上名都要“蹭课”，松阳乡村艺校为何这么火？,https://www.jfdaily.com/news/detail?id=1096513,2026-04-14 17:00:02,自采原创
无人机送AED、无人车送标本、机器人扎穴位，杭州用科技破解基层医疗难题,https://www.jfdaily.com/news/detail?id=1096512,2026-04-14 16:56:00,自采原创
文汇时评 | AI时代，老年群体“智”识需特别关照,https://www.jfdaily.com/news/detail?id=1096751,2026-04-14 15:33:38,自采原创
上万美军人员正在执行封锁进出伊朗港口船只的任务,https://www.jfdaily.com/news/detail?id=1096778,2026-04-14 15:22:15,转载摘编
两会精神看落实丨来了又来、投了又投，外资“老朋友”为何坚定看好上海,https://www.jfdaily.com/news/detail?id=1096773,2026-04-14 15:11:01,转载摘编
“牛顿苹果树”落户浙江湖州吴兴区钱山漾,https://www.jfdaily.com/news/detail?id=1096766,2026-04-14 14:56:39,转载摘编
90岁李少芬入选篮球名人堂，90岁丈夫钟南山为她穿礼服，两人都坚持运动,https://www.jfdaily.com/news/detail?id=1096631,2026-04-14 14:45:02,自采原创
黄莉新会见德国汉堡市议会议长,https://www.jfdaily.com/news/detail?id=1096745,2026-04-14 14:41:33,自采原创
白玉兰戏剧奖得主蓝天走进复旦大学，一曲《定军山》祝大家学业有成,https://www.jfdaily.com/news/detail?id=1096758,2026-04-14 14:41:00,自采原创
王毅同俄罗斯外长拉夫罗夫会谈,https://www.jfdaily.com/news/detail?id=1096762,2026-04-14 14:39:49,转载摘编
为更多受伤儿童及家庭提供专业支持，儿童疤痕公益项目在沪启动,https://www.jfdaily.com/news/detail?id=1096749,2026-04-14 14:28:01,自采原创
一件清代烫样的身份纠错与技艺重生,https://www.jfdaily.com/news/detail?id=1096687,2026-04-14 14:10:14,自采原创
【场面】“花漾萌宠乐园”与“空中石库门”双景联动,https://www.jfdaily.com/news/detail?id=1096730,2026-04-14 14:06:58,自采原创
【场面】田子坊弄堂“开花”,https://www.jfdaily.com/news/detail?id=1096719,2026-04-14 14:06:48,自采原创
静安区中小学班主任共聚一堂，只为办好这件事……,https://www.jfdaily.com/news/detail?id=1096697,2026-04-14 14:06:39,自采原创
“宝藏绘本奶奶”蔡皋：没上过一天美术学校，却成中国首位安徒生插画奖获得者,https://www.jfdaily.com/news/detail?id=1096468,2026-04-14 14:01:02,整合改编
俄国家原子能公司：乌军再次袭击扎波罗热核电站,https://www.jfdaily.com/news/detail?id=1096742,2026-04-14 13:57:08,转载摘编
进入“小年”，荔枝还吃得起吗？涨价真相跟你想的不太一样,https://www.jfdaily.com/news/detail?id=1096558,2026-04-14 13:53:56,自采原创
曾任天津市两区区委书记，贺亦农落马！,https://www.jfdaily.com/news/detail?id=1096743,2026-04-14 13:53:49,转载摘编
外国影片来中国，如何“有效营业”？,https://www.jfdaily.com/news/detail?id=1096711,2026-04-14 13:45:35,自采原创
上海书城，32所高校辩手激辩这一话题,https://www.jfdaily.com/news/detail?id=1096735,2026-04-14 13:44:54,自采原创
IMF下调世界经济增长预期，中东战事冲击致不确定性加大,https://www.jfdaily.com/news/detail?id=1096737,2026-04-14 13:34:37,转载摘编
又一个“李清照”诞生，她的饰演者是上海戏剧学院博士生,https://www.jfdaily.com/news/detail?id=1096727,2026-04-14 13:34:19,自采原创
伊朗正考虑暂停霍尔木兹海峡航运，卡塔尔：海峡安全不容任何一方威胁,https://www.jfdaily.com/news/detail?id=1096725,2026-04-14 13:22:23,整合改编
“男子无偿献血十年要求免诊查费遭拒”，涉事医院多人被处罚,https://www.jfdaily.com/news/detail?id=1096707,2026-04-14 13:22:17,整合改编
翰墨和鸣，华章同赋！联合国中文日主题文化活动在纽约联合国总部举行,https://www.jfdaily.com/news/detail?id=1096734,2026-04-14 13:20:12,转载摘编
举债3.68亿、总投资超7亿，农业实训基地为何不见农业影子？,https://www.jfdaily.com/news/detail?id=1096733,2026-04-14 13:15:52,转载摘编
拾光纪·习近平会见西班牙首相，这三个关键词值得关注,https://www.jfdaily.com/news/detail?id=1096720,2026-04-14 13:04:44,转载摘编
人民之心丨“不慕虚荣，不务虚功，不图虚名”,https://www.jfdaily.com/news/detail?id=1096721,2026-04-14 13:04:38,转载摘编
习近平会见阿联酋阿布扎比王储哈立德,https://www.jfdaily.com/news/detail?id=1096724,2026-04-14 13:04:29,转载摘编
海报荐读｜上海国际花卉节周六启幕，申城再迎23天花海；蔡皋成为中国首位国际安徒生奖插画家奖得主,https://www.jfdaily.com/news/detail?id=1096699,2026-04-14 13:04:10,自采原创
习近平会见西班牙首相桑切斯,https://www.jfdaily.com/news/detail?id=1096723,2026-04-14 13:04:05,转载摘编
【场面】S16蕰川高速新建工程杨盛河东匝道将贯通,https://www.jfdaily.com/news/detail?id=1096596,2026-04-14 13:03:37,自采原创
【城事】市民日校、夜校春季班开班啦！这个日校开出三个考证班,https://www.jfdaily.com/news/detail?id=1096220,2026-04-14 13:03:17,自采原创
沪二手房交易创5年单日新高，车位单独发证增加交易？官方详解不动产新规变化,https://www.jfdaily.com/news/detail?id=1096449,2026-04-14 13:00:42,自采原创
中国外贸一季度同比增速15％，创近5年最高！海关总署副署长兴奋直呼“起势有力”,https://www.jfdaily.com/news/detail?id=1096706,2026-04-14 12:55:31,转载摘编
全球首个！智元机器人实现工业产线“正式工”规模落地,https://www.jfdaily.com/news/detail?id=1096700,2026-04-14 12:55:26,自采原创
上海国企上市公司市值破3.2万亿元，拆解背后的资本逻辑,https://www.jfdaily.com/news/detail?id=1096653,2026-04-14 12:53:30,自采原创
月球经济的发令枪，已正式打响,https://www.jfdaily.com/news/detail?id=1096656,2026-04-14 12:53:19,自采原创
英国财政大臣评价美国发动对伊战争是“愚蠢之举”,https://www.jfdaily.com/news/detail?id=1096710,2026-04-14 12:50:40,转载摘编
“不参与、不卷入、不支持”，欧洲缘何对美一再说“不”,https://www.jfdaily.com/news/detail?id=1096709,2026-04-14 12:49:57,转载摘编
下班在家微信工作猝死，算工伤吗？公司：擅自加班；官司一路打到高院,https://www.jfdaily.com/news/detail?id=1096712,2026-04-14 12:49:40,整合改编
夜排档驻扎小区门口 居民有苦难言盼整治,https://www.jfdaily.com/news/detail?id=1096604,2026-04-14 12:49:32,自采原创
新闻追踪 | 摇摇欲坠光交箱完成加固 人行道出行隐患彻底消除,https://www.jfdaily.com/news/detail?id=1096635,2026-04-14 12:49:21,自采原创
轨交多条线路自助售票机“闹脾气” 市民扫码购票遇尴尬,https://www.jfdaily.com/news/detail?id=1096636,2026-04-14 12:49:05,自采原创
新闻追踪｜添上厕纸补上短板 市民如厕不再尴尬,https://www.jfdaily.com/news/detail?id=1096607,2026-04-14 12:48:52,自采原创
AI医生问诊、眼镜实时翻译、在家就能看3D电影，消博会上“含智量”拉满,https://www.jfdaily.com/news/detail?id=1096573,2026-04-14 12:46:22,自采原创
红色传家宝 | 八旬老人翻开遗稿，字里行间尽是铮铮铁骨,https://www.jfdaily.com/news/detail?id=1096685,2026-04-14 12:42:31,自采原创
新三板市场供应商、客户帮助发行人财务造假，要承担怎样的责任？,https://www.jfdaily.com/news/detail?id=1096567,2026-04-14 12:41:48,整合改编
不只在课堂！静安发布6条红色研学路，边逛边筑牢国家安全意识,https://www.jfdaily.com/news/detail?id=1096519,2026-04-14 12:40:29,自采原创
聚焦青少年群体关注话题，他们这样开展国家安全教育,https://www.jfdaily.com/news/detail?id=1096618,2026-04-14 12:40:16,自采原创
莫叔自曝鸡煲配方求“降温”，48小时同款料包刷屏,https://www.jfdaily.com/news/detail?id=1096572,2026-04-14 12:40:16,自采原创
像人眼一样看懂世界，机器人的这双“眼睛”全球首发,https://www.jfdaily.com/news/detail?id=1096622,2026-04-14 12:39:55,自采原创
首次！上戏博士生跨专业打造原创戏曲作品,https://www.jfdaily.com/news/detail?id=1096369,2026-04-14 12:39:38,自采原创
非遗乐音与传统器物交融，赴一场东方美学雅集,https://www.jfdaily.com/news/detail?id=1096536,2026-04-14 12:39:29,自采原创
骑手日扣3元保费，出租屋内猝死后理赔被拒，法院二审：维持原判，保险公司赔付60万,https://www.jfdaily.com/news/detail?id=1096703,2026-04-14 12:38:54,转载摘编
拿地不到24小时，上海“人造太阳”实验基地通电开工,https://www.jfdaily.com/news/detail?id=1096542,2026-04-14 12:37:20,自采原创
美国未来对华政策，将更多由青年一代塑造,https://www.jfdaily.com/news/detail?id=1096130,2026-04-14 12:36:48,自采原创
亲爱的中国，有句话想对你说,https://www.jfdaily.com/news/detail?id=1096702,2026-04-14 12:36:39,自采原创
企业绿色低碳发展优秀实践案例发布，东航资产两个项目入选,https://www.jfdaily.com/news/detail?id=1096543,2026-04-14 12:36:24,自采原创
