title,url,time,source
“北京服务”不止于便利，以“伙伴式”服务理念，打造一流营商环境,https://www.jfdaily.com/news/detail?id=1082757,2026-03-17 05:21:24,自采原创
国际能源署：“如有必要”将进一步释放石油储备,https://www.jfdaily.com/news/detail?id=1082765,2026-03-17 05:18:37,转载摘编
F1中国大奖赛首例航空转运病例完成手术转危为安，上海构建地空立体救援网络,https://www.jfdaily.com/news/detail?id=1082715,2026-03-17 05:12:50,自采原创
深视频|美国驻伊拉克大使馆遭袭起火,https://www.jfdaily.com/news/detail?id=1082709,2026-03-17 05:07:45,自采原创
肺癌老人剧痛因肿瘤“啃断”骨头，医生微创“双剑”让高危患者重新站起,https://www.jfdaily.com/news/detail?id=1082718,2026-03-17 05:02:37,自采原创
孩子生母离世，81岁老人独自照顾2名外籍外孙女，“我之后谁来管她们？,https://www.jfdaily.com/news/detail?id=1082761,2026-03-17 04:59:08,自采原创
AI注智申城，电信服务到家,https://www.jfdaily.com/news/detail?id=1082707,2026-03-17 04:54:05,广告推广
尼日利亚疑遭自杀式连环袭击，死伤多人,https://www.jfdaily.com/news/detail?id=1082756,2026-03-17 04:46:16,转载摘编
一油轮在阿曼湾遇袭,https://www.jfdaily.com/news/detail?id=1082755,2026-03-17 04:45:12,转载摘编
高价无抗鸡蛋、虫草蛋被曝是普通蛋！养殖户：骗人的！当地通报：立案调查,https://www.jfdaily.com/news/detail?id=1082758,2026-03-17 04:43:26,整合改编
6次出舱，张陆追平纪录！神舟二十一号乘组圆满完成第二次出舱活动,https://www.jfdaily.com/news/detail?id=1082742,2026-03-17 04:39:03,自采原创
​“在中国，为全球”，松下参展AWE发布中国事业新战略,https://www.jfdaily.com/news/detail?id=1082617,2026-03-17 04:37:10,自采原创
重庆江津教委：网传小学“禁止学生带纸入厕”情况不属实,https://www.jfdaily.com/news/detail?id=1082754,2026-03-17 04:27:53,转载摘编
特朗普给高市早苗出道“送命题”，日本会参与霍尔木兹海峡护航吗？,https://www.jfdaily.com/news/detail?id=1082753,2026-03-17 04:26:22,整合改编
英伟达在GTC大会推出多项AI相关新产品,https://www.jfdaily.com/news/detail?id=1082751,2026-03-17 04:18:58,转载摘编
澳大利亚央行宣布加息,https://www.jfdaily.com/news/detail?id=1082750,2026-03-17 04:15:32,转载摘编
2026格子旗嘉年华收官，超92万人次共赴竞速之约,https://www.jfdaily.com/news/detail?id=1082602,2026-03-17 04:14:58,自采原创
阿联酋发布安全警报，称正应对伊朗导弹与无人机,https://www.jfdaily.com/news/detail?id=1082748,2026-03-17 04:13:18,转载摘编
利比亚宣布发现新天然气田,https://www.jfdaily.com/news/detail?id=1082749,2026-03-17 04:13:02,转载摘编
当土地日益稀缺、政策日趋内卷，场景为何能在杨浦挑起招商的大梁？,https://www.jfdaily.com/news/detail?id=1082574,2026-03-17 04:12:48,自采原创
从陀思妥耶夫斯基到音乐剧 “影海书香”马年首场活动解锁《卡拉马佐夫兄弟》,https://www.jfdaily.com/news/detail?id=1082674,2026-03-17 04:09:23,自采原创
中国国家画院院长刘万鸣：指间存万象 墨里见乾坤,https://www.jfdaily.com/news/detail?id=1082743,2026-03-17 04:07:26,转载摘编
“刚健婀娜”尚派《玉堂春》在沪上演，韩宜珈金喜全萧润年携手演绎,https://www.jfdaily.com/news/detail?id=1082212,2026-03-17 04:05:48,自采原创
将日常升华为艺术，萧红何以开辟书写“她景观”,https://www.jfdaily.com/news/detail?id=1082250,2026-03-17 04:05:41,自采原创
湖北省委原书记蒋超良被公诉，受贿数额特别巨大,https://www.jfdaily.com/news/detail?id=1082745,2026-03-17 04:05:31,转载摘编
倪妮闫妮等主演，《梦华录》导演再出手，《隐身的名字》以新视角书写女性命运,https://www.jfdaily.com/news/detail?id=1082282,2026-03-17 04:05:29,自采原创
阿联酋全境空域已恢复正常,https://www.jfdaily.com/news/detail?id=1082739,2026-03-17 03:53:23,转载摘编
育人识见 | 上海首个大中小学思政课一体化建设联合教研中心成立,https://www.jfdaily.com/news/detail?id=1082520,2026-03-17 03:50:19,自采原创
微言 | 不止“拆墙”，传统景区如何走出“流量困局”,https://www.jfdaily.com/news/detail?id=1082722,2026-03-17 03:50:01,自采原创
共绘老年友好生活新图景  长宁区小蓝花市民中心两周年焕新启动,https://www.jfdaily.com/news/detail?id=1082735,2026-03-17 03:46:55,自采原创
上海今年前2月进出口同比增长23.1%,https://www.jfdaily.com/news/detail?id=1082731,2026-03-17 03:36:25,自采原创
以军称对德黑兰和贝鲁特发动大规模袭击,https://www.jfdaily.com/news/detail?id=1082730,2026-03-17 03:28:49,转载摘编
“上观碰碰头·秋秋不睡午觉”：315之后，让我们谈谈“食品安全”,https://www.jfdaily.com/news/detail?id=1082726,2026-03-17 03:24:38,自采原创
美媒称“福特”号航母火情30小时才扑灭，600名水兵灾后睡地板,https://www.jfdaily.com/news/detail?id=1082721,2026-03-17 03:19:38,整合改编
没人愿意派军舰，特朗普抱怨盟友对护航“不热衷”,https://www.jfdaily.com/news/detail?id=1082702,2026-03-17 03:18:46,整合改编
伊朗用十年前导弹作战，更先进武器留着作为储备,https://www.jfdaily.com/news/detail?id=1082698,2026-03-17 03:18:19,整合改编
来听听！当两位老外用母语为你讲述百年沁园邨……｜新民侨梁,https://www.jfdaily.com/news/detail?id=1082562,2026-03-17 03:12:49,自采原创
F1赛场上演极速救援！上海圆满完成近期重大活动医疗保障,https://www.jfdaily.com/news/detail?id=1082711,2026-03-17 03:08:46,自采原创
丈夫去世前夜妻子私自转60万存款，子女将继母诉至法院要求归还,https://www.jfdaily.com/news/detail?id=1082309,2026-03-17 03:08:25,自采原创
胖东来小方糖戒指时隔三个月重新上架，1克拉售价仍为169元,https://www.jfdaily.com/news/detail?id=1082712,2026-03-17 03:03:52,整合改编
老扎劲额！跑进春天里,https://www.jfdaily.com/news/detail?id=1082719,2026-03-17 03:03:44,自采原创
一家12口罹难！广东汕头自建房火灾事故直接原因查明：店主使用蚊香不慎引发,https://www.jfdaily.com/news/detail?id=1082723,2026-03-17 03:01:15,整合改编
看牙不出楼！上海九院东部院区运行在即，国家口腔医学中心（上海）入驻,https://www.jfdaily.com/news/detail?id=1082481,2026-03-17 02:54:09,自采原创
全球发展学院在浙大成立，面向全球招生，首批博士生今年9月入学,https://www.jfdaily.com/news/detail?id=1082261,2026-03-17 02:53:50,自采原创
地瓜机器人完成1.2亿美元B1轮融资，加速打造具身智能原生技术底座,https://www.jfdaily.com/news/detail?id=1082697,2026-03-17 02:50:29,自采原创
卡塔尔大熊猫馆负责人：大熊猫状况良好,https://www.jfdaily.com/news/detail?id=1082717,2026-03-17 02:49:49,转载摘编
上海男篮赢了球，主帅卢伟又抢了头条？,https://www.jfdaily.com/news/detail?id=1082657,2026-03-17 02:49:27,自采原创
三起重大火灾原因公布，国家消防救援局发布重要提醒,https://www.jfdaily.com/news/detail?id=1082716,2026-03-17 02:48:11,转载摘编
山姆紧急下架网红问题产品！还被曝不正当竞争行为！三文鱼不能生吃此前引争议,https://www.jfdaily.com/news/detail?id=1082706,2026-03-17 02:45:09,整合改编
湖南省商务厅原厅长徐湘平被查,https://www.jfdaily.com/news/detail?id=1082713,2026-03-17 02:44:20,转载摘编
春运进出京客流总量1.17亿人次创新高，铁路高峰日客流居全国首位,https://www.jfdaily.com/news/detail?id=1082694,2026-03-17 02:40:13,自采原创
新老小区壁垒难破？看这个社区如何创新融合改造换新貌,https://www.jfdaily.com/news/detail?id=1082138,2026-03-17 02:38:28,自采原创
太辛酸！上海81岁外公卖房还债照顾2个外籍外孙女！孩子生母离世、生父未知,https://www.jfdaily.com/news/detail?id=1082710,2026-03-17 02:37:52,整合改编
上海商业用房新政策出台，业内：部分核心地段商办项目咨询量预计迎来大涨,https://www.jfdaily.com/news/detail?id=1082668,2026-03-17 02:36:03,自采原创
万历近三十年不上朝，紫禁城却在替他“执政”？,https://www.jfdaily.com/news/detail?id=1081849,2026-03-17 02:33:15,约组外稿
山姆2款产品陷入食品安全风波：冻干草莓重金属超标，进口三文鱼竟然不能生吃,https://www.jfdaily.com/news/detail?id=1082708,2026-03-17 02:33:12,自采原创
特朗普因盟友无人响应护航霍尔木兹发急：我们保护他们，困境之时他们不帮忙！,https://www.jfdaily.com/news/detail?id=1082703,2026-03-17 02:27:08,整合改编
美军13死200伤，特朗普称“战争不久后就会结束”；伊朗外长：战争结束取决于确保不再发生“侵略”,https://www.jfdaily.com/news/detail?id=1082673,2026-03-17 02:19:44,整合改编
马拉松比赛冠军选手冲线时遭裁判错误拦截！官方通报：该裁判停赛一年,https://www.jfdaily.com/news/detail?id=1082693,2026-03-17 02:16:11,整合改编
陕西省委常委王海鹏任延安市委书记，前任已任西安市委书记,https://www.jfdaily.com/news/detail?id=1082696,2026-03-17 02:15:12,整合改编
