title,url,time,source
《候场》对话梁朝伟：孤独的人在海上撑着船帆,https://www.jfdaily.com/news/detail?id=1143183,2026-07-12 21:00:06,自采原创
上海年轻人的新“局”：古籍修复,https://www.jfdaily.com/news/detail?id=1143136,2026-07-12 21:00:03,自采原创
天下一席谈｜专访李立凡：上合25周年，从奠基到升华,https://www.jfdaily.com/news/detail?id=1143411,2026-07-12 20:41:02,自采原创
今日数据精选：霍尔木兹海峡商业航运下降；两部门联合发布山洪灾害气象预警,https://www.jfdaily.com/news/detail?id=1143419,2026-07-12 20:19:02,整合改编
美军打击约140个伊朗军事目标，霍尔木兹海峡通行情况又成疑云,https://www.jfdaily.com/news/detail?id=1143402,2026-07-12 20:08:05,整合改编
世界杯之最：梅西将在国家队生涯首次面对英格兰队,https://www.jfdaily.com/news/detail?id=1143253,2026-07-12 20:08:02,自采原创
德国6月近百人溺亡，男性占九成，“野泳”是主因,https://www.jfdaily.com/news/detail?id=1143365,2026-07-12 20:07:02,整合改编
特朗普担心遭伊朗暗杀，罕见立下“遗嘱”,https://www.jfdaily.com/news/detail?id=1143367,2026-07-12 20:04:02,整合改编
一周三轮互袭，背后还是海峡之争,https://www.jfdaily.com/news/detail?id=1143373,2026-07-12 20:00:05,整合改编
中国女排差点掀翻奥运冠军赢得尊重，下一场生死战面对美国女排,https://www.jfdaily.com/news/detail?id=1143398,2026-07-12 20:00:02,自采原创
一张直选单式票得奖947万余元，闵行购彩者喜中大乐透第26077期一等奖,https://www.jfdaily.com/news/detail?id=1143336,2026-07-12 19:58:05,自采原创
泽连斯基宣布重组内阁，乌总理或转任驻美大使,https://www.jfdaily.com/news/detail?id=1143368,2026-07-12 19:58:02,整合改编
温网｜终结一年大满贯冠军荒！辛纳逆转兹维列夫卫冕男单冠军，紧追阿尔卡拉斯,https://www.jfdaily.com/news/detail?id=1143421,2026-07-12 19:57:58,自采原创
世界杯｜专家点评：慢节奏传控时代落幕，快速向前+高位压迫成为强队主流战术,https://www.jfdaily.com/news/detail?id=1143414,2026-07-12 19:56:04,自采原创
世界杯｜瑞士队输得太憋屈，VAR新规缺乏清晰标准，“身份错判”究竟是什么,https://www.jfdaily.com/news/detail?id=1143397,2026-07-12 19:53:02,自采原创
状态时好时坏，关键分屡屡卡壳，世界联赛6胜6负的中国女排还在交学费,https://www.jfdaily.com/news/detail?id=1143415,2026-07-12 19:50:05,自采原创
世界杯｜VAR过度干预引发诸多争议，高科技辅助工具将足球推向另一个极端,https://www.jfdaily.com/news/detail?id=1143400,2026-07-12 19:50:02,自采原创
温网｜守得云开见月明！28岁的郭涵煜斩获首座大满贯，中国女网再添冠军,https://www.jfdaily.com/news/detail?id=1143374,2026-07-12 19:46:03,自采原创
【城事】台风“巴威”还未走远，小区伏木败枝就已清零,https://www.jfdaily.com/news/detail?id=1143306,2026-07-12 19:43:44,自采原创
世界杯｜竞彩推荐：半决赛再战西班牙队，姆巴佩能否率法国队成功“复仇”？,https://www.jfdaily.com/news/detail?id=1143408,2026-07-12 19:43:03,自采原创
泽连斯基“内政外交”大动作：对内重组内阁，对外强调与美欧合作,https://www.jfdaily.com/news/detail?id=1143406,2026-07-12 19:40:02,整合改编
刚访问完乌克兰，被俄罗斯通缉的“战争贩子”格雷厄姆猝死,https://www.jfdaily.com/news/detail?id=1143401,2026-07-12 19:34:04,整合改编
“见字如面！”学者陈子善在手稿展惊觉老友隐藏技能,https://www.jfdaily.com/news/detail?id=1142822,2026-07-12 17:57:36,自采原创
BW破次元壁，上海地铁2号线变身“二次元专列”,https://www.jfdaily.com/news/detail?id=1142975,2026-07-12 17:47:16,自采原创
梨园戏《董生与李氏》再度惊艳上海,https://www.jfdaily.com/news/detail?id=1143369,2026-07-12 16:56:29,自采原创
事发上海，台风刮裂烟囱！消防人员10分钟解除隐患,https://www.jfdaily.com/news/detail?id=1143385,2026-07-12 15:07:35,自采原创
南戏活化石梨园戏：一个剧种的900年 一部戏的30年和一群人的传承,https://www.jfdaily.com/news/detail?id=1143357,2026-07-12 15:06:30,自采原创
3天40万人次参展、首次海外售票，BW“火”出圈,https://www.jfdaily.com/news/detail?id=1143260,2026-07-12 15:03:42,自采原创
海塘防护、内河排涝、城区排水……看金山水务人如何顶住台风冲击,https://www.jfdaily.com/news/detail?id=1143256,2026-07-12 14:52:07,自采原创
7月17日至7月20日，上海部分道路区域采取临时限制通行措施,https://www.jfdaily.com/news/detail?id=1143246,2026-07-12 14:52:00,自采原创
徐家汇有了专属短音频节目《徐家汇情怀》，在软糯沪语中激活海派记忆,https://www.jfdaily.com/news/detail?id=1143361,2026-07-12 14:51:53,自采原创
顾问天下 | “欧奸”or功臣？吕特：北约头号谄媚者！,https://www.jfdaily.com/news/detail?id=1143378,2026-07-12 14:33:11,自采原创
同貌人、耦合家庭……走入陀思妥耶夫斯基六部代表作 |讲堂视频,https://www.jfdaily.com/news/detail?id=1143375,2026-07-12 14:26:17,自采原创
台风“巴威”一线见闻：上海彻夜抢修电网基站，倒伏树木最快1小时清运,https://www.jfdaily.com/news/detail?id=1143320,2026-07-12 14:23:16,自采原创
外交部亚洲司负责人就日方涉“南海仲裁案裁决”恶劣言行提出严正交涉,https://www.jfdaily.com/news/detail?id=1143370,2026-07-12 14:14:29,转载摘编
特朗普盟友格雷厄姆猝死，终年71岁，曾鼓吹对伊朗开战,https://www.jfdaily.com/news/detail?id=1143362,2026-07-12 13:59:54,整合改编
特朗普盟友格雷厄姆猝死，曾鼓吹对伊朗开战,https://www.jfdaily.com/news/detail?id=1143360,2026-07-12 13:59:10,转载摘编
关于“南海仲裁案”，新华社讲了个寓言故事,https://www.jfdaily.com/news/detail?id=1143358,2026-07-12 13:49:32,转载摘编
测评胜负靠演、水军控评带节奏，总台曝光家电测评直播间造假“带货”,https://www.jfdaily.com/news/detail?id=1143350,2026-07-12 13:25:21,转载摘编
16国篮球少女集结杨浦！2026FIBA女子篮球夏令营热血启幕,https://www.jfdaily.com/news/detail?id=1143317,2026-07-12 13:19:22,自采原创
一盘棋，何以连接五大洲青年,https://www.jfdaily.com/news/detail?id=1143316,2026-07-12 13:19:09,自采原创
18时30分，上海解除全市防汛防台Ⅲ级响应行动,https://www.jfdaily.com/news/detail?id=1143296,2026-07-12 13:18:24,自采原创
早发现，快处置，保安全，虹口水务已准备清捞河道漂浮物,https://www.jfdaily.com/news/detail?id=1143298,2026-07-12 13:16:11,自采原创
乌克兰总统泽连斯基宣布将重组内阁,https://www.jfdaily.com/news/detail?id=1143348,2026-07-12 13:14:21,转载摘编
德国6月溺亡近百人，高温下“野泳”成主因,https://www.jfdaily.com/news/detail?id=1143346,2026-07-12 13:09:43,转载摘编
台风夜黄浦江上游水闸断电，松电抢修人员顶风冒雨极速复电,https://www.jfdaily.com/news/detail?id=1143307,2026-07-12 13:08:34,自采原创
3位“985”高校校长，当选中国科协副主席,https://www.jfdaily.com/news/detail?id=1143342,2026-07-12 13:08:05,转载摘编
刘伟才已任辽宁省委宣传部常务副部长,https://www.jfdaily.com/news/detail?id=1143341,2026-07-12 13:08:02,转载摘编
全球首场DOTA2交响音乐会落幕，下个月，DOTA2国际邀请赛再临上海,https://www.jfdaily.com/news/detail?id=1143126,2026-07-12 13:06:03,自采原创
海派艺术馆推出蒙古当代艺术展，游牧生活与数字艺术同台亮相,https://www.jfdaily.com/news/detail?id=1143261,2026-07-12 13:04:10,自采原创
奥运冠军苏翊鸣谈“复活”,https://www.jfdaily.com/news/detail?id=1143308,2026-07-12 12:54:06,自采原创
小红书为何押宝世界杯？,https://www.jfdaily.com/news/detail?id=1143328,2026-07-12 12:54:00,自采原创
智谱创始人唐杰发内部信，透露下一步战略方向,https://www.jfdaily.com/news/detail?id=1143340,2026-07-12 12:52:41,转载摘编
北京密云一副局长自购10亿token，“手搓”防汛App,https://www.jfdaily.com/news/detail?id=1143339,2026-07-12 12:52:19,转载摘编
新研究：人类智力奥秘或藏于单个脑细胞中,https://www.jfdaily.com/news/detail?id=1143338,2026-07-12 12:51:42,转载摘编
最新！上海更新台风预警，今夜到明天局部仍有大到暴雨,https://www.jfdaily.com/news/detail?id=1143326,2026-07-12 12:41:57,整合改编
台风影响逐渐减弱，上海轨道交通恢复正常运行,https://www.jfdaily.com/news/detail?id=1143291,2026-07-12 12:39:47,自采原创
世界杯四分之一决赛综述：诸强归位，巨星闪耀,https://www.jfdaily.com/news/detail?id=1143323,2026-07-12 12:39:29,转载摘编
刘国中在北京调研：全力以赴抓好水库安全度汛工作，病险水库原则上一律空库运行,https://www.jfdaily.com/news/detail?id=1143322,2026-07-12 12:37:42,转载摘编
为什么台风经常在浙江登陆，而不是江苏？,https://www.jfdaily.com/news/detail?id=1143277,2026-07-12 12:36:03,约组外稿
