title,url,time,source
习近平会见芬兰总理奥尔波,https://www.jfdaily.com/news/detail?id=1058238,2026-01-27 04:46:15,转载摘编
山西焦煤集团原董事长武华太一审获刑15年，专题片披露细节,https://www.jfdaily.com/news/detail?id=1058236,2026-01-27 04:45:14,转载摘编
快看视频 | 美国航母进入中东地区，与“十二日战争”时部署类似,https://www.jfdaily.com/news/detail?id=1058214,2026-01-27 04:44:22,自采原创
“传递爱心，践行社会责任”，上海这所学校把慈善超市开进社区,https://www.jfdaily.com/news/detail?id=1058051,2026-01-27 04:40:11,自采原创
北方小年夜火车票今日开售！春运购票有新变化,https://www.jfdaily.com/news/detail?id=1058228,2026-01-27 04:33:33,转载摘编
日本众议院选战开始，高市称执政联盟议席不过半就辞职,https://www.jfdaily.com/news/detail?id=1058220,2026-01-27 04:18:45,转载摘编
因年龄原因，云南省纪委书记冯志礼，辞去省监委主任职务,https://www.jfdaily.com/news/detail?id=1058222,2026-01-27 04:16:36,整合改编
荷兰发现奶牛感染禽流感，或为美国以外首例,https://www.jfdaily.com/news/detail?id=1058218,2026-01-27 04:13:58,转载摘编
韩总统府：将尽快就特朗普宣布提高对韩关税与美方磋商,https://www.jfdaily.com/news/detail?id=1058217,2026-01-27 04:12:35,转载摘编
真上天了！国科大成立星际航行学院，网友：挂科属于星际迷航,https://www.jfdaily.com/news/detail?id=1058215,2026-01-27 04:08:16,自采原创
“上观碰碰头·秋秋不睡午觉”：聊聊“食品安全”,https://www.jfdaily.com/news/detail?id=1057627,2026-01-27 04:02:58,自采原创
国家邮政局：切实保障快递员春运期间休息休假等合法权利,https://www.jfdaily.com/news/detail?id=1058207,2026-01-27 04:01:06,转载摘编
整治政府采购“内卷式”竞争，财政部推动解决异常低价问题,https://www.jfdaily.com/news/detail?id=1058208,2026-01-27 04:00:24,转载摘编
创世界纪录，我国全超导用户磁体获重大突破,https://www.jfdaily.com/news/detail?id=1058130,2026-01-27 04:00:14,自采原创
一碗暖粥裹温情，一份守护筑平安,https://www.jfdaily.com/news/detail?id=1058211,2026-01-27 04:00:02,自采原创
交通运输部：严格落实春节假期免收7座及以下小型客车通行费政策,https://www.jfdaily.com/news/detail?id=1058206,2026-01-27 03:58:48,转载摘编
旅日大熊猫“晓晓”和“蕾蕾”启程回国,https://www.jfdaily.com/news/detail?id=1058210,2026-01-27 03:57:45,转载摘编
法国国民议会通过法案，禁止15岁以下未成年人使用社交媒体,https://www.jfdaily.com/news/detail?id=1058205,2026-01-27 03:56:21,转载摘编
香山商帮续写百年商脉新篇章，“广货行天下·中山百货进上海”31日启幕,https://www.jfdaily.com/news/detail?id=1057768,2026-01-27 03:53:07,自采原创
微言 | 飞来峰祭出 “诚信戒尺”， 预约制背后不止个人诚信,https://www.jfdaily.com/news/detail?id=1058194,2026-01-27 03:50:19,自采原创
2026上海豫园灯会正式点亮！海派年味盛宴带你体验“回家过年”的仪式感,https://www.jfdaily.com/news/detail?id=1058203,2026-01-27 03:49:07,自采原创
特朗普施压伊朗：美军派遣舰队规模更庞大,https://www.jfdaily.com/news/detail?id=1058201,2026-01-27 03:33:55,转载摘编
留学中的儿子为爱辍学，上海阿姨急了！花18万元搬“救兵”，竟“人财两空”,https://www.jfdaily.com/news/detail?id=1058199,2026-01-27 03:33:29,整合改编
印度疫情详情披露！张文宏：“二代测序检测能力没问题”；最新发现：防治有望,https://www.jfdaily.com/news/detail?id=1058197,2026-01-27 03:33:14,整合改编
国务院免去曾国卫香港特别行政区政府政制及内地事务局局长职务,https://www.jfdaily.com/news/detail?id=1058200,2026-01-27 03:32:36,转载摘编
著名诗人吉狄马加谈中国与非洲之文化交流,https://www.jfdaily.com/news/detail?id=1058202,2026-01-27 03:32:31,自采原创
上海爷叔靠一把放大镜，10年看完了500多本书 | 上海阅读者,https://www.jfdaily.com/news/detail?id=1058186,2026-01-27 03:21:34,自采原创
焕新归来！上海传奇地标、老牌五星级酒店春节前试运营，有个大变化→,https://www.jfdaily.com/news/detail?id=1058132,2026-01-27 03:17:55,整合改编
“很后悔托举他，没有托举自己！”遭遇双重背叛，女子一夜白头,https://www.jfdaily.com/news/detail?id=1058136,2026-01-27 03:17:46,整合改编
航班大量取消！超市货架拿空！不少中国网友发文称滞留日本，“简直是灾难”,https://www.jfdaily.com/news/detail?id=1058192,2026-01-27 03:02:09,整合改编
千年文物工艺谜题，这场特展教你如何用现代科技“一眼看穿”,https://www.jfdaily.com/news/detail?id=1057981,2026-01-27 03:00:12,自采原创
上海科普大讲坛“硬核”开年，2026年计划推出“四个新”,https://www.jfdaily.com/news/detail?id=1057960,2026-01-27 02:58:53,自采原创
人社部：三项社保基金累计结余10.2万亿元,https://www.jfdaily.com/news/detail?id=1058191,2026-01-27 02:55:47,转载摘编
欢迎中外记者采访十四届全国人大四次会议和全国政协十四届四次会议,https://www.jfdaily.com/news/detail?id=1058190,2026-01-27 02:54:17,转载摘编
上观时评 | 从一角银元半袋小米说深去,https://www.jfdaily.com/news/detail?id=1049362,2026-01-27 02:48:31,约组外稿
减重100斤逆袭、全家变“健康达人”……上海四大类体重管理优秀案例揭晓,https://www.jfdaily.com/news/detail?id=1058147,2026-01-27 02:35:49,自采原创
习近平会见芬兰总理奥尔波,https://www.jfdaily.com/news/detail?id=1058185,2026-01-27 02:32:13,转载摘编
国际金价首破5100美元大关，黄金珠宝门店：一口价金饰品甚至来不及改价！,https://www.jfdaily.com/news/detail?id=1058182,2026-01-27 02:23:53,自采原创
50岁女子性命堪忧，丈夫决定：捐肝！瑞金医院实施夫妻间活体肝移植手术,https://www.jfdaily.com/news/detail?id=1057924,2026-01-27 02:20:59,自采原创
肾移植后蛋白尿难治？上海医生精准破解肾病诊断难题,https://www.jfdaily.com/news/detail?id=1057901,2026-01-27 02:20:45,自采原创
事关新就业形态劳动者、超龄劳动者、带薪年休假，人力资源社会保障部将有新政策,https://www.jfdaily.com/news/detail?id=1058181,2026-01-27 02:19:39,转载摘编
我国将出台应对人工智能影响促就业文件,https://www.jfdaily.com/news/detail?id=1058178,2026-01-27 02:08:47,转载摘编
习言道｜我和你们一起在这里站岗,https://www.jfdaily.com/news/detail?id=1058154,2026-01-27 02:05:30,转载摘编
冰雪春天丨总书记关切的“冷资源”带动“热经济”,https://www.jfdaily.com/news/detail?id=1058153,2026-01-27 02:01:41,转载摘编
上海科技馆焕新升级即将归来  打造世界级科学技术博物馆典范,https://www.jfdaily.com/news/detail?id=1058127,2026-01-27 02:01:06,自采原创
中国科学院大学星际航行学院成立,https://www.jfdaily.com/news/detail?id=1058149,2026-01-27 01:58:29,转载摘编
楼道里电表起火，上海七旬爷叔竟然用嘴吹！女儿：知识太匮乏,https://www.jfdaily.com/news/detail?id=1058150,2026-01-27 01:58:16,整合改编
凝聚共识启新程，易居论坛共探地产城更高质发展,https://www.jfdaily.com/news/detail?id=1058007,2026-01-27 01:49:24,自采原创
“开年第一课”，习近平总书记为什么强调“一步一步坚定走”,https://www.jfdaily.com/news/detail?id=1058146,2026-01-27 01:48:18,转载摘编
“老板，给我来300块钱的情绪！”这届年轻人，正在批量购买“电子朋友”,https://www.jfdaily.com/news/detail?id=1058079,2026-01-27 01:45:59,自采原创
2025年全国规模以上工业企业利润增长0.6%,https://www.jfdaily.com/news/detail?id=1058144,2026-01-27 01:44:03,转载摘编
爱专业，也爱家乡——华理学子分享返乡求职攻略 | 关注大学生就业,https://www.jfdaily.com/news/detail?id=1058137,2026-01-27 01:34:42,整合改编
百岁王振义，与他的谢医生,https://www.jfdaily.com/news/detail?id=1056497,2026-01-27 01:32:04,约组外稿
林肯号航母打击群前出，美国伊朗真要开打吗？,https://www.jfdaily.com/news/detail?id=1058142,2026-01-27 01:30:08,自采原创
极寒重创美国能源业，电价狂飙1400%，一季度经济数据或大幅波动,https://www.jfdaily.com/news/detail?id=1058140,2026-01-27 01:26:45,转载摘编
教育部叫停高一提前选科！先学好每门课，别被有些“指南”误导｜新民教育观察,https://www.jfdaily.com/news/detail?id=1057693,2026-01-27 01:26:08,自采原创
同济研究成果斩获人工智能领域顶级会议AAAI“杰出论文奖”,https://www.jfdaily.com/news/detail?id=1058135,2026-01-27 01:22:05,整合改编
上海科技馆升级改造后首亮相 十大特色展区近千件新展品打造科普尖峰新境,https://www.jfdaily.com/news/detail?id=1058126,2026-01-27 01:20:54,自采原创
今日数据精选：黄金 “狂飙”首上5100美元；猎豹企业榜出炉，上海最多,https://www.jfdaily.com/news/detail?id=1057986,2026-01-27 01:20:35,整合改编
院士回校传薪火！气候学家符淙斌为岳阳小学首届少年科学论坛开讲,https://www.jfdaily.com/news/detail?id=1057817,2026-01-27 01:16:26,自采原创
