title,url,time,source
在AI产业一线开课：复旦科技思政大课来啦,https://www.jfdaily.com/news/detail?id=1122543,2026-06-03 04:59:23,自采原创
没写毕业论文，全凭能干！上理工两硕士靠实践成果毕业,https://www.jfdaily.com/news/detail?id=1122600,2026-06-03 04:59:10,自采原创
两家具身智能企业同日官宣融资,https://www.jfdaily.com/news/detail?id=1122604,2026-06-03 04:53:27,转载摘编
195人逃脱！巴拿马一监狱发生大规模越狱事件,https://www.jfdaily.com/news/detail?id=1122606,2026-06-03 04:52:58,转载摘编
俄总统新闻秘书谈俄乌停战条件：乌军从俄各地区撤离,https://www.jfdaily.com/news/detail?id=1122605,2026-06-03 04:52:42,转载摘编
安徽、山西、湖南、辽宁省长深入矿区井下，检查安全生产情况,https://www.jfdaily.com/news/detail?id=1122597,2026-06-03 04:38:44,转载摘编
蒋光太、程进、拜合拉木因伤缺席，国足无奈为中超高强度一周双赛 “埋单”,https://www.jfdaily.com/news/detail?id=1122501,2026-06-03 04:36:38,自采原创
安徽马鞍山市和县一大巴车失控造成2人死亡2受伤,https://www.jfdaily.com/news/detail?id=1122596,2026-06-03 04:34:36,转载摘编
太气人！是亲生的吗？新生儿被父亲“丢”在上海儿童医院5个月！最新进展→,https://www.jfdaily.com/news/detail?id=1122595,2026-06-03 04:28:57,整合改编
一场普通发烧，40岁男子差点没命！他一波操作，致炎症指标爆表、多脏器受累,https://www.jfdaily.com/news/detail?id=1122594,2026-06-03 04:26:55,整合改编
于是：中女独居生活，让写作更自由,https://www.jfdaily.com/news/detail?id=1122170,2026-06-03 04:15:04,自采原创
两分钟验核十几件免税品！上海机场这台“会翻译”的智能终端有点神,https://www.jfdaily.com/news/detail?id=1122525,2026-06-03 04:04:26,自采原创
西西弗斯跳下山 | 阮唐,https://www.jfdaily.com/news/detail?id=1120120,2026-06-03 03:57:05,约组外稿
造谣济南青岛山姆“熟食饮料疑遭偷吃”，济南警方：已被拘留,https://www.jfdaily.com/news/detail?id=1122580,2026-06-03 03:53:55,转载摘编
突发！美国伊朗再次互袭，巴林、阿联酋、科威特机场关闭，所有航班暂停起降,https://www.jfdaily.com/news/detail?id=1122482,2026-06-03 03:45:48,整合改编
上海、广东、湖北等地提醒：高考考生如戴眼镜，入场前须接受查验,https://www.jfdaily.com/news/detail?id=1122517,2026-06-03 03:45:41,整合改编
随身登机行李收费合理吗？专家：票务信息需明确告知,https://www.jfdaily.com/news/detail?id=1122575,2026-06-03 03:44:06,转载摘编
韩冬已任宁夏回族自治区党委常委、宣传部部长,https://www.jfdaily.com/news/detail?id=1122573,2026-06-03 03:41:14,转载摘编
印度欲“大手笔”采购法国战机,https://www.jfdaily.com/news/detail?id=1122571,2026-06-03 03:40:21,转载摘编
回击反俄宣传，俄罗斯禁止5名英国人入境,https://www.jfdaily.com/news/detail?id=1122523,2026-06-03 03:37:07,转载摘编
从20块到2000块，怎样才能买到一件好防晒服？,https://www.jfdaily.com/news/detail?id=1122566,2026-06-03 03:36:59,整合改编
滨水新空间！华东政法大学长宁校区改扩建工程实现全面结构封顶,https://www.jfdaily.com/news/detail?id=1122565,2026-06-03 03:34:25,自采原创
名著中的“老小姐”们，只用一个笑容，就洞穿了真相 | 闫红,https://www.jfdaily.com/news/detail?id=1115671,2026-06-03 03:28:02,约组外稿
推迟三个月的告别：哈梅内伊国葬敲定三城举行,https://www.jfdaily.com/news/detail?id=1122509,2026-06-03 03:27:19,自采原创
民进党抹黑4款大陆APP，台湾网友却在疯传12306订票教程,https://www.jfdaily.com/news/detail?id=1122540,2026-06-03 03:24:34,自采原创
非法收受他人财物，数额特别巨大！“老虎”王莉霞被逮捕、提起公诉,https://www.jfdaily.com/news/detail?id=1122541,2026-06-03 03:23:51,整合改编
直击AI换脸、虚假售后乱象，合合信息AI鉴伪技术助力行业精准反诈,https://www.jfdaily.com/news/detail?id=1122563,2026-06-03 03:22:12,自采原创
原研药进社区，配得到用得上吗？上海社区配药新规落地“满月”追踪,https://www.jfdaily.com/news/detail?id=1122388,2026-06-03 03:18:29,自采原创
中国红十字会总会紧急向黑龙江省调拨救灾物资,https://www.jfdaily.com/news/detail?id=1122557,2026-06-03 03:13:47,转载摘编
“球王”贝利1958年世界杯夺冠球衣将拍卖,https://www.jfdaily.com/news/detail?id=1122553,2026-06-03 03:13:17,转载摘编
广西柳州66家受灾工业企业全部稳产复工,https://www.jfdaily.com/news/detail?id=1122544,2026-06-03 03:00:12,转载摘编
受贿数额特别巨大，“老虎”王莉霞被提起公诉！曾任内蒙古自治区政府主席,https://www.jfdaily.com/news/detail?id=1122542,2026-06-03 02:56:27,整合改编
探访上海街边书店‌③ | 一周只卖“一本书”，一年捐出了20多万元,https://www.jfdaily.com/news/detail?id=1113849,2026-06-03 02:56:24,自采原创
策展人详解：读懂“千金之家”就读懂了今夏上海的马王堆大展,https://www.jfdaily.com/news/detail?id=1122539,2026-06-03 02:52:20,自采原创
国台办：缺电已成台湾发展软肋，大家有目共睹,https://www.jfdaily.com/news/detail?id=1122532,2026-06-03 02:46:44,转载摘编
国台办：相信会有更多台湾同胞充分认识“一国两制”的优越性,https://www.jfdaily.com/news/detail?id=1122529,2026-06-03 02:39:26,转载摘编
上海过去26年的高考作文题，你写的是哪一篇？,https://www.jfdaily.com/news/detail?id=1122514,2026-06-03 02:36:44,自采原创
微创脑科学携手傲意科技，开启“脑机接口—外骨骼机器人”临床康复新范式,https://www.jfdaily.com/news/detail?id=1122527,2026-06-03 02:36:38,自采原创
能看、能玩、能体验！第十二届上交会下周开幕，首发首展硬核技术成果,https://www.jfdaily.com/news/detail?id=1122524,2026-06-03 02:36:32,自采原创
华理化工5人团是如何拿下这个全国特等奖的,https://www.jfdaily.com/news/detail?id=1122494,2026-06-03 02:34:26,自采原创
国台办：日菲所谓“划界谈判”严重侵害中国海洋权益，完全非法无效,https://www.jfdaily.com/news/detail?id=1122526,2026-06-03 02:34:08,转载摘编
前程无忧发布2026年度大学生喜爱的雇主品牌榜单：技术人才需求升温,https://www.jfdaily.com/news/detail?id=1122508,2026-06-03 02:33:21,自采原创
美加墨世界杯48骏大名单全部敲定，梅西、C罗和奥乔亚史无前例六度出征,https://www.jfdaily.com/news/detail?id=1122474,2026-06-03 02:27:04,自采原创
上海企业加速全球算力布局！优刻得落子乌兹别克斯坦，已建成36个可用区,https://www.jfdaily.com/news/detail?id=1122468,2026-06-03 02:25:00,自采原创
赖清德称将处理TikTok小红书对台青影响，国台办回应,https://www.jfdaily.com/news/detail?id=1122518,2026-06-03 02:24:27,转载摘编
上交会将于6月11日至13日举行，参展企业首次突破千家，设立国际展区！,https://www.jfdaily.com/news/detail?id=1122512,2026-06-03 02:18:53,自采原创
第十八届海峡论坛将于6月中旬在福建举办,https://www.jfdaily.com/news/detail?id=1122511,2026-06-03 02:14:41,转载摘编
陕西集中发布三项考古研究成果,https://www.jfdaily.com/news/detail?id=1122510,2026-06-03 02:10:51,转载摘编
陕西集中发布三项考古研究成果,https://www.jfdaily.com/news/detail?id=1122510,2026-06-03 02:10:51,转载摘编
AI短剧“抽卡”抽到跳脚！中小企业正遭遇的“算力饥渴”怎么解？,https://www.jfdaily.com/news/detail?id=1122473,2026-06-03 02:08:18,自采原创
受贿数额特别巨大，内蒙古自治区政府原主席王莉霞被提起公诉,https://www.jfdaily.com/news/detail?id=1122504,2026-06-03 02:07:43,转载摘编
慕尼黑，一个印度学学者的童话 | 范慕尤,https://www.jfdaily.com/news/detail?id=1112620,2026-06-03 02:05:02,约组外稿
从“崇洋”到拥抱国货，中国美妆市场迎新机遇丨洋掌柜新观察,https://www.jfdaily.com/news/detail?id=1120559,2026-06-03 02:03:03,自采原创
专访 | 伊朗为什么没乱？她从战场归来，带回了答案,https://www.jfdaily.com/news/detail?id=1122150,2026-06-03 02:02:59,自采原创
丹麦新政府：坚守格陵兰岛主权，推进北极军事建设；俄军大规模空袭乌克兰造成152人死伤,https://www.jfdaily.com/news/detail?id=1122487,2026-06-03 02:02:18,整合改编
中东危机蔓延，为何日本餐桌上的香蕉告急？,https://www.jfdaily.com/news/detail?id=1122496,2026-06-03 01:43:05,转载摘编
全国首批、上海唯一，上海这个国家级零碳园区要将绿电直连占比拉到50%,https://www.jfdaily.com/news/detail?id=1122384,2026-06-03 01:39:24,自采原创
美军战机开火，独家录音曝光,https://www.jfdaily.com/news/detail?id=1122495,2026-06-03 01:35:37,转载摘编
5天预计发送1745万人次！长三角铁路2026年端午假期旅客运输方案出台,https://www.jfdaily.com/news/detail?id=1122492,2026-06-03 01:28:33,自采原创
集采药被药店高价销售背后：为何会有价差？如何破解？,https://www.jfdaily.com/news/detail?id=1122493,2026-06-03 01:27:36,转载摘编
经纬线·政绩观里的文化根脉,https://www.jfdaily.com/news/detail?id=1122489,2026-06-03 01:19:36,转载摘编
