title,url,time,source
新型BCL2抑制剂助力淋巴瘤诊疗迈入新阶段,https://www.jfdaily.com/news/detail?id=1059237,2026-01-29 05:08:08,自采原创
金刺猬丨评当代自媒体语境下的“红学热”与“红学乱”,https://www.jfdaily.com/news/detail?id=1058826,2026-01-29 05:07:58,自采原创
快看视频 | 特朗普警告伊朗达成核协议，“否则下一次打击更猛烈”,https://www.jfdaily.com/news/detail?id=1059418,2026-01-29 05:06:57,自采原创
中国黄金、西部黄金…集体公告：提示风险！,https://www.jfdaily.com/news/detail?id=1059442,2026-01-29 05:05:05,转载摘编
《新西兰先驱报》发表为“台独”分裂言论张目文章，我使馆发声,https://www.jfdaily.com/news/detail?id=1059444,2026-01-29 05:04:13,转载摘编
尼日尔首都一机场遭不明身份武装分子大规模袭击，持续约一小时,https://www.jfdaily.com/news/detail?id=1059441,2026-01-29 05:01:56,转载摘编
齐大海、程一堃履新外交部司长,https://www.jfdaily.com/news/detail?id=1059438,2026-01-29 05:00:50,转载摘编
央行上海总部：推动临港离岸贸易金融服务综改试点扩围、外汇管理改革试点落地,https://www.jfdaily.com/news/detail?id=1059429,2026-01-29 04:55:42,自采原创
杨勤荣卸任山西省副省长，曾任长治市市长、市委书记,https://www.jfdaily.com/news/detail?id=1059433,2026-01-29 04:53:45,整合改编
痛心！20余亩农田被倾倒大量渣土！上海浦东警方抓获7人,https://www.jfdaily.com/news/detail?id=1059406,2026-01-29 04:50:34,自采原创
行走世界｜一座火山与奥克兰的万年回响,https://www.jfdaily.com/news/detail?id=1059431,2026-01-29 04:50:14,自采原创
足坛“反赌扫黑”落下重锤：申花等13支球队遭罚分，73人终身禁足,https://www.jfdaily.com/news/detail?id=1059253,2026-01-29 04:46:44,自采原创
足坛“反赌扫黑”落下重锤：申花等13支球队遭罚分，73人终身禁足,https://www.jfdaily.com/news/detail?id=1059253,2026-01-29 04:46:44,自采原创
中央气象局：2月有4次冷空气过程影响我国，北方地区将出现阶段性强降温强降雪,https://www.jfdaily.com/news/detail?id=1059426,2026-01-29 04:45:02,转载摘编
冷知识：印度有三个“国庆日”,https://www.jfdaily.com/news/detail?id=1059427,2026-01-29 04:44:08,自采原创
今年印度阅兵有哪些亮点？,https://www.jfdaily.com/news/detail?id=1059423,2026-01-29 04:43:45,自采原创
泰国清迈一架军用飞机坠毁，初步报告显示2人死亡,https://www.jfdaily.com/news/detail?id=1059425,2026-01-29 04:41:22,转载摘编
３所985高校迎来新领导,https://www.jfdaily.com/news/detail?id=1059424,2026-01-29 04:38:27,转载摘编
上海晋元高中21年爱心接力：5396名师生入库，30位志愿者配对成功捐献,https://www.jfdaily.com/news/detail?id=1053350,2026-01-29 04:26:40,自采原创
店家宣称免费续面，游客续两次遭加价3元！民警质问：3块钱你都不愿意出！,https://www.jfdaily.com/news/detail?id=1059417,2026-01-29 04:20:23,整合改编
尹锡悦金建希创“首次”，韩国宪政史上前总统夫妇同时获实刑；国际金价突破5300美元关口,https://www.jfdaily.com/news/detail?id=1059227,2026-01-29 04:18:31,整合改编
马年“饺”好运！金山边检站护航，让远洋船员的年味不缺席,https://www.jfdaily.com/news/detail?id=1059259,2026-01-29 04:18:28,自采原创
护卫企业创新发展、亮剑“幽灵外卖”……长宁区检察院这场展示活动“料”很足,https://www.jfdaily.com/news/detail?id=1059251,2026-01-29 04:18:17,自采原创
马路中间1平方厘米的坑洼也能看清！徐汇市政道路养护巡检进入全域智能时代,https://www.jfdaily.com/news/detail?id=1059231,2026-01-29 04:18:07,自采原创
“暴力，美国的组成部分”——从“古德之死”起底美国执法暴力,https://www.jfdaily.com/news/detail?id=1059415,2026-01-29 04:16:50,转载摘编
上海生煎馒头的“鼻祖”回来了！消失21年的萝春阁回归，首日1.5h即售罄,https://www.jfdaily.com/news/detail?id=1059416,2026-01-29 04:16:17,整合改编
两个省会城市纪委书记调整,https://www.jfdaily.com/news/detail?id=1059413,2026-01-29 04:15:13,整合改编
13家俱乐部被罚，陈戌源李铁等73人被终身禁“足”,https://www.jfdaily.com/news/detail?id=1059412,2026-01-29 04:14:41,转载摘编
5位省部级领导，当选新职务,https://www.jfdaily.com/news/detail?id=1059411,2026-01-29 04:13:33,整合改编
本周人文社科类图书精选,https://www.jfdaily.com/news/detail?id=1059079,2026-01-29 04:12:11,约组外稿
冰雪温泉正当“燃”，六安“冷资源”加速向“热经济”转化,https://www.jfdaily.com/news/detail?id=1059159,2026-01-29 04:08:34,转载摘编
上海出台食品经营许可审查细则，支持业态创新，明确合规“边界”,https://www.jfdaily.com/news/detail?id=1059381,2026-01-29 04:08:20,自采原创
【直播】副馆长带你探营上海科技馆焕新开放,https://www.jfdaily.com/news/detail?id=1059408,2026-01-29 04:07:33,自采原创
2025年全年上海社会融资规模增加11632亿元,https://www.jfdaily.com/news/detail?id=1059391,2026-01-29 04:04:59,自采原创
金价狂飙！有交易所发布紧急通知，一黄金预定平台兑付困难，被曝涉百亿元,https://www.jfdaily.com/news/detail?id=1059376,2026-01-29 03:58:07,整合改编
中国准备太空采矿！,https://www.jfdaily.com/news/detail?id=1059405,2026-01-29 03:56:56,转载摘编
足球行业“假赌黑”问题专项整治行动发布，上海申花和海港俱乐部新赛季被罚分,https://www.jfdaily.com/news/detail?id=1059398,2026-01-29 03:55:55,自采原创
深视频|一落地，斯塔默就召集“商业天团”并喊话要把握中国机遇,https://www.jfdaily.com/news/detail?id=1059365,2026-01-29 03:54:11,自采原创
上海市2026年事业单位公开招聘公告发布,https://www.jfdaily.com/news/detail?id=1059328,2026-01-29 03:47:57,整合改编
突发：新赛季上海申花被罚10分，上海海港被罚5分,https://www.jfdaily.com/news/detail?id=1059395,2026-01-29 03:45:58,整合改编
市中心最大年宵花市为何火丨新民快评,https://www.jfdaily.com/news/detail?id=1059390,2026-01-29 03:42:51,自采原创
关键时刻，伊朗接收俄罗斯装备,https://www.jfdaily.com/news/detail?id=1059393,2026-01-29 03:39:24,转载摘编
明家犯罪集团案11名罪犯被执行死刑,https://www.jfdaily.com/news/detail?id=1059388,2026-01-29 03:32:19,转载摘编
呼和浩特市委书记：此次暗访，就是要从我做起,https://www.jfdaily.com/news/detail?id=1059386,2026-01-29 03:30:31,转载摘编
市人大常委会党组扩大会议传达学习习近平总书记重要讲话精神等,https://www.jfdaily.com/news/detail?id=1059314,2026-01-29 03:28:32,自采原创
上观碰碰头·许蜜桃佳言｜下一首国风金曲在哪,https://www.jfdaily.com/news/detail?id=1059380,2026-01-29 03:27:02,自采原创
侵占20亩农用地非法倾倒渣土！上海警方凌晨收网，7人被抓,https://www.jfdaily.com/news/detail?id=1059372,2026-01-29 03:24:16,自采原创
杨勤荣卸任山西省副省长,https://www.jfdaily.com/news/detail?id=1059371,2026-01-29 03:08:08,转载摘编
束珏婷已任商务部财务司司长,https://www.jfdaily.com/news/detail?id=1059370,2026-01-29 03:07:31,转载摘编
英法日等11国联合发声：强烈谴责,https://www.jfdaily.com/news/detail?id=1059369,2026-01-29 03:06:35,转载摘编
习近平会见英国首相斯塔默,https://www.jfdaily.com/news/detail?id=1059374,2026-01-29 03:05:07,转载摘编
深视频｜斯塔默抵达北京，英国首相时隔八年再次访华,https://www.jfdaily.com/news/detail?id=1059057,2026-01-29 03:04:17,自采原创
金融赋能AGI创新：浦发银行携手阶跃星辰共绘智能未来新图景,https://www.jfdaily.com/news/detail?id=1059366,2026-01-29 03:04:01,广告推广
【直播】长三角生态绿色一体化发展示范区“十四五”成果及“十五五”开局工作发布会,https://www.jfdaily.com/news/detail?id=1057658,2026-01-29 03:00:02,自采原创
用科技温暖守护银发一族，上海四院探索老年健康新路径,https://www.jfdaily.com/news/detail?id=1058852,2026-01-29 02:58:34,自采原创
上海创新视觉健康服务模式首次落地海外，柬埔寨百姓尝鲜中国AI技术筛眼病,https://www.jfdaily.com/news/detail?id=1059364,2026-01-29 02:58:07,自采原创
刘强东又给家乡送年货！礼物清单含AI大屏手机，有村民骑三轮车来领,https://www.jfdaily.com/news/detail?id=1059357,2026-01-29 02:50:11,整合改编
国铁集团：误购车票限时免费退票政策将常态化实施,https://www.jfdaily.com/news/detail?id=1059361,2026-01-29 02:47:23,转载摘编
2026年春节假期小客车上高速继续免收通行费,https://www.jfdaily.com/news/detail?id=1059360,2026-01-29 02:44:07,转载摘编
职业索赔，不能乱来！三部门发布5件警示案例，有人带蟑螂5次向餐馆要求免单赔偿,https://www.jfdaily.com/news/detail?id=1059351,2026-01-29 02:43:45,转载摘编
“拖把”和“抹布”的启示,https://www.jfdaily.com/news/detail?id=1058836,2026-01-29 02:40:28,约组外稿
