title,url,time,source
WTT新加坡大满贯：女单四强国乒占三席，男单又只剩独苗王楚钦,https://www.jfdaily.com/news/detail?id=1074138,2026-02-28 20:30:06,自采原创
很多人不解：伊朗为何成为国际局势风向标？,https://www.jfdaily.com/news/detail?id=1074113,2026-02-28 20:30:03,整合改编
澳波助教德比、武磊冠军补丁、新版京沪大战……今年超级杯信息量太大！,https://www.jfdaily.com/news/detail?id=1074101,2026-02-28 20:17:06,自采原创
WTT新加坡大满贯｜共情对手伤情，王楚钦只身进男单四强，女单四强国乒三席,https://www.jfdaily.com/news/detail?id=1074148,2026-02-28 20:02:02,自采原创
内塔尼亚胡：诸多迹象显示哈梅内伊已“不在人世”，伊朗外长称其“仍然活着”,https://www.jfdaily.com/news/detail?id=1074149,2026-02-28 19:29:23,整合改编
美国中情局在社交媒体招募伊朗线人,https://www.jfdaily.com/news/detail?id=1074153,2026-02-28 19:07:08,整合改编
美以联合打击伊朗丨伊朗首日超千人死伤，美以预计打击将持续数日,https://www.jfdaily.com/news/detail?id=1074152,2026-02-28 19:01:19,整合改编
美国明修栈道，以色列暗渡陈仓，对伊朗复刻委内瑞拉模式能成功吗？,https://www.jfdaily.com/news/detail?id=1074144,2026-02-28 16:41:23,自采原创
这一次，马克龙公然对美以唱了反调,https://www.jfdaily.com/news/detail?id=1074145,2026-02-28 16:36:42,自采原创
越剧实火！赵志刚、方亚芬、吴凤花助阵，《越动青春》专场谢幕来了,https://www.jfdaily.com/news/detail?id=1074146,2026-02-28 16:34:58,自采原创
伊朗称“从未面世的神秘武器”将投入使用，针对美军基地的新一轮攻击已开始,https://www.jfdaily.com/news/detail?id=1074143,2026-02-28 16:14:58,整合改编
《越动青春》专场热力爆棚，赵志刚方亚芬吴凤花携手助力越剧传承焕新,https://www.jfdaily.com/news/detail?id=1074129,2026-02-28 15:58:34,自采原创
受权发布丨中华人民共和国2025年国民经济和社会发展统计公报,https://www.jfdaily.com/news/detail?id=1074137,2026-02-28 15:23:34,转载摘编
“毛孩子”也有自己的游乐场！世纪公园宠物乐园将于3月8日正式对公众开放,https://www.jfdaily.com/news/detail?id=1074060,2026-02-28 14:54:52,自采原创
聚起社区烟火气，“元宵暖集”既传统又新潮,https://www.jfdaily.com/news/detail?id=1074076,2026-02-28 14:54:39,自采原创
【场面】水上烟花秀、国潮集市齐聚滴水湖畔，临港元宵奇妙夜震撼开秀,https://www.jfdaily.com/news/detail?id=1074086,2026-02-28 14:34:50,自采原创
垮塌大桥21份合同里竟有18份违法分包！大企业承建，“草台班子”干活……,https://www.jfdaily.com/news/detail?id=1074111,2026-02-28 14:17:05,转载摘编
伊朗最高领袖和总统目前状况良好,https://www.jfdaily.com/news/detail?id=1074110,2026-02-28 14:12:32,转载摘编
华人紧急逃离伊朗德黑兰：没想到袭击来得这么快！多趟国际航班被迫返航,https://www.jfdaily.com/news/detail?id=1074107,2026-02-28 14:03:24,整合改编
赵志刚、方亚芬、吴凤花助阵！《越动青春》专场演唱会开唱,https://www.jfdaily.com/news/detail?id=1074079,2026-02-28 14:00:10,自采原创
第二届上海市罕见病科普大赛决赛落幕，为罕见病患者及其家庭点亮生命之光,https://www.jfdaily.com/news/detail?id=1074098,2026-02-28 13:51:39,自采原创
苏州吴中：元宵限定，千架无人机表演秀,https://www.jfdaily.com/news/detail?id=1074096,2026-02-28 13:49:15,整合改编
20万小时/年！宁波：低空飞行服务平台9月试运行,https://www.jfdaily.com/news/detail?id=1074085,2026-02-28 13:49:10,整合改编
无锡：省级森林步道+3,https://www.jfdaily.com/news/detail?id=1074082,2026-02-28 13:49:03,整合改编
“年轻的城”举办滴水湖元宵奇妙夜，潮味十足！,https://www.jfdaily.com/news/detail?id=1074064,2026-02-28 13:49:01,自采原创
外交部发言人就美国和以色列军事打击伊朗答记者问,https://www.jfdaily.com/news/detail?id=1074097,2026-02-28 13:46:32,转载摘编
巴基斯坦否认战斗机被阿富汗击落：假消息，流传视频均为过去其他事件旧片段！,https://www.jfdaily.com/news/detail?id=1074099,2026-02-28 13:46:09,整合改编
给人民币汇率降温，央行用的什么工具？,https://www.jfdaily.com/news/detail?id=1074088,2026-02-28 13:38:14,自采原创
伊朗称已致至少200名美军死伤！以方：美以刺杀伊朗最高领袖和总统企图失败,https://www.jfdaily.com/news/detail?id=1074089,2026-02-28 13:37:14,整合改编
万亿增长空间待释放，入境游成服贸出口“新引擎”,https://www.jfdaily.com/news/detail?id=1074071,2026-02-28 13:31:58,自采原创
这里的元宵节超有料！烟花秀、鱼灯游、国潮集市…滴水湖元宵奇妙夜开秀,https://www.jfdaily.com/news/detail?id=1074083,2026-02-28 13:31:50,自采原创
国际罕见病日：每年新增6万例，这个“关节隐性杀手”需注意,https://www.jfdaily.com/news/detail?id=1074078,2026-02-28 13:31:37,自采原创
CF40研究预测：今年或为房地产下行周期最后一年，2027年有望企稳,https://www.jfdaily.com/news/detail?id=1074062,2026-02-28 13:25:16,自采原创
美以袭击致伊朗一学校51死60伤！现场一片废墟，民众崩溃尖叫……,https://www.jfdaily.com/news/detail?id=1074080,2026-02-28 13:17:36,整合改编
云深处科技创始人朱秋国：机器人不能只会后空翻,https://www.jfdaily.com/news/detail?id=1074075,2026-02-28 13:13:29,自采原创
上海战略性新兴产业破局检测难，民用飞机、人形机器人核心技术有突破,https://www.jfdaily.com/news/detail?id=1073968,2026-02-28 13:12:18,自采原创
最美巾帼红！浦东实施2026年巾帼建功行动，动员全区妇女立足岗位建功立业,https://www.jfdaily.com/news/detail?id=1074073,2026-02-28 13:09:22,自采原创
访华回国后的德总理默茨急了：去过中国你就知道，德国4天工作制无法维持繁荣,https://www.jfdaily.com/news/detail?id=1074074,2026-02-28 13:07:38,整合改编
伊朗称袭击美军基地已造成至少200名军人死伤,https://www.jfdaily.com/news/detail?id=1074072,2026-02-28 13:05:44,转载摘编
四川省宜宾五粮液集团有限公司党委书记、董事长曾从钦接受审查调查,https://www.jfdaily.com/news/detail?id=1074068,2026-02-28 13:04:50,转载摘编
高能级项目入驻、重磅合作落定！浦东老港正跑出高质量发展加速度,https://www.jfdaily.com/news/detail?id=1074070,2026-02-28 13:04:04,自采原创
全球多家公司宣布暂停石油与燃料船只通过霍尔木兹海峡,https://www.jfdaily.com/news/detail?id=1074069,2026-02-28 13:03:45,转载摘编
穆斯卡特：更换梅伦多是基于球队现有特点做出的决定，我会为此担责！,https://www.jfdaily.com/news/detail?id=1074061,2026-02-28 12:58:54,自采原创
烟花、鱼灯、国潮电音...临港元宵奇妙夜充满年轻人的专属浪漫,https://www.jfdaily.com/news/detail?id=1074020,2026-02-28 12:54:24,自采原创
伊朗反击，不设红线！导弹雨砸向以色列，打击中东四处美军基地,https://www.jfdaily.com/news/detail?id=1074059,2026-02-28 12:53:08,自采原创
"""青鸟”陈述会举行，18位青年作家实现从文字到影像的第一步",https://www.jfdaily.com/news/detail?id=1074012,2026-02-28 12:48:34,自采原创
主动投案，华润集团副总经理韩嵩被查,https://www.jfdaily.com/news/detail?id=1074043,2026-02-28 12:33:44,转载摘编
听得见画面 看得出故事：上海民乐团元宵节音乐会治愈全场,https://www.jfdaily.com/news/detail?id=1074033,2026-02-28 12:33:19,自采原创
习近平的两会之喻｜像石榴籽那样紧紧抱在一起,https://www.jfdaily.com/news/detail?id=1074056,2026-02-28 12:32:00,转载摘编
传习录丨为人民出政绩 以实干出政绩,https://www.jfdaily.com/news/detail?id=1074055,2026-02-28 12:31:44,转载摘编
习近平总书记引领中国从脱贫攻坚迈向乡村全面振兴,https://www.jfdaily.com/news/detail?id=1074057,2026-02-28 12:31:30,转载摘编
【城事】“毛孩子激动了一路” 世纪公园辟出1.2万平方米开设宠物友好天地,https://www.jfdaily.com/news/detail?id=1073892,2026-02-28 12:27:19,自采原创
部分赛事禁止使用遥控器，杭州国际具身机器人场景应用大赛发布，今起报名,https://www.jfdaily.com/news/detail?id=1074037,2026-02-28 12:18:23,自采原创
打好“人工智能+文化建设”的组合拳,https://www.jfdaily.com/news/detail?id=1071718,2026-02-28 12:16:03,约组外稿
中东局势影响出行计划？携程平台这些订单可无损退订,https://www.jfdaily.com/news/detail?id=1074017,2026-02-28 12:15:32,自采原创
下周一迎开学首日，早高峰提前半小时，北京交通部门倡导市民绿色、错峰出行,https://www.jfdaily.com/news/detail?id=1073965,2026-02-28 12:14:16,自采原创
182项赛事拉动效应358亿元，2025年上海体育交出亮眼成绩单,https://www.jfdaily.com/news/detail?id=1074034,2026-02-28 12:05:26,自采原创
探访上海宠物“幼稚园”后，记者发现这些“意想不到”,https://www.jfdaily.com/news/detail?id=1073747,2026-02-28 12:00:20,自采原创
夜读 | 宁白：东坡无人,https://www.jfdaily.com/news/detail?id=1073732,2026-02-28 12:00:02,自采原创
3月1日起浙江钱塘江等八大流域将全面进入禁渔期,https://www.jfdaily.com/news/detail?id=1074035,2026-02-28 11:52:07,转载摘编
