title,url,time,source
上海市长为新一批共30家跨国公司地区总部、15家外资研发中心颁发证书,https://www.jfdaily.com/news/detail?id=1083625,2026-03-18 13:36:31,自采原创
加快构建中国经济学自主知识体系，“中国政治经济学四十人论坛”举行,https://www.jfdaily.com/news/detail?id=1083078,2026-03-18 13:35:26,自采原创
“上海不光应该来，还得多开”，郭德纲：上海能开四五家德云社,https://www.jfdaily.com/news/detail?id=1083660,2026-03-18 13:33:23,整合改编
“没有厚此薄彼，都是轮着走”，郭德纲：演出队伍实行循环轮换,https://www.jfdaily.com/news/detail?id=1083656,2026-03-18 13:33:10,整合改编
八连胜！上海久事男篮主场战胜山东队,https://www.jfdaily.com/news/detail?id=1083616,2026-03-18 13:32:29,自采原创
致敬于漪：一个时代的教育回响,https://www.jfdaily.com/news/detail?id=1083504,2026-03-18 13:23:18,约组外稿
德云社上海分社开业，“咖啡+大蒜”能否带动演出消费新风潮？,https://www.jfdaily.com/news/detail?id=1083597,2026-03-18 13:19:05,自采原创
既要又要还要，特朗普陷入“不可能三角”,https://www.jfdaily.com/news/detail?id=1083641,2026-03-18 13:06:14,转载摘编
女子诉二婚丈夫：年龄大没钱、出轨还家暴！仍想复合！丈夫怒回：我宁愿打光棍,https://www.jfdaily.com/news/detail?id=1083642,2026-03-18 13:05:08,整合改编
上音将携16台23场亮相“上海之春”，中德联合制作《魔笛》压轴,https://www.jfdaily.com/news/detail?id=1083589,2026-03-18 13:04:13,自采原创
弗朗西斯·福山粗暴地误读了科耶夫的“历史终结”概念,https://www.jfdaily.com/news/detail?id=1081126,2026-03-18 13:02:36,约组外稿
来北虹桥，奔赴“创新领航地”新生活！,https://www.jfdaily.com/news/detail?id=1083628,2026-03-18 13:02:32,自采原创
上海德云社开业，郭德纲：这座城市很包容，南北曲艺是一家,https://www.jfdaily.com/news/detail?id=1083619,2026-03-18 12:58:23,自采原创
建“大体系”“大课堂”“大师资”，上海深化大中小学思想政治教育一体化建设,https://www.jfdaily.com/news/detail?id=1083429,2026-03-18 12:55:38,约组外稿
直击执法一线！B站9.9分纪录片《你好，12315》第二季开播收获好评,https://www.jfdaily.com/news/detail?id=1083564,2026-03-18 12:52:31,自采原创
AI如何辅助古装剧生产？《太平年》导演揭秘——,https://www.jfdaily.com/news/detail?id=1083620,2026-03-18 12:50:25,自采原创
视频丨习近平：我愿同你共商合作大计 推动中土关系像汗血宝马一样马不停蹄 一马当先,https://www.jfdaily.com/news/detail?id=1083632,2026-03-18 12:46:21,转载摘编
习近平会见土库曼斯坦民族领袖、人民委员会主席别尔德穆哈梅多夫,https://www.jfdaily.com/news/detail?id=1083634,2026-03-18 12:46:13,转载摘编
总书记的人民情怀丨“干事创业一定要树立正确政绩观”,https://www.jfdaily.com/news/detail?id=1083633,2026-03-18 12:46:06,转载摘编
奥运冠军带你跑入无锡阳山花海春风,https://www.jfdaily.com/news/detail?id=1083614,2026-03-18 12:45:00,自采原创
攻坚路，实干作答！上报集团全力奔赴深化主流媒体系统性变革“时代之约”,https://www.jfdaily.com/news/detail?id=1083631,2026-03-18 12:43:41,转载摘编
江苏如东：探寻“向海图强”实践路径,https://www.jfdaily.com/news/detail?id=1083293,2026-03-18 12:41:40,自采原创
新疆克拉玛依来沪推介，签约27个项目,https://www.jfdaily.com/news/detail?id=1083585,2026-03-18 12:41:30,自采原创
围绕深化开发区管理制度改革、推动高新区高质量发展，陈吉宁开展中央巡视反馈意见整改专题调研,https://www.jfdaily.com/news/detail?id=1083581,2026-03-18 12:37:30,自采原创
澡堂子的梨 | 赵大谿,https://www.jfdaily.com/news/detail?id=1080046,2026-03-18 12:37:03,约组外稿
前有“男二以下全部AI”，后脚“实名制”AI演员就来了，网友：给片酬吗？,https://www.jfdaily.com/news/detail?id=1083629,2026-03-18 12:31:34,自采原创
袋鼠妈妈被约谈批评,https://www.jfdaily.com/news/detail?id=1083626,2026-03-18 12:28:34,整合改编
太气人！业主投诉物业，反被举报到单位！“从哪知道我工作单位的？”,https://www.jfdaily.com/news/detail?id=1083623,2026-03-18 12:24:33,整合改编
“两山”理念下的江南有多美？叶梅《能不忆江南》里的生态乡愁与时代新生,https://www.jfdaily.com/news/detail?id=1083258,2026-03-18 12:18:50,约组外稿
公益编织课进社区，老学员带新学员传承指尖文化,https://www.jfdaily.com/news/detail?id=1083603,2026-03-18 12:16:14,自采原创
上海职工代表共读《习近平与一线职工朋友们》,https://www.jfdaily.com/news/detail?id=1083599,2026-03-18 12:15:51,自采原创
第31届上海电视节将于6月22日至26日举行,https://www.jfdaily.com/news/detail?id=1083537,2026-03-18 12:14:25,自采原创
首家入选“上海老字号”的国有文艺院团揭晓：上海话剧艺术中心,https://www.jfdaily.com/news/detail?id=1082888,2026-03-18 12:14:14,自采原创
像巧克力般丝滑！英国名团BBC交响乐团“上海之春”东艺奏响双重纪念乐章,https://www.jfdaily.com/news/detail?id=1083503,2026-03-18 12:14:03,自采原创
深度 | 本想春风得意，谁知如履薄冰，高市“白宫赶考”能否过关？,https://www.jfdaily.com/news/detail?id=1083561,2026-03-18 12:11:02,自采原创
松江区中心医院后门这条路，终于不堵了,https://www.jfdaily.com/news/detail?id=1083560,2026-03-18 12:10:05,自采原创
动人的故事，榜样的力量，浦东青年在岗位展示中互学,https://www.jfdaily.com/news/detail?id=1083563,2026-03-18 12:09:01,自采原创
等了3年！周杰伦新专辑《太阳之子》来了，粉丝逐帧破译预告线索,https://www.jfdaily.com/news/detail?id=1083601,2026-03-18 12:07:55,自采原创
快观察｜反对伊朗战事，特朗普政府首位高官辞职，暴露了什么？,https://www.jfdaily.com/news/detail?id=1083531,2026-03-18 12:06:02,自采原创
今天上午宁城路近国和路室外停车区起火 幸无人员伤亡,https://www.jfdaily.com/news/detail?id=1083522,2026-03-18 12:05:31,自采原创
极度郁闷！上海乘客遭航空公司无故“降舱”，赔付标准被指“自说自话”,https://www.jfdaily.com/news/detail?id=1083549,2026-03-18 12:05:22,自采原创
夜读｜何常在：趣邻轶事,https://www.jfdaily.com/news/detail?id=1083151,2026-03-18 12:00:02,自采原创
韩国上调资源安全危机预警级别，拟实施车辆限行,https://www.jfdaily.com/news/detail?id=1083604,2026-03-18 11:59:11,转载摘编
输液太慢能自行调快吗？,https://www.jfdaily.com/news/detail?id=1083501,2026-03-18 11:59:03,约组外稿
伊朗南帕尔斯石化设施遭袭,https://www.jfdaily.com/news/detail?id=1083606,2026-03-18 11:58:48,转载摘编
文汇海报 | 13年没发顶刊的团队攻克世界难题,https://www.jfdaily.com/news/detail?id=1083491,2026-03-18 11:56:55,自采原创
快看视频 | 上台后首次访美，高市早苗想借船出海,https://www.jfdaily.com/news/detail?id=1083556,2026-03-18 11:56:03,自采原创
巨响如同爆炸！一块7吨重陨石在美东部上空解体,https://www.jfdaily.com/news/detail?id=1083598,2026-03-18 11:53:34,转载摘编
盲盒饭局：这届年轻人为何在为“和陌生人吃饭”买单？,https://www.jfdaily.com/news/detail?id=1083431,2026-03-18 11:49:12,自采原创
【场面】上海德云社剧场开业，郭德纲于谦连演3天压轴,https://www.jfdaily.com/news/detail?id=1083508,2026-03-18 11:49:04,自采原创
《太平年》《三体》导演新作亮相，《苍穹以北》将聚焦大国重器“北斗”,https://www.jfdaily.com/news/detail?id=1083425,2026-03-18 11:46:52,自采原创
习近平会见土库曼斯坦民族领袖、人民委员会主席别尔德穆哈梅多夫,https://www.jfdaily.com/news/detail?id=1083600,2026-03-18 11:46:03,转载摘编
“声动闵行·我是歌王”2026市民歌手争霸赛启动,https://www.jfdaily.com/news/detail?id=1083592,2026-03-18 11:41:19,自采原创
一夜店派对致13人感染，2死11病危！可24小时内夺命，很多健康人携带它,https://www.jfdaily.com/news/detail?id=1083587,2026-03-18 11:41:11,整合改编
再延长30年！我国全面开展农村承包地二轮到期延包整省试点,https://www.jfdaily.com/news/detail?id=1083595,2026-03-18 11:38:48,转载摘编
她走了，年仅21岁！告别信全网泪目！这种病恶化极快，我国每年新增4万病例,https://www.jfdaily.com/news/detail?id=1083590,2026-03-18 11:35:34,整合改编
熬夜打游戏+连喝两场酒，男子酒精中毒身亡！家属向同饮者及店家索赔78万元,https://www.jfdaily.com/news/detail?id=1083588,2026-03-18 11:35:06,整合改编
全国青年茶人文化节启幕！来豫园，喝一杯超有戏的茶,https://www.jfdaily.com/news/detail?id=1083584,2026-03-18 11:33:54,自采原创
时隔近百年，首获国际认可的两幅中国油画申城同台亮相,https://www.jfdaily.com/news/detail?id=1083593,2026-03-18 11:30:42,自采原创
市委中心组学习会专题学习习近平总书记关于树立和践行正确政绩观的重要论述,https://www.jfdaily.com/news/detail?id=1083565,2026-03-18 11:15:43,自采原创
