title,url,time,source
东安县联合调查组发布情况通报,https://www.jfdaily.com/news/detail?id=1108951,2026-05-08 06:01:12,转载摘编
市质子重离子医院发布新版“粒子放疗患者生存数据报告”，重离子技术优势凸显,https://www.jfdaily.com/news/detail?id=1108901,2026-05-08 06:01:02,自采原创
解禁杀伤性武器出口后，日本不再掩饰“海外主动出击”的真实企图,https://www.jfdaily.com/news/detail?id=1108833,2026-05-08 05:59:58,自采原创
全球地缘政治博弈之下，为何西方国家愈发重视葡共体的战略价值？,https://www.jfdaily.com/news/detail?id=1108835,2026-05-08 05:59:44,自采原创
乌克兰无人机要在俄罗斯阅兵式刷存在感？,https://www.jfdaily.com/news/detail?id=1108915,2026-05-08 05:58:57,自采原创
秦政任吉林省政府副秘书长,https://www.jfdaily.com/news/detail?id=1108949,2026-05-08 05:58:01,转载摘编
张敏已任河南省常务副省长,https://www.jfdaily.com/news/detail?id=1108948,2026-05-08 05:57:14,转载摘编
深海评｜阿联酋退出欧佩克带来多大影响？,https://www.jfdaily.com/news/detail?id=1108917,2026-05-08 05:55:47,约组外稿
中国男子讲述乘坐涉疫邮轮经历：我前一天下船，汉坦病毒感染者第二天登船,https://www.jfdaily.com/news/detail?id=1108946,2026-05-08 05:52:01,转载摘编
出租车司机“狂喷”乘客，当地通报,https://www.jfdaily.com/news/detail?id=1108940,2026-05-08 05:49:27,转载摘编
国际卵巢癌日：早识别、早诊断，警惕卵巢癌的“伪装”信号,https://www.jfdaily.com/news/detail?id=1108884,2026-05-08 05:48:53,自采原创
中疾控：我国无感染病例报告，无本次涉疫汉坦病毒自然宿主分布,https://www.jfdaily.com/news/detail?id=1108943,2026-05-08 05:47:16,转载摘编
卢希望去代转正，当选信阳市市长,https://www.jfdaily.com/news/detail?id=1108942,2026-05-08 05:45:52,整合改编
广西两头蛇，被发现了,https://www.jfdaily.com/news/detail?id=1108938,2026-05-08 05:34:10,转载摘编
不再让小区公共收益成“糊涂账”丨新民随笔,https://www.jfdaily.com/news/detail?id=1108931,2026-05-08 05:32:08,自采原创
花卉节不“散场”丨新民快评,https://www.jfdaily.com/news/detail?id=1108933,2026-05-08 05:32:00,自采原创
芒果TV宣布《亲爱的·客栈2026》《乘风2026》等推迟播出：以悼念！,https://www.jfdaily.com/news/detail?id=1108932,2026-05-08 05:31:17,整合改编
印尼一火山喷发致约20名登山者受困,https://www.jfdaily.com/news/detail?id=1108930,2026-05-08 05:21:40,转载摘编
青春光影定义心动上海！,https://www.jfdaily.com/news/detail?id=1108928,2026-05-08 05:21:30,自采原创
美国国际贸易法院公布裁决：特朗普政府征收10%全球进口关税的法律依据不成立，白宫此前公告无效,https://www.jfdaily.com/news/detail?id=1108929,2026-05-08 05:21:02,转载摘编
俄罗斯公布胜利日阅兵日程，再次呼吁各国及时从基辅撤离人员,https://www.jfdaily.com/news/detail?id=1108926,2026-05-08 05:20:36,转载摘编
上海梅开二度的奥运资格赛举办地，为什么是西岸？,https://www.jfdaily.com/news/detail?id=1108909,2026-05-08 05:20:23,自采原创
茅奖作品改编剧《主角》即将开播，听听作者陈彦怎么谈原著,https://www.jfdaily.com/news/detail?id=1108925,2026-05-08 05:18:21,自采原创
上观碰碰头一起做晚FANS | 浩峰看世界 日本的跪,https://www.jfdaily.com/news/detail?id=1108357,2026-05-08 05:16:02,自采原创
14岁少年买竹叶青当宠物，结果被反咬一口！又到蛇咬伤多发期，这些事得知道,https://www.jfdaily.com/news/detail?id=1108817,2026-05-08 05:15:13,自采原创
美媒说美国务院正在审查所有墨西哥驻美领事馆,https://www.jfdaily.com/news/detail?id=1108921,2026-05-08 05:12:02,转载摘编
伊朗发生4.5级地震,https://www.jfdaily.com/news/detail?id=1108924,2026-05-08 05:11:54,转载摘编
“4只皮皮虾1035元”店主事发次日病逝，年仅43岁，家人称此前已脑出血,https://www.jfdaily.com/news/detail?id=1108918,2026-05-08 05:08:55,整合改编
一张村民收入与支出调查表，为啥成了浦东最南端这个经济薄弱村的振兴支点？,https://www.jfdaily.com/news/detail?id=1091472,2026-05-08 05:02:34,自采原创
香港1.7亿元拿下世界杯转播权，中国大陆转播权依旧悬而未决,https://www.jfdaily.com/news/detail?id=1108893,2026-05-08 05:02:17,整合改编
笑迎“世界微笑日”，你的嘴角“营业”了吗？,https://www.jfdaily.com/news/detail?id=1108858,2026-05-08 05:00:07,整合改编
月壤研究有了新发现，碳质小行星撞击地月系统时间晚于预期,https://www.jfdaily.com/news/detail?id=1108916,2026-05-08 04:59:11,转载摘编
深视频 | 墨西哥一购物广场发生特大火灾,https://www.jfdaily.com/news/detail?id=1108854,2026-05-08 04:54:34,自采原创
燃油价格暴涨，全球多家航司削减逾7.5万个夏季航班,https://www.jfdaily.com/news/detail?id=1108907,2026-05-08 04:39:17,转载摘编
光影无声爱有声，萌宝皮影《你的选择》演绎生命奇迹,https://www.jfdaily.com/news/detail?id=1108906,2026-05-08 04:37:48,自采原创
腰围变粗、莫名腹胀要当心！警惕卵巢癌的“伪装”信号,https://www.jfdaily.com/news/detail?id=1108895,2026-05-08 04:25:34,自采原创
自媒体博主称胖东来电器“套取国补，价格欺诈”，胖东来回应,https://www.jfdaily.com/news/detail?id=1108903,2026-05-08 04:23:26,转载摘编
钱江摩托：从未“围剿”张雪机车,https://www.jfdaily.com/news/detail?id=1108899,2026-05-08 04:19:44,转载摘编
山东省纪委监委通报：刘红军被查,https://www.jfdaily.com/news/detail?id=1108898,2026-05-08 04:17:47,转载摘编
湖南浏阳烟花厂爆炸事故已致37人死亡1人失联,https://www.jfdaily.com/news/detail?id=1108896,2026-05-08 04:12:41,转载摘编
当海外网友“Becoming Chinese”：中式养生习惯看过来！,https://www.jfdaily.com/news/detail?id=1108850,2026-05-08 04:11:07,约组外稿
“潦草小狗”延迟退休至少3个月并全网征名，它的朋友长颈鹿怎么办？,https://www.jfdaily.com/news/detail?id=1108849,2026-05-08 04:08:48,自采原创
“香港淡马锡”首次背书，阶跃星辰融资近25亿美元，冲刺港股大模型第三股,https://www.jfdaily.com/news/detail?id=1108860,2026-05-08 04:05:26,自采原创
80%城市居民已无法裸眼看银河！上海天文馆球幕互动天文秀带你“找回”星空,https://www.jfdaily.com/news/detail?id=1108887,2026-05-08 04:03:34,自采原创
受贿数额特别巨大，东航原董事长刘绍勇被提起公诉,https://www.jfdaily.com/news/detail?id=1108894,2026-05-08 03:54:29,整合改编
嘀嗒顺风车同行邀请再升级：“语音邀请+关注行程”让同路人合乘更快捷,https://www.jfdaily.com/news/detail?id=1108862,2026-05-08 03:42:39,自采原创
国际能源署署长说可能进一步释放战略石油储备,https://www.jfdaily.com/news/detail?id=1108890,2026-05-08 03:42:38,转载摘编
夫妻哽咽发声！这两地宣布：一年内互免景区门票；网友：这才是我们想要的生活,https://www.jfdaily.com/news/detail?id=1108880,2026-05-08 03:28:54,整合改编
智能汽车行业如何突围？他用6000多项专利给出答案,https://www.jfdaily.com/news/detail?id=1104340,2026-05-08 03:22:19,自采原创
“上观碰碰头·秋秋不睡午觉”：聊聊年终奖,https://www.jfdaily.com/news/detail?id=1108829,2026-05-08 03:18:40,自采原创
非法收受他人财物，数额特别巨大！东航原董事长刘绍勇被逮捕、提起公诉,https://www.jfdaily.com/news/detail?id=1108881,2026-05-08 03:18:20,整合改编
俄罗斯宣布8日起停火；特朗普证实美3艘军舰遭袭，威胁伊朗“速签协议”,https://www.jfdaily.com/news/detail?id=1108814,2026-05-08 03:14:37,整合改编
李佳琦直播间市集连续第二年助阵上海国际花卉节,https://www.jfdaily.com/news/detail?id=1108879,2026-05-08 03:13:23,自采原创
网友称坐出租车被司机一路“狂喷”，官方通报：涉事驾驶员被记扣20分,https://www.jfdaily.com/news/detail?id=1108848,2026-05-08 03:11:03,整合改编
上海大模型公司阶跃星辰将完成近25亿美元融资，加速冲刺港股IPO,https://www.jfdaily.com/news/detail?id=1108859,2026-05-08 03:00:13,自采原创
上海小菜场有多魔幻？0.98元/斤的小青菜、1000多元的帝王蟹都能买到,https://www.jfdaily.com/news/detail?id=1108826,2026-05-08 02:55:11,自采原创
解放军报评论员：坚持有腐必反、有贪必肃,https://www.jfdaily.com/news/detail?id=1108852,2026-05-08 02:52:20,整合改编
天舟十号将于近日择机发射，船箭组合体转运至发射区,https://www.jfdaily.com/news/detail?id=1108861,2026-05-08 02:52:15,转载摘编
上海攻坚物业治理：提质增效破局“小弱散”、规范业委会管好“钱袋子”,https://www.jfdaily.com/news/detail?id=1108831,2026-05-08 02:50:40,自采原创
特朗普：美3艘军舰成功穿越霍尔木兹海峡，敦促伊朗“迅速”签署协议,https://www.jfdaily.com/news/detail?id=1108856,2026-05-08 02:44:55,转载摘编
