title,url,time,source
首次超越：“中国上升9位，美国下降11位”！,https://www.jfdaily.com/news/detail?id=1084180,2026-03-19 13:24:08,整合改编
深度 | 打破禁忌，重大升级！“能源战”打响，美以却陷“罗生门”？,https://www.jfdaily.com/news/detail?id=1084074,2026-03-19 13:22:02,自采原创
职工就医有专属通道，上海建成30余家“职工e务室”，将扩大覆盖面完善分诊,https://www.jfdaily.com/news/detail?id=1084091,2026-03-19 13:18:00,自采原创
铭记场面| 三军用命！上海久事112-96山东高速，斩获主场十五连胜,https://www.jfdaily.com/news/detail?id=1083702,2026-03-19 13:15:29,自采原创
数字化赋能！松江这个蓝莓基地尽显“科技范儿”,https://www.jfdaily.com/news/detail?id=1083882,2026-03-19 13:15:03,自采原创
美国情报机构称中方并无“2027攻台计划”，外交部回应,https://www.jfdaily.com/news/detail?id=1084182,2026-03-19 13:14:44,整合改编
苏州河畔出现“高原花海”！2026年上海市消费帮扶系列活动启动,https://www.jfdaily.com/news/detail?id=1084129,2026-03-19 13:09:55,自采原创
三千留言勾勒“家”的温暖底色，“我与上海不可分割”开启“城市”篇章,https://www.jfdaily.com/news/detail?id=1084116,2026-03-19 13:09:51,自采原创
特朗普称对以色列袭击伊朗油气设施“毫不知情”，卡塔尔是“无辜躺枪”,https://www.jfdaily.com/news/detail?id=1084178,2026-03-19 13:06:58,整合改编
看“颜值”还是重数据？上海先和市民对齐河湖治理颗粒度,https://www.jfdaily.com/news/detail?id=1084096,2026-03-19 13:05:46,自采原创
我国科学家破解锂电池“怕冷”难题，电动车续航有望破1000公里,https://www.jfdaily.com/news/detail?id=1083913,2026-03-19 13:01:14,自采原创
“徐老大”，为何又跨省摇人？,https://www.jfdaily.com/news/detail?id=1083860,2026-03-19 12:55:10,自采原创
伊朗最高领袖哀悼“事实上的领导人”拉里贾尼，称凶手必须付出代价,https://www.jfdaily.com/news/detail?id=1084145,2026-03-19 12:51:04,整合改编
女子体检被出具3份不同CT报告，经历“过山车”式惊吓！医院通报致歉,https://www.jfdaily.com/news/detail?id=1084149,2026-03-19 12:50:58,整合改编
“番茄炒蛋”回归？中国男足新款球衣亮相，还记得曾经的那些经典款吗？,https://www.jfdaily.com/news/detail?id=1084070,2026-03-19 12:49:59,自采原创
下个月，上海申花的青年军有望与阿森纳维拉狼队等英超劲旅过招？,https://www.jfdaily.com/news/detail?id=1084058,2026-03-19 12:49:50,自采原创
阿联酋称拦截来自伊朗的7枚弹道导弹和15架无人机,https://www.jfdaily.com/news/detail?id=1084143,2026-03-19 12:49:16,转载摘编
知名品牌宣布销毁产品、紧急下架！消费者懵了：一家老小天天吃，到底能吃吗？,https://www.jfdaily.com/news/detail?id=1084128,2026-03-19 12:42:19,整合改编
红烧肉别传——乱书房食单之三 | 谢冕,https://www.jfdaily.com/news/detail?id=1080359,2026-03-19 12:37:03,约组外稿
路虎1分钟8次别停奔驰致追尾，此前未予立案！最新通报：采取刑事强制措施,https://www.jfdaily.com/news/detail?id=1084050,2026-03-19 12:36:45,整合改编
【讲习所】共产党人的政绩，就是做得人心、暖人心、稳人心的事,https://www.jfdaily.com/news/detail?id=1084137,2026-03-19 12:36:12,转载摘编
联播+｜在“钢铁驼队”旁 习近平连发四问,https://www.jfdaily.com/news/detail?id=1084136,2026-03-19 12:35:54,转载摘编
“小龙虾”+“一人公司”=单人成军，全球开发者先锋大会聚焦这群“弄潮儿”,https://www.jfdaily.com/news/detail?id=1084113,2026-03-19 12:35:37,自采原创
世界模型才是未来！智元宣布携手英伟达共建物理AI标准生态加速全球部署,https://www.jfdaily.com/news/detail?id=1084077,2026-03-19 12:35:28,自采原创
儿童优先！上海发布儿童友好城市建设三年行动方案,https://www.jfdaily.com/news/detail?id=1084108,2026-03-19 12:35:16,自采原创
5年128项重点任务落地率超96%，虹桥国际开放枢纽“基本建成”,https://www.jfdaily.com/news/detail?id=1084097,2026-03-19 12:35:08,自采原创
重磅微视频丨为民出政绩 实干出政绩,https://www.jfdaily.com/news/detail?id=1084135,2026-03-19 12:34:55,转载摘编
快观察 | 掐灭特朗普希望，美联储为何不但不降息，还谈加息？,https://www.jfdaily.com/news/detail?id=1084039,2026-03-19 12:29:02,自采原创
快看视频｜瞄准能源设施 ，伊朗战争“新阶段”？美以分歧有多大？,https://www.jfdaily.com/news/detail?id=1084081,2026-03-19 12:28:02,自采原创
菲律宾抵近部署导弹，妄图封锁重要水道,https://www.jfdaily.com/news/detail?id=1084126,2026-03-19 12:23:12,转载摘编
【演界】四十五载情缘再续，BBC 交响乐团奏响上海之春首个华章,https://www.jfdaily.com/news/detail?id=1083975,2026-03-19 12:10:41,自采原创
【上海一周】新征程上的“试验田”,https://www.jfdaily.com/news/detail?id=1083841,2026-03-19 12:08:55,自采原创
作曲家龚国泰逝世，曾参与《智取威虎山》《曹操与杨修》《盘丝洞》创作,https://www.jfdaily.com/news/detail?id=1084073,2026-03-19 12:07:01,自采原创
虹桥国际开放枢纽GDP实现万亿元跨越，接下来要迈向“全面建成”,https://www.jfdaily.com/news/detail?id=1084115,2026-03-19 12:06:04,自采原创
发出“向肝胆外科进军”号召70年后，他们靠“一管血”给肝癌早诊立下新标准,https://www.jfdaily.com/news/detail?id=1084012,2026-03-19 12:05:06,自采原创
华为2026合作伙伴大会召开：AI落地提速，五大举措加码伙伴生态,https://www.jfdaily.com/news/detail?id=1084099,2026-03-19 12:01:19,自采原创
夜读 | 李舒：金农的月亮,https://www.jfdaily.com/news/detail?id=1083828,2026-03-19 12:00:02,自采原创
事关虹桥枢纽“十五五”建设，三省一市在苏州召开协调推进工作会,https://www.jfdaily.com/news/detail?id=1083997,2026-03-19 11:53:23,自采原创
伊朗动用新一代自杀式无人机机群，对以色列发动报复性打击,https://www.jfdaily.com/news/detail?id=1084104,2026-03-19 11:42:36,转载摘编
在复兴岛开放空间，陈吉宁龚正黄莉新胡文容参加全民义务植树,https://www.jfdaily.com/news/detail?id=1084068,2026-03-19 11:42:23,自采原创
热点前瞻 | 高市“走钢丝之旅”，稍有不慎就可能跌落,https://www.jfdaily.com/news/detail?id=1083452,2026-03-19 11:37:52,自采原创
腾讯青云实习生招募启动！来“鹅厂”，一起打造下一个爆款,https://www.jfdaily.com/news/detail?id=1084072,2026-03-19 11:22:12,自采原创
“投资眉山”长三角招商大会启幕，发布3000亿元机遇清单,https://www.jfdaily.com/news/detail?id=1084080,2026-03-19 11:20:31,自采原创
黄浦已有2万老人受益于免费筛查，背后有份提案在推动……,https://www.jfdaily.com/news/detail?id=1083985,2026-03-19 11:19:50,自采原创
九成幼儿园开托班，上海学前教育如何做到？,https://www.jfdaily.com/news/detail?id=1084071,2026-03-19 11:19:38,自采原创
情绪经济驱动文旅新消费，2026上海旅博会解锁百业融合新生态,https://www.jfdaily.com/news/detail?id=1084060,2026-03-19 11:18:55,自采原创
方言土语配农民画，枫泾古镇的“年报摊头”为何能让商户频频点赞？,https://www.jfdaily.com/news/detail?id=1083973,2026-03-19 11:13:45,自采原创
更好筑牢生态基底、构筑生态优势！上海市河湖长制林长制工作会议举行,https://www.jfdaily.com/news/detail?id=1084063,2026-03-19 11:07:33,自采原创
疏通老小区“毛细血管”，党建联建把实事办到居民心坎上,https://www.jfdaily.com/news/detail?id=1084069,2026-03-19 11:05:16,自采原创
方言脱口秀、科技装备展示、精准宣教齐上阵，守护农村地区道路安全,https://www.jfdaily.com/news/detail?id=1084042,2026-03-19 11:00:31,自采原创
中国首份！洋山港海事局这项提案获国际海事组织采纳,https://www.jfdaily.com/news/detail?id=1084053,2026-03-19 11:00:24,自采原创
上海第九人民医院浦东新院区明天启用！新设口腔首诊中心，看牙更便捷,https://www.jfdaily.com/news/detail?id=1084065,2026-03-19 10:54:58,自采原创
电影《时间旅馆》3月20日上映，20年前“BBS网恋”能否触动当下观众？,https://www.jfdaily.com/news/detail?id=1084038,2026-03-19 10:46:20,自采原创
LABUBU真人电影要来了，《帕丁顿熊》导演保罗·金执导，还有好莱坞班底,https://www.jfdaily.com/news/detail?id=1083978,2026-03-19 10:45:27,自采原创
香港遇难消防员殉职经过披露：误入楼栋发Mayday信号，31楼破窗逃生…,https://www.jfdaily.com/news/detail?id=1084048,2026-03-19 10:44:06,整合改编
本轮美以伊冲突以来，拉法口岸首次恢复双向通行,https://www.jfdaily.com/news/detail?id=1084067,2026-03-19 10:40:44,转载摘编
资深出版人疾呼：少儿出版成了伪出版！复旦大学教授严锋：应该反思工具化教育,https://www.jfdaily.com/news/detail?id=1084021,2026-03-19 10:39:50,自采原创
去年我国共实施消费品召回1081次，较上年下降1.7%,https://www.jfdaily.com/news/detail?id=1084061,2026-03-19 10:34:51,转载摘编
进口食品安全监管有新规 肉类、水产品等进口需官方推荐注册,https://www.jfdaily.com/news/detail?id=1084062,2026-03-19 10:33:16,转载摘编
“上海视听”精品组团亮相第30届香港国际影视展,https://www.jfdaily.com/news/detail?id=1084023,2026-03-19 10:31:27,自采原创
