title,url,time,source
知名经济学家王连洲去世,https://www.jfdaily.com/news/detail?id=1143536,2026-07-13 03:39:36,转载摘编
“巴威”对上海影响逐渐减弱！轮渡、客轮最新情况→,https://www.jfdaily.com/news/detail?id=1143533,2026-07-13 03:35:22,转载摘编
沈阳、抚顺、锦州、铁岭、盘锦等地停课、停业、停工,https://www.jfdaily.com/news/detail?id=1143530,2026-07-13 03:33:20,转载摘编
“上观碰碰头·秋秋不睡午觉”：聊聊台风“巴威”一线见闻,https://www.jfdaily.com/news/detail?id=1143491,2026-07-13 03:27:47,自采原创
上周2名中管干部落马，李建波已卸任7年多；中候补方红卫被“双开”,https://www.jfdaily.com/news/detail?id=1143503,2026-07-13 03:21:07,整合改编
泰国曼谷酒吧火灾致27人遇难22人伤势危重，中使馆：暂无中国公民遇难,https://www.jfdaily.com/news/detail?id=1143496,2026-07-13 03:20:56,整合改编
官方通报“14岁女生放学后失联”：已顺利找到，身心状态一切正常,https://www.jfdaily.com/news/detail?id=1143519,2026-07-13 03:20:50,整合改编
美军：完成对伊朗新一轮进攻性打击，首次使用无人艇袭击,https://www.jfdaily.com/news/detail?id=1143522,2026-07-13 03:09:03,转载摘编
跨越三百年重读聊斋：平凡人的坚守，最动人的人间理想,https://www.jfdaily.com/news/detail?id=1143517,2026-07-13 02:59:48,自采原创
伊朗媒体称中东多地美军基地发生爆炸,https://www.jfdaily.com/news/detail?id=1143518,2026-07-13 02:56:48,转载摘编
六盘水市市长李巍，已任市委书记，前任已任黔东南州委书记,https://www.jfdaily.com/news/detail?id=1143515,2026-07-13 02:51:19,整合改编
今年第11号台风“海神”生成，对我国海域无影响,https://www.jfdaily.com/news/detail?id=1143516,2026-07-13 02:49:34,转载摘编
黎明前的黑夜，一位父亲的76字遗嘱,https://www.jfdaily.com/news/detail?id=1143512,2026-07-13 02:45:42,转载摘编
“宠物狗使用公共直饮水”引争议，多地回应,https://www.jfdaily.com/news/detail?id=1143485,2026-07-13 02:44:05,整合改编
“沈阳暴雨”上热搜！台风“巴威”继续北上，沈阳发布居家办公通知，客运停运,https://www.jfdaily.com/news/detail?id=1143483,2026-07-13 02:43:54,整合改编
百亿新赛道爆发！在长三角，比算力更珍贵的是科学数据,https://www.jfdaily.com/news/detail?id=1143505,2026-07-13 02:42:45,自采原创
特朗普命令全国降半旗,https://www.jfdaily.com/news/detail?id=1143507,2026-07-13 02:39:46,转载摘编
《百年传动》第8集：“扁担电机”精神的回响，国企市场化转型报春花,https://www.jfdaily.com/news/detail?id=1141905,2026-07-13 02:34:13,广告推广
我驻泰使馆：暂无中国公民在曼谷酒吧火灾中遇难,https://www.jfdaily.com/news/detail?id=1143500,2026-07-13 02:30:14,转载摘编
流量来了，然后呢？两年后，看城市屋顶的“再进化”,https://www.jfdaily.com/news/detail?id=1143310,2026-07-13 02:28:18,自采原创
举杯美加墨·场外音丨李元春：现在，世界杯拿着四种剧本，法西英阿谁笑到最后,https://www.jfdaily.com/news/detail?id=1143356,2026-07-13 02:25:54,自采原创
新民艺评｜孙佳音：《功夫女足》上映，观众还欠周星驰一张电影票吗？,https://www.jfdaily.com/news/detail?id=1143377,2026-07-13 02:22:40,自采原创
看马王堆，看中国人的生命世界 | 项苙苹,https://www.jfdaily.com/news/detail?id=1135276,2026-07-13 02:18:46,约组外稿
安徽大学通报“拟录用被期刊认定学术不端博士”：正依规严肃复核,https://www.jfdaily.com/news/detail?id=1143492,2026-07-13 02:14:18,转载摘编
曼谷酒吧火灾伤亡惨重：27人遇难63人受伤，关键调查启动；美军中央司令部：已对伊朗发动新一轮打击,https://www.jfdaily.com/news/detail?id=1143476,2026-07-13 02:11:07,整合改编
国际足联主席回应“世界杯或扩军至64队”,https://www.jfdaily.com/news/detail?id=1143489,2026-07-13 02:05:11,转载摘编
“空”与“有” | 王方晨,https://www.jfdaily.com/news/detail?id=1136339,2026-07-13 02:05:02,约组外稿
从“工具使用”到“智能体共创”，同济大学与腾讯云共探AI赋能教育新范式,https://www.jfdaily.com/news/detail?id=1143418,2026-07-13 02:02:58,自采原创
视频丨河水暴涨道路被淹，“巴威”过境后抢修救援抓紧进行,https://www.jfdaily.com/news/detail?id=1143488,2026-07-13 01:55:34,转载摘编
国产工业软件跑出加速度（新场景新动能）,https://www.jfdaily.com/news/detail?id=1143487,2026-07-13 01:54:35,转载摘编
上半年高频数据折射我国经济稳中向优,https://www.jfdaily.com/news/detail?id=1143486,2026-07-13 01:54:03,转载摘编
国际油价，涨超3%,https://www.jfdaily.com/news/detail?id=1143484,2026-07-13 01:50:13,转载摘编
痛别！上海著名文学评论家杨匡汉逝世,https://www.jfdaily.com/news/detail?id=1143480,2026-07-13 01:43:02,转载摘编
“巴威”北上，东北等地强降雨连连，南方多地闷热加剧,https://www.jfdaily.com/news/detail?id=1143482,2026-07-13 01:42:30,转载摘编
李君如：管党治党、兴党强党的根本遵循和行动指南,https://www.jfdaily.com/news/detail?id=1138938,2026-07-13 01:37:56,约组外稿
广西一动物园被淹，工作人员为防猛兽外逃冒险锁死兽舍，自己被困集装箱6小时,https://www.jfdaily.com/news/detail?id=1143477,2026-07-13 01:35:32,整合改编
瑟洛特“没传球给哈兰德”遭网暴，回应：想传，但路线被挡住；女友也被殃及,https://www.jfdaily.com/news/detail?id=1143469,2026-07-13 01:35:24,整合改编
内蒙古16岁田径少年被捅身亡，母亲发声：“他们和嫌疑人没有发生矛盾”,https://www.jfdaily.com/news/detail?id=1143474,2026-07-13 01:26:36,整合改编
伊朗发表最新声明：强烈谴责美军侵略性袭击,https://www.jfdaily.com/news/detail?id=1143475,2026-07-13 01:23:03,转载摘编
民声现场· 公园24小时开放，公厕却准时“下班”？夜间配套也需不断档,https://www.jfdaily.com/news/detail?id=1142324,2026-07-13 01:20:49,自采原创
台风已远离，上海今早天空有点不一样！网友：原来风雨之后，真的会有彩虹,https://www.jfdaily.com/news/detail?id=1143473,2026-07-13 01:19:08,整合改编
国家海洋预报台针对我国北部海域发布风暴潮橙色和海浪蓝色警报,https://www.jfdaily.com/news/detail?id=1143472,2026-07-13 01:13:04,转载摘编
从“24小时开放”到“24小时服务”，公共设施不打烊，体验如何不断档？,https://www.jfdaily.com/news/detail?id=1141626,2026-07-13 01:12:48,自采原创
“沪AP”号段新能源车牌屡屡被拒，停车场识别系统升级为何“慢半拍”？,https://www.jfdaily.com/news/detail?id=1141582,2026-07-13 01:12:34,自采原创
拟录用“逐字翻译抄写”博士被质疑后，安徽大学公示信息网页已无权限访问,https://www.jfdaily.com/news/detail?id=1143470,2026-07-13 01:11:00,转载摘编
资深美籍华裔演员何炜晴离世，曾接连参演漫威经典剧集,https://www.jfdaily.com/news/detail?id=1143468,2026-07-13 01:04:21,转载摘编
年轻人眼中的上海红色场馆什么模样？华师大师生用“数看”给出答案,https://www.jfdaily.com/news/detail?id=1142623,2026-07-13 01:00:02,约组外稿
【新思想引领新征程】严守耕地红线 筑牢国家粮食安全根基,https://www.jfdaily.com/news/detail?id=1143465,2026-07-13 00:53:56,转载摘编
深入学习贯彻习近平总书记在庆祝中国共产党成立105周年大会上重要讲话系列述评之七,https://www.jfdaily.com/news/detail?id=1143464,2026-07-13 00:52:42,转载摘编
近镜头｜大国外交的“中国时间”,https://www.jfdaily.com/news/detail?id=1143463,2026-07-13 00:50:46,转载摘编
在蒙西，“规则之治”解锁小区停车难｜社区微观察,https://www.jfdaily.com/news/detail?id=1143293,2026-07-13 00:48:19,自采原创
杨浦设置82个安置场所转移上万人，处理多起树木倒伏等意外事件,https://www.jfdaily.com/news/detail?id=1143364,2026-07-13 00:47:59,自采原创
从上海市政府副秘书长到业委会主任，柴俊勇的基层治理心得,https://www.jfdaily.com/news/detail?id=1142371,2026-07-13 00:45:02,自采原创
今年上半年全国铁路发送旅客23.48亿人次，创历史同期新高,https://www.jfdaily.com/news/detail?id=1143462,2026-07-13 00:41:32,转载摘编
MISA十七载：风雨夏日，音乐滋润城市生活,https://www.jfdaily.com/news/detail?id=1143461,2026-07-13 00:39:38,自采原创
顶级赛事留在上海的背后：“流量”这样变“留量”,https://www.jfdaily.com/news/detail?id=1142360,2026-07-13 00:30:02,自采原创
蓝衣军团的榜样！意大利男足没做到的，辛纳做到了！,https://www.jfdaily.com/news/detail?id=1143451,2026-07-13 00:16:01,自采原创
卡车不停歇，健康有人管：集卡司机有了“车轮边的家庭医生”,https://www.jfdaily.com/news/detail?id=1143366,2026-07-13 00:13:02,自采原创
系统性拓展至儿童心理等新方向！第九届海派儿科推拿学术交流大会举行,https://www.jfdaily.com/news/detail?id=1142731,2026-07-13 00:10:27,自采原创
普陀建成全市首个大宗商品可信贸易综合服务管理平台，百余家企业率先“上链”,https://www.jfdaily.com/news/detail?id=1142216,2026-07-13 00:06:11,自采原创
