title,url,time,source
作家李娟：人应该适度的自卑与自我怀疑,https://www.jfdaily.com/news/detail?id=1063722,2026-02-06 20:37:03,整合改编
日本大选倒计时，特朗普公开力挺高市早苗：我对她印象深刻,https://www.jfdaily.com/news/detail?id=1064469,2026-02-06 20:32:02,自采原创
王濛感动米兰冬奥会开幕式现场华人观众数，带领大家用意大利语说：加油中国！,https://www.jfdaily.com/news/detail?id=1064715,2026-02-06 20:31:02,自采原创
亚洲杯乒乓球：国乒女单德比成焦点，日本男乒下下签将有两场内战,https://www.jfdaily.com/news/detail?id=1064718,2026-02-06 20:30:02,自采原创
米兰冬奥｜尚未开战已有多位名将受伤，麦克莫里斯与斯特拉托退出首项赛事,https://www.jfdaily.com/news/detail?id=1064735,2026-02-06 20:25:03,自采原创
乌拉圭总统结束访华之旅，150人代表团成员中，竟藏着上海足球的老朋友！,https://www.jfdaily.com/news/detail?id=1064413,2026-02-06 20:21:02,自采原创
前有上海银行、后拥上汽集团，中超三连冠海港携两大合作方出征新赛季中超,https://www.jfdaily.com/news/detail?id=1064465,2026-02-06 20:12:04,自采原创
米兰冬奥｜仅有的两座新建场馆终于通过检验，直到最后一刻，意大利准备好了,https://www.jfdaily.com/news/detail?id=1064733,2026-02-06 20:10:02,自采原创
走近米兰冬奥会：最大分项自由式滑雪有15金，能否变身中国军团的夺宝奇兵,https://www.jfdaily.com/news/detail?id=1063211,2026-02-06 20:09:02,约组外稿
米兰冬奥｜2月7日看点：苏翊鸣大跳台卫冕战面临挑战，谷爱凌出战坡障预赛,https://www.jfdaily.com/news/detail?id=1064669,2026-02-06 20:08:03,自采原创
米兰冬奥｜谷爱凌与苏翊鸣在这个小镇携手出战，利维尼奥究竟有什么魅力？,https://www.jfdaily.com/news/detail?id=1064734,2026-02-06 20:05:07,自采原创
板凳深度成为制胜关键，上海男篮力克广东队，挺进CBA俱乐部杯半决赛,https://www.jfdaily.com/news/detail?id=1064722,2026-02-06 20:05:04,自采原创
隋文静哽咽那句“对不起”不是作秀，而是真扛不住了！老将真的太难了,https://www.jfdaily.com/news/detail?id=1064695,2026-02-06 20:04:04,自采原创
乒乓球亚洲杯｜国乒新教练员走马上任，王楚钦林诗栋与新指导配合不错,https://www.jfdaily.com/news/detail?id=1064730,2026-02-06 20:02:04,自采原创
乒乓球亚洲杯｜国乒12人折损两名年轻男单选手，日本队全员晋级十六强,https://www.jfdaily.com/news/detail?id=1064680,2026-02-06 20:00:02,自采原创
米兰冬奥｜苏翊鸣卫冕战竞争空前激烈，谷爱凌迎来赛事首秀,https://www.jfdaily.com/news/detail?id=1064737,2026-02-06 19:20:39,自采原创
米兰冬奥｜隋文静/韩聪带伤完成首秀，打了五针封闭的隋文静赛后两度落泪,https://www.jfdaily.com/news/detail?id=1064736,2026-02-06 19:20:00,自采原创
“每个中国人，一生中至少看一场戏”，这句话怎么在上海实现,https://www.jfdaily.com/news/detail?id=1064406,2026-02-06 17:00:04,自采原创
新华视点丨8部门“攥指成拳”强监管 合力遏制虚拟货币等风险,https://www.jfdaily.com/news/detail?id=1064726,2026-02-06 16:04:08,转载摘编
国际金价银价上演过山车行情，交易所频繁出手降温,https://www.jfdaily.com/news/detail?id=1064716,2026-02-06 15:53:34,自采原创
火热开市！总台“机器人年货大集”来了,https://www.jfdaily.com/news/detail?id=1064723,2026-02-06 15:48:42,转载摘编
王濛现身米兰冬奥会开幕式，不再“我的眼睛就是尺”，变身美妆分享达人,https://www.jfdaily.com/news/detail?id=1064713,2026-02-06 15:28:31,自采原创
候诊时突然倒下！上海七旬老人心跳呼吸骤停，医护“黄金一分钟”抢回一命,https://www.jfdaily.com/news/detail?id=1064371,2026-02-06 15:27:13,自采原创
突发失明竟是眼睛中风！上海四院2小时眼动脉溶栓抢回患者视力,https://www.jfdaily.com/news/detail?id=1064396,2026-02-06 15:27:05,自采原创
靠旅拍年入4200万，松阳陈家铺村让风景“显影”成可持续的金山银山,https://www.jfdaily.com/news/detail?id=1064699,2026-02-06 15:26:07,自采原创
黄仁勋只来一次，错过“一个亿”,https://www.jfdaily.com/news/detail?id=1064712,2026-02-06 15:25:49,自采原创
隋文静赛后哽咽那句“对不起”让人听破防！冬奥会花滑团体赛太残酷,https://www.jfdaily.com/news/detail?id=1064710,2026-02-06 15:24:25,自采原创
“四小时”能在长三角造个啥,https://www.jfdaily.com/news/detail?id=1064708,2026-02-06 15:16:05,自采原创
从上海到纽约，新春音乐会传递浓浓“中国味”,https://www.jfdaily.com/news/detail?id=1064325,2026-02-06 14:58:09,自采原创
马头琴遇交响乐、呼麦对话美声！2026上海新春音乐会“中国味”浓厚,https://www.jfdaily.com/news/detail?id=1064690,2026-02-06 14:51:22,自采原创
上海512家环球美食餐厅1050套优选套餐恭候你，还有这些主厨推荐可打卡,https://www.jfdaily.com/news/detail?id=1064562,2026-02-06 14:49:55,自采原创
流量变销量！静安国际光影展还要放大招,https://www.jfdaily.com/news/detail?id=1064693,2026-02-06 14:47:47,自采原创
寒潮春节前“压轴考”：上海郊区周末最低温零下7℃，全城硬核守护已上线,https://www.jfdaily.com/news/detail?id=1064596,2026-02-06 14:41:56,自采原创
军地同心、医慈携手，为守护西部儿童健康注入强大合力,https://www.jfdaily.com/news/detail?id=1064689,2026-02-06 14:26:01,自采原创
2026新春走基层 | 这是高铁上能吃到的吗？！对！！！,https://www.jfdaily.com/news/detail?id=1064678,2026-02-06 14:20:40,自采原创
乌拉圭企业家，为何选择中国？,https://www.jfdaily.com/news/detail?id=1064679,2026-02-06 14:20:35,自采原创
乌拉圭总统奥尔西在上海作出承诺,https://www.jfdaily.com/news/detail?id=1064681,2026-02-06 14:20:28,自采原创
乌拉圭总统奥尔西今天访问上博东馆，他为什么如此惊讶,https://www.jfdaily.com/news/detail?id=1064682,2026-02-06 14:20:24,自采原创
加速亚太地区创新与协作，这个创新中心在上海启用,https://www.jfdaily.com/news/detail?id=1064650,2026-02-06 14:20:19,自采原创
春运护平安，“鹰眼”再升级：可6秒内自动检测事故并触发报警,https://www.jfdaily.com/news/detail?id=1064646,2026-02-06 14:20:13,自采原创
跨境物流需求增长迅速，“行邮顺”个人行李跨境专送服务上线,https://www.jfdaily.com/news/detail?id=1064641,2026-02-06 14:20:05,自采原创
乌拉圭总统奥尔西给上海写下一条留言：下次见,https://www.jfdaily.com/news/detail?id=1064687,2026-02-06 14:19:54,自采原创
春节假期，上海地铁3号线4号线部分区段临时停运,https://www.jfdaily.com/news/detail?id=1064442,2026-02-06 14:19:29,自采原创
海南飞上海的飞机上，旅客突然面色苍白冒冷汗，万幸做了这件事,https://www.jfdaily.com/news/detail?id=1064502,2026-02-06 14:12:47,自采原创
上海期货交易所、上海黄金交易所频繁出手，应对国际金银价格剧烈波动,https://www.jfdaily.com/news/detail?id=1064521,2026-02-06 14:11:18,自采原创
蜥脚类恐龙新属种，云南楚雄发现林氏雁塔龙,https://www.jfdaily.com/news/detail?id=1064654,2026-02-06 14:05:47,整合改编
全国首个绿色低碳示范站房！南京北站：转入地面主体结构施工,https://www.jfdaily.com/news/detail?id=1064644,2026-02-06 14:05:41,自采原创
华东首创“大中庭”结构车站！无锡地铁6号线奥体中心站封顶,https://www.jfdaily.com/news/detail?id=1064629,2026-02-06 14:05:34,整合改编
外国语学校新校区：杭州的将开工，宁波的秋季投用,https://www.jfdaily.com/news/detail?id=1064622,2026-02-06 14:05:28,整合改编
2月10日起，南京启动有奖发票,https://www.jfdaily.com/news/detail?id=1064613,2026-02-06 14:05:22,自采原创
向世界传递“中国年味”，2026上海新春音乐会奏响,https://www.jfdaily.com/news/detail?id=1064653,2026-02-06 14:03:42,自采原创
缅怀黄旭华院士逝世一周年：我爱妻子爱家庭，但更爱国家和核潜艇！,https://www.jfdaily.com/news/detail?id=1064509,2026-02-06 14:00:02,整合改编
解锁“节庆+”多元融合模式，周浦镇举办“年味节”年俗大集,https://www.jfdaily.com/news/detail?id=1064676,2026-02-06 13:57:11,自采原创
助力静安打造智算产业创新高地，这个联合创新实验室正式揭牌,https://www.jfdaily.com/news/detail?id=1064589,2026-02-06 13:57:00,自采原创
艺术与商业融合！第四届“闪亮·上海”静安国际光影展邀企业共创城市新名片,https://www.jfdaily.com/news/detail?id=1064618,2026-02-06 13:56:50,自采原创
告别等火车！宝山这条跨线桥通车，早高峰省下30分钟,https://www.jfdaily.com/news/detail?id=1064561,2026-02-06 13:56:41,自采原创
陆悦天地“悦购新春”启幕，解锁多重新春消费惊喜,https://www.jfdaily.com/news/detail?id=1064467,2026-02-06 13:56:33,自采原创
让5亿二次元消费者爱上这座城，朱光代表建议上海打造“次元友好城市”新名片,https://www.jfdaily.com/news/detail?id=1064489,2026-02-06 13:56:24,自采原创
暖心年夜饭，为城市“奔跑者”送上新春祝福,https://www.jfdaily.com/news/detail?id=1064677,2026-02-06 13:56:14,自采原创
再胜广东队！上海大鲨鱼杀入CBA俱乐部杯半决赛,https://www.jfdaily.com/news/detail?id=1064667,2026-02-06 13:46:55,自采原创
