title,url,time,source
阿斯塔纳航空庆祝“阿拉木图—上海”航线开通，至此其已通航中国六座城市,https://www.jfdaily.com/news/detail?id=1094407,2026-04-10 03:26:59,自采原创
张强任陇南市代市长，原市长已任市委书记,https://www.jfdaily.com/news/detail?id=1094519,2026-04-10 03:26:28,整合改编
北约秘书长回应管特朗普叫“爸爸”：是翻译失误，这辈子都撕不掉爸爸梗标签了,https://www.jfdaily.com/news/detail?id=1094518,2026-04-10 03:24:01,整合改编
从西岸出发，体验骑行快乐！蓝莓骑行上海西岸旗舰店启幕,https://www.jfdaily.com/news/detail?id=1094422,2026-04-10 03:23:52,自采原创
SpaceX去年亏损近50亿美元，此前刚披露融资目标为750亿美元,https://www.jfdaily.com/news/detail?id=1094517,2026-04-10 03:19:34,整合改编
1公里“开出”5000元车费？上海警方：20名网约车司机落网,https://www.jfdaily.com/news/detail?id=1094487,2026-04-10 03:15:46,自采原创
以围棋文化滋养童心，上海这个“全国围棋之乡”持续推进“围棋进校园”,https://www.jfdaily.com/news/detail?id=1094511,2026-04-10 03:12:14,自采原创
网约车合规化整治，“锋芒”指向何处？,https://www.jfdaily.com/news/detail?id=1093865,2026-04-10 03:11:18,自采原创
多地政府主要领导调整,https://www.jfdaily.com/news/detail?id=1094488,2026-04-10 03:07:07,整合改编
联影外科机器人和AI医疗成果集体亮相，全面赋能医院智慧化升级,https://www.jfdaily.com/news/detail?id=1094434,2026-04-10 03:05:23,自采原创
习近平总书记会见中国国民党主席郑丽文,https://www.jfdaily.com/news/detail?id=1094507,2026-04-10 03:05:02,转载摘编
国家矿山安全监察局：全国矿山安全风险监测预警“一张网”已基本建成,https://www.jfdaily.com/news/detail?id=1094497,2026-04-10 03:01:03,转载摘编
支持以旧换新，625亿元超长期特别国债已下达,https://www.jfdaily.com/news/detail?id=1094499,2026-04-10 02:59:39,转载摘编
投身养老，00后年轻人有了新赛道,https://www.jfdaily.com/news/detail?id=1094503,2026-04-10 02:58:32,自采原创
分类施策全覆盖！教育部等5部门部署“人工智能+教育”行动计划,https://www.jfdaily.com/news/detail?id=1094498,2026-04-10 02:57:53,转载摘编
马宁等三人入围世界杯，国内赛场执裁争议不断，中国裁判到底什么水平？,https://www.jfdaily.com/news/detail?id=1094471,2026-04-10 02:53:40,自采原创
“江潮乐”系列音乐会首次奏响“春日序曲”,https://www.jfdaily.com/news/detail?id=1094425,2026-04-10 02:53:05,自采原创
上观碰碰头·玫好青年局丨上海本周去哪玩：莫奈花园、喜剧盛宴、春日寻鲜......,https://www.jfdaily.com/news/detail?id=1094482,2026-04-10 02:42:14,自采原创
跳出“手抖+吃药”误区！知名神经内科专家谈帕金森诊疗新进展,https://www.jfdaily.com/news/detail?id=1094478,2026-04-10 02:33:43,自采原创
客货列车开行对数均创新高，长三角铁路明起实施今年第二季度列车运行图,https://www.jfdaily.com/news/detail?id=1094480,2026-04-10 02:31:16,自采原创
中美青年教育文化交流论坛在沪举行,https://www.jfdaily.com/news/detail?id=1094359,2026-04-10 02:27:02,自采原创
同济大学与香港中文大学签约！将共建智慧交通联合实验室,https://www.jfdaily.com/news/detail?id=1093998,2026-04-10 02:26:38,自采原创
68岁老人频发脑梗痛苦不堪，新技术解围，医生称这是脖子上的“定时炸弹”,https://www.jfdaily.com/news/detail?id=1094051,2026-04-10 02:26:27,自采原创
华东理工大学这间算法实验室10名学生来自不同专业，同时升学就业大丰收,https://www.jfdaily.com/news/detail?id=1094197,2026-04-10 02:26:16,自采原创
初中学校如何推进课间15分钟？学业和运动这样平衡,https://www.jfdaily.com/news/detail?id=1094479,2026-04-10 02:26:06,自采原创
饕餮为形、汉风为魂，徐州“城宠”IP餮仔亮相,https://www.jfdaily.com/news/detail?id=1094454,2026-04-10 02:25:32,自采原创
县域经济标杆！江苏昆山走出农文旅融合共富路,https://www.jfdaily.com/news/detail?id=1094451,2026-04-10 02:25:24,自采原创
来PK！衢州寻找乡村“舞王”,https://www.jfdaily.com/news/detail?id=1094348,2026-04-10 02:25:14,自采原创
MBTI已经过时了？全网都在玩的SBTI，测完我直接破防了！,https://www.jfdaily.com/news/detail?id=1094477,2026-04-10 02:18:10,自采原创
2025年我国留学回国人数达53.56万,https://www.jfdaily.com/news/detail?id=1094473,2026-04-10 02:13:55,转载摘编
一女子坐地铁时被挡水板绊倒受伤，索赔27万元！法院：驳回！网友热议,https://www.jfdaily.com/news/detail?id=1094462,2026-04-10 02:13:29,整合改编
“登登”离世！曾2次被拍卖抵债，几次上热搜！网友：幸好拥有了美好的后半生,https://www.jfdaily.com/news/detail?id=1094458,2026-04-10 02:13:20,整合改编
韩国拟2040年前逐步减少韩朝边境驻兵,https://www.jfdaily.com/news/detail?id=1094474,2026-04-10 02:10:59,转载摘编
《互联网平台价格行为规则》今起实施,https://www.jfdaily.com/news/detail?id=1094472,2026-04-10 02:10:20,转载摘编
大半夜突然刷屏，冲上热搜！大量用户页面崩溃、链接打不开，我错过了什么？,https://www.jfdaily.com/news/detail?id=1094465,2026-04-10 02:10:03,整合改编
全是演员！上海闹市区一中医馆被央视曝光，网友：太恶劣，陌生人的搭讪要注意,https://www.jfdaily.com/news/detail?id=1094466,2026-04-10 02:08:24,整合改编
加大对新型隐性腐败惩治力度，两高发布最新司法解释,https://www.jfdaily.com/news/detail?id=1094469,2026-04-10 02:04:35,转载摘编
伊朗最高领袖对和谈提出三点主张；俄乌东正教复活节停火32小时,https://www.jfdaily.com/news/detail?id=1094334,2026-04-10 02:01:24,整合改编
国家统计局：3月份居民消费价格同比上涨1.0%,https://www.jfdaily.com/news/detail?id=1094461,2026-04-10 01:55:53,转载摘编
百年柯氏音“电子化”终落地，血压监测迈入精准透明新阶段,https://www.jfdaily.com/news/detail?id=1094390,2026-04-10 01:40:13,自采原创
宇树豪掷20亿投入这个方向，上海“接单”，要给机器人装上“中国脑”,https://www.jfdaily.com/news/detail?id=1094453,2026-04-10 01:35:31,自采原创
如何让社会组织能“成立”更能“站稳脚跟”，徐汇全生命周期扶持政策落地开花,https://www.jfdaily.com/news/detail?id=1094356,2026-04-10 01:34:06,自采原创
上海德比第一回合｜战海港，拉唐不会再踢10号位了吧？,https://www.jfdaily.com/news/detail?id=1094444,2026-04-10 01:32:00,自采原创
上观时评｜黄旭华为何背上“不孝”的骂声,https://www.jfdaily.com/news/detail?id=1094455,2026-04-10 01:30:51,约组外稿
上海德比第一回合｜对申花，穆斯卡特终于有人可用了？,https://www.jfdaily.com/news/detail?id=1094445,2026-04-10 01:30:31,自采原创
深耕文坛数十年，阎晶明畅谈：读懂新大众文艺，读懂当下时代文学,https://www.jfdaily.com/news/detail?id=1094446,2026-04-10 01:24:53,自采原创
视频丨习近平主席在全军高级干部培训班开班式上的重要讲话引发热烈反响,https://www.jfdaily.com/news/detail?id=1094449,2026-04-10 01:11:59,转载摘编
学习新语｜把为民造福作为最大政绩,https://www.jfdaily.com/news/detail?id=1094447,2026-04-10 01:11:35,转载摘编
时政微观察丨服务业如何高质量发展？总书记提出新要求,https://www.jfdaily.com/news/detail?id=1094448,2026-04-10 01:09:53,转载摘编
一杯咖啡，一出好戏！静安打造文旅融合新聚场，超60个特色展位亮相,https://www.jfdaily.com/news/detail?id=1094350,2026-04-10 01:07:54,自采原创
直播间赌石“一刀暴富”神话令人“上头”？法院这起判决揭秘镜头后的连环骗局,https://www.jfdaily.com/news/detail?id=1094355,2026-04-10 01:03:11,自采原创
花桥啊花桥，我的故乡 | 叶辛,https://www.jfdaily.com/news/detail?id=1090783,2026-04-10 01:02:23,约组外稿
中美老友记|专访姚明：去NBA打球，是“劳务输出”,https://www.jfdaily.com/news/detail?id=1094009,2026-04-10 01:00:02,自采原创
国产抹茶变身烘焙爆品，抹茶盒马村将贵州千目直送全国商超,https://www.jfdaily.com/news/detail?id=1094428,2026-04-10 00:55:53,自采原创
哈拉齐伤重不治，伊朗最高领袖发表声明；特朗普：已要求以色列行动“更低调”,https://www.jfdaily.com/news/detail?id=1094438,2026-04-10 00:43:52,整合改编
主动脉弓支架成“拦路虎”？巧让血流“改道”，破解脑梗隐患,https://www.jfdaily.com/news/detail?id=1094392,2026-04-10 00:41:46,自采原创
最短6年！本博贯通席卷20多所名校，“抢人”新赛道香吗？,https://www.jfdaily.com/news/detail?id=1094440,2026-04-10 00:38:02,自采原创
普京宣布停火32小时，泽连斯基表示跟进,https://www.jfdaily.com/news/detail?id=1094439,2026-04-10 00:34:51,整合改编
上海首例！84岁老人心梗后双“心门”反流，东方医院何奔教授团队一站式修复,https://www.jfdaily.com/news/detail?id=1094424,2026-04-10 00:30:08,自采原创
360°旋转列车驶入东艺！邢昭林那志东主演话剧《南来北往》迎来全国首演,https://www.jfdaily.com/news/detail?id=1094396,2026-04-10 00:24:02,自采原创
