title,url,time,source
莫言自曝戒不掉刷短视频，以此为灵感创作新书《人呐》,https://www.jfdaily.com/news/detail?id=1095871,2026-04-13 06:22:03,转载摘编
“自以为是”自民党大会，高市“搞事”重申修宪意愿,https://www.jfdaily.com/news/detail?id=1095868,2026-04-13 06:19:49,自采原创
霍尔木兹海峡对峙升级，特朗普“卡脖子”会否再次点燃战火？,https://www.jfdaily.com/news/detail?id=1095865,2026-04-13 06:18:58,自采原创
新民视频｜2026年上海市民日校春季班今日开学,https://www.jfdaily.com/news/detail?id=1095860,2026-04-13 06:17:45,自采原创
暖光不熄，奔波者有“歇脚港湾”｜社区微观察,https://www.jfdaily.com/news/detail?id=1095866,2026-04-13 06:17:29,自采原创
老外“拎着行李箱”来上海泡澡，“China Spa”为何走红海外？,https://www.jfdaily.com/news/detail?id=1095785,2026-04-13 06:14:54,自采原创
年销2500万、增速超9倍，一家上海汽配工厂在拼多多的“西进”之路,https://www.jfdaily.com/news/detail?id=1095797,2026-04-13 06:06:25,广告推广
不得向8岁以下儿童开放！网信办发布11条网络直播打赏规定,https://www.jfdaily.com/news/detail?id=1095858,2026-04-13 06:04:41,转载摘编
便利+美味成就国民美食之冠 墨西哥塔可年产值超200万 | 新民侨梁,https://www.jfdaily.com/news/detail?id=1092909,2026-04-13 06:01:04,整合改编
上海检方揭露新型犯罪：“碰一下”遇上免密支付，相隔千里也能盗刷手机,https://www.jfdaily.com/news/detail?id=1094460,2026-04-13 05:58:17,自采原创
中美“乒乓外交”亲历者：美国没有这样的机器人,https://www.jfdaily.com/news/detail?id=1095754,2026-04-13 05:57:25,自采原创
沪派江南寻村记｜青浦金泽镇山深村：江南溇沼地，人家尽枕河,https://www.jfdaily.com/news/detail?id=1095851,2026-04-13 05:56:16,自采原创
英国不参与霍尔木兹海峡封锁行动传递哪些信号,https://www.jfdaily.com/news/detail?id=1095845,2026-04-13 05:44:37,转载摘编
连打三“虎”！江敦涛、乌兰、韩占武，被开除党籍和公职,https://www.jfdaily.com/news/detail?id=1095846,2026-04-13 05:42:44,自采原创
伊朗驻巴基斯坦大使：美伊谈判是一个过程，非单一事件,https://www.jfdaily.com/news/detail?id=1095842,2026-04-13 05:41:29,转载摘编
松江G60“曲率引擎”硬科先导科技园项目开工,https://www.jfdaily.com/news/detail?id=1095746,2026-04-13 05:40:45,自采原创
当AI学会速读，我们为何仍要深耕？嘉定青年阅读大会直面AI时代阅读之问,https://www.jfdaily.com/news/detail?id=1095819,2026-04-13 05:33:02,自采原创
看球、逛吃、看无人机，金山这个“村超”比过年还闹猛,https://www.jfdaily.com/news/detail?id=1095833,2026-04-13 05:32:53,自采原创
文汇专访《八千里路云和月》导演张永新：抗战剧常拍常新，历史是最铿锵的回答,https://www.jfdaily.com/news/detail?id=1095824,2026-04-13 05:26:09,自采原创
秘鲁推出“护照”小书，促进文化认同 | 新民侨梁,https://www.jfdaily.com/news/detail?id=1095725,2026-04-13 05:18:00,整合改编
中国人民的老朋友，大山也来第六届消博会了！,https://www.jfdaily.com/news/detail?id=1095798,2026-04-13 05:09:07,自采原创
涨价比黄金和石油还猛，这样东西就在你的手里！网友：我的涨了4倍……,https://www.jfdaily.com/news/detail?id=1095820,2026-04-13 05:01:14,整合改编
霍尔木兹海峡船舶通行再次完全中断，全球原油运输正明显转向美国墨西哥湾沿岸,https://www.jfdaily.com/news/detail?id=1095815,2026-04-13 05:01:09,整合改编
济南一沿街商铺发生坍塌！现场2名群众受伤，已送医救治，无生命危险,https://www.jfdaily.com/news/detail?id=1095811,2026-04-13 05:01:01,整合改编
中纪委连打三“虎”！,https://www.jfdaily.com/news/detail?id=1095790,2026-04-13 05:00:49,整合改编
上观碰碰头·一起做晚FANS｜飞君连连看：从金山试点看上海公共收益新规如何落地,https://www.jfdaily.com/news/detail?id=1095783,2026-04-13 04:59:59,自采原创
在全球医疗健康创新“超级枢纽港”，看AI、机器人塑造“未来医院”,https://www.jfdaily.com/news/detail?id=1095539,2026-04-13 04:54:58,自采原创
找不到快乐怎么办？看看《小猪佩奇》……图书馆里的这些治愈小卡片火了！,https://www.jfdaily.com/news/detail?id=1095814,2026-04-13 04:54:26,自采原创
乌克兰称愿帮忙“对付伊朗”，黎巴嫩真主党：先管好你自己,https://www.jfdaily.com/news/detail?id=1095813,2026-04-13 04:38:15,转载摘编
51岁男子突发心梗，执意登机！血管堵塞程度高达99%！航司苦劝1小时,https://www.jfdaily.com/news/detail?id=1095807,2026-04-13 04:36:11,整合改编
伊朗官员删除“美国三个过分要求”帖文,https://www.jfdaily.com/news/detail?id=1095810,2026-04-13 04:34:46,转载摘编
霍尔木兹海峡船舶通行再次完全中断,https://www.jfdaily.com/news/detail?id=1095812,2026-04-13 04:34:20,转载摘编
聚焦心学与浙学！全国二十余位学者绍兴论道明清儒学流变,https://www.jfdaily.com/news/detail?id=1095779,2026-04-13 04:32:38,自采原创
共享春光“趣”阅读！杭图以惠民实践绘就全民阅读新图景,https://www.jfdaily.com/news/detail?id=1095782,2026-04-13 04:32:29,自采原创
“风禾尽起 光影传薪” 吴品禾摄影艺术展呈现镜头下的浙南山水与人文纪实,https://www.jfdaily.com/news/detail?id=1095786,2026-04-13 04:32:19,自采原创
欧尔班败选，冯德莱恩立即发声,https://www.jfdaily.com/news/detail?id=1095805,2026-04-13 04:30:18,转载摘编
美军公布“海上封锁”细节,https://www.jfdaily.com/news/detail?id=1095804,2026-04-13 04:24:41,转载摘编
对抗组织审查，江敦涛被“双开”！曾任淄博、潍坊市委书记,https://www.jfdaily.com/news/detail?id=1095803,2026-04-13 04:24:12,整合改编
快看视频|美伊和平谈判无果而终，特朗普宣布封锁霍尔木兹，国际油价应声大涨,https://www.jfdaily.com/news/detail?id=1095792,2026-04-13 04:19:45,自采原创
坚信“霸总”送房送车，老人执意“奔现”！警惕“AI霸总”正在围猎老年人……,https://www.jfdaily.com/news/detail?id=1095762,2026-04-13 04:19:21,转载摘编
中共中央批准：开除3“虎”党籍,https://www.jfdaily.com/news/detail?id=1095774,2026-04-13 04:10:49,整合改编
中纪委打虎：王文灵、姚玉舟、丁业现落马！今年已有22虎落马,https://www.jfdaily.com/news/detail?id=1095772,2026-04-13 04:10:41,转载摘编
今天的舞蹈还能说什么？37个新作交出上海原创答卷,https://www.jfdaily.com/news/detail?id=1095521,2026-04-13 04:09:59,自采原创
出行设计赋能行业发展 上海智慧出行设计谷取得阶段性成效,https://www.jfdaily.com/news/detail?id=1095759,2026-04-13 04:02:58,自采原创
领跑全国空港！浦东国际机场口岸今年出入境人员率先突破1000万人次,https://www.jfdaily.com/news/detail?id=1095777,2026-04-13 04:02:33,自采原创
南部战区新闻发言人发表谈话,https://www.jfdaily.com/news/detail?id=1095793,2026-04-13 04:01:11,转载摘编
对家人失管失教，“老虎”乌兰被双开,https://www.jfdaily.com/news/detail?id=1095791,2026-04-13 03:59:35,整合改编
“让伊朗无法出售石油”，特朗普考虑恢复对伊朗有限军事打击,https://www.jfdaily.com/news/detail?id=1095758,2026-04-13 03:56:24,整合改编
产教融合走深走实，上海大学医学院与普瑞眼科共推眼科高质量发展,https://www.jfdaily.com/news/detail?id=1095778,2026-04-13 03:55:55,自采原创
“如果你不服从我的命令 ，你将被锁定为目标”，伊朗公布驱离美军舰视频,https://www.jfdaily.com/news/detail?id=1095757,2026-04-13 03:55:51,整合改编
国家队名师来授课， 2026年上海市民日校春季班今天开学,https://www.jfdaily.com/news/detail?id=1095770,2026-04-13 03:49:05,自采原创
新民艺评｜高鸽：以艺为镜——谈《危险关系》的现实力量与艺术担当,https://www.jfdaily.com/news/detail?id=1095698,2026-04-13 03:38:52,自采原创
提前4轮锁定常规赛冠军，这一回，上海男篮真能圆梦？,https://www.jfdaily.com/news/detail?id=1095711,2026-04-13 03:36:59,自采原创
警棍怎么出又快又准？纠纷调解从哪入手？来看金山公安的实战训练有多硬核,https://www.jfdaily.com/news/detail?id=1095417,2026-04-13 03:36:35,自采原创
看球、逛吃、买特产，“村超”全国赛上海金山赛区揭幕，点燃乡村足球热情,https://www.jfdaily.com/news/detail?id=1095631,2026-04-13 03:36:24,自采原创
男单时隔九年再夺冠女双包揽金银牌，国羽亚锦赛有收获有遗憾,https://www.jfdaily.com/news/detail?id=1095712,2026-04-13 03:36:11,自采原创
344进5！上海歌剧院“神仙打架”结果出炉，石倚洁详解如何助推青年人才,https://www.jfdaily.com/news/detail?id=1095664,2026-04-13 03:36:00,自采原创
无人机改装后携带金属箭从高空飞速下坠！有人利用无人机进行狩猎，法院判了,https://www.jfdaily.com/news/detail?id=1095745,2026-04-13 03:33:15,整合改编
张雪接受央视专访：下场比赛可能会输，先给观众泼冷水；再回应机车新手禁令,https://www.jfdaily.com/news/detail?id=1095726,2026-04-13 03:33:07,整合改编
特朗普考虑再打伊朗！伊朗最高领袖军事顾问：美国在霍尔木兹海峡遭历史性失败,https://www.jfdaily.com/news/detail?id=1095731,2026-04-13 03:32:55,整合改编
