title,url,time,source
特朗普宣称获格陵兰“永久、免费、全面准入”，格陵兰自治政府：不了解不知情,https://www.jfdaily.com/news/detail?id=1056515,2026-01-23 08:39:06,自采原创
美国任命她担任驻委内瑞拉“准大使”，加速重建“外交存在”？,https://www.jfdaily.com/news/detail?id=1056479,2026-01-23 08:39:03,自采原创
茅台：“马茅”经典版包装已修正，推出两项售后方案,https://www.jfdaily.com/news/detail?id=1056622,2026-01-23 08:36:25,转载摘编
“想管也管不了，家长都不管！”商场里的手机店，咋成了“儿童网吧”？,https://www.jfdaily.com/news/detail?id=1056621,2026-01-23 08:35:50,转载摘编
与湖人管理层存在矛盾？詹姆斯：我根本不在乎那些报道,https://www.jfdaily.com/news/detail?id=1056620,2026-01-23 08:34:34,自采原创
11岁男孩患恶性肿瘤，上海医生借助3D打印“毫米级定位”精准切除,https://www.jfdaily.com/news/detail?id=1056616,2026-01-23 08:27:47,自采原创
校长脱口秀“圈粉”！竹园小学教育集团解锁“双新”改革新打开方式,https://www.jfdaily.com/news/detail?id=1056475,2026-01-23 08:18:13,自采原创
速视频｜“加拿大因美国而存在”？卡尼强硬回击特朗普：我们是自己国家的主人,https://www.jfdaily.com/news/detail?id=1056615,2026-01-23 08:17:46,整合改编
利用儿童当“诱饵”，美移民执法行动遭批,https://www.jfdaily.com/news/detail?id=1056611,2026-01-23 08:14:21,转载摘编
非洲联盟恢复几内亚成员资格,https://www.jfdaily.com/news/detail?id=1056610,2026-01-23 08:10:19,转载摘编
海上施工向陆域形成，小洋山北西2区（北区）工程4号堤实现合龙,https://www.jfdaily.com/news/detail?id=1056592,2026-01-23 08:09:31,自采原创
日本众议院60年首次在国会例会开幕日解散，高市为在支持率下滑前锁定议席？,https://www.jfdaily.com/news/detail?id=1056609,2026-01-23 08:08:26,整合改编
俄方证实俄美乌首次三方会谈将在阿联酋举行，已派谈判小组启程,https://www.jfdaily.com/news/detail?id=1056606,2026-01-23 08:07:45,整合改编
泽连斯基急赴瑞士和特朗普会谈同时，普京和美方代表谈了3个小时,https://www.jfdaily.com/news/detail?id=1056596,2026-01-23 08:07:28,整合改编
美将获格陵兰岛军事基地主权？格陵兰岛自治政府总理：不了解“协议框架”内容,https://www.jfdaily.com/news/detail?id=1056583,2026-01-23 08:06:51,整合改编
卡尼反驳特朗普称“加拿大的存在并非仰赖美国”，特朗普撤回对卡尼的邀请,https://www.jfdaily.com/news/detail?id=1056582,2026-01-23 08:06:37,整合改编
特朗普称正调集重兵前往伊朗，伊朗革命卫队总司令警告美国：手指已扣扳机,https://www.jfdaily.com/news/detail?id=1056563,2026-01-23 08:06:03,整合改编
日本内阁府公务车闯红灯导致连环车祸，已致1死8伤,https://www.jfdaily.com/news/detail?id=1056559,2026-01-23 08:05:27,整合改编
跨市履新后，韦秀芳当选蚌埠市市长，此前任芜湖市副市长,https://www.jfdaily.com/news/detail?id=1056608,2026-01-23 08:04:51,整合改编
老旧插线板别将就！金山这个村“以旧换新”守护平安,https://www.jfdaily.com/news/detail?id=1056488,2026-01-23 07:57:51,自采原创
寒潮来袭，社区老人有“温暖避风港”,https://www.jfdaily.com/news/detail?id=1055725,2026-01-23 07:57:33,自采原创
南汇新城，你的方向是星辰大海,https://www.jfdaily.com/news/detail?id=1056560,2026-01-23 07:55:56,自采原创
乔叶：有事说事，无事不扰,https://www.jfdaily.com/news/detail?id=1056252,2026-01-23 07:55:52,自采原创
程姣姣：时间给了我们最珍贵的礼物,https://www.jfdaily.com/news/detail?id=1056259,2026-01-23 07:54:30,自采原创
山东GDP突破10万亿元,https://www.jfdaily.com/news/detail?id=1056597,2026-01-23 07:54:19,转载摘编
《太平年》央一今晚开播，白宇周雨彤朱亚文共谱山河史诗,https://www.jfdaily.com/news/detail?id=1056392,2026-01-23 07:53:40,自采原创
豆包出任浦东美术馆官方AI讲解员,https://www.jfdaily.com/news/detail?id=1056489,2026-01-23 07:53:18,自采原创
俄联邦安全局逮捕2名涉嫌向乌克兰传递情报的人员,https://www.jfdaily.com/news/detail?id=1056591,2026-01-23 07:51:09,转载摘编
上海青浦：加快推进长三角创新枢纽建设，实现“十五五”良好开局,https://www.jfdaily.com/news/detail?id=1056565,2026-01-23 07:50:17,自采原创
世界经济论坛年会即将落幕，外交部：中国将始终做不确定世界中的“压舱石”,https://www.jfdaily.com/news/detail?id=1056589,2026-01-23 07:47:54,转载摘编
网红“黑白颠周媛”课程，或涉嫌3项违法,https://www.jfdaily.com/news/detail?id=1056580,2026-01-23 07:40:48,转载摘编
外交部：新疆、西藏的发展进步有目共睹，不容诋毁,https://www.jfdaily.com/news/detail?id=1056578,2026-01-23 07:39:57,转载摘编
外交部回应美方称调集重兵前往伊朗：希望各方珍惜和平,https://www.jfdaily.com/news/detail?id=1056579,2026-01-23 07:39:09,转载摘编
社区观察｜只要业主有疑问，业委会就必须解决吗？,https://www.jfdaily.com/news/detail?id=1056357,2026-01-23 07:37:19,自采原创
老旧小区加装电梯，重在“全流程筹谋”和“邻里共参与”,https://www.jfdaily.com/news/detail?id=1056384,2026-01-23 07:36:08,自采原创
特朗普下令调集重兵 我外交部最新回应,https://www.jfdaily.com/news/detail?id=1056561,2026-01-23 07:35:52,整合改编
外交部回应日本众议院正式解散：这是日本的内政，我们不做评论,https://www.jfdaily.com/news/detail?id=1056556,2026-01-23 07:33:00,转载摘编
越南共产党选举产生第十四届中央政治局,https://www.jfdaily.com/news/detail?id=1056557,2026-01-23 07:32:20,转载摘编
浙大妇院团队《科学》发文：远古病毒碎片竟是胚胎发育的关键因素？,https://www.jfdaily.com/news/detail?id=1056547,2026-01-23 07:31:43,自采原创
3568亿 ！“浙江经济第一区”发布全年经济战报 GDP总量位居全省第一,https://www.jfdaily.com/news/detail?id=1056543,2026-01-23 07:31:30,自采原创
特朗普早就盯上了格陵兰岛,https://www.jfdaily.com/news/detail?id=1056480,2026-01-23 07:30:33,约组外稿
习近平致电祝贺苏林当选越共中央总书记,https://www.jfdaily.com/news/detail?id=1056555,2026-01-23 07:29:45,转载摘编
几毛钱能买数百张！你的“晒娃”照，可能正在被售卖,https://www.jfdaily.com/news/detail?id=1056553,2026-01-23 07:28:27,转载摘编
深视频 |6.24亿吨！日本又“开闸”！计划今年排放8次核污染水,https://www.jfdaily.com/news/detail?id=1056544,2026-01-23 07:28:00,自采原创
“为健康助力，为梦想启航”2026卫生健康系统上海业余网球邀请赛圆满收官,https://www.jfdaily.com/news/detail?id=1056552,2026-01-23 07:26:19,转载摘编
乌美、俄美会晤后，三方将在阿联酋会谈,https://www.jfdaily.com/news/detail?id=1056551,2026-01-23 07:24:19,转载摘编
网点一关超三月 银行回应：春节前有望重开,https://www.jfdaily.com/news/detail?id=1056471,2026-01-23 07:22:03,自采原创
未来五年北京打造10个高端酒店集群，培育高品质酒店600家以上,https://www.jfdaily.com/news/detail?id=1056445,2026-01-23 07:19:42,自采原创
中国人工智能50强2/3总部在京沪，上海14家且新增企业最多，看看有谁？,https://www.jfdaily.com/news/detail?id=1056262,2026-01-23 07:19:34,自采原创
破解外卖配送的“最后一公里”，有什么新解法？,https://www.jfdaily.com/news/detail?id=1055735,2026-01-23 07:17:02,自采原创
外资增速全国第一！非沿边靠海，安徽凭什么吸引全球资本？,https://www.jfdaily.com/news/detail?id=1056451,2026-01-23 07:15:47,自采原创
隋文静韩聪带伤复出大捷，四大洲赛摘金：希望米兰冬奥做到奥运冠军之上,https://www.jfdaily.com/news/detail?id=1056358,2026-01-23 07:15:25,自采原创
韩国3名向朝鲜放飞无人机的嫌疑人被下达出国禁止令,https://www.jfdaily.com/news/detail?id=1056548,2026-01-23 07:12:10,整合改编
中国航协开展航班预留座位规则标准制定,https://www.jfdaily.com/news/detail?id=1056546,2026-01-23 07:09:28,转载摘编
11岁男孩目睹母亲被生父连刺28刀遇害：我不开门，妈妈是不是不会死？……,https://www.jfdaily.com/news/detail?id=1056519,2026-01-23 06:55:50,整合改编
日本内阁府公务车闯红灯致连环车祸1死8伤,https://www.jfdaily.com/news/detail?id=1056518,2026-01-23 06:50:29,转载摘编
林某（男，34岁）、刘某（女，37岁）被抓！抢劫金店、电击店主，画面曝光,https://www.jfdaily.com/news/detail?id=1056514,2026-01-23 06:48:48,整合改编
鼎益丰案最新进展，隋广义等80人被提起公诉,https://www.jfdaily.com/news/detail?id=1056513,2026-01-23 06:46:34,转载摘编
近闻·开局之年“第一课”，总书记为接续奋斗划重点,https://www.jfdaily.com/news/detail?id=1056510,2026-01-23 06:39:27,转载摘编
时习之丨一体推进不敢腐、不能腐、不想腐,https://www.jfdaily.com/news/detail?id=1056509,2026-01-23 06:39:05,转载摘编
