title,url,time,source
奉贤金海街道举办创新挑战赛，让创意与需求双向奔赴,https://www.jfdaily.com/news/detail?id=1052026,2026-01-14 15:57:05,自采原创
惊艳！这群演员如何让永乐宫文物起舞？,https://www.jfdaily.com/news/detail?id=1052018,2026-01-14 15:35:23,自采原创
“至扇至美”展品换新，八件珍稀宋元名迹亮相,https://www.jfdaily.com/news/detail?id=1051941,2026-01-14 15:23:58,自采原创
A股成交额三连破纪录，逼近4万亿元大关，市场迎来“温和降温”,https://www.jfdaily.com/news/detail?id=1051924,2026-01-14 15:02:34,自采原创
速视频｜加拿大总理卡尼抵达北京，出发前为中加关系定调,https://www.jfdaily.com/news/detail?id=1052016,2026-01-14 14:54:20,整合改编
痛心！妈妈将女儿送回前夫家后躲藏，9岁女儿撕心裂肺找妈妈晕倒身亡！,https://www.jfdaily.com/news/detail?id=1052011,2026-01-14 14:51:36,整合改编
坚持25年，中国首个银发网站终于等来了“风口”,https://www.jfdaily.com/news/detail?id=1052015,2026-01-14 14:51:21,自采原创
美国将暂停办理对75个国家的所有签证,https://www.jfdaily.com/news/detail?id=1052014,2026-01-14 14:47:59,转载摘编
欧陆风味季火热开场！亲民套餐受热捧，有的打到对折，餐厅客流增长超20%,https://www.jfdaily.com/news/detail?id=1051872,2026-01-14 14:45:24,自采原创
三部门官宣：“换房退个税”政策不变，优惠政策再延2年,https://www.jfdaily.com/news/detail?id=1051904,2026-01-14 14:45:10,自采原创
一场创新创业大赛后，半数以上获奖企业缘何选择“就地落户”？,https://www.jfdaily.com/news/detail?id=1052006,2026-01-14 14:40:53,自采原创
静安2026民生清单：启动4个旧改项目，新增1600张“建设者之家”床位,https://www.jfdaily.com/news/detail?id=1051958,2026-01-14 14:39:01,自采原创
市民“金点子”变惠民利企“金钥匙”！去年，上海收到人民建议10.3万件,https://www.jfdaily.com/news/detail?id=1051932,2026-01-14 14:38:48,自采原创
以玻璃艺术重述百年女性故事，珍・布拉齐娜亚洲首展在沪开幕,https://www.jfdaily.com/news/detail?id=1051937,2026-01-14 14:27:27,自采原创
三位中华艺术家作品流动性跻身全球当代艺术家前25强,https://www.jfdaily.com/news/detail?id=1051833,2026-01-14 14:20:05,自采原创
超38万人观展！广东美术百年大展应观众需求延期至3月8日,https://www.jfdaily.com/news/detail?id=1051930,2026-01-14 14:17:40,自采原创
舞动中澳青春，《李清照》点亮文化共鸣,https://www.jfdaily.com/news/detail?id=1051686,2026-01-14 14:17:15,自采原创
汇聚多元力量，向网络暴力说“不”,https://www.jfdaily.com/news/detail?id=1051435,2026-01-14 14:17:06,自采原创
十台好戏，十分精彩！台州市“三百”戏曲大联赛院团大戏赛圆满谢幕,https://www.jfdaily.com/news/detail?id=1051969,2026-01-14 14:13:24,约组外稿
肺癌“双靶”疗法实现患者生存期翻倍，上海医生成果再登《柳叶刀》,https://www.jfdaily.com/news/detail?id=1051698,2026-01-14 14:09:15,自采原创
机器人替农民“弯腰”，AI+激光精准识别、“秒杀”杂草,https://www.jfdaily.com/news/detail?id=1051843,2026-01-14 14:09:07,自采原创
机器人“农民”来了！智能“秒杀”杂草，不用一滴农药,https://www.jfdaily.com/news/detail?id=1051817,2026-01-14 14:08:58,自采原创
上海歌舞团迎来澳洲研学团，这群华裔青少年在宋韵舞姿里触摸中华文化根脉,https://www.jfdaily.com/news/detail?id=1051956,2026-01-14 14:06:41,自采原创
打平出线！U23国足首次晋级八强创造历史,https://www.jfdaily.com/news/detail?id=1051970,2026-01-14 14:03:30,自采原创
长三角看展丨关于时间、记忆与观看方式的跨界对话,https://www.jfdaily.com/news/detail?id=1051979,2026-01-14 13:55:07,自采原创
别让电子产品成孩子的“电子保姆”,https://www.jfdaily.com/news/detail?id=1051973,2026-01-14 13:53:23,转载摘编
一见·党兴方能国强,https://www.jfdaily.com/news/detail?id=1051977,2026-01-14 13:52:28,转载摘编
学习时节丨总书记关心“小家”这些事,https://www.jfdaily.com/news/detail?id=1051976,2026-01-14 13:52:19,转载摘编
中国共产党第二十届中央纪律检查委员会第五次全体会议公报,https://www.jfdaily.com/news/detail?id=1051978,2026-01-14 13:51:59,转载摘编
驻日美军基地工作人员涉嫌走私毒品被捕,https://www.jfdaily.com/news/detail?id=1051974,2026-01-14 13:49:16,转载摘编
总台首部原创精品短剧集《奇迹》首播收官，奇迹奋斗篇章未完待续,https://www.jfdaily.com/news/detail?id=1051918,2026-01-14 13:49:07,自采原创
中国驻卡塔尔使馆发布最新安全提醒,https://www.jfdaily.com/news/detail?id=1051968,2026-01-14 13:42:45,转载摘编
历史性突破！中国U23队首次小组出线，主帅“大脚尼奥”用成绩击退质疑,https://www.jfdaily.com/news/detail?id=1051962,2026-01-14 13:38:38,自采原创
美国官员称美国正从中东主要基地撤出人员,https://www.jfdaily.com/news/detail?id=1051964,2026-01-14 13:37:33,转载摘编
专访“90后”女演员蓝盈莹：是“浣碧”，更是“文纫秋”,https://www.jfdaily.com/news/detail?id=1051952,2026-01-14 13:33:39,自采原创
超38万人观展，触达超2700万人次，“其命惟新”大展延期至3月8日,https://www.jfdaily.com/news/detail?id=1051949,2026-01-14 13:33:31,自采原创
创造历史！中国U23男足首进亚洲杯淘汰赛,https://www.jfdaily.com/news/detail?id=1051961,2026-01-14 13:30:52,转载摘编
出道29年，蔡健雅第一次推出演唱会专辑，长达三小时现场实录,https://www.jfdaily.com/news/detail?id=1051892,2026-01-14 13:29:22,自采原创
美军机沿伊朗边界飞行，伊朗寻求外交支持,https://www.jfdaily.com/news/detail?id=1051959,2026-01-14 13:28:31,转载摘编
浙江证监局对向日葵重组预案涉嫌误导性陈述立案调查,https://www.jfdaily.com/news/detail?id=1051960,2026-01-14 13:27:45,转载摘编
海外项目中大额受贿，自以为境外藏钱没法查，面对铁证，李勇悔不当初,https://www.jfdaily.com/news/detail?id=1051951,2026-01-14 13:25:48,转载摘编
太刺激！上海明天直冲20℃！新台风要来了？下周断崖式降温，可能还有雪,https://www.jfdaily.com/news/detail?id=1051929,2026-01-14 13:16:40,整合改编
80多家央企负责人年薪披露：中石油董事长97.85万元……,https://www.jfdaily.com/news/detail?id=1051903,2026-01-14 13:15:42,整合改编
涉及7岁嫁人15岁生子等情节，这部惹众怒的短剧紧急下架,https://www.jfdaily.com/news/detail?id=1051917,2026-01-14 13:14:20,整合改编
多人徒步时意外去世，深圳大鹏新区发文,https://www.jfdaily.com/news/detail?id=1051950,2026-01-14 13:03:12,转载摘编
价值上亿元的书法“传家宝”能制作数字藏品投资理财？慢着，当心有诈！,https://www.jfdaily.com/news/detail?id=1051931,2026-01-14 13:00:21,自采原创
“居然一分钱不要！”居民为这件小事写下感谢信,https://www.jfdaily.com/news/detail?id=1051836,2026-01-14 12:59:56,自采原创
一次收受2000枚市值数千万元以太币，姚前大搞权钱交易,https://www.jfdaily.com/news/detail?id=1051947,2026-01-14 12:58:33,转载摘编
你有过在医院陪护的经历吗？上海启动新试点，跟记者探访免陪照护病区,https://www.jfdaily.com/news/detail?id=1051945,2026-01-14 12:54:59,自采原创
“铁脚板”遇见“新智慧”：上海“四百”大走访妙招迭出更走心,https://www.jfdaily.com/news/detail?id=1051926,2026-01-14 12:51:13,自采原创
外科医生去配眼镜自嘲每天“打游戏十多个小时”，真相令人感慨……,https://www.jfdaily.com/news/detail?id=1051340,2026-01-14 12:40:44,自采原创
深度| 一开年就飞“黑天鹅”，世行却上调预期，今年世界经济没想得那么糟？,https://www.jfdaily.com/news/detail?id=1051839,2026-01-14 12:37:39,自采原创
爬两层楼就心慌气短？你的“心门”可能出现了故障,https://www.jfdaily.com/news/detail?id=1051782,2026-01-14 12:34:20,约组外稿
带状疱疹缓解了就等于病好了？医生敲黑板：别干活、别活动！,https://www.jfdaily.com/news/detail?id=1051791,2026-01-14 12:33:58,约组外稿
上海警备区党委扩大会议举行，陈吉宁出席会议并讲话,https://www.jfdaily.com/news/detail?id=1051874,2026-01-14 12:33:50,自采原创
鸡蛋壳颜色越深越有营养？,https://www.jfdaily.com/news/detail?id=1051795,2026-01-14 12:32:32,约组外稿
美甲后，好好的指甲怎么变绿了？,https://www.jfdaily.com/news/detail?id=1051798,2026-01-14 12:32:13,约组外稿
免签红利加持，优惠套餐给力，“上海环球美食汇”点燃欧陆餐饮消费热潮,https://www.jfdaily.com/news/detail?id=1051913,2026-01-14 12:31:28,自采原创
山东省政府原参事袭燕严重违纪违法被开除党籍和公职,https://www.jfdaily.com/news/detail?id=1051919,2026-01-14 12:27:21,转载摘编
加拿大总理卡尼抵达北京，开启就任后首次对华正式访问,https://www.jfdaily.com/news/detail?id=1051920,2026-01-14 12:26:17,转载摘编
