title,url,time,source
在梦幻绚丽的色块中显示“海派抽象”,https://www.jfdaily.com/news/detail?id=1064594,2026-02-06 13:15:54,自采原创
贵州省黔西南州人大常委会原副厅长级干部袁建林一审被判十年,https://www.jfdaily.com/news/detail?id=1064656,2026-02-06 13:15:02,转载摘编
八部门印发《关于进一步防范和处置虚拟货币等相关风险的通知》,https://www.jfdaily.com/news/detail?id=1064657,2026-02-06 13:14:06,转载摘编
全球首个专为商务场景打造的智能体WeMeet亮相“模力社区”,https://www.jfdaily.com/news/detail?id=1064652,2026-02-06 13:08:15,自采原创
虚拟世界如何建成？| 小问号碰大咖,https://www.jfdaily.com/news/detail?id=1064468,2026-02-06 12:57:17,自采原创
教育部：将专项整治校园餐、教辅、校服等，有序推进中考改革,https://www.jfdaily.com/news/detail?id=1064354,2026-02-06 12:57:09,自采原创
今年春节，国际光影展将再度闪亮静安,https://www.jfdaily.com/news/detail?id=1064550,2026-02-06 12:54:11,自采原创
联合创新实验室揭牌，为国产算力产业发展提供技术支撑与生态赋能,https://www.jfdaily.com/news/detail?id=1064602,2026-02-06 12:53:59,自采原创
首次跨省联动，体育赋能一体化，2026长三角国际铁人三项赛4月举行,https://www.jfdaily.com/news/detail?id=1064512,2026-02-06 12:53:50,自采原创
史依弘、施夏明、茅善玉……大咖好戏荟萃第十六届东方名家名剧月,https://www.jfdaily.com/news/detail?id=1064379,2026-02-06 12:52:33,自采原创
步入30位上海艺术名家的工作室，“走进”鲜活的创作发生现场,https://www.jfdaily.com/news/detail?id=1064351,2026-02-06 12:52:23,自采原创
当工业遗存遇上“心象山水”，新展解锁东方美学新意境,https://www.jfdaily.com/news/detail?id=1064523,2026-02-06 12:51:57,自采原创
男子瘫痪深夜频现嘶吼敲墙声，小23岁女友照护崩溃：无名无分,https://www.jfdaily.com/news/detail?id=1064635,2026-02-06 12:43:44,整合改编
与“喘”死磕十年终于稳住！慢阻肺反复加重，可能与这3个误区有关,https://www.jfdaily.com/news/detail?id=1064542,2026-02-06 12:43:41,自采原创
上海乐高乐园携手飞猪、高德，打造“一站式”家庭游新体验,https://www.jfdaily.com/news/detail?id=1064540,2026-02-06 12:43:13,自采原创
眼睛也会中风！上海四院完成眼动脉溶栓，患者突发失明2小时内重见光明,https://www.jfdaily.com/news/detail?id=1064545,2026-02-06 12:39:51,自采原创
溃疡性结肠炎治疗遇困，维适平获批开启口服深度愈合新篇,https://www.jfdaily.com/news/detail?id=1064555,2026-02-06 12:38:40,自采原创
千年艺术珍品首度大规模亮相 朵云轩库藏展免费开放至3月18日,https://www.jfdaily.com/news/detail?id=1064378,2026-02-06 12:38:37,自采原创
综合评分登顶八大榜单！商汤开源最新空间智能模型，刁钻考题“考不倒”,https://www.jfdaily.com/news/detail?id=1064612,2026-02-06 12:37:34,自采原创
传习录丨体育强则中国强 国运兴则体育兴,https://www.jfdaily.com/news/detail?id=1064636,2026-02-06 12:34:41,转载摘编
看图学习·冰雪春天丨“中国冰雪运动寄希望于你们”,https://www.jfdaily.com/news/detail?id=1064638,2026-02-06 12:34:27,转载摘编
“猪葛亮”公司将注销，法定代表人周瑜：公司名并非恶搞，注销与网络关注无关,https://www.jfdaily.com/news/detail?id=1064631,2026-02-06 12:34:20,整合改编
【讲习所·中国与世界】习近平：让中乌友谊之树愈加枝繁叶茂,https://www.jfdaily.com/news/detail?id=1064637,2026-02-06 12:34:12,转载摘编
陈泰铨（陈小春），以政协委员身份参加惠州政协会议；网友：格局打开了,https://www.jfdaily.com/news/detail?id=1064630,2026-02-06 12:33:44,整合改编
新赛季新伙伴 上海银行成为海港球衣胸前赞助商,https://www.jfdaily.com/news/detail?id=1064525,2026-02-06 12:26:57,自采原创
巴厘岛大堵车背后：印尼的发展之路究竟通向何方,https://www.jfdaily.com/news/detail?id=1064309,2026-02-06 12:24:47,约组外稿
上海世赛准备周系列活动落幕，筹备工作全面转入冲刺阶段,https://www.jfdaily.com/news/detail?id=1064546,2026-02-06 12:19:30,自采原创
法国在格陵兰岛开设领事馆,https://www.jfdaily.com/news/detail?id=1064620,2026-02-06 12:12:27,转载摘编
防寒保供，上海供水行业已启动防冻保供应急机制，全员上阵,https://www.jfdaily.com/news/detail?id=1064615,2026-02-06 12:11:33,自采原创
魔都看展丨艺术家的工作室什么样,https://www.jfdaily.com/news/detail?id=1064614,2026-02-06 12:04:29,自采原创
用技能促进全球文化交融互鉴，上海世赛“一校一队”发布会召开,https://www.jfdaily.com/news/detail?id=1064314,2026-02-06 12:03:48,自采原创
跟着上海世赛全球技能梦想大使，沉浸式打卡世界技能博物馆,https://www.jfdaily.com/news/detail?id=1064470,2026-02-06 12:03:42,自采原创
拉网式排查+提级督办，青浦供电公司春运保电：重点站点故障1小时内处理完,https://www.jfdaily.com/news/detail?id=1064595,2026-02-06 12:03:00,自采原创
夜读 | 管继平：好玩有趣的文人名号,https://www.jfdaily.com/news/detail?id=1064362,2026-02-06 12:00:02,自采原创
节前夜间高铁列车车票已陆续开售，主要开行线路为京广、京沪、沪昆等高铁干线,https://www.jfdaily.com/news/detail?id=1064494,2026-02-06 11:57:52,自采原创
石化“去油增化”、轻工多出国货潮品，上海发布工业稳增长“强引擎方案”,https://www.jfdaily.com/news/detail?id=1064559,2026-02-06 11:56:32,自采原创
机器人表演完成“从10分到100分”蜕变，全球首个大型机器人晚会周日开演,https://www.jfdaily.com/news/detail?id=1064367,2026-02-06 11:56:20,自采原创
“福来福宝”亮相！六大服务加持，精准赋能企业发展,https://www.jfdaily.com/news/detail?id=1064529,2026-02-06 11:54:39,自采原创
黄浦区首发“家庭照护床位服务”区级标准，首批百名“家护师”持证上岗,https://www.jfdaily.com/news/detail?id=1064448,2026-02-06 11:53:49,自采原创
品牌入驻突破90%，代表盼“张园经验”助力上海国际消费中心城市建设,https://www.jfdaily.com/news/detail?id=1064526,2026-02-06 11:49:18,自采原创
市人大代表剧透：张园东区要来啦！6月30日开放首发区域,https://www.jfdaily.com/news/detail?id=1064571,2026-02-06 11:49:11,自采原创
上海海港与上海银行达成战略合作！武磊、颜骏凌身着新赛季全新主场战袍亮相,https://www.jfdaily.com/news/detail?id=1064553,2026-02-06 11:49:04,自采原创
未来五年，大城养老将如何进化？ | 两会焦点,https://www.jfdaily.com/news/detail?id=1064606,2026-02-06 11:48:53,自采原创
推动人形机器人等产品从研发到场景落地的全过程协同，这个联盟在沪成立,https://www.jfdaily.com/news/detail?id=1064549,2026-02-06 11:48:42,自采原创
“暖冬护航”全面升级，市北供电公司春运保电“容不得半点马虎”,https://www.jfdaily.com/news/detail?id=1064551,2026-02-06 11:48:15,自采原创
京沪专家呼吁，像重视“引进来”一样重视“走出去”工作,https://www.jfdaily.com/news/detail?id=1064490,2026-02-06 11:47:45,约组外稿
“迎新上岗”守好春运空中“团圆线”，浦东供电公司全力确保电力设备最佳状态,https://www.jfdaily.com/news/detail?id=1064558,2026-02-06 11:47:16,自采原创
预制菜不得添加防腐剂、保质期不应超一年，预制菜国标等征求意见稿发布,https://www.jfdaily.com/news/detail?id=1064552,2026-02-06 11:45:28,自采原创
531件与马有关的陶瓷艺术品集聚浦东，时代跨度从汉唐到现代,https://www.jfdaily.com/news/detail?id=1064520,2026-02-06 11:44:01,自采原创
浦锦街道把物业治理一线作为“赛马场”，大批年轻干部在基层实干中被“发现”,https://www.jfdaily.com/news/detail?id=1064479,2026-02-06 11:41:54,自采原创
总面积约3200平方米！北外滩街道社区文化活动中心正式开馆,https://www.jfdaily.com/news/detail?id=1064538,2026-02-06 11:41:22,自采原创
广州一男子投放老鼠药与猪肉碎混合物，致3名被害人的宠物狗死亡，法院判了,https://www.jfdaily.com/news/detail?id=1064564,2026-02-06 11:34:04,整合改编
一个半小时，和世界技能“大咖”一起打卡上海媒体,https://www.jfdaily.com/news/detail?id=1064203,2026-02-06 11:30:23,自采原创
未来农业什么样？中央一号文件给出答案,https://www.jfdaily.com/news/detail?id=1064565,2026-02-06 11:29:40,转载摘编
东北释放冰雪经济“热动能”,https://www.jfdaily.com/news/detail?id=1064567,2026-02-06 11:29:27,转载摘编
新春走基层丨每一次滑行都是极限挑战！国家残奥高山滑雪队正冲刺备战,https://www.jfdaily.com/news/detail?id=1064566,2026-02-06 11:29:15,转载摘编
新场古镇新春盛会贯穿整个春节，现场参与游戏就能换消费券,https://www.jfdaily.com/news/detail?id=1064528,2026-02-06 11:29:00,自采原创
南媒赴长话冬雪 邂逅春城冰雪之美,https://www.jfdaily.com/news/detail?id=1064496,2026-02-06 11:27:05,自采原创
美俄核军控“开天窗”有何影响,https://www.jfdaily.com/news/detail?id=1064563,2026-02-06 11:26:30,转载摘编
巴基斯坦首都爆炸事件已致31死，多家医院宣布进入紧急状态,https://www.jfdaily.com/news/detail?id=1064556,2026-02-06 11:23:15,转载摘编
