title,url,time,source
美伊开战，航班停飞，中东回国机票300万元有说法了,https://www.jfdaily.com/news/detail?id=1074209,2026-03-01 05:14:52,自采原创
从折叠走步机到“四吸材料”，华交会上这些“宝藏好物”藏着外贸韧性,https://www.jfdaily.com/news/detail?id=1074236,2026-03-01 05:10:24,自采原创
上海：中小学不得以寒假作业完成情况作为新学期注册依据,https://www.jfdaily.com/news/detail?id=1074248,2026-03-01 05:05:32,自采原创
明天开学雨停风变大，上海到底入春了吗？｜丹丹看天气,https://www.jfdaily.com/news/detail?id=1074237,2026-03-01 05:05:21,自采原创
老年人粗粮吃得越多越好？洗衣时高温比低温洗得更干净？来看2月科学流言榜→,https://www.jfdaily.com/news/detail?id=1073961,2026-03-01 05:05:14,自采原创
施夏明领衔，五大“天官”台前拜年，东方名家名剧月“开箱”，好有仪式感！,https://www.jfdaily.com/news/detail?id=1073924,2026-03-01 05:01:29,自采原创
伊朗最高领袖哈梅内伊遇袭身亡，曾以总统身份访华,https://www.jfdaily.com/news/detail?id=1074244,2026-03-01 04:57:24,整合改编
美军公布对伊朗行动视频，白宫发布特朗普监控照片,https://www.jfdaily.com/news/detail?id=1074245,2026-03-01 04:56:28,整合改编
【浩峰说】哈梅内伊身亡谁接班与战事走向,https://www.jfdaily.com/news/detail?id=1074246,2026-03-01 04:56:11,自采原创
2026年长三角地区首趟“球迷专列”3月1日从上海开出,https://www.jfdaily.com/news/detail?id=1074238,2026-03-01 04:54:57,自采原创
中东战火再起，东航南航紧急返航！多家航司发布退改方案；迪拜机场酒店受波及,https://www.jfdaily.com/news/detail?id=1074249,2026-03-01 04:53:29,整合改编
人物｜伊朗最高领袖哈梅内伊确认殉职：活在暗杀阴影中，后半生视死如归,https://www.jfdaily.com/news/detail?id=1074240,2026-03-01 04:46:09,自采原创
伊朗导弹击中以军总参谋部,https://www.jfdaily.com/news/detail?id=1074247,2026-03-01 04:35:06,转载摘编
泥塘里撒欢、柴火灶自助烹饪……金山廊下镇亲子家庭“干塘摸鱼”闹元宵,https://www.jfdaily.com/news/detail?id=1074211,2026-03-01 04:23:27,自采原创
中国职业足球开年大戏一触即发，当海港雄鹰直面国安京狮，注定火星撞地球？,https://www.jfdaily.com/news/detail?id=1074243,2026-03-01 04:17:39,自采原创
外交部和中国驻伊朗使领馆提醒在伊朗中国公民尽快撤离,https://www.jfdaily.com/news/detail?id=1074241,2026-03-01 04:14:30,转载摘编
新民帮侬忙 民生直播,https://www.jfdaily.com/news/detail?id=1074219,2026-03-01 04:10:55,自采原创
“带看几次房要收15000元！”上海市民购房意向金，竟遭中介“高额截留”,https://www.jfdaily.com/news/detail?id=1074222,2026-03-01 04:10:47,自采原创
巨痛！沪上知名儿童游乐机构，两岁宝摔落骨折！后面的事，家长更“心痛”,https://www.jfdaily.com/news/detail?id=1074223,2026-03-01 04:10:41,自采原创
哈梅内伊遇害，“中东火药桶”彻底引爆，连锁反应正逐渐显现,https://www.jfdaily.com/news/detail?id=1074233,2026-03-01 04:03:53,自采原创
伊朗对伊拉克北部美军基地发起袭击,https://www.jfdaily.com/news/detail?id=1074235,2026-03-01 03:50:21,转载摘编
让“罕见”发声，四成参赛者是患者！第二届上海市罕见病科普大赛圆满落幕,https://www.jfdaily.com/news/detail?id=1073963,2026-03-01 03:36:38,自采原创
热观察 | 哈梅内伊遇袭身亡，考验伊朗韧性的时候到了,https://www.jfdaily.com/news/detail?id=1074226,2026-03-01 03:24:20,自采原创
天下一席谈｜专访刘中民：哈梅内伊遇袭身亡，中东会否再陷生灵涂炭战争深渊？,https://www.jfdaily.com/news/detail?id=1074224,2026-03-01 03:18:28,自采原创
伊朗政府就哈梅内伊殉职发表声明,https://www.jfdaily.com/news/detail?id=1074227,2026-03-01 03:12:24,转载摘编
申城遗体（角膜）捐献志愿登记人数近7.7万，累计实现捐献1.9万例,https://www.jfdaily.com/news/detail?id=1073825,2026-03-01 03:11:33,自采原创
伊朗媒体说伊朗总统等将领导国家,https://www.jfdaily.com/news/detail?id=1074225,2026-03-01 03:09:04,转载摘编
杭州目标“人工智能第一城”，长三角究竟有多少“第一城”?,https://www.jfdaily.com/news/detail?id=1074213,2026-03-01 02:59:13,自采原创
参加救援、跑马拉松，这就是一名打工者的业余生活？ | 许朋乐,https://www.jfdaily.com/news/detail?id=1072595,2026-03-01 02:58:36,约组外稿
报名开启！第三届“海聚英才”“国泰海通杯”上海大学生创新创业大赛来了,https://www.jfdaily.com/news/detail?id=1074197,2026-03-01 02:54:00,自采原创
美以打击伊朗后，伊朗男足或无缘2026 美加墨世界杯，中国男足有望递补？,https://www.jfdaily.com/news/detail?id=1074216,2026-03-01 02:46:52,自采原创
伊朗伊斯兰革命卫队就哈梅内伊殉职发表声明，称将“严惩凶手”,https://www.jfdaily.com/news/detail?id=1074217,2026-03-01 02:36:20,转载摘编
哈梅内伊身亡细节公开！美以对伊朗发动“斩首式”打击，冲突走向难料,https://www.jfdaily.com/news/detail?id=1074214,2026-03-01 02:34:33,整合改编
美媒称伊朗防长等约40名伊朗官员在袭击中死亡,https://www.jfdaily.com/news/detail?id=1074215,2026-03-01 02:26:51,转载摘编
美官员：美以在哈梅内伊与其高级助手举行会议时发动袭击,https://www.jfdaily.com/news/detail?id=1074212,2026-03-01 02:18:09,转载摘编
深视频 | 伊朗媒体：最高领袖哈梅内伊遇害,https://www.jfdaily.com/news/detail?id=1074210,2026-03-01 02:11:01,自采原创
