title,url,time,source
张雪为什么让这么多人破防？上海世赛想说的，其实也是这件事,https://www.jfdaily.com/news/detail?id=1090785,2026-04-01 20:49:03,自采原创
与澳大利亚、美国合谋之后，高市早苗又想与法国制定计划摆脱对华稀土依赖,https://www.jfdaily.com/news/detail?id=1090470,2026-04-01 20:34:02,自采原创
神探李昌钰的“封神”案：用死猪做实验，实现美国首例无尸定罪,https://www.jfdaily.com/news/detail?id=1090108,2026-04-01 20:31:04,整合改编
澳门世界杯：国乒男单输掉三场“中德之战”，孙颖莎蒯曼今争夺八强席位,https://www.jfdaily.com/news/detail?id=1090812,2026-04-01 20:30:05,自采原创
第19个“世界孤独症日”，上海演员在哈尔滨为一群特别观众演出,https://www.jfdaily.com/news/detail?id=1090741,2026-04-01 20:12:06,自采原创
快看视频 | 特朗普回应白宫宴会厅修建被叫停，称“我们又没花纳税人的钱”,https://www.jfdaily.com/news/detail?id=1090589,2026-04-01 20:08:02,自采原创
澳门世界杯｜国乒男队告危！一日对德国选手三连败，仅两人晋级十六强,https://www.jfdaily.com/news/detail?id=1090813,2026-04-01 20:06:09,自采原创
时隔25年再度率上海女排登顶联赛，淡然谦逊的蔡斌还是那个“小诸葛”,https://www.jfdaily.com/news/detail?id=1090817,2026-04-01 20:06:07,自采原创
特朗普反复威胁后，德国呼吁“避免出现情绪化升级”,https://www.jfdaily.com/news/detail?id=1090803,2026-04-01 20:06:04,整合改编
意大利足球遭遇“第三次末日”，足协主席拒绝引咎辞职，国内舆论炸锅,https://www.jfdaily.com/news/detail?id=1090773,2026-04-01 20:06:02,自采原创
时隔25年登顶排超联赛，上海女排终破“亚军魔咒”，是完美谢幕更是全新起点,https://www.jfdaily.com/news/detail?id=1090818,2026-04-01 20:05:09,自采原创
巴菲特：已与盖茨断绝联系，不想就此发表评论,https://www.jfdaily.com/news/detail?id=1090804,2026-04-01 20:05:06,整合改编
上海女排夺冠背后：一座城，三个男人，二十五年再圆梦！,https://www.jfdaily.com/news/detail?id=1090801,2026-04-01 20:05:04,自采原创
澳门世界杯｜国乒男队战况急转直下，梁靖崑彻底无缘伦敦世乒赛令人唏嘘,https://www.jfdaily.com/news/detail?id=1090794,2026-04-01 20:04:09,自采原创
从”小颜“到”颜哥“，35 岁国门颜骏凌已是八朝元老，继续肩负传帮带责任,https://www.jfdaily.com/news/detail?id=1090772,2026-04-01 20:04:06,自采原创
俄罗斯敦促乌方尽快决定从顿巴斯撤军，此前泽连斯基称遭美方施压移交该地区,https://www.jfdaily.com/news/detail?id=1090800,2026-04-01 20:01:03,整合改编
澳门世界杯｜国乒女队六人全员晋级十六强，小将覃予萱淘汰日本前一姐早田希娜,https://www.jfdaily.com/news/detail?id=1090673,2026-04-01 20:00:09,自采原创
伊朗对美以发动第89波攻势，自杀式无人机突进北印度洋，逼退“林肯”号航母,https://www.jfdaily.com/news/detail?id=1090810,2026-04-01 20:00:06,整合改编
澳门世界杯｜温瑞博少年锋芒，王楚钦稳定发挥，国乒男队仅剩两人晋级十六强,https://www.jfdaily.com/news/detail?id=1090721,2026-04-01 20:00:04,自采原创
尹锡悦看守所内“吸金”12亿韩元， 比李在明年薪高4.6倍,https://www.jfdaily.com/news/detail?id=1090807,2026-04-01 19:50:02,整合改编
俄罗斯发出最后通牒：要求乌方在两个月内从顿巴斯地区撤军,https://www.jfdaily.com/news/detail?id=1090805,2026-04-01 19:45:02,整合改编
速视频｜斯塔默坦承没有配合美军行动而被施压，但坚持英国“不会参与战争”,https://www.jfdaily.com/news/detail?id=1090811,2026-04-01 19:40:02,整合改编
特朗普威胁退出北约，马克龙暗讽“有的国家善变还伤盟友”，德方表态一针见血,https://www.jfdaily.com/news/detail?id=1090798,2026-04-01 19:36:03,整合改编
快看视频｜反转！纽约市撤销政府设备TikTok禁令，马姆达尼官宣“回归”,https://www.jfdaily.com/news/detail?id=1090579,2026-04-01 19:34:02,自采原创
尹锡悦被羁押8个月狂揽12亿韩元代管金，据称是李在明年薪的数倍,https://www.jfdaily.com/news/detail?id=1090802,2026-04-01 19:31:02,整合改编
在烈士墓前听一堂“政绩观”微党课，沪郊朱泾清明主题活动这样赓续红色血脉,https://www.jfdaily.com/news/detail?id=1090467,2026-04-01 15:47:44,自采原创
浦东新区“品书香・绘无邪・护国安”主题活动启幕,https://www.jfdaily.com/news/detail?id=1090520,2026-04-01 15:47:37,自采原创
中法公证业务交流会在沪举行,https://www.jfdaily.com/news/detail?id=1090449,2026-04-01 15:47:25,自采原创
“充电站”传薪火、凉亭里议事……石化街道用“特色阵地”破解基层治理难题,https://www.jfdaily.com/news/detail?id=1090656,2026-04-01 15:47:14,自采原创
2025年上海支持科创和制造业税惠达1873.6亿元,https://www.jfdaily.com/news/detail?id=1090742,2026-04-01 14:50:20,自采原创
医本正经聊天室 | 我“针”的麻了！,https://www.jfdaily.com/news/detail?id=1090374,2026-04-01 14:49:15,自采原创
“一个特别的韩女作者”！在流动的世界，她把语言当作家园,https://www.jfdaily.com/news/detail?id=1089613,2026-04-01 14:48:15,自采原创
《雄狮少年》归来，粤语版音乐剧能否征服上海观众？,https://www.jfdaily.com/news/detail?id=1090633,2026-04-01 14:48:07,自采原创
破亿！松江综保区这个“卫星站”让跨境电商“飞”出新速度,https://www.jfdaily.com/news/detail?id=1090712,2026-04-01 14:41:31,自采原创
楼上被褥起火引燃楼下阳台堆物，目睹火情，他“扔下”10岁的儿子……,https://www.jfdaily.com/news/detail?id=1090241,2026-04-01 14:40:23,自采原创
羽毛球运动水平等级评定走进古美学校，奥运冠军黄雅琼现场“划重点”,https://www.jfdaily.com/news/detail?id=1090394,2026-04-01 14:39:43,自采原创
上海女排夺得联赛第六冠！25年前夺冠的老照片，勾起多少回忆？,https://www.jfdaily.com/news/detail?id=1090782,2026-04-01 14:39:25,自采原创
告别单次义诊！闵行这所小学有了“常驻”家庭医生工作室,https://www.jfdaily.com/news/detail?id=1089896,2026-04-01 14:38:04,自采原创
“首席服务员”上线！静安顶格推进楼宇包干机制，楼宇经济开启新生态,https://www.jfdaily.com/news/detail?id=1090608,2026-04-01 14:37:35,自采原创
密密麻麻！这段人行道，竟成“地锁阵”！疯狂划车位，市民质疑“监管缺失”,https://www.jfdaily.com/news/detail?id=1090662,2026-04-01 14:34:43,自采原创
亿元楼也是“垂直产业社区”，静安召开楼宇经济高质量发展大会,https://www.jfdaily.com/news/detail?id=1090709,2026-04-01 14:34:22,自采原创
徐汇这片樱花林里，职工共赴春日派对,https://www.jfdaily.com/news/detail?id=1090733,2026-04-01 14:33:51,自采原创
将音乐与City Walk深度融合，风貌街区化身为流动的音乐长廊,https://www.jfdaily.com/news/detail?id=1090753,2026-04-01 14:33:24,自采原创
中法公证业务交流会在沪举行,https://www.jfdaily.com/news/detail?id=1090631,2026-04-01 14:31:32,自采原创
逛花海、品早茶、看球赛！泰州为上海游客量身打造三条主题线路,https://www.jfdaily.com/news/detail?id=1090623,2026-04-01 14:30:42,自采原创
公交加大运力保障清明祭扫出行,https://www.jfdaily.com/news/detail?id=1090621,2026-04-01 14:30:18,自采原创
上海女排时隔25年登顶联赛，主教练蔡斌说：“下一个目标是全运会冠军！”,https://www.jfdaily.com/news/detail?id=1090774,2026-04-01 14:22:37,自采原创
中央广播电视总台举办树立和践行正确政绩观学习教育读书班,https://www.jfdaily.com/news/detail?id=1090775,2026-04-01 14:20:36,转载摘编
赛车俱乐部里的90后画家：走进韦丁桢的“小烛”宇宙,https://www.jfdaily.com/news/detail?id=1090505,2026-04-01 14:20:30,自采原创
年轻艺术家的成长方法论：要美，更要鼓舞人心,https://www.jfdaily.com/news/detail?id=1090521,2026-04-01 14:19:53,自采原创
“上海实体交通卡，为啥退不了？”73岁老伯来沪遭遇引发质疑,https://www.jfdaily.com/news/detail?id=1090661,2026-04-01 14:18:38,自采原创
杨浦街头：这种机器突然冒烟，周边车辆险些遭殃,https://www.jfdaily.com/news/detail?id=1090744,2026-04-01 14:18:30,自采原创
法治应成为城市品格、城市信用与核心竞争力的重要标识｜王永杰,https://www.jfdaily.com/news/detail?id=1090013,2026-04-01 14:15:06,自采原创
“养龙虾”热的经济学思考：智能体改写企业管理底层逻辑,https://www.jfdaily.com/news/detail?id=1089552,2026-04-01 14:15:03,约组外稿
菌菇海鲜干货、腊味、调味品，到底放多久不能吃了？,https://www.jfdaily.com/news/detail?id=1090771,2026-04-01 14:10:58,约组外稿
澳门世界杯｜0比3不敌德国名将邱党止步小组赛，陈垣宇成为国乒出局首人,https://www.jfdaily.com/news/detail?id=1090751,2026-04-01 14:06:01,自采原创
受贿1.54亿，“老虎”寇伟一审被判死缓！处心积虑对抗组织审查,https://www.jfdaily.com/news/detail?id=1090641,2026-04-01 14:00:29,整合改编
怀念张国荣：你若尚在，已是七十,https://www.jfdaily.com/news/detail?id=1090403,2026-04-01 14:00:02,整合改编
三地党委主要领导升任副部！省级政府领导班子密集调整,https://www.jfdaily.com/news/detail?id=1090578,2026-04-01 13:59:58,自采原创
浦发银行2025年业绩发布：ESG引领高质量发展，数智化战略结硕果,https://www.jfdaily.com/news/detail?id=1090760,2026-04-01 13:59:54,广告推广
