title,url,time,source
“订单已排到9月份”！新春伊始，金山企业争相冲刺“开门红”,https://www.jfdaily.com/news/detail?id=1072102,2026-02-25 05:25:36,自采原创
马年爆火的歙县三村，凭什么成为黄山乡村振兴的“样板标杆”？,https://www.jfdaily.com/news/detail?id=1072117,2026-02-25 05:19:41,约组外稿
企业家坐主席台，坐C位，说明了什么？| 锋面评论,https://www.jfdaily.com/news/detail?id=1072174,2026-02-25 05:15:40,自采原创
韩美军方宣布3月9日至19日举行联合军演,https://www.jfdaily.com/news/detail?id=1072201,2026-02-25 05:12:52,转载摘编
解读丨上海今出楼市新政：持居住证满5年可买房，公积金贷款额度又涨了,https://www.jfdaily.com/news/detail?id=1072138,2026-02-25 05:09:27,自采原创
刚刚！上海发布楼市“沪七条”，亮点多多,https://www.jfdaily.com/news/detail?id=1072179,2026-02-25 05:07:10,自采原创
线上社牛，现实社恐？开学前，孩子的这剂“手机收心药”请收好,https://www.jfdaily.com/news/detail?id=1072188,2026-02-25 05:05:13,自采原创
胡艳红 | 以伟大建党精神培育时代新人的实践进路,https://www.jfdaily.com/news/detail?id=1071766,2026-02-25 05:02:14,约组外稿
赵恩国 倪馨 | 伟大建党精神的实践哲学底蕴,https://www.jfdaily.com/news/detail?id=1071777,2026-02-25 05:01:47,约组外稿
省委巡视组原巡视专员高建慧被开除党籍，毫无纪法底线，大搞权钱交易,https://www.jfdaily.com/news/detail?id=1072197,2026-02-25 05:01:32,整合改编
蒲妍 | 伟大建党精神融入“大思政课”的多维路径,https://www.jfdaily.com/news/detail?id=1071755,2026-02-25 05:01:19,约组外稿
美国重兵集结中东，背后是怎样的盘算,https://www.jfdaily.com/news/detail?id=1072195,2026-02-25 05:00:59,转载摘编
普京透露：“敌方准备制造爆炸”,https://www.jfdaily.com/news/detail?id=1072190,2026-02-25 04:51:49,转载摘编
大疆反击美国禁令！,https://www.jfdaily.com/news/detail?id=1072191,2026-02-25 04:51:13,转载摘编
中办发文强调“正确政绩观”，有何深意？,https://www.jfdaily.com/news/detail?id=1072189,2026-02-25 04:49:41,转载摘编
“减肥神药”专利期将至，专家表示：药物仅是辅助，这些生活方式才是“王道”,https://www.jfdaily.com/news/detail?id=1072152,2026-02-25 04:45:11,自采原创
社交平台 “单边断联”，郑钦文与功勋教练里巴缘何走到十字路口？,https://www.jfdaily.com/news/detail?id=1072156,2026-02-25 04:41:53,自采原创
微言 | 13万奢侈品卖了9300元，未成年成长不容“趁火打劫”,https://www.jfdaily.com/news/detail?id=1072180,2026-02-25 04:39:59,自采原创
头部旅游平台新实践：中国文化走出去，旅游产业活起来,https://www.jfdaily.com/news/detail?id=1072184,2026-02-25 04:36:34,广告推广
屋内液化气灶小火炖牛肉，母亲出门洗菜幼童反锁家门,https://www.jfdaily.com/news/detail?id=1072176,2026-02-25 04:34:35,自采原创
120万人次打卡，3.57亿消费！静安国际光影展新春活动收官,https://www.jfdaily.com/news/detail?id=1072177,2026-02-25 04:34:10,自采原创
市民误以为“520墙”遗址是情侣打卡地，徐汇检察官出手让红色基因焕发新生,https://www.jfdaily.com/news/detail?id=1072171,2026-02-25 04:33:50,自采原创
网友吐槽虹桥站返程打车难：超1200人在线排队，有人骑两小时共享单车回家,https://www.jfdaily.com/news/detail?id=1072185,2026-02-25 04:33:45,整合改编
徐汇“春节消费账单”出炉！客流、销售额纷纷实现两位数增长→,https://www.jfdaily.com/news/detail?id=1072170,2026-02-25 04:33:29,转载摘编
十日谈·为春天存档｜毛芦芦：江南第一簇篱笆花,https://www.jfdaily.com/news/detail?id=1071977,2026-02-25 04:28:45,自采原创
陈美：有个师父真好,https://www.jfdaily.com/news/detail?id=1071979,2026-02-25 04:28:33,自采原创
解锁AI科技年味新玩法，数智力量守护申城新春 “满格” 模式,https://www.jfdaily.com/news/detail?id=1072162,2026-02-25 04:16:04,自采原创
转存！大学英语四、六级考试成绩27日可查,https://www.jfdaily.com/news/detail?id=1072175,2026-02-25 04:10:20,转载摘编
离谱！男子用AI伪造呕吐物、带血牛肉图片和病历，向多家餐厅恶意索赔被查获,https://www.jfdaily.com/news/detail?id=1072166,2026-02-25 03:57:16,自采原创
邵佳一的国足要和亚马尔过招了？,https://www.jfdaily.com/news/detail?id=1072096,2026-02-25 03:55:38,自采原创
特朗普称伊朗正研制能打到美国的导弹,https://www.jfdaily.com/news/detail?id=1072167,2026-02-25 03:55:03,转载摘编
西双版纳：正努力隔离受伤亚洲象，具备条件后及时救助,https://www.jfdaily.com/news/detail?id=1072168,2026-02-25 03:54:23,转载摘编
刚刚宣布，杭州已入春！比常年提早半个月,https://www.jfdaily.com/news/detail?id=1072169,2026-02-25 03:53:34,转载摘编
英监管机构对美社交新闻网站开出1447万英镑罚单,https://www.jfdaily.com/news/detail?id=1072164,2026-02-25 03:45:12,转载摘编
太恐怖！手机自动给陌生人打47分钟电话！有人凌晨打给领导，这几个赶紧关！,https://www.jfdaily.com/news/detail?id=1072160,2026-02-25 03:43:08,整合改编
我与年夜饭的故事| 幸福是年味中最鲜亮的色彩,https://www.jfdaily.com/news/detail?id=1071459,2026-02-25 03:34:41,自采原创
我与年夜饭的故事|年到边疆自有味,https://www.jfdaily.com/news/detail?id=1071456,2026-02-25 03:33:05,自采原创
我与年夜饭的故事|三十人团圆宴，十七载家国情,https://www.jfdaily.com/news/detail?id=1071472,2026-02-25 03:32:51,自采原创
我与年夜饭的故事|万里归航过大年,https://www.jfdaily.com/news/detail?id=1071443,2026-02-25 03:32:06,自采原创
我与年夜饭的故事|外婆的葱烤大排,https://www.jfdaily.com/news/detail?id=1071441,2026-02-25 03:31:55,自采原创
自主研制！这一平台已完成约5万张国际濒危天文底片的数字化抢救工作,https://www.jfdaily.com/news/detail?id=1072145,2026-02-25 03:28:24,自采原创
云南德宏州盈江县发生4.6级地震,https://www.jfdaily.com/news/detail?id=1072159,2026-02-25 03:27:06,转载摘编
57岁男演员突发脑出血去世，曾出演《神雕侠侣》《封神榜》《射雕英雄传》,https://www.jfdaily.com/news/detail?id=1072157,2026-02-25 03:26:34,整合改编
冲上热搜！男子误喝过期牛奶暴瘦53斤，医生提醒,https://www.jfdaily.com/news/detail?id=1072127,2026-02-25 03:25:45,整合改编
海外观众“下飞机即观展”！AWE首次在东方枢纽国际商务合作区设立展区,https://www.jfdaily.com/news/detail?id=1072142,2026-02-25 03:16:15,自采原创
“教师报考其他单位被开除”，三亚教育局回应,https://www.jfdaily.com/news/detail?id=1072155,2026-02-25 03:15:22,转载摘编
刘强东投资50亿元，官宣进军游艇行业：我家是一百多年的船民，这是儿时梦想,https://www.jfdaily.com/news/detail?id=1072154,2026-02-25 03:12:26,整合改编
德国总理默茨抵达北京开始访华，高规格经贸代表团随行,https://www.jfdaily.com/news/detail?id=1072153,2026-02-25 03:10:56,转载摘编
从课堂到临床，这支团队在守正创新中打通针灸传承“任督二脉”,https://www.jfdaily.com/news/detail?id=1072141,2026-02-25 03:09:54,自采原创
皇马未就歧视中国人言论在海外平台致歉,https://www.jfdaily.com/news/detail?id=1072150,2026-02-25 03:09:29,转载摘编
跑官要官、大搞权钱交易，济南市原党组成员、副市长焦卫星被“双开”,https://www.jfdaily.com/news/detail?id=1072149,2026-02-25 03:04:42,转载摘编
特朗普发表国情咨文演讲，谈及移民、经济和犯罪问题,https://www.jfdaily.com/news/detail?id=1072148,2026-02-25 03:04:00,转载摘编
抢滩跨海、如履平地，详解国产“野马”气垫登陆艇的硬核战力,https://www.jfdaily.com/news/detail?id=1072147,2026-02-25 03:03:11,转载摘编
高市早苗被曝向自民党议员发放数万日元礼品,https://www.jfdaily.com/news/detail?id=1072144,2026-02-25 03:00:49,转载摘编
高市早苗，涉嫌违法？向议员发放“当选礼品”，还发帖承认……,https://www.jfdaily.com/news/detail?id=1072143,2026-02-25 02:57:55,整合改编
亿年前蜥蜴得骨瘤？中国主导，首次琥珀中发现骨肿瘤病变直接证据,https://www.jfdaily.com/news/detail?id=1072116,2026-02-25 02:46:25,自采原创
这个疾病春节后“算账”，第一批“受难者”已经出现，昨天有医院接诊量破百！,https://www.jfdaily.com/news/detail?id=1072140,2026-02-25 02:36:20,整合改编
女生西藏徒步失联后在牛棚被找到！当地回应：她用牛粪保温,https://www.jfdaily.com/news/detail?id=1072139,2026-02-25 02:33:25,整合改编
多地发布春节假期楼市“成绩单”,https://www.jfdaily.com/news/detail?id=1072137,2026-02-25 02:30:28,转载摘编
六旬老太服务区内被德牧犬两度扑咬致骨折，犬主称老人身上有味所致！警方介入,https://www.jfdaily.com/news/detail?id=1072136,2026-02-25 02:24:58,转载摘编
