title,url,time,source
上海市公安局公开招聘1100名辅警,https://www.jfdaily.com/news/detail?id=1071683,2026-02-24 05:24:19,自采原创
稳增长、优环境、善治理、惠民生 ，普陀区召开党建工作提质年部署会,https://www.jfdaily.com/news/detail?id=1071620,2026-02-24 05:23:27,自采原创
最新民调：逾半美国成年人认为特朗普正在“把国家带向错误方向”,https://www.jfdaily.com/news/detail?id=1071673,2026-02-24 05:12:53,自采原创
微言 | 春节档票房领跑全球，“电影 +” 何以带火整条消费链,https://www.jfdaily.com/news/detail?id=1071675,2026-02-24 05:12:35,自采原创
虹口区春节人气旺，北外滩、今潮8弄等热门地标全时段“人从众”,https://www.jfdaily.com/news/detail?id=1071480,2026-02-24 05:08:12,自采原创
马里兰州起诉美国政府“非法建造”移民拘留中心,https://www.jfdaily.com/news/detail?id=1071686,2026-02-24 05:07:39,转载摘编
全年重大工程投资额4850亿元！节后第一天，黄浦举行重大工程集中开工仪式,https://www.jfdaily.com/news/detail?id=1071646,2026-02-24 05:05:53,自采原创
东方枢纽试运行“满月”，体感如何？,https://www.jfdaily.com/news/detail?id=1071681,2026-02-24 05:01:26,自采原创
“我不知道自己还能活多久”，特朗普谈海湖庄园事件,https://www.jfdaily.com/news/detail?id=1071679,2026-02-24 05:01:09,转载摘编
2026年春节假期1779.6万人次出入境，日均增长10.1%,https://www.jfdaily.com/news/detail?id=1071645,2026-02-24 05:00:33,转载摘编
台湾宜兰县发生4.7级地震，震源深度8千米,https://www.jfdaily.com/news/detail?id=1071680,2026-02-24 04:59:21,转载摘编
上观时评｜马年开工日如何策马向前,https://www.jfdaily.com/news/detail?id=1071586,2026-02-24 04:58:51,自采原创
200亿新风口！AI漫剧“造梦”之后，如何深耕？,https://www.jfdaily.com/news/detail?id=1071672,2026-02-24 04:58:40,自采原创
文汇海报｜消费603.5亿！迎客超2167万！上海马年春节“热力全开”,https://www.jfdaily.com/news/detail?id=1071634,2026-02-24 04:57:04,自采原创
省委批准：开除刘长江党籍！节后上班第一天，67岁厅官被处分,https://www.jfdaily.com/news/detail?id=1071663,2026-02-24 04:51:16,整合改编
微言 | 36斤羊烤出6.9斤，损耗不是消费欺诈借口,https://www.jfdaily.com/news/detail?id=1071649,2026-02-24 04:32:11,自采原创
“36斤活羊烤制完成后重6.9斤”，重庆通报调查结果,https://www.jfdaily.com/news/detail?id=1071669,2026-02-24 04:26:02,转载摘编
突破80亿！2026中国电影票房暂列全球第一，《飞驰人生3》贡献过半,https://www.jfdaily.com/news/detail?id=1071666,2026-02-24 04:15:29,自采原创
深度赋能HR决策力，前程无忧正式推出“AI招聘助手”,https://www.jfdaily.com/news/detail?id=1071651,2026-02-24 04:13:17,自采原创
春节假期全国铁路发送旅客1.21亿人次，日均开行旅客列车12380列,https://www.jfdaily.com/news/detail?id=1071650,2026-02-24 04:09:14,自采原创
寒假记忆中，野火烧了童年的眉毛 | 汤朔梅,https://www.jfdaily.com/news/detail?id=1069178,2026-02-24 04:08:06,约组外稿
男子花5600元套中汽车使用权，商家反悔拒兑现！网友怒斥：玩不起就别玩！,https://www.jfdaily.com/news/detail?id=1071662,2026-02-24 04:08:01,整合改编
好消息候补成功，坏消息车开走了！12306回应半夜候补成功无法退全款！,https://www.jfdaily.com/news/detail?id=1071660,2026-02-24 04:04:49,整合改编
《百年传动》预告片首发：透过数十位亲历者口述，见证上海工业百年风云,https://www.jfdaily.com/news/detail?id=1071652,2026-02-24 04:02:03,自采原创
潞村打造欢乐祥和“太平年”，春节游客超10万,https://www.jfdaily.com/news/detail?id=1071647,2026-02-24 03:52:24,转载摘编
刚刚，官方通报“36斤活羊烤完剩6.9斤”：商家非正常投喂增重，退一赔三,https://www.jfdaily.com/news/detail?id=1071640,2026-02-24 03:39:39,整合改编
覆盖严重阿尔茨海默症等高发失能特定疾病，大都会人寿首款税优护理险上市,https://www.jfdaily.com/news/detail?id=1071638,2026-02-24 03:32:16,自采原创
“上观碰碰头·秋秋不睡午觉”｜“马”上有新意 新年新气象,https://www.jfdaily.com/news/detail?id=1071635,2026-02-24 03:32:12,自采原创
知名时尚巨头58岁创始人在泰国坠亡！妻子回应：已经四年多没有联系,https://www.jfdaily.com/news/detail?id=1071637,2026-02-24 03:30:37,整合改编
32岁女子“大象腿”无法行走被迫卧床，上海医生2毫米微创“清理”血管,https://www.jfdaily.com/news/detail?id=1071611,2026-02-24 03:12:53,自采原创
最新消息！上海人工智能实验室永久基地今年6月竣工,https://www.jfdaily.com/news/detail?id=1071628,2026-02-24 03:10:51,自采原创
暴风雪肆虐美国东北部，数千航班取消50万用户停电,https://www.jfdaily.com/news/detail?id=1071630,2026-02-24 03:10:36,转载摘编
开工第一天如何度过比较好？春节后“收心包”助你“丝滑切换”,https://www.jfdaily.com/news/detail?id=1071614,2026-02-24 03:10:36,自采原创
从“看得见”到“坐得上”，2026低空市场如何加速打开？,https://www.jfdaily.com/news/detail?id=1071629,2026-02-24 03:09:23,转载摘编
顾客怒了：1188元一只36斤活羊，烤完剩6.9斤！商家回应，网友吵翻！,https://www.jfdaily.com/news/detail?id=1071588,2026-02-24 03:07:50,整合改编
金正恩：未来五年是朝鲜经济循序渐进质量发展阶段,https://www.jfdaily.com/news/detail?id=1071624,2026-02-24 03:04:54,转载摘编
服从关税终裁，美国政府24日起停止征收违法关税,https://www.jfdaily.com/news/detail?id=1071625,2026-02-24 03:04:21,转载摘编
日本发生幼儿园校车事故致14人受伤,https://www.jfdaily.com/news/detail?id=1071626,2026-02-24 03:03:10,转载摘编
开工不emo！体育人的新年仪式感，从两枚百年“工牌”开始,https://www.jfdaily.com/news/detail?id=1071619,2026-02-24 03:03:10,自采原创
默茨连选连任，默克尔与特朗普谁在眼热,https://www.jfdaily.com/news/detail?id=1071622,2026-02-24 02:59:13,自采原创
价格翻10倍，好难抢！有人懊悔到拍大腿，网友马上翻箱倒柜：我家好像有,https://www.jfdaily.com/news/detail?id=1071618,2026-02-24 02:54:49,整合改编
春节假期全国铁路累计发送旅客1.21亿人次,https://www.jfdaily.com/news/detail?id=1071615,2026-02-24 02:46:51,转载摘编
退钱了！退钱了！明天起开始预约,https://www.jfdaily.com/news/detail?id=1071616,2026-02-24 02:44:28,整合改编
美军最高将领警告：对伊朗动武可能有重大风险,https://www.jfdaily.com/news/detail?id=1071612,2026-02-24 02:37:02,转载摘编
64岁男演员春节在景区打工，暴瘦引担忧！曾自曝不再拍戏,https://www.jfdaily.com/news/detail?id=1071608,2026-02-24 02:30:15,整合改编
春晚之后，义乌为何拥有随时调转车头的能力？,https://www.jfdaily.com/news/detail?id=1071606,2026-02-24 02:24:12,自采原创
商务部就对日相关出口管制措施答问：目的是制止日本“再军事化”和拥核企图,https://www.jfdaily.com/news/detail?id=1071605,2026-02-24 02:24:09,转载摘编
墨西哥贩毒集团报复行动致27名安全人员死亡；古特雷斯说“两国方案”正在被侵蚀,https://www.jfdaily.com/news/detail?id=1071501,2026-02-24 02:08:40,整合改编
商务部：将20家日本实体列入出口管制管控名单,https://www.jfdaily.com/news/detail?id=1071603,2026-02-24 02:07:09,转载摘编
2026播客迎来新变局，章泽天、王屹芝相继下场，苹果也有新动作,https://www.jfdaily.com/news/detail?id=1071290,2026-02-24 02:02:21,自采原创
尹锡悦就内乱头目罪一审判决结果提起上诉,https://www.jfdaily.com/news/detail?id=1071589,2026-02-24 01:58:50,转载摘编
春节档精彩收官！2026年中国电影票房领跑全球电影市场,https://www.jfdaily.com/news/detail?id=1071580,2026-02-24 01:55:59,转载摘编
“95后”夫妻春节不回家送外卖1个月赚4万！创业负债20万，会一笔笔还…,https://www.jfdaily.com/news/detail?id=1071585,2026-02-24 01:54:51,整合改编
视频画面太揪心！妈妈教扔摔炮玩，幼童误以为是糖，放嘴里咬，瞬间炸了……,https://www.jfdaily.com/news/detail?id=1071587,2026-02-24 01:54:43,整合改编
【直播】有医说医|对话儿科医院倪花医生，过完春节，“假日/开学综合症”怎么破,https://www.jfdaily.com/news/detail?id=1071559,2026-02-24 01:44:47,自采原创
徐根宝的接班人，渐渐有了模样,https://www.jfdaily.com/news/detail?id=1071564,2026-02-24 01:39:27,自采原创
《惊蛰无声》为何口碑崩塌？只因失去了敬畏之心 | 锋面评论,https://www.jfdaily.com/news/detail?id=1071565,2026-02-24 01:26:01,自采原创
春运返程高峰来临，上海公交行业开通多条定制专线保障旅客疏运,https://www.jfdaily.com/news/detail?id=1071569,2026-02-24 01:22:41,自采原创
【新思想引领新征程】跃马扬鞭开新局，实干奋斗向未来,https://www.jfdaily.com/news/detail?id=1071571,2026-02-24 01:17:38,转载摘编
抖音春节数据：“非遗+市集”团购销售额增长764%，鱼灯巡游增长超15倍,https://www.jfdaily.com/news/detail?id=1071388,2026-02-24 01:17:22,自采原创
