title,url,time,source
伊朗：伊美谅解备忘录部分条款15日就开始执行,https://www.jfdaily.com/news/detail?id=1129237,2026-06-15 22:15:59,转载摘编
“600号”开方科技馆“接诊”，沪上首张“博物馆处方”白领老人皆可体验,https://www.jfdaily.com/news/detail?id=1129195,2026-06-15 22:15:02,自采原创
AI版支付宝秘密内测中，记者体验：暂不支持自主转账，AI支付基建初步成型,https://www.jfdaily.com/news/detail?id=1129025,2026-06-15 22:09:02,自采原创
世界杯｜200公里花了五小时才入境美国，处处感受到压抑的伊朗队迎来首秀,https://www.jfdaily.com/news/detail?id=1129220,2026-06-15 22:04:03,自采原创
上影节AI“演武场”，电影的另外一种可能,https://www.jfdaily.com/news/detail?id=1129093,2026-06-15 22:00:02,自采原创
为建构具有普遍解释力的“中国理论”提供上海支撑｜姚建龙,https://www.jfdaily.com/news/detail?id=1127129,2026-06-15 21:38:02,自采原创
共同富裕体现全心全意为人民服务的根本宗旨 | 外国学者讲读习近平经济思想,https://www.jfdaily.com/news/detail?id=1127109,2026-06-15 21:19:02,自采原创
让一个意大利人执教巴西队，是病急乱投医还是真的“有料”？,https://www.jfdaily.com/news/detail?id=1128951,2026-06-15 20:29:03,自采原创
今日数据精选：医药代表或被大量清退，招聘需求却旺起来了；快递业持续火热,https://www.jfdaily.com/news/detail?id=1129192,2026-06-15 20:17:02,整合改编
这支中国草根队赢得美加墨世界杯决赛门票，“传奇野场”彻底点燃申城足球盛夏,https://www.jfdaily.com/news/detail?id=1129115,2026-06-15 20:08:02,自采原创
美国占法国葡萄酒全球销量的五分之一，马克龙警告特朗普加征关税“没有好处”,https://www.jfdaily.com/news/detail?id=1129208,2026-06-15 20:00:05,整合改编
在环人民广场3公里路线中，收集上海戏曲百年记忆,https://www.jfdaily.com/news/detail?id=1129204,2026-06-15 20:00:02,自采原创
欧洲不行？世界杯还得看亚洲球队，陪跑者的逆袭！,https://www.jfdaily.com/news/detail?id=1128894,2026-06-15 19:56:02,自采原创
世界杯｜梅西C罗的社交媒体数据稳居全球前二，但中国社媒的领跑者竟不是他俩,https://www.jfdaily.com/news/detail?id=1129221,2026-06-15 19:52:04,自采原创
协议达成后黎巴嫩南部仍遭袭击，以色列军方宣布“无限期”停留,https://www.jfdaily.com/news/detail?id=1129215,2026-06-15 19:51:05,整合改编
人口不能超过1000万？瑞士公投否决人口上限提案,https://www.jfdaily.com/news/detail?id=1129222,2026-06-15 19:51:03,整合改编
世界杯｜1比5惨败瑞典队压垮了骆驼，仅带队五场比赛的突尼斯队主帅遭解雇,https://www.jfdaily.com/news/detail?id=1129217,2026-06-15 19:44:02,自采原创
美军仍在封锁伊朗港口，霍尔木兹海峡安全威胁等级维持严重级别,https://www.jfdaily.com/news/detail?id=1129213,2026-06-15 19:38:02,整合改编
世界杯｜谁说世界杯新军没有战斗力？佛得角逼平西班牙，欧洲冠军徒呼奈何,https://www.jfdaily.com/news/detail?id=1129232,2026-06-15 19:37:02,自采原创
李在明上任以来最大危机！韩国最大在野党支持率首次反超执政党,https://www.jfdaily.com/news/detail?id=1129209,2026-06-15 19:34:02,整合改编
乌军深入俄境内700公里，炸毁俄前线关键燃油补给库,https://www.jfdaily.com/news/detail?id=1129207,2026-06-15 19:31:03,整合改编
打开端午新方式！匠心艾草花市融合节日民俗美学,https://www.jfdaily.com/news/detail?id=1129230,2026-06-15 17:56:07,自采原创
穆桂英唱段又火了！豫剧“灵魂乐器”为何是它？,https://www.jfdaily.com/news/detail?id=1125306,2026-06-15 17:29:05,自采原创
资讯 | 金融强国建设背景下如何投资于人、投资于物？,https://www.jfdaily.com/news/detail?id=1129040,2026-06-15 17:13:43,自采原创
资讯 | 股份合作制相关法律问题研讨会举行,https://www.jfdaily.com/news/detail?id=1128997,2026-06-15 17:12:18,自采原创
资讯 | 如何守正创新讲好江南故事、岭南故事,https://www.jfdaily.com/news/detail?id=1128993,2026-06-15 17:11:44,自采原创
默片《新女性》4K修复配音版面世 乔榛：要把自己的魂融到角色里面去,https://www.jfdaily.com/news/detail?id=1129216,2026-06-15 16:52:23,自采原创
SIFF | 在上海，感受与世界共振,https://www.jfdaily.com/news/detail?id=1129212,2026-06-15 16:26:26,自采原创
牢记初心使命 奋进复兴征程丨山西吕梁：从晋绥红都到产业新城,https://www.jfdaily.com/news/detail?id=1129210,2026-06-15 16:15:39,转载摘编
本世纪以来全球最大莫兰迪展亮相上海，邀你沉浸式步入“独白”现场,https://www.jfdaily.com/news/detail?id=1129133,2026-06-15 16:09:43,自采原创
乌镇消夏节7月1日开启,https://www.jfdaily.com/news/detail?id=1129067,2026-06-15 15:17:43,自采原创
电动汽车新国标，7月1日起施行,https://www.jfdaily.com/news/detail?id=1129064,2026-06-15 15:17:36,自采原创
苏州：新学院+1，今年招收300名本科生,https://www.jfdaily.com/news/detail?id=1129059,2026-06-15 15:17:28,整合改编
江苏首例！瘫痪者凭意念，控制平板电脑等,https://www.jfdaily.com/news/detail?id=1129055,2026-06-15 15:17:23,整合改编
江苏：中小学7月1日放暑假,https://www.jfdaily.com/news/detail?id=1129049,2026-06-15 15:17:17,自采原创
数学家集体“抗议”AI，人类数学家护城河在哪里？,https://www.jfdaily.com/news/detail?id=1129203,2026-06-15 14:32:52,自采原创
天津大学携手香港理工共建深圳未来技术学院，上海纳入该学院首批招生范围,https://www.jfdaily.com/news/detail?id=1129186,2026-06-15 14:25:19,自采原创
时髦爷爷奶奶化身“银发数智家” 带领孩子们探索“一江一河”,https://www.jfdaily.com/news/detail?id=1129183,2026-06-15 14:23:09,自采原创
今日影评 | 《哈莉玛》：一部明明写实但却很魔幻的电影,https://www.jfdaily.com/news/detail?id=1128834,2026-06-15 14:10:02,自采原创
举杯美加墨·话题｜世界杯一轮游！突尼斯队惨败后，拉穆奇成为首位下课教练,https://www.jfdaily.com/news/detail?id=1129176,2026-06-15 14:08:50,自采原创
逆转萨卡里，郑钦文迎来草地赛季首胜,https://www.jfdaily.com/news/detail?id=1129185,2026-06-15 14:08:09,自采原创
王梦婷拜童芷苓之女童小苓为师，童祥苓妻子、91岁京剧名家张南云到贺,https://www.jfdaily.com/news/detail?id=1129171,2026-06-15 14:07:28,自采原创
不断开辟百年大党管党治党、兴党强党新境界——深入学习领会习近平党建思想,https://www.jfdaily.com/news/detail?id=1129193,2026-06-15 13:59:57,转载摘编
沪琼携手共绘自贸港光影新图景,https://www.jfdaily.com/news/detail?id=1129143,2026-06-15 13:56:54,自采原创
马克龙：不会屈从美方威胁而取消数字税,https://www.jfdaily.com/news/detail?id=1129191,2026-06-15 13:53:55,转载摘编
跟着万茜、黄渤的足迹换个方式看上海——你就是让故事完整的那块拼图,https://www.jfdaily.com/news/detail?id=1129158,2026-06-15 13:46:06,自采原创
40岁女子怀疑男友出轨，关监控后泼洒高腐蚀性化学液体，致其面颈部容貌损毁,https://www.jfdaily.com/news/detail?id=1129084,2026-06-15 13:39:39,整合改编
河南泌阳通报“21车冻货跨省偏航被查扣”：两名相关负责人被留置,https://www.jfdaily.com/news/detail?id=1129083,2026-06-15 13:39:33,整合改编
美副总统：霍尔木兹海峡将“长期开放、免费通行”，但伊朗的说法不太一样,https://www.jfdaily.com/news/detail?id=1129163,2026-06-15 13:39:24,整合改编
苏翊鸣发文回应私生活：向无辜被波及的人深表歉意，祝福彼此，4个月前曾官宣,https://www.jfdaily.com/news/detail?id=1129113,2026-06-15 13:38:44,整合改编
突发：俄一架战略轰炸机在伊尔库茨克地区坠毁,https://www.jfdaily.com/news/detail?id=1129179,2026-06-15 13:29:53,转载摘编
举杯美加墨·释惑｜7000万完胜4亿，“澳洲袋鼠”为什么这么强了？,https://www.jfdaily.com/news/detail?id=1129141,2026-06-15 13:28:22,自采原创
王梦婷上海拜师童小苓，王南云感慨：童门有后人了,https://www.jfdaily.com/news/detail?id=1129039,2026-06-15 13:28:07,自采原创
伊朗外交部：停战谅解备忘录中三次提到黎巴嫩；将对霍尔木兹海峡相关航运服务收费,https://www.jfdaily.com/news/detail?id=1129172,2026-06-15 13:26:11,转载摘编
沪韵演唱的《黄鹤楼》《声声慢》你听过吗？这场直播吸引了4万人观看,https://www.jfdaily.com/news/detail?id=1128842,2026-06-15 13:25:35,自采原创
48小时，AI创作者极限攻坚！浦东软件园打造首场专属AI主题黑客松赛事,https://www.jfdaily.com/news/detail?id=1129164,2026-06-15 13:20:35,自采原创
上海迪士尼扩建项目全速推进，蜘蛛侠园区、第三座酒店取得新进展,https://www.jfdaily.com/news/detail?id=1129149,2026-06-15 13:17:39,自采原创
从副省级降为副处级后，王铁再被查,https://www.jfdaily.com/news/detail?id=1129175,2026-06-15 13:17:07,转载摘编
快看视频 | 美伊达成谅解备忘录，战争何时真正收尾？,https://www.jfdaily.com/news/detail?id=1129138,2026-06-15 13:06:21,自采原创
沉浸式学安全！上海这个轨交施工现场开展趣味安全运动会竞赛,https://www.jfdaily.com/news/detail?id=1129151,2026-06-15 13:02:09,自采原创
