title,url,time,source
张嘉益亮相《主角》创作座谈会：敬畏行业、尊重观众，讲好普通人的故事,https://www.jfdaily.com/news/detail?id=1126597,2026-06-10 16:31:18,自采原创
苟师哭倒万千网友？孙浩：下一站，要拍更多对得起人民群众的好戏,https://www.jfdaily.com/news/detail?id=1126603,2026-06-10 16:29:57,自采原创
本周人文社科类图书精选,https://www.jfdaily.com/news/detail?id=1126254,2026-06-10 16:28:39,约组外稿
秦娥回家！刘浩存在《主角》创作座谈会上坦言：曾惊觉自己低估了她,https://www.jfdaily.com/news/detail?id=1126600,2026-06-10 16:28:00,自采原创
爱与孤独的辩证关系,https://www.jfdaily.com/news/detail?id=1126314,2026-06-10 16:27:34,约组外稿
21封寄不出的情书——《奥维德〈拟情书〉译注》分享会举行,https://www.jfdaily.com/news/detail?id=1126275,2026-06-10 16:25:27,约组外稿
时隔一年，终于上岸！黄晓明被上海戏剧学院艺术管理方向博士录取,https://www.jfdaily.com/news/detail?id=1126300,2026-06-10 16:25:11,自采原创
专访迟小秋｜一曲《锁麟囊》，串联几代人的戏曲情缘,https://www.jfdaily.com/news/detail?id=1126281,2026-06-10 16:22:07,自采原创
微言｜16元，“鹅腿阿姨”卖你人生一堂课,https://www.jfdaily.com/news/detail?id=1126581,2026-06-10 16:05:57,自采原创
老字号与一大文创联名，国货有了新表达,https://www.jfdaily.com/news/detail?id=1126481,2026-06-10 15:58:27,自采原创
静安亮相上海碳博会，聚焦商务楼宇ESG低碳转型,https://www.jfdaily.com/news/detail?id=1126495,2026-06-10 15:58:01,自采原创
徐汇：打造高端香化产业集聚区,https://www.jfdaily.com/news/detail?id=1126531,2026-06-10 15:57:54,自采原创
夏日焕新！总台财经节目中心暑期暨下半年精品片单重磅亮相,https://www.jfdaily.com/news/detail?id=1126596,2026-06-10 15:54:23,转载摘编
不断催生新质生产力，理工科高校有哪些抓手？,https://www.jfdaily.com/news/detail?id=1119424,2026-06-10 15:05:21,约组外稿
以五育融合赋能心理健康教育,https://www.jfdaily.com/news/detail?id=1119430,2026-06-10 15:03:04,约组外稿
这部微短剧发生在90多年前的上海，由文学、革命、青春与城市记忆交织而成,https://www.jfdaily.com/news/detail?id=1126508,2026-06-10 14:55:13,自采原创
打破“一家一审”！长三角医学伦理审查走向“互认”，首批有59家主审机构,https://www.jfdaily.com/news/detail?id=1126577,2026-06-10 14:53:43,自采原创
虫咬皮炎迎来高发季，被咬后找AI“破案”？医生提醒：避免不当处理更重要,https://www.jfdaily.com/news/detail?id=1126516,2026-06-10 14:48:25,自采原创
如何在考试中发挥自己最大潜能？,https://www.jfdaily.com/news/detail?id=1126579,2026-06-10 14:41:50,约组外稿
肚子痛到底是哪在痛？急诊医生有一张特殊“地图”，强调别随意吃止痛药,https://www.jfdaily.com/news/detail?id=1126573,2026-06-10 14:21:48,约组外稿
埃博拉、汉坦病毒与世界杯，暑期如何安心出游？,https://www.jfdaily.com/news/detail?id=1126566,2026-06-10 14:18:21,约组外稿
涉安全制度和现场管理“两张皮”等问题 两公司被约谈,https://www.jfdaily.com/news/detail?id=1126567,2026-06-10 14:01:31,转载摘编
反其道而行之！上海科学家用“脉冲式”理念颠覆几十年老观念，登上国际顶刊,https://www.jfdaily.com/news/detail?id=1126524,2026-06-10 14:00:06,自采原创
一款道法自然的候选新药，何以成为“这辈子最重要的工作”？,https://www.jfdaily.com/news/detail?id=1126471,2026-06-10 14:00:03,自采原创
【直播】上海公安新闻发布会：“三所联动”企业版发布 “蓝鲸”护企工作机制升级,https://www.jfdaily.com/news/detail?id=1126564,2026-06-10 13:57:19,自采原创
京东MALL上海首店6月12日开业，除了机器人迎客，还有哪些亮点可体验？,https://www.jfdaily.com/news/detail?id=1126550,2026-06-10 13:55:31,自采原创
人民币有望发力！上海国际绿色燃料交易中心前景可期|讲堂视频,https://www.jfdaily.com/news/detail?id=1126360,2026-06-10 13:54:25,自采原创
京东MALL上海首店12日开业，一起沉浸式体验科技消费！,https://www.jfdaily.com/news/detail?id=1126562,2026-06-10 13:52:09,自采原创
【动力图】邵佳一首秀，武磊第101秀，国足没输没赢,https://www.jfdaily.com/news/detail?id=1126324,2026-06-10 13:49:15,自采原创
【演界】方亚芬：用更多的心思去“抓”人物,https://www.jfdaily.com/news/detail?id=1126369,2026-06-10 13:49:07,自采原创
美国5月消费者价格指数同比上涨4.2%,https://www.jfdaily.com/news/detail?id=1126557,2026-06-10 13:45:04,转载摘编
【长三角日报】潘银浩任舟山市代市长，曾长期在宁波工作,https://www.jfdaily.com/news/detail?id=1126387,2026-06-10 13:39:55,整合改编
李佳琦直播间首度开售奔驰新车，卖得如何？,https://www.jfdaily.com/news/detail?id=1126554,2026-06-10 13:39:15,自采原创
皮肤不好，怎么“边养边遮”？“科学护肤 精简修饰”公益美容讲座现场支招,https://www.jfdaily.com/news/detail?id=1126553,2026-06-10 13:37:20,自采原创
平台核保能否更有温度？老伯续“沪惠保”附加险遭拒 多次致电未获具体原因,https://www.jfdaily.com/news/detail?id=1126334,2026-06-10 13:37:02,自采原创
“涟泉大江户”上海莘庄店闭店 收款方与运营方不一致 该告哪家？,https://www.jfdaily.com/news/detail?id=1126302,2026-06-10 13:36:43,自采原创
很难很累很辛苦！这座“必经之桥”让人“望而却步”，“出行难点”如何打通,https://www.jfdaily.com/news/detail?id=1126368,2026-06-10 13:36:32,自采原创
“没穿几次，坏到离谱！”知名品牌淘宝旗舰店，消费者质疑买来“陈年老鞋”,https://www.jfdaily.com/news/detail?id=1126370,2026-06-10 13:36:07,自采原创
今天下午一辆土方车撞上施工路段隔离墩 幸无人员伤亡,https://www.jfdaily.com/news/detail?id=1126507,2026-06-10 13:35:57,自采原创
男子抱娃，行走中环高架,https://www.jfdaily.com/news/detail?id=1126512,2026-06-10 13:35:32,自采原创
“入戏东宫，光影向YOUNG” 带你来一场穿越百年的沉浸式电影漫游,https://www.jfdaily.com/news/detail?id=1126405,2026-06-10 13:35:27,自采原创
碳博会开幕，上海老办公楼AI改造后节能30.6%，唯一国家级零碳园区亮相,https://www.jfdaily.com/news/detail?id=1126472,2026-06-10 13:34:59,自采原创
深度 | 六天访三国，首秀G7峰会，高市任内首次欧洲行又要夹带私货？,https://www.jfdaily.com/news/detail?id=1126460,2026-06-10 13:31:36,自采原创
超燃比武、硬核亮剑！54名安全尖兵同台竞技，青浦国资国企筑牢安全生产防线,https://www.jfdaily.com/news/detail?id=1126523,2026-06-10 13:31:20,自采原创
五位劳模工匠走进华东师大，他们的讲述为何让年轻人频鼓掌？,https://www.jfdaily.com/news/detail?id=1126397,2026-06-10 13:29:40,自采原创
上海财大成立全球文明研究院，完善人文社科布局,https://www.jfdaily.com/news/detail?id=1126414,2026-06-10 13:29:27,自采原创
胰腺癌患者两次突发急性胰腺炎，手术时机怎么选？上海医生迎难而上完整摘瘤,https://www.jfdaily.com/news/detail?id=1126479,2026-06-10 13:29:14,自采原创
“我家来了‘新疆亲戚’”，浦莎最美家庭在沪共话“好家风”,https://www.jfdaily.com/news/detail?id=1126549,2026-06-10 13:28:09,自采原创
维也纳爱乐金秋献演申城，郎朗助阵首场演出一票难求,https://www.jfdaily.com/news/detail?id=1126482,2026-06-10 13:25:27,自采原创
上海首发不可移动革命文物保护利用指引，96处重要史迹集结成册,https://www.jfdaily.com/news/detail?id=1126542,2026-06-10 13:24:43,自采原创
虹口区发布两项绿色低碳领域团体标准，填补国内相关领域标准空白,https://www.jfdaily.com/news/detail?id=1126496,2026-06-10 13:18:36,自采原创
千亿级微短剧赛道上再落关键一子！浦东联手阅文打造了这个AI文创产业基地,https://www.jfdaily.com/news/detail?id=1126541,2026-06-10 13:16:20,自采原创
全国第28家上海首家，京东Mall来了，还藏着上海首家消费级机器人体验馆,https://www.jfdaily.com/news/detail?id=1126488,2026-06-10 13:11:24,自采原创
半夜到凌晨，球迷在哪里，商机就在哪里，沪上商家争相搭建世界杯“第二现场”,https://www.jfdaily.com/news/detail?id=1126321,2026-06-10 13:10:25,自采原创
端午前机票价格跳水,https://www.jfdaily.com/news/detail?id=1126525,2026-06-10 13:00:06,转载摘编
京东MALL上海首店12日开业，科技潮品点燃夏日消费活力,https://www.jfdaily.com/news/detail?id=1126509,2026-06-10 12:59:28,自采原创
鲁迅笔下的“偷瓜贼”消失多年重现市区，数量比初次记录时翻倍,https://www.jfdaily.com/news/detail?id=1126502,2026-06-10 12:58:58,自采原创
“浮城记”杜海军个展在威尼斯开幕，呼应威尼斯双年展总主题“小调”,https://www.jfdaily.com/news/detail?id=1126442,2026-06-10 12:55:51,自采原创
大华银行艺术空间呈现艺术家刘毅个展，影像与当代水墨结合,https://www.jfdaily.com/news/detail?id=1126463,2026-06-10 12:55:39,自采原创
总台领导会见路透社社长巴斯科伯特,https://www.jfdaily.com/news/detail?id=1126522,2026-06-10 12:53:38,转载摘编
