title,url,time,source
新民艺评｜卜翌：场景在变，团圆不变——今天你在哪里过元宵？,https://www.jfdaily.com/news/detail?id=1074982,2026-03-03 05:06:38,自采原创
伊朗人民拼命护送中国人撤离！他们说：我们走不了，希望你到安全的地方...,https://www.jfdaily.com/news/detail?id=1075320,2026-03-03 05:03:45,整合改编
“霍尔木兹海峡被封”，日本紧张了,https://www.jfdaily.com/news/detail?id=1075319,2026-03-03 05:00:04,转载摘编
在沪全国人大代表今天赴京,https://www.jfdaily.com/news/detail?id=1075221,2026-03-03 04:52:47,自采原创
霍尔木兹海峡有多重要？,https://www.jfdaily.com/news/detail?id=1075315,2026-03-03 04:46:48,转载摘编
浦东交管支队民警护校新学期,https://www.jfdaily.com/news/detail?id=1074622,2026-03-03 04:44:36,自采原创
“开学第一课”消防安全实训进校园,https://www.jfdaily.com/news/detail?id=1074616,2026-03-03 04:44:14,自采原创
“全国爱耳日”主题宣传活动进社区，共护听力健康,https://www.jfdaily.com/news/detail?id=1074669,2026-03-03 04:43:40,自采原创
国际爱耳日｜噪声污染正成为听力“隐形杀手”，这些防护要点记牢,https://www.jfdaily.com/news/detail?id=1075312,2026-03-03 04:40:39,自采原创
魔都生活指北| 就在上海！喜茶lab2.0全国首店，一站式打卡全套下午茶,https://www.jfdaily.com/news/detail?id=1075308,2026-03-03 04:40:31,自采原创
中国石油，创近17年新高！,https://www.jfdaily.com/news/detail?id=1075310,2026-03-03 04:37:33,转载摘编
新春走基层｜松江老街上演“元宵家宴”：老人孩子齐上阵，手把手传承老味道,https://www.jfdaily.com/news/detail?id=1075265,2026-03-03 04:35:08,自采原创
“这是战争的一部分”，特朗普：不担心美国领土遭受袭击威胁,https://www.jfdaily.com/news/detail?id=1075305,2026-03-03 04:34:57,转载摘编
新春走基层｜金山马年首场大型招聘火热举行,https://www.jfdaily.com/news/detail?id=1075254,2026-03-03 04:34:35,自采原创
杨浦“两旧一村”首个旧改项目今天交房，160户居民收到“最好新年礼物”,https://www.jfdaily.com/news/detail?id=1075286,2026-03-03 04:31:41,自采原创
利用“7天无理由退货”以假换真！上海警方连打8个犯罪团伙,https://www.jfdaily.com/news/detail?id=1075282,2026-03-03 04:31:25,自采原创
中国常驻联合国代表傅聪：中方强烈谴责一切将儿童作为攻击目标的行为！,https://www.jfdaily.com/news/detail?id=1075304,2026-03-03 04:30:54,转载摘编
非遗灯彩邂逅百卅交大，科技赋能点亮春日豫园,https://www.jfdaily.com/news/detail?id=1075087,2026-03-03 04:16:09,自采原创
瞬间血肉模糊！一男子被紧急送医，医生痛心发文！今天是元宵节，这件事要注意,https://www.jfdaily.com/news/detail?id=1075301,2026-03-03 04:15:45,整合改编
今宵总有花千树,https://www.jfdaily.com/news/detail?id=1075297,2026-03-03 04:05:21,约组外稿
七宝老街江南丝竹雅集闹元宵，用一场春集“拾回蚕丝的声音”,https://www.jfdaily.com/news/detail?id=1075113,2026-03-03 04:02:09,自采原创
2026国话·上海演出季如约而至，《苏堤春晓》《抗战中的文艺》率先开票,https://www.jfdaily.com/news/detail?id=1075298,2026-03-03 04:01:54,自采原创
健身房新进化：能撸铁、能喝咖啡、还能美美出片,https://www.jfdaily.com/news/detail?id=1075292,2026-03-03 03:51:36,自采原创
《习近平经济思想学习问答》出版发行,https://www.jfdaily.com/news/detail?id=1075296,2026-03-03 03:51:35,转载摘编
当白宫动用武力，国会紧急启动“刹车”程序,https://www.jfdaily.com/news/detail?id=1075295,2026-03-03 03:49:11,转载摘编
“上观碰碰头·秋秋不睡午觉”：聊聊线下活动,https://www.jfdaily.com/news/detail?id=1075294,2026-03-03 03:48:05,自采原创
“七一勋章”获得者王占山逝世，一生参加战役40余次,https://www.jfdaily.com/news/detail?id=1075293,2026-03-03 03:46:55,整合改编
筑牢制度根基，专家解读税务部门服务全国统一大市场建设六项举措成果,https://www.jfdaily.com/news/detail?id=1075279,2026-03-03 03:45:58,自采原创
韩国股市暴跌触发熔断机制,https://www.jfdaily.com/news/detail?id=1075285,2026-03-03 03:39:36,转载摘编
微言 | 青少年爱看网络小说：不必禁绝，重在引导,https://www.jfdaily.com/news/detail?id=1075275,2026-03-03 03:38:06,自采原创
春节后全市首场规模最大招聘会，1.3万个岗位与1000家企业等你来,https://www.jfdaily.com/news/detail?id=1075280,2026-03-03 03:37:41,自采原创
第三届温哥华名家扇面展开幕 | 新民侨梁,https://www.jfdaily.com/news/detail?id=1074711,2026-03-03 03:25:16,整合改编
向暖！提振消费，上海勇挑大梁，为建设强大国内市场提供生动样本,https://www.jfdaily.com/news/detail?id=1075257,2026-03-03 03:21:21,自采原创
闹元宵猜灯谜玩不过中国人？老外表示不服气｜新民侨梁,https://www.jfdaily.com/news/detail?id=1074936,2026-03-03 03:17:35,整合改编
事关上海出发航班！突然暴涨，有航线票价飙升5倍，甚至“根本买不到”,https://www.jfdaily.com/news/detail?id=1075272,2026-03-03 03:16:55,整合改编
特朗普妻子安理会上遭怒斥：你丈夫轰炸小学，死了165人，几乎都是小女孩,https://www.jfdaily.com/news/detail?id=1075271,2026-03-03 03:06:25,整合改编
美海军第五舰队总部遇袭前后卫星对比图曝光,https://www.jfdaily.com/news/detail?id=1075273,2026-03-03 03:06:24,整合改编
买杯奶茶排队8小时？喜茶lab 2.0首店落子上海丰盛里，年轻人买什么,https://www.jfdaily.com/news/detail?id=1075141,2026-03-03 03:01:02,自采原创
伊朗关闭霍尔木兹海峡，美以空袭伊朗港口！美使馆遭袭起火，特朗普：将报复,https://www.jfdaily.com/news/detail?id=1075268,2026-03-03 02:58:43,整合改编
元宵赴丽水之约，看松阳青白布龙演绎古堰传说,https://www.jfdaily.com/news/detail?id=1075261,2026-03-03 02:56:55,自采原创
上海市儿童医院李嫔：关注孩子身高，家长要抓住三个关键阶段,https://www.jfdaily.com/news/detail?id=1075196,2026-03-03 02:55:40,自采原创
上海市儿童医院李嫔：别再信“二十三窜一窜”的说法啦！,https://www.jfdaily.com/news/detail?id=1075200,2026-03-03 02:55:33,自采原创
女子花10多万去南极旅游，刚下飞机行李就没了！衣物全靠借，还好有同胞帮忙,https://www.jfdaily.com/news/detail?id=1075267,2026-03-03 02:48:10,整合改编
豫园里的交大故事,https://www.jfdaily.com/news/detail?id=1075202,2026-03-03 02:46:48,自采原创
蒲汇塘畔丝竹声，老茶楼里拾旧音——元宵“丝竹春集”在七宝老街以曲会友,https://www.jfdaily.com/news/detail?id=1075210,2026-03-03 02:46:13,自采原创
“我成了一个笑话”，倾尽积蓄大办婚礼，新娘却已婚已育，父母表哥都是假的,https://www.jfdaily.com/news/detail?id=1075260,2026-03-03 02:40:35,整合改编
亚马逊中东地区多个数据中心遭袭致业务中断,https://www.jfdaily.com/news/detail?id=1075263,2026-03-03 02:32:49,转载摘编
2026年徐汇区寒假中小学生匠心模范寻访活动暖心落幕，你参加了吗？,https://www.jfdaily.com/news/detail?id=1075134,2026-03-03 02:24:42,自采原创
美国使领馆不安宁：驻沙特大使馆遭袭起火，驻科威特使馆附近冒浓烟；以军空袭，黎巴嫩城镇连夜大规模撤离,https://www.jfdaily.com/news/detail?id=1075216,2026-03-03 02:24:40,转载摘编
哈梅内伊遇害，专家解析“斩首”战术：除了“内鬼”，还有啥？如何有效反制？,https://www.jfdaily.com/news/detail?id=1075255,2026-03-03 02:24:28,整合改编
一座AI“火山”正在杨浦蓄势待“爆”，杨浦与火山引擎两项重磅合作昨落地,https://www.jfdaily.com/news/detail?id=1075133,2026-03-03 02:24:24,自采原创
长开53年，这家烟纸店做对了啥？,https://www.jfdaily.com/news/detail?id=1075130,2026-03-03 02:22:45,自采原创
赵璟当选新职，曾任商洛市委书记,https://www.jfdaily.com/news/detail?id=1075258,2026-03-03 02:22:28,整合改编
九十载长征铸魂、新时代少年逐梦，普陀区长征中心小学开展红色开学第一课,https://www.jfdaily.com/news/detail?id=1075085,2026-03-03 02:22:04,自采原创
今晚7点讲堂直播|伊朗归来看中东危局与全球能源格局,https://www.jfdaily.com/news/detail?id=1075152,2026-03-03 02:21:55,自采原创
普陀警方“立体护校”开启新学期安全护航,https://www.jfdaily.com/news/detail?id=1075041,2026-03-03 02:21:38,自采原创
80万元买985高校录取通知书，结果……,https://www.jfdaily.com/news/detail?id=1074677,2026-03-03 02:21:21,自采原创
守护农村和谐稳定、助力和美乡村建设，崇明区检察院启动“检护三农”专项行动,https://www.jfdaily.com/news/detail?id=1075048,2026-03-03 02:20:18,自采原创
杨浦火山工场AI Agent产业园开业,https://www.jfdaily.com/news/detail?id=1075111,2026-03-03 02:20:08,自采原创
八旬阿婆负气跨区出走，警民接力暖心守护助团圆,https://www.jfdaily.com/news/detail?id=1075051,2026-03-03 02:19:57,自采原创
