title,url,time,source
罕见！这一次内塔尼亚胡竟公开“叫板”特朗普,https://www.jfdaily.com/news/detail?id=1053917,2026-01-18 20:31:05,整合改编
格陵兰岛军演八国面对特朗普关税大棒，干了件大事！,https://www.jfdaily.com/news/detail?id=1053915,2026-01-18 20:31:03,整合改编
WTT多哈球星挑战赛：国乒非主力集体爆发，包揽男单冠亚军,https://www.jfdaily.com/news/detail?id=1053918,2026-01-18 20:30:02,自采原创
德黑兰街头已恢复稳定，但外部干涉的阴云仍笼罩着城市,https://www.jfdaily.com/news/detail?id=1053913,2026-01-18 20:28:03,整合改编
明码标价，特朗普为所谓“和平委员会”永久席位开价10亿美元,https://www.jfdaily.com/news/detail?id=1053912,2026-01-18 20:24:03,整合改编
当美国强权渗透到北约内部，二战后的国际秩序真到了崩塌边缘,https://www.jfdaily.com/news/detail?id=1053911,2026-01-18 20:23:03,约组外稿
意大利防长嘲讽欧洲向格陵兰岛派兵37人：听起来像是玩笑的开篇,https://www.jfdaily.com/news/detail?id=1053900,2026-01-18 20:22:03,整合改编
特朗普对欧洲盟友加关税，欧洲随即暂停了好不容易达成的美欧贸易协议,https://www.jfdaily.com/news/detail?id=1053910,2026-01-18 20:18:02,自采原创
日本最大核电站机组又出故障，重启可能推迟,https://www.jfdaily.com/news/detail?id=1053922,2026-01-18 20:05:04,整合改编
澳网｜世界排名第702位却掀翻前法网亚军，白卓璇闯入次轮祝周杰伦生日快乐,https://www.jfdaily.com/news/detail?id=1053877,2026-01-18 20:05:02,自采原创
美国想打造联合国替代机构，谁来领导？该机构章程透露关键信息,https://www.jfdaily.com/news/detail?id=1053923,2026-01-18 20:00:05,整合改编
U23亚洲杯｜杀入四强引多国媒体关注，U23国足为自己赢得更多尊重,https://www.jfdaily.com/news/detail?id=1053862,2026-01-18 20:00:03,自采原创
澳网｜只差一冠成就全满贯，阿尔卡拉斯晋级男单次轮，迈出创造历史第一步,https://www.jfdaily.com/news/detail?id=1052326,2026-01-18 19:59:02,自采原创
被改变的马戏，被改变的当代剧场,https://www.jfdaily.com/news/detail?id=1053919,2026-01-18 18:02:20,自采原创
阿盟代表团到访中阿改革发展研究中心,https://www.jfdaily.com/news/detail?id=1053876,2026-01-18 17:07:16,自采原创
强脑科技韩璧丞当选“风云浙商”，杭州“六小龙”崛起印证浙江科创实力,https://www.jfdaily.com/news/detail?id=1053902,2026-01-18 15:39:18,自采原创
余皑磊：演《小城大事》，人物留在我身上了，“谭光明看李秋萍像女儿”,https://www.jfdaily.com/news/detail?id=1053884,2026-01-18 15:31:29,自采原创
从《沉默的荣耀》谷正文，到《小城大事》谭光明，他是戏比人红的实力派。,https://www.jfdaily.com/news/detail?id=1053887,2026-01-18 15:30:57,自采原创
棋圣聂卫平：名局和谜题 | 萧强,https://www.jfdaily.com/news/detail?id=1053721,2026-01-18 15:14:42,约组外稿
聂卫平的三顿饭 | 李天扬,https://www.jfdaily.com/news/detail?id=1053723,2026-01-18 15:12:50,约组外稿
首例！AI陪聊涉黄，服务提供者获刑，法学专家呼吁加大陪伴类AI监管,https://www.jfdaily.com/news/detail?id=1053893,2026-01-18 15:07:09,自采原创
【演界】翰墨戏韵：“贵妃”从画中走来,https://www.jfdaily.com/news/detail?id=1053861,2026-01-18 14:50:20,自采原创
专访亚建协新任主席伍江：面对汹涌的数智浪潮，更要坚守建筑的“人文坐标”,https://www.jfdaily.com/news/detail?id=1053888,2026-01-18 14:47:24,自采原创
70公里外患病“小老人”深夜未归急煞“老老人” 家政师深夜奔波平安送回家,https://www.jfdaily.com/news/detail?id=1053719,2026-01-18 14:41:02,自采原创
强冷空气明早影响上海，周二雪量“毫米级”，郊区最低仅零下6℃,https://www.jfdaily.com/news/detail?id=1053775,2026-01-18 14:19:55,自采原创
风云三号卫星监测显示世界最大冰山迎来崩解最后阶段,https://www.jfdaily.com/news/detail?id=1053882,2026-01-18 14:02:40,转载摘编
新一年，浙商如何应对挑战？南存辉郭广昌王均金等知名浙商这样说……,https://www.jfdaily.com/news/detail?id=1053635,2026-01-18 14:01:18,自采原创
白宇周雨彤朱亚文新剧来了，《太平年》将在央视一套播出,https://www.jfdaily.com/news/detail?id=1053849,2026-01-18 13:58:43,自采原创
欧洲多国发表联合声明：威胁加征关税破坏跨大西洋关系,https://www.jfdaily.com/news/detail?id=1053880,2026-01-18 13:52:50,转载摘编
巴西里约热内卢一直升机坠毁，多人遇难,https://www.jfdaily.com/news/detail?id=1053881,2026-01-18 13:52:43,转载摘编
从江南情景到岁寒三友，上海民族乐团奏响顾冠仁力作,https://www.jfdaily.com/news/detail?id=1053514,2026-01-18 13:50:20,自采原创
喜忧参半！白卓璇爆冷突围，张之臻被观众“帮倒忙”止步首轮,https://www.jfdaily.com/news/detail?id=1053822,2026-01-18 13:47:48,自采原创
理论周报 | 反腐败是一场输不起也决不能输的重大斗争,https://www.jfdaily.com/news/detail?id=1053867,2026-01-18 13:43:48,整合改编
桃浦地标上新！金环广场投入运营，打造“三生融合”新空间,https://www.jfdaily.com/news/detail?id=1053781,2026-01-18 13:32:47,自采原创
防守显威力！上海久事男篮主场战胜新疆斩获两连胜,https://www.jfdaily.com/news/detail?id=1053805,2026-01-18 13:32:37,自采原创
新质生产力助力电影产业升级,https://www.jfdaily.com/news/detail?id=1053874,2026-01-18 13:31:45,转载摘编
人民日报评西贝关店事件：网络舆论环境不能成为企业发展的短板,https://www.jfdaily.com/news/detail?id=1053875,2026-01-18 13:29:50,转载摘编
沪港创新发展交流会举行，共同为创新发展贡献力量,https://www.jfdaily.com/news/detail?id=1053864,2026-01-18 13:26:34,自采原创
满满的仪式感！“梁王”组合再夺印度公开赛冠军，复刻3年前冠军照,https://www.jfdaily.com/news/detail?id=1053869,2026-01-18 13:23:03,自采原创
看图学习·冰雪春天丨“把发展冰雪经济作为新增长点”,https://www.jfdaily.com/news/detail?id=1053872,2026-01-18 13:20:53,转载摘编
学习笔记丨雄安新区建设，习近平这样领航指路、把脉定向,https://www.jfdaily.com/news/detail?id=1053871,2026-01-18 13:20:45,转载摘编
第一观察｜全面深入了解真实立体的中国,https://www.jfdaily.com/news/detail?id=1053870,2026-01-18 13:20:37,转载摘编
“好望角科学沙龙”在松江举办，助力松江大学城科创源建设,https://www.jfdaily.com/news/detail?id=1053804,2026-01-18 12:55:41,自采原创
王汝刚茅善玉舒悦吴琼竞相登台，唱响“戏曲也流行”,https://www.jfdaily.com/news/detail?id=1053845,2026-01-18 12:55:38,自采原创
青瓦台更换政务首席秘书，或有更多人事变动,https://www.jfdaily.com/news/detail?id=1053855,2026-01-18 12:54:39,转载摘编
潜心补短板 着力优结构——开年以来各地各部门稳投资观察,https://www.jfdaily.com/news/detail?id=1053856,2026-01-18 12:51:49,转载摘编
视频丨年用电量首超10万亿度 展现中国经济发展活力,https://www.jfdaily.com/news/detail?id=1053857,2026-01-18 12:51:42,转载摘编
视频丨多项在轨工作稳步推进 神二十一乘组工作周记上新,https://www.jfdaily.com/news/detail?id=1053858,2026-01-18 12:51:33,转载摘编
“孩子哭得撕心裂肺！”短剧演员吐槽剧组让婴儿一直淋雨，片酬仅800元,https://www.jfdaily.com/news/detail?id=1053850,2026-01-18 12:42:33,整合改编
江时学：说拉美人有“三漫”，有的对，有的不一定对|讲堂轻直播1①,https://www.jfdaily.com/news/detail?id=1053523,2026-01-18 12:29:37,自采原创
深度 | 特朗普掀起“关税风暴”！格陵兰岛让美欧关系恶化进入新阶段,https://www.jfdaily.com/news/detail?id=1053754,2026-01-18 12:29:36,自采原创
挺进澳网次轮将战萨巴伦卡，白卓璇的勇气，靠自己打出来,https://www.jfdaily.com/news/detail?id=1053820,2026-01-18 12:25:59,自采原创
桃浦新地标亮相,https://www.jfdaily.com/news/detail?id=1053746,2026-01-18 12:23:56,自采原创
安倍遇刺案即将宣判，被告量刑备受关注,https://www.jfdaily.com/news/detail?id=1053836,2026-01-18 12:22:22,转载摘编
已致2人死亡、5人失联，66人送医，其中3人重症！内蒙古包钢一板材厂爆炸,https://www.jfdaily.com/news/detail?id=1053814,2026-01-18 12:01:13,整合改编
夜读 | 达西：堆积幸福,https://www.jfdaily.com/news/detail?id=1053406,2026-01-18 12:00:03,自采原创
跨越太平洋的抽象艺术之桥，上海夏威夷抽象艺术交流展上海展开幕,https://www.jfdaily.com/news/detail?id=1053812,2026-01-18 11:59:44,自采原创
直击城隍庙旧书市集重启首日，摊主书虫盼望水电供应尽快恢复,https://www.jfdaily.com/news/detail?id=1053706,2026-01-18 11:47:38,自采原创
80年岁月，浓缩成一张沙盘……为何说“上海的老人藏龙卧虎”,https://www.jfdaily.com/news/detail?id=1053663,2026-01-18 11:47:25,自采原创
恭喜梁伟铿/王昶夺得2026年印度公开赛男双冠军,https://www.jfdaily.com/news/detail?id=1053801,2026-01-18 11:44:04,转载摘编
