title,url,time,source
“新换门禁两年不到就瘫痪！”沪上小区百万元工程引质疑，公共收益负债49万,https://www.jfdaily.com/news/detail?id=1099734,2026-04-21 06:06:14,自采原创
张文宏现场“整活”，传授超实在的长寿3大秘诀！早点退休才能活得久？,https://www.jfdaily.com/news/detail?id=1100051,2026-04-21 06:05:14,整合改编
被“别”车后 男子斗气驾车还发挑衅视频,https://www.jfdaily.com/news/detail?id=1099700,2026-04-21 06:03:46,自采原创
为何众多老人跨区奔赴，这家街角老店究竟有多暖心？,https://www.jfdaily.com/news/detail?id=1099720,2026-04-21 06:03:14,自采原创
这里要建跨河桥，居民为啥不乐意,https://www.jfdaily.com/news/detail?id=1099799,2026-04-21 06:03:03,自采原创
新民帮侬忙 民生直播,https://www.jfdaily.com/news/detail?id=1100070,2026-04-21 06:02:28,自采原创
小区学校间“穿梭”，东育路将建跨河桥引“拥堵之忧”,https://www.jfdaily.com/news/detail?id=1099807,2026-04-21 06:02:18,自采原创
“新换门禁两年不到就瘫痪！”小区百万元工程引质疑，公共收益－49.4万元,https://www.jfdaily.com/news/detail?id=1099639,2026-04-21 06:01:41,自采原创
痛心！蓝天救援队员陈延寿搜救时不幸遇难，年仅39岁，遗体已被运送下山,https://www.jfdaily.com/news/detail?id=1100120,2026-04-21 05:52:52,整合改编
学者圆桌 | “纸老虎”北约与欧洲的“觉醒”：没有美国，欧洲能自卫吗？,https://www.jfdaily.com/news/detail?id=1099810,2026-04-21 05:47:42,自采原创
文汇视讯｜他们，是城市文明窗口里温暖的风景,https://www.jfdaily.com/news/detail?id=1100095,2026-04-21 05:46:47,自采原创
穿越长江口！上海轨道交通22号线（崇明线）工程实现全线轨道贯通,https://www.jfdaily.com/news/detail?id=1100115,2026-04-21 05:45:57,自采原创
文汇海报｜上海全民阅读活动周：AI数字人携365天书单打造不打烊书香城,https://www.jfdaily.com/news/detail?id=1100097,2026-04-21 05:34:14,自采原创
【直播】上海市人民政府新闻发布会：推进知识产权强市建设 加快新质生产力发展,https://www.jfdaily.com/news/detail?id=1096834,2026-04-21 05:28:56,自采原创
快看视频|中国代表在安理会当场驳斥美方抹黑，“向战场提供武器的不是中国”,https://www.jfdaily.com/news/detail?id=1100105,2026-04-21 05:24:43,自采原创
中国经济的“活力橱窗”｜喻见中国经济,https://www.jfdaily.com/news/detail?id=1100108,2026-04-21 05:16:51,转载摘编
微视频丨山河迎忠魂,https://www.jfdaily.com/news/detail?id=1100110,2026-04-21 05:16:38,转载摘编
学习手记｜领会总书记对服务业发展的战略擘画,https://www.jfdaily.com/news/detail?id=1100109,2026-04-21 05:14:52,转载摘编
四把金钥匙，解锁百年玫瑰园超长花期密码,https://www.jfdaily.com/news/detail?id=1100093,2026-04-21 05:07:55,自采原创
德国州长上海行，中德汽车“合资2.0”有哪些新看点,https://www.jfdaily.com/news/detail?id=1099733,2026-04-21 05:07:45,自采原创
爱奇艺再回应AI艺人库争议，CEO龚宇连续发文：科技永远是为人服务的,https://www.jfdaily.com/news/detail?id=1100103,2026-04-21 05:02:40,自采原创
莫桑比克总统查波向人民英雄纪念碑敬献花圈,https://www.jfdaily.com/news/detail?id=1100098,2026-04-21 04:58:33,转载摘编
3月份民航旅客运输量同比增长12.1%,https://www.jfdaily.com/news/detail?id=1100099,2026-04-21 04:58:03,转载摘编
伊朗要求美国立即释放被扣押船只及人员,https://www.jfdaily.com/news/detail?id=1100100,2026-04-21 04:56:35,转载摘编
日本拟投资万亿日元加强金属、塑料等资源回收再利用,https://www.jfdaily.com/news/detail?id=1100101,2026-04-21 04:56:04,转载摘编
白宫称美伊正处于达成协议的“边缘”,https://www.jfdaily.com/news/detail?id=1100102,2026-04-21 04:54:54,转载摘编
金鸡艺术影展首次走入校园，10部精选影片架起连接传统与现代的文化桥梁,https://www.jfdaily.com/news/detail?id=1099880,2026-04-21 04:40:15,自采原创
第二届人形机器人运动会“更自主更灵巧更实用”，增设拔河、投壶、举重等项目,https://www.jfdaily.com/news/detail?id=1100071,2026-04-21 04:38:59,自采原创
美国防部：415名美军人员在对伊朗军事行动中受伤,https://www.jfdaily.com/news/detail?id=1100085,2026-04-21 04:36:09,转载摘编
5月起，四川禁止或者限制在公共交通工具和公共场所吸烟,https://www.jfdaily.com/news/detail?id=1100086,2026-04-21 04:34:55,转载摘编
一支上海机器人团队，在北京亦庄奔跑 ｜新民特稿,https://www.jfdaily.com/news/detail?id=1100041,2026-04-21 04:32:56,自采原创
AI定制书单、MR穿越古画！余杭把书房搬进草坪，全民阅读还能这么“潮”,https://www.jfdaily.com/news/detail?id=1100064,2026-04-21 04:32:19,自采原创
从“水大鱼大”奔向“鱼水情深”：戈峻2026谷雨演讲畅谈民企进化新30年,https://www.jfdaily.com/news/detail?id=1100067,2026-04-21 04:32:06,自采原创
当陶瓷遭遇残缺：到浙博看先民“缝合”时光把裂缝变成风景,https://www.jfdaily.com/news/detail?id=1100061,2026-04-21 04:31:53,自采原创
春日放风筝，注意这些安全隐患,https://www.jfdaily.com/news/detail?id=1100075,2026-04-21 04:06:09,转载摘编
快看视频 | 英雄明天回家！运-20B首次飞赴韩国接迎志愿军烈士,https://www.jfdaily.com/news/detail?id=1100059,2026-04-21 04:01:53,自采原创
国务院免去他国务院副秘书长职务，已“空降”厦门任市委书记,https://www.jfdaily.com/news/detail?id=1100057,2026-04-21 04:00:44,整合改编
广州一高架桥底疑现裂缝？官方：并非裂缝，实为现浇钢筋混凝土的湿接缝,https://www.jfdaily.com/news/detail?id=1100054,2026-04-21 03:54:22,整合改编
樊振东现身美国职业乒联赛场，恩师吴敬平：你是蕴藏在一滴水里的整个汪洋,https://www.jfdaily.com/news/detail?id=1100058,2026-04-21 03:53:59,整合改编
老龄议题不沉重，艺术如何让生命再发光？,https://www.jfdaily.com/news/detail?id=1100039,2026-04-21 03:53:36,自采原创
文汇视讯｜凡人善举暖浦江！上海好人与公益践行者点亮城市文明微光,https://www.jfdaily.com/news/detail?id=1100053,2026-04-21 03:52:06,自采原创
如何能更长寿？张文宏最新演讲：永远不要悲观｜医本正经聊天室,https://www.jfdaily.com/news/detail?id=1099940,2026-04-21 03:50:17,自采原创
沪上学者探讨：美欧关系疏离促使中欧关系向好？,https://www.jfdaily.com/news/detail?id=1100065,2026-04-21 03:47:36,自采原创
马伯庸14万字新作《楚弓计划》等12部长篇体现上海文学老中青接力丰富面貌,https://www.jfdaily.com/news/detail?id=1100003,2026-04-21 03:46:05,自采原创
施耐德电气亮相2026汉诺威工业展，助力企业化挑战为竞争力,https://www.jfdaily.com/news/detail?id=1100040,2026-04-21 03:45:03,自采原创
3岁男童被生父女友虐待致死，一审宣判：死缓！量刑依据是啥？父亲参与了吗？,https://www.jfdaily.com/news/detail?id=1100055,2026-04-21 03:33:11,整合改编
日本正式允许出口杀伤性武器！自卫队训练时坦克炮弹突然爆炸，已致3人死亡,https://www.jfdaily.com/news/detail?id=1100052,2026-04-21 03:30:11,整合改编
国务院最新任命：吕武钦任公安部部长助理,https://www.jfdaily.com/news/detail?id=1100049,2026-04-21 03:24:45,整合改编
国务院免去周亮职务！此前任上被查,https://www.jfdaily.com/news/detail?id=1100036,2026-04-21 03:16:44,整合改编
19岁女孩挪用自家档口1700万元当“榜一大姐”，亲爹无奈带其自首……,https://www.jfdaily.com/news/detail?id=1100042,2026-04-21 03:10:36,自采原创
怎么退？和中企有多大关系？详解美国史上最大规模关税退款,https://www.jfdaily.com/news/detail?id=1100043,2026-04-21 03:10:30,转载摘编
张文宏上纽大最新分享：年纪超过50岁，这件事情建议一定要做,https://www.jfdaily.com/news/detail?id=1099973,2026-04-21 03:07:12,自采原创
工信部回应存储器价格上涨：将多措并举保障产业链供应链稳定,https://www.jfdaily.com/news/detail?id=1100034,2026-04-21 03:06:18,转载摘编
深视频 | 日本允许出口杀伤性武器,https://www.jfdaily.com/news/detail?id=1100005,2026-04-21 03:00:26,自采原创
文艺坦白局｜李光洁：每个时期都可以是演员的黄金年龄,https://www.jfdaily.com/news/detail?id=1099904,2026-04-21 02:59:48,自采原创
日本众参两院议长向靖国神社供奉祭品,https://www.jfdaily.com/news/detail?id=1100033,2026-04-21 02:56:21,转载摘编
从早到晚不停歇，美食非遗全解锁！这回，“宝藏邻居”吴江在豫园开了个市集,https://www.jfdaily.com/news/detail?id=1099760,2026-04-21 02:53:51,自采原创
八旬老人报警“电瓶车被偷”，民警凭两张公交车票识破“乌龙”,https://www.jfdaily.com/news/detail?id=1100025,2026-04-21 02:49:12,自采原创
真假糖果混卖“移花接木”，从百万销售额中精准认定29万假货成定罪量刑关键,https://www.jfdaily.com/news/detail?id=1100020,2026-04-21 02:48:40,自采原创
苹果宣布将更换CEO后，多家“果链”企业开盘下跌,https://www.jfdaily.com/news/detail?id=1100021,2026-04-21 02:46:58,转载摘编
