title,url,time,source
十四届全国政协常委、农业和农村委员会副主任王晓东被查,https://www.jfdaily.com/news/detail?id=1113356,2026-05-17 09:34:37,转载摘编
【上海一周】基础“尖兵”，何以攻坚,https://www.jfdaily.com/news/detail?id=1113351,2026-05-17 09:29:26,自采原创
广西柳州市柳南区发生3.2级地震,https://www.jfdaily.com/news/detail?id=1113352,2026-05-17 09:24:58,转载摘编
国家防办派工作组赴广西协助指导车辆坠河人员搜救工作,https://www.jfdaily.com/news/detail?id=1113350,2026-05-17 09:17:44,转载摘编
热搜爆！上海女演员就争议举动道歉：认识到问题严重性！很多人不知道这个常识,https://www.jfdaily.com/news/detail?id=1113343,2026-05-17 09:16:29,整合改编
来场“红途Citywalk”！15组亲子家庭用脚步“行悦黄浦”,https://www.jfdaily.com/news/detail?id=1113341,2026-05-17 09:12:15,自采原创
全球首个照明行业GenAI智能体获认证，外资企业说“在中国，为全球”,https://www.jfdaily.com/news/detail?id=1113339,2026-05-17 09:12:07,自采原创
樱桃熟了，搭子来了！嘉定菊园樱桃嘉年华搭建青年社交新场景,https://www.jfdaily.com/news/detail?id=1112750,2026-05-17 09:11:58,自采原创
一场持续百年的“化学反应”，靠什么持续释放“能量”|科创观察员,https://www.jfdaily.com/news/detail?id=1113300,2026-05-17 09:11:14,自采原创
汪家芳的宁海霞客梦,https://www.jfdaily.com/news/detail?id=1113345,2026-05-17 09:10:43,转载摘编
今天凌晨漕溪北路一家商场杂物间起火 幸无人员伤亡,https://www.jfdaily.com/news/detail?id=1113323,2026-05-17 09:09:11,自采原创
伊朗议长卡利巴夫被任命为对华事务特别代表,https://www.jfdaily.com/news/detail?id=1113346,2026-05-17 09:08:49,转载摘编
103号新汽油来了！自主研发！网友喊话张雪机车,https://www.jfdaily.com/news/detail?id=1113301,2026-05-17 09:07:01,整合改编
全车人陷入昏迷，孩子口吐白沫！天热了，这个习惯千万要改！,https://www.jfdaily.com/news/detail?id=1113342,2026-05-17 09:00:48,整合改编
未来一周，全国多地大雨笼罩,https://www.jfdaily.com/news/detail?id=1113340,2026-05-17 08:56:27,转载摘编
第22个世界高血压日｜《高山的回响》云端首映，聚力筑牢高原健康守护线,https://www.jfdaily.com/news/detail?id=1113291,2026-05-17 08:56:27,自采原创
中美阿三国警方首次开展联合打击电信网络诈骗犯罪行动,https://www.jfdaily.com/news/detail?id=1113337,2026-05-17 08:51:46,转载摘编
U17亚洲杯四强诞生，半决赛中国队将战澳大利亚队,https://www.jfdaily.com/news/detail?id=1113332,2026-05-17 08:31:12,转载摘编
IRONMAN70.3上海崇明站落幕，中外健儿竞逐生态赛道，冠军荣耀揭晓,https://www.jfdaily.com/news/detail?id=1113227,2026-05-17 08:30:39,自采原创
日本今天开始演习,https://www.jfdaily.com/news/detail?id=1113322,2026-05-17 08:18:18,转载摘编
今天，他们是临港最幸福的人,https://www.jfdaily.com/news/detail?id=1113169,2026-05-17 08:18:10,自采原创
第22个世界高血压日｜别把“低压高”不当回事！背后藏着代谢异常危机,https://www.jfdaily.com/news/detail?id=1113285,2026-05-17 08:03:23,自采原创
医本正经聊天室｜尿很干净？是真的！但是这些颜色就不对了,https://www.jfdaily.com/news/detail?id=1113277,2026-05-17 08:03:14,自采原创
尼泊尔登山者再破纪录，第32次登顶珠峰,https://www.jfdaily.com/news/detail?id=1113307,2026-05-17 08:02:52,转载摘编
广西5条河流出现超警洪水,https://www.jfdaily.com/news/detail?id=1113306,2026-05-17 08:01:37,转载摘编
金山区家风传承实践基地落成，家风教育从书本走到田间,https://www.jfdaily.com/news/detail?id=1113275,2026-05-17 08:00:33,自采原创
千年圩田村启动改造，不搞大拆大建，村容民生同步升级,https://www.jfdaily.com/news/detail?id=1113288,2026-05-17 08:00:13,自采原创
在“文学邮轮”上探索数字文博馆的魅力,https://www.jfdaily.com/news/detail?id=1113298,2026-05-17 07:58:57,自采原创
世界神经纤维瘤病关爱日，公益科普活动鼓励患者重拾信心,https://www.jfdaily.com/news/detail?id=1113297,2026-05-17 07:58:32,自采原创
除了国乒名宿和世界冠军，郑敏之还有这样的身份……,https://www.jfdaily.com/news/detail?id=1113282,2026-05-17 07:58:22,自采原创
四个品牌五款产品都自称“第一”？ 起底互联网广告的“文字游戏”,https://www.jfdaily.com/news/detail?id=1113299,2026-05-17 07:38:30,转载摘编
“母亲工业”不再只是纺纱织布，东南同济香港理工华理东华等41校结成共同体,https://www.jfdaily.com/news/detail?id=1113279,2026-05-17 07:36:42,自采原创
2026上海青少年科创实践工作站开班，4800新生共赴科创之约,https://www.jfdaily.com/news/detail?id=1113204,2026-05-17 07:36:05,自采原创
沪上义务教育民办学校报名志愿录取日程出炉，黄浦等9区20日摇号|附5问,https://www.jfdaily.com/news/detail?id=1113190,2026-05-17 07:35:44,自采原创
陈冲在上纽大毕业典礼上说：永远保留并滋养童真，发现属于自己的幸福定义,https://www.jfdaily.com/news/detail?id=1113099,2026-05-17 07:35:20,自采原创
去爱，去好奇，去更新自己：上纽大2026届毕业生整装出发！,https://www.jfdaily.com/news/detail?id=1113118,2026-05-17 07:35:12,自采原创
警惕！上海八旬阿婆参团旅游签下百万投资理财，子女报警后又投资了100万元,https://www.jfdaily.com/news/detail?id=1113286,2026-05-17 07:10:20,整合改编
全国晚报摄影学会走进河南焦作，用镜头记录云台山如画美景,https://www.jfdaily.com/news/detail?id=1113294,2026-05-17 07:10:14,自采原创
以笔为媒、以镜为眼，主流媒体记者聚焦河南新乡文旅发展,https://www.jfdaily.com/news/detail?id=1113280,2026-05-17 07:10:05,自采原创
借力国际赛事，奉贤多产业融合发力共筑“国际户外运动之城”,https://www.jfdaily.com/news/detail?id=1113283,2026-05-17 07:06:35,自采原创
重庆市巫溪县卫生健康委发布情况通报,https://www.jfdaily.com/news/detail?id=1113292,2026-05-17 07:03:10,转载摘编
从过去探寻未来,https://www.jfdaily.com/news/detail?id=1113289,2026-05-17 06:56:32,转载摘编
镜观·回响｜让每个生命都绽放光芒,https://www.jfdaily.com/news/detail?id=1113290,2026-05-17 06:56:18,转载摘编
2026年长三角高校匹克球邀请赛总决赛在临港举行,https://www.jfdaily.com/news/detail?id=1113241,2026-05-17 06:53:28,自采原创
掌舵“当船长”、体验帆船运动，上海海事大学校园开放日举行,https://www.jfdaily.com/news/detail?id=1113259,2026-05-17 06:51:32,自采原创
并非“晚长”，别错过孩子身高黄金干预期！最新专家指导意见规范生长激素应用,https://www.jfdaily.com/news/detail?id=1113229,2026-05-17 06:51:23,自采原创
领跑胶原创新，复旦大学新增“活性胶原蛋白创新材料校企联合实验室”,https://www.jfdaily.com/news/detail?id=1113218,2026-05-17 06:51:11,自采原创
不要仅以简历或世俗“幸福”来定义人生！上纽大毕业典礼上，陈冲现身并寄语,https://www.jfdaily.com/news/detail?id=1113155,2026-05-17 06:50:52,自采原创
倒查30年前旧账，美军侦察模式似曾相识：古巴会成下一个委内瑞拉吗？,https://www.jfdaily.com/news/detail?id=1113246,2026-05-17 06:44:35,自采原创
司法部、中国残联发布残疾人法律援助典型案例,https://www.jfdaily.com/news/detail?id=1113281,2026-05-17 06:43:32,转载摘编
歌诗达・赛琳娜号“中国旅游日”到访上海，中外游客同游宝山滨江,https://www.jfdaily.com/news/detail?id=1113264,2026-05-17 06:37:22,自采原创
游戏卡、购物卡竟成洗钱工具？起底网赌集团资金黑产链,https://www.jfdaily.com/news/detail?id=1113274,2026-05-17 06:21:48,转载摘编
“上海国际航运中心能级跃升”智库论坛在沪举行,https://www.jfdaily.com/news/detail?id=1113269,2026-05-17 06:18:29,自采原创
假“特种兵王”落网！退伍、转业全是骗局,https://www.jfdaily.com/news/detail?id=1113272,2026-05-17 06:12:09,转载摘编
多款燃油车大降价！,https://www.jfdaily.com/news/detail?id=1113270,2026-05-17 06:03:05,转载摘编
驻日美军一士兵涉嫌盗窃被日本警方逮捕,https://www.jfdaily.com/news/detail?id=1113268,2026-05-17 06:00:36,转载摘编
上海3大地标全新升级！还有2个规划建设中！家门口的运动休闲好去处！真绝了,https://www.jfdaily.com/news/detail?id=1112142,2026-05-17 06:00:03,整合改编
上海大学留学生玩转国际文化风情展 泰国女生：毕业后想留在上海！,https://www.jfdaily.com/news/detail?id=1113254,2026-05-17 05:57:04,自采原创
这场16分钟混编足球赛，蕴含着教育的巧思,https://www.jfdaily.com/news/detail?id=1113263,2026-05-17 05:56:43,自采原创
【直播】奥运冠军领衔，全球顶尖剑客激战上海松江,https://www.jfdaily.com/news/detail?id=1113267,2026-05-17 05:43:35,自采原创
