title,url,time,source
泰州文艺何以持续“出圈”？精品频现背后的文化密码,https://www.jfdaily.com/news/detail?id=1077262,2026-03-06 08:41:33,自采原创
跨越山海筑华章！泰州“十四五”发展答卷亮眼,https://www.jfdaily.com/news/detail?id=1077259,2026-03-06 08:41:23,自采原创
特朗普“必须亲自参与”选伊朗领导人？佩泽希齐扬回应来了,https://www.jfdaily.com/news/detail?id=1077358,2026-03-06 08:39:51,整合改编
中国人民银行行长：中国没有必要也无意通过汇率贬值获取贸易竞争优势,https://www.jfdaily.com/news/detail?id=1077398,2026-03-06 08:31:14,转载摘编
从闽山闽海到申城餐桌，千种福建好物登陆供销市集，鲜动上海人的味蕾,https://www.jfdaily.com/news/detail?id=1077384,2026-03-06 08:30:57,自采原创
证监会主席：将在创业板增设一套更加精准包容的上市标准,https://www.jfdaily.com/news/detail?id=1077397,2026-03-06 08:30:32,转载摘编
严控午餐热量和成本，80余名营养配餐员同台比拼“白领午餐”,https://www.jfdaily.com/news/detail?id=1077378,2026-03-06 08:29:38,自采原创
上海松江把招聘会开进火车站，用“第一站”的温度留住“第一眼”的人才,https://www.jfdaily.com/news/detail?id=1077300,2026-03-06 08:29:14,自采原创
越来越多香港演员“北上”？甄子丹回应,https://www.jfdaily.com/news/detail?id=1077365,2026-03-06 08:27:50,自采原创
杭迎伟代表：上海交通“大动脉”基本成型，还要激活“毛细血管”,https://www.jfdaily.com/news/detail?id=1077335,2026-03-06 08:27:26,自采原创
中国人民银行行长：今年以来公开市场各项工具净投放中长期资金约2万亿元,https://www.jfdaily.com/news/detail?id=1077394,2026-03-06 08:26:14,转载摘编
长征镇推出组合拳，解决老人“缴费难题”,https://www.jfdaily.com/news/detail?id=1077317,2026-03-06 08:26:09,自采原创
全球音乐剧顶流齐聚申城：2026明星音乐会系列再度启航！,https://www.jfdaily.com/news/detail?id=1076922,2026-03-06 08:25:15,自采原创
外高桥、中国药科大学、高博医疗三方合作，立志让全国肿瘤患者生存率提高,https://www.jfdaily.com/news/detail?id=1077330,2026-03-06 08:24:57,自采原创
扎根浦东周浦近20年，这家企业“长大”成为汽车内饰件领域领跑者并成功上市,https://www.jfdaily.com/news/detail?id=1077311,2026-03-06 08:24:48,自采原创
“老舅妈”嫩娘去世，享年100岁，百岁寿辰时她高歌一曲,https://www.jfdaily.com/news/detail?id=1077267,2026-03-06 08:21:19,自采原创
从一颗星星微光，到一座城市温暖场域！前滩太古里这些公益实践传递更多能量,https://www.jfdaily.com/news/detail?id=1077391,2026-03-06 08:20:44,自采原创
习近平看望全国政协委员,https://www.jfdaily.com/news/detail?id=1077388,2026-03-06 08:18:36,转载摘编
商务部部长王文涛：以旧换新2.0将重点支持绿色智能商品和线下实体零售,https://www.jfdaily.com/news/detail?id=1077383,2026-03-06 08:17:30,自采原创
2026上海汽车消费季启动，上汽集团与上报集团打造“春日超级IP”,https://www.jfdaily.com/news/detail?id=1077309,2026-03-06 08:12:37,自采原创
浦东机场顺利保障首个中东地区返沪航班,https://www.jfdaily.com/news/detail?id=1077374,2026-03-06 08:11:37,自采原创
浦东机场蝉联2025年ACI亚太地区4000万以上最佳机场,https://www.jfdaily.com/news/detail?id=1077379,2026-03-06 08:10:44,自采原创
报名入口丨2026上海市民艺术夜校春季班,https://www.jfdaily.com/news/detail?id=1077021,2026-03-06 08:06:43,自采原创
感受F1赛道魅力、购车享限时礼遇，2026上海汽车消费季启动,https://www.jfdaily.com/news/detail?id=1077350,2026-03-06 08:05:03,自采原创
感受F1赛道魅力、购车享限时礼遇，2026上海汽车消费季启动,https://www.jfdaily.com/news/detail?id=1077350,2026-03-06 08:05:03,自采原创
五角大楼：公开宣称打伊朗“耗得起”，私下急筹钱补弹药,https://www.jfdaily.com/news/detail?id=1077381,2026-03-06 08:01:29,转载摘编
财政部部长：中央财政安排1000亿元支持财政金融协同促内需,https://www.jfdaily.com/news/detail?id=1077380,2026-03-06 08:00:04,转载摘编
外高桥边检站高效保障新船首航,https://www.jfdaily.com/news/detail?id=1077375,2026-03-06 07:55:53,自采原创
证监会主席：“十五五”期间完善中国特色稳市机制建设,https://www.jfdaily.com/news/detail?id=1077377,2026-03-06 07:55:39,转载摘编
日本频现“撞人族”引关注，中国游客亲述被撞经历！我使馆发布提醒,https://www.jfdaily.com/news/detail?id=1077376,2026-03-06 07:54:54,整合改编
全国人大代表朱建弟：跨界融合创业需专项政策扶持,https://www.jfdaily.com/news/detail?id=1077299,2026-03-06 07:51:38,自采原创
证监会主席：目前A股总市值超过110万亿元,https://www.jfdaily.com/news/detail?id=1077371,2026-03-06 07:48:07,转载摘编
中东棋局：为何和平总是“流产”？,https://www.jfdaily.com/news/detail?id=1076703,2026-03-06 07:47:12,自采原创
阿联酋航空复航后，上海边检保障首批迪拜至上海口岸旅客入境,https://www.jfdaily.com/news/detail?id=1077370,2026-03-06 07:45:12,自采原创
外交部：中国经济发展将为动荡世界提供宝贵的稳定性和确定性,https://www.jfdaily.com/news/detail?id=1077369,2026-03-06 07:40:03,转载摘编
外交部：高度重视中国乘客滞留中东国家情况，全力提供协助,https://www.jfdaily.com/news/detail?id=1077368,2026-03-06 07:36:35,转载摘编
美以伊战事又一个危险信号！美国欲引库尔德人“入局”？,https://www.jfdaily.com/news/detail?id=1077360,2026-03-06 07:36:33,转载摘编
外交部：维护霍尔木兹海峡及其附近水域安全稳定符合国际社会共同利益,https://www.jfdaily.com/news/detail?id=1077366,2026-03-06 07:35:34,转载摘编
2026年政府工作报告，这些内容事关退役军人工作,https://www.jfdaily.com/news/detail?id=1077351,2026-03-06 07:34:58,整合改编
董勇直言饰演冯道是“捞着了”，戏外依旧角色附体：前面发言的感谢我全同意,https://www.jfdaily.com/news/detail?id=1077285,2026-03-06 07:34:34,自采原创
上汽集团与上报集团联合打造“上海春日超级IP”,https://www.jfdaily.com/news/detail?id=1077302,2026-03-06 07:30:02,自采原创
商务部部长：马年春节假期线下实体消费增速近年来首次反超线上,https://www.jfdaily.com/news/detail?id=1077362,2026-03-06 07:28:42,转载摘编
【直播】合生元开启“宝贝节”新征程 携手爱婴室倡导“自在当妈”！,https://www.jfdaily.com/news/detail?id=1077361,2026-03-06 07:27:21,自采原创
商务部部长：“十四五”时期我国消费市场规模按购买力平价换算世界第一,https://www.jfdaily.com/news/detail?id=1077359,2026-03-06 07:26:03,转载摘编
外交部：高度重视中国乘客滞留中东国家情况，全力提供协助,https://www.jfdaily.com/news/detail?id=1077357,2026-03-06 07:23:20,转载摘编
国家发展改革委主任：“十五五”末人工智能相关产业规模将增长到10万亿元以上,https://www.jfdaily.com/news/detail?id=1077356,2026-03-06 07:22:21,转载摘编
美军称击中伊朗无人机航母，伊朗称“尚有新型武器未大规模使用”,https://www.jfdaily.com/news/detail?id=1077353,2026-03-06 07:22:21,整合改编
7年后，委内瑞拉与美国恢复外交关系,https://www.jfdaily.com/news/detail?id=1077344,2026-03-06 07:21:54,整合改编
财政部部长：今年财政资金规模安排三方面创“新高”,https://www.jfdaily.com/news/detail?id=1077354,2026-03-06 07:21:11,转载摘编
伊朗外长：总统先生，速战速决A计划已经失败了，B计划会更失败,https://www.jfdaily.com/news/detail?id=1077343,2026-03-06 07:20:52,整合改编
报告里挖宝①未来五年怎么赚钱？,https://www.jfdaily.com/news/detail?id=1077018,2026-03-06 07:18:06,自采原创
张生：车轮上的国家,https://www.jfdaily.com/news/detail?id=1077031,2026-03-06 07:13:14,自采原创
微言 | 让高速公路免费从“大脉冲”走向“长流水”,https://www.jfdaily.com/news/detail?id=1077292,2026-03-06 07:13:07,自采原创
国家发展改革委主任：预计今年GDP增量超过6万亿元,https://www.jfdaily.com/news/detail?id=1077346,2026-03-06 07:12:26,转载摘编
精准选择信号路径开启了减重药研发新思路,https://www.jfdaily.com/news/detail?id=1077304,2026-03-06 07:12:21,自采原创
杭迎伟代表：上海城市建设运行，把困难留给自己，方便留给市民,https://www.jfdaily.com/news/detail?id=1077307,2026-03-06 07:11:36,自采原创
郑栅洁、蓝佛安、王文涛、潘功胜、吴清，第三次同时亮相两会记者会,https://www.jfdaily.com/news/detail?id=1077328,2026-03-06 07:09:19,自采原创
十日谈·为春天存档 | 戴荣里：定格春天,https://www.jfdaily.com/news/detail?id=1077032,2026-03-06 07:08:26,自采原创
白宫换将，洗牌战友还是稳固路线？,https://www.jfdaily.com/news/detail?id=1077342,2026-03-06 07:04:01,转载摘编
细味两会热词“新基建”：AI的尽头是电力，电力的尽头是中国,https://www.jfdaily.com/news/detail?id=1077341,2026-03-06 07:01:07,转载摘编
市一医院南北院“名医天团”摆摊，市民家门口享顶级诊疗,https://www.jfdaily.com/news/detail?id=1077334,2026-03-06 07:00:49,自采原创
