title,url,time,source
痛心！3人溺亡！江西吉安通报“车辆坠水事件”,https://www.jfdaily.com/news/detail?id=1082174,2026-03-16 03:23:25,整合改编
最新通报来了！业主实名举报小区违建，个人隐私甚至家人行踪何以“秒泄”？,https://www.jfdaily.com/news/detail?id=1082136,2026-03-16 03:10:21,整合改编
亲爱的老师，再见！上海人泪别人民教育家于漪！她春风般的话语就在耳边...,https://www.jfdaily.com/news/detail?id=1082142,2026-03-16 03:10:14,整合改编
军事专家：伊朗无人机难对付 美拦截成本高昂,https://www.jfdaily.com/news/detail?id=1082162,2026-03-16 02:55:18,转载摘编
上海移动5G-A大上行网络为F1注入新速度,https://www.jfdaily.com/news/detail?id=1082139,2026-03-16 02:49:55,自采原创
伊朗：海湾国家已成美国利益牺牲品，“福特”号航母后勤将被列为打击目标；朝鲜远程炮兵进行火力打击训练,https://www.jfdaily.com/news/detail?id=1082126,2026-03-16 02:47:41,整合改编
上海最新通报：一公职人员被查,https://www.jfdaily.com/news/detail?id=1082159,2026-03-16 02:46:32,整合改编
一周文艺：哲学家哈贝马斯去世，苏菲·玛索新小说出版，千名作家抗议AI侵权,https://www.jfdaily.com/news/detail?id=1082132,2026-03-16 02:42:08,自采原创
印度证实与伊朗进行谈判,https://www.jfdaily.com/news/detail?id=1082152,2026-03-16 02:38:02,转载摘编
国际能源署：紧急石油储备将很快投放市场,https://www.jfdaily.com/news/detail?id=1082153,2026-03-16 02:37:36,转载摘编
圣地亚哥见证黑马夺冠，中国战队挺进六强,https://www.jfdaily.com/news/detail?id=1082148,2026-03-16 02:35:25,自采原创
10年前的巧克力、26年前的肥皂…男子吐槽：315晚会应该曝光我外婆！,https://www.jfdaily.com/news/detail?id=1082134,2026-03-16 02:31:39,整合改编
痛心！失联研究生已坠江身亡！官方通报：已成立联合调查组,https://www.jfdaily.com/news/detail?id=1082144,2026-03-16 02:27:35,整合改编
内塔尼亚胡发视频，自证还活着！伊朗使用新武器，最高领袖深夜发文,https://www.jfdaily.com/news/detail?id=1082141,2026-03-16 02:27:00,整合改编
“上观碰碰头·秋秋不睡午觉”：对话解放日报记者王海燕,https://www.jfdaily.com/news/detail?id=1082135,2026-03-16 02:14:54,自采原创
国家统计局：1—2月份主要经济指标明显回升，开局良好,https://www.jfdaily.com/news/detail?id=1082133,2026-03-16 02:05:42,转载摘编
短道世锦赛｜六项单项竟无人进决赛，新老交替的中国队靠接力挽回颜面,https://www.jfdaily.com/news/detail?id=1082097,2026-03-16 02:05:06,自采原创
短道世锦赛｜韩国揽近半金牌成最大赢家，男女当家选手林钟彦、金吉莉各夺两金,https://www.jfdaily.com/news/detail?id=1082079,2026-03-16 02:04:46,自采原创
检察机关依法对李春良涉嫌受贿、利用影响力受贿案提起公诉,https://www.jfdaily.com/news/detail?id=1082131,2026-03-16 02:04:15,转载摘编
“医生我家是不是被诅咒了？兄弟姐妹没一个活过50岁！”48岁阿姨慌了,https://www.jfdaily.com/news/detail?id=1082127,2026-03-16 01:58:17,整合改编
伊朗总统上街，美国总统摇人,https://www.jfdaily.com/news/detail?id=1082130,2026-03-16 01:53:18,自采原创
3·15起底“物理增高”骗局，来看专家解答科学长高“十问十答”｜健康新知,https://www.jfdaily.com/news/detail?id=1082070,2026-03-16 01:46:30,自采原创
门诊故事：被“再等等”拖延的成长｜健康新知,https://www.jfdaily.com/news/detail?id=1082081,2026-03-16 01:46:13,约组外稿
黄浦“红色周一”启幕：中共一大纪念馆闭馆日变身初心大课堂,https://www.jfdaily.com/news/detail?id=1082095,2026-03-16 01:40:16,自采原创
突破具身智能两大痛点，上海人工智能研究院孵出机器人的“心灵手巧”,https://www.jfdaily.com/news/detail?id=1082088,2026-03-16 01:38:50,自采原创
上海变身 “赛车痛城”，折射F1通过文化叙事重塑体育生态的变革之路,https://www.jfdaily.com/news/detail?id=1081995,2026-03-16 01:38:28,自采原创
国家统计局：2月份70城商品住宅销售价格环比降幅继续收窄,https://www.jfdaily.com/news/detail?id=1082124,2026-03-16 01:35:20,转载摘编
302天蛰伏，8分钟绽放！武磊满血归来，海港有救了！,https://www.jfdaily.com/news/detail?id=1082082,2026-03-16 01:23:52,自采原创
【凝心聚力 真抓实干 奋力实现“十五五”良好开局】厚植中国式现代化民生底色,https://www.jfdaily.com/news/detail?id=1082103,2026-03-16 01:22:54,转载摘编
焦点访谈｜从产业到民生 “十五五”规划勾勒中国发展新图景,https://www.jfdaily.com/news/detail?id=1082105,2026-03-16 01:22:48,转载摘编
为中华民族永续发展筑牢法治根基,https://www.jfdaily.com/news/detail?id=1082104,2026-03-16 01:22:42,转载摘编
学习手记｜春天，种下一粒“种子”,https://www.jfdaily.com/news/detail?id=1082101,2026-03-16 01:17:53,转载摘编
足迹里的政绩观：一口水井，一种信念,https://www.jfdaily.com/news/detail?id=1082100,2026-03-16 01:17:46,转载摘编
微视频｜山海寻梦阔步行,https://www.jfdaily.com/news/detail?id=1082099,2026-03-16 01:17:38,转载摘编
吃货的天塌了！冲上热搜！山姆“断货王”不少人吃错了！网友慌了：我会有事吗,https://www.jfdaily.com/news/detail?id=1082098,2026-03-16 01:14:42,整合改编
平安银行上海分行开展“平安相伴 暖‘新’同行”金融教育宣传及公益关怀行动,https://www.jfdaily.com/news/detail?id=1082083,2026-03-16 01:14:36,广告推广
34岁中国女子泰国泳池派对上失踪，被抛尸两百公里外！与嫌疑人对话音频曝光,https://www.jfdaily.com/news/detail?id=1082094,2026-03-16 01:09:48,整合改编
帕金森患者打乒乓夺冠？徐寅生王励勤推动的这场乒乓球赛事暖流涌动,https://www.jfdaily.com/news/detail?id=1082077,2026-03-16 01:08:26,自采原创
新民场外音丨陆玮鑫：拉动F1中国站这台全城引擎，上海描绘赛事经济新图景,https://www.jfdaily.com/news/detail?id=1082084,2026-03-16 01:06:04,自采原创
土库曼斯坦民族领袖、人民委员会主席别尔德穆哈梅多夫将访华,https://www.jfdaily.com/news/detail?id=1082092,2026-03-16 01:03:42,转载摘编
伊朗新任最高领袖深夜发声！公布战报：彻底摧毁4套“萨德”！新武器首次使用,https://www.jfdaily.com/news/detail?id=1082087,2026-03-16 01:00:45,整合改编
"【演界】天才钢琴家上海返场，演绎“李斯特和他的时代""",https://www.jfdaily.com/news/detail?id=1081998,2026-03-16 00:59:01,自采原创
限速二十五，实速七八十：租赁电动自行车行业乱象被曝,https://www.jfdaily.com/news/detail?id=1082019,2026-03-16 00:58:44,自采原创
CT、核磁、B超是否有辐射？专家揭秘不同影像检查安全边界,https://www.jfdaily.com/news/detail?id=1082086,2026-03-16 00:53:48,转载摘编
今日数据精选：第一批被反噬的“养虾人”出现；游戏代打陪练职位增速283%,https://www.jfdaily.com/news/detail?id=1081989,2026-03-16 00:51:18,整合改编
太仓这场“元宇宙展览”打捞起往昔温柔岁月,https://www.jfdaily.com/news/detail?id=1081909,2026-03-16 00:44:08,自采原创
短道世锦赛｜韩国队犯规，意大利队摔出，中国男队获5000米接力银牌,https://www.jfdaily.com/news/detail?id=1082080,2026-03-16 00:36:38,自采原创
起底花钱就能办证书的“救援队”：发展下线还能拿提成,https://www.jfdaily.com/news/detail?id=1082076,2026-03-16 00:13:03,转载摘编
2026电视剧品质盛典播出，孙俪收获特别礼物，肖战解读“藏海传”,https://www.jfdaily.com/news/detail?id=1081916,2026-03-16 00:06:35,自采原创
2025年我国基本医保参保人数超13.3亿人,https://www.jfdaily.com/news/detail?id=1082075,2026-03-16 00:02:46,转载摘编
伊朗：海湾国家成美国利益牺牲品，与伊朗的关系需“认真审视”,https://www.jfdaily.com/news/detail?id=1082074,2026-03-16 00:01:46,转载摘编
引入全生命周期管理，评价将影响去留,https://www.jfdaily.com/news/detail?id=1081704,2026-03-15 23:50:47,自采原创
处理小区纠纷务要理性，这个案例了解一下,https://www.jfdaily.com/news/detail?id=1081738,2026-03-15 23:50:06,自采原创
米兰冬残奥会中国队15金13银16铜收官，位居双榜榜首,https://www.jfdaily.com/news/detail?id=1082073,2026-03-15 23:49:55,转载摘编
国家安全机关提示：无线键盘、鼠标可能潜藏窃密风险,https://www.jfdaily.com/news/detail?id=1082072,2026-03-15 23:47:37,转载摘编
江苏一地鼓励外卖小哥反映餐饮商家问题线索，查实后发放奖金,https://www.jfdaily.com/news/detail?id=1082071,2026-03-15 23:45:48,转载摘编
上海的垃圾去哪儿了：一座超级垃圾基地的 “无废” 演算,https://www.jfdaily.com/news/detail?id=1081818,2026-03-15 23:24:05,自采原创
视频｜上海的垃圾场已经发展到这个程度了？,https://www.jfdaily.com/news/detail?id=1080928,2026-03-15 23:24:03,自采原创
靠做读书会，95后河南小伙在上海扎根，现在，他开了一家24小时书屋,https://www.jfdaily.com/news/detail?id=1080972,2026-03-15 23:23:01,自采原创
商务部新闻发言人就美贸易代表办公室宣布以“未禁止进口强迫劳动产品”为由对包括中国在内的60个经济体发起301调查答记者问,https://www.jfdaily.com/news/detail?id=1082069,2026-03-15 23:22:02,转载摘编
