title,url,time,source
上海师范大学附属普陀科技学校（筹）亮相，今年9月开始招生,https://www.jfdaily.com/news/detail?id=1085742,2026-03-23 09:00:50,自采原创
我国肥胖合并脂肪肝患者比例高达81.8%，脂肪肝可逆转，先看看腰围数字,https://www.jfdaily.com/news/detail?id=1085450,2026-03-23 09:00:24,自采原创
如何看待高市访美姿态谄媚？是否要求伊朗保证运往中国的石油安全？外交部回应,https://www.jfdaily.com/news/detail?id=1085750,2026-03-23 08:58:53,整合改编
青浦电网添“应急神器” ，首套低压互联转供装置投运，停电时长进一步压缩,https://www.jfdaily.com/news/detail?id=1085732,2026-03-23 08:58:35,自采原创
四代人的青春，被这500张大学贺年片悄悄收藏,https://www.jfdaily.com/news/detail?id=1082018,2026-03-23 08:57:16,约组外稿
美年健康与蚂蚁健康达成全面战略合作，共筑AI医疗健康新范式,https://www.jfdaily.com/news/detail?id=1085741,2026-03-23 08:55:09,自采原创
金价，大跌！老庙黄金等足金首饰，两个月跌了超300元/克,https://www.jfdaily.com/news/detail?id=1085751,2026-03-23 08:53:54,整合改编
“伏羲”入选2025年度“中国十大气象科技进展”,https://www.jfdaily.com/news/detail?id=1085740,2026-03-23 08:51:54,整合改编
深耕中国市场，grin荣获 “2026年大消费年度价值品牌” 奖项,https://www.jfdaily.com/news/detail?id=1085589,2026-03-23 08:50:55,自采原创
为什么要对成品油价格采取临时调控措施？专家解读,https://www.jfdaily.com/news/detail?id=1085754,2026-03-23 08:48:03,转载摘编
首单举报秒见效！外卖骑手“随手一拍”，这家“幽灵外卖”小吃店被全网下架,https://www.jfdaily.com/news/detail?id=1085747,2026-03-23 08:46:18,自采原创
《太平年》里官衔为何长？从治世烟火解读古代官僚制度,https://www.jfdaily.com/news/detail?id=1085562,2026-03-23 08:45:55,自采原创
发布AI生态基金、打造行业AI梦工厂……“伙伴+华为”打造AI新基建,https://www.jfdaily.com/news/detail?id=1085672,2026-03-23 08:43:19,自采原创
致学生2死14伤，张某广（男，49岁）被控制！当地通报,https://www.jfdaily.com/news/detail?id=1085716,2026-03-23 08:40:40,整合改编
沈嘉禄：糟熘塘片,https://www.jfdaily.com/news/detail?id=1085539,2026-03-23 08:40:08,自采原创
牛斌：春野即事,https://www.jfdaily.com/news/detail?id=1085546,2026-03-23 08:39:49,自采原创
十日谈·“老马路”变迁 | 孔明珠：总长五百米的著名小马路,https://www.jfdaily.com/news/detail?id=1085551,2026-03-23 08:39:11,自采原创
“三高一疹” 联防联治，构建健康老龄化新思路,https://www.jfdaily.com/news/detail?id=1085624,2026-03-23 08:39:02,自采原创
他们为何为这位荷兰摄影师开了一场“追思会”？,https://www.jfdaily.com/news/detail?id=1085723,2026-03-23 08:36:18,自采原创
查清华：古典诗学体制与现代人文情怀——林在勇诗词曲自选集读后,https://www.jfdaily.com/news/detail?id=1085725,2026-03-23 08:34:40,约组外稿
中国政府中东问题特使就中东局势向中外媒体吹风,https://www.jfdaily.com/news/detail?id=1085739,2026-03-23 08:29:12,转载摘编
上海发布儿童友好城市新“三年行动方案”，专家解读：要可感、可触、可及！,https://www.jfdaily.com/news/detail?id=1085687,2026-03-23 08:26:19,自采原创
习近平在河北雄安新区考察,https://www.jfdaily.com/news/detail?id=1085734,2026-03-23 08:24:20,转载摘编
停薪数周、数百人辞职、机场或将关闭，美国国土安全部“停摆”如何收场？,https://www.jfdaily.com/news/detail?id=1085595,2026-03-23 08:18:30,自采原创
上海气象抢出“黄金时间”，去年强对流预通报平均提前4小时20分钟,https://www.jfdaily.com/news/detail?id=1085177,2026-03-23 08:17:30,自采原创
虹口区将打造上海排水治理样本,https://www.jfdaily.com/news/detail?id=1085556,2026-03-23 08:15:46,自采原创
花粉过敏真正“元凶”不是桃花也不是樱花？！这份花粉过敏防护手册请收好,https://www.jfdaily.com/news/detail?id=1085706,2026-03-23 08:14:11,自采原创
习近平致电祝贺通伦当选连任老挝国家主席,https://www.jfdaily.com/news/detail?id=1085728,2026-03-23 08:13:14,转载摘编
十几人同住一个屋檐下，年轻人为啥想住“共居社区”？,https://www.jfdaily.com/news/detail?id=1085339,2026-03-23 08:06:49,自采原创
以色列遇袭后内塔尼亚胡最新发声，伊朗警告采取4项“惩罚性”措施,https://www.jfdaily.com/news/detail?id=1085722,2026-03-23 08:03:20,整合改编
春夜观星指南,https://www.jfdaily.com/news/detail?id=1085718,2026-03-23 08:00:29,转载摘编
国家知识产权局：严厉打击违法违规代理行为，集中整治不规范执业行为,https://www.jfdaily.com/news/detail?id=1085719,2026-03-23 07:59:21,转载摘编
在春日市集体验“医疗+旅游”，上海这家医院打造主题睦邻健康新场景,https://www.jfdaily.com/news/detail?id=1084960,2026-03-23 07:56:31,自采原创
“妙粹灵通Ⅲ——巨建伟绘画作品展”在荣宝斋当代艺术馆举办,https://www.jfdaily.com/news/detail?id=1085713,2026-03-23 07:51:39,转载摘编
小区公共收益为何倒欠物业74万元,https://www.jfdaily.com/news/detail?id=1085667,2026-03-23 07:46:20,自采原创
上海女子欠银行188元不知情，19年后差点买不了房,https://www.jfdaily.com/news/detail?id=1085623,2026-03-23 07:46:08,自采原创
外交部：如果中东战事持续扩大，整个地区将陷入不可收拾的局面,https://www.jfdaily.com/news/detail?id=1085710,2026-03-23 07:43:25,转载摘编
外交部回应高市访美：美日发展双边关系不应针对第三国或损害他国利益,https://www.jfdaily.com/news/detail?id=1085711,2026-03-23 07:42:39,转载摘编
覆盖6种血清型！全球首款六价轮状疫苗在上海开始接种，宝宝张嘴就搞定,https://www.jfdaily.com/news/detail?id=1085604,2026-03-23 07:36:09,自采原创
静安发布支持外资总部转型“静八条”，系统构建外资转型静安模式,https://www.jfdaily.com/news/detail?id=1085342,2026-03-23 07:36:04,自采原创
赋能“一人公司”，阿里全国首个国际OPC社区落地闵行新虹,https://www.jfdaily.com/news/detail?id=1084979,2026-03-23 07:30:36,自采原创
男子在上海遇到奇葩网约车，车内挂满玉石出售，网友：万一气囊弹出后果很严重,https://www.jfdaily.com/news/detail?id=1085688,2026-03-23 07:29:08,整合改编
文汇海报 | 人机共创，走向下一个创新时代,https://www.jfdaily.com/news/detail?id=1085686,2026-03-23 07:21:12,自采原创
国家发展改革委对国内成品油价格采取临时调控措施,https://www.jfdaily.com/news/detail?id=1085664,2026-03-23 07:06:31,转载摘编
贵州赫章：驾驶人张某广（男，49岁）被控制,https://www.jfdaily.com/news/detail?id=1085665,2026-03-23 07:05:48,转载摘编
亚毫米级精度！中国首创智能化骨折复位手术机器人亮相中关村,https://www.jfdaily.com/news/detail?id=1085626,2026-03-23 07:02:48,自采原创
国内金价跌破1000元每克，上金所发布通知,https://www.jfdaily.com/news/detail?id=1085653,2026-03-23 06:59:18,转载摘编
伊朗喊话特朗普：你被解雇了！嘲讽美国与以色列军队为“屡战屡败的懦夫”,https://www.jfdaily.com/news/detail?id=1085659,2026-03-23 06:57:42,整合改编
深视频|加速集结！美考虑地面行动夺取伊朗哈尔克岛,https://www.jfdaily.com/news/detail?id=1085645,2026-03-23 06:54:19,自采原创
G1503绕城高速外圈两车事故 一辆厢式货车侧翻两人被撞,https://www.jfdaily.com/news/detail?id=1085622,2026-03-23 06:53:56,自采原创
“秒回”之困？“小蜜蜂”之争？请把边界与自主权还给教师 | 锋面评论,https://www.jfdaily.com/news/detail?id=1085640,2026-03-23 06:53:27,自采原创
中国驻以色列大使馆再次发文提醒：在以中国公民尽快撤离,https://www.jfdaily.com/news/detail?id=1085650,2026-03-23 06:52:05,转载摘编
东航最新回应“MU5128航班起火”，此前有网友称“突然出现刺鼻焦糊味”,https://www.jfdaily.com/news/detail?id=1085639,2026-03-23 06:39:42,整合改编
梅姨案细节公布！每交易一名儿童收1000元介绍费，网传照片都非本人,https://www.jfdaily.com/news/detail?id=1085642,2026-03-23 06:39:16,整合改编
重要转折！美以伊战事处于“失控边缘”？,https://www.jfdaily.com/news/detail?id=1085641,2026-03-23 06:37:47,转载摘编
盐城淮剧再登国家大剧院,https://www.jfdaily.com/news/detail?id=1085560,2026-03-23 06:32:29,整合改编
距一大会址仅200米，这处“国保”明起开放！走进毛泽东、董必武住过的房间,https://www.jfdaily.com/news/detail?id=1085620,2026-03-23 06:31:15,自采原创
中东地缘政治危机下黄金为何大跌,https://www.jfdaily.com/news/detail?id=1085635,2026-03-23 06:28:00,转载摘编
“上观碰碰头·秋秋不睡午觉”：聊聊上海的养老,https://www.jfdaily.com/news/detail?id=1085634,2026-03-23 06:27:37,自采原创
北京飞上海航班客舱发生火情！东航：旅客手机掉落座椅缝隙，受挤压冒烟起燃,https://www.jfdaily.com/news/detail?id=1085632,2026-03-23 06:21:15,自采原创
