title,url,time,source
购物有优惠酒店还能升级，上生·新所里的这个戏剧节拉满假期“氛围感”,https://www.jfdaily.com/news/detail?id=1102115,2026-04-24 13:48:47,自采原创
沪上知名主持人们又一次合作这件事：以声韵演绎城市文脉,https://www.jfdaily.com/news/detail?id=1102317,2026-04-24 13:48:38,自采原创
百年来全球仅120人当选，这名上海医生做到了，他开拓的手术造福万千患者,https://www.jfdaily.com/news/detail?id=1102431,2026-04-24 13:48:35,自采原创
专家素人齐聚上海读书节，新大众文艺热潮中共享书香,https://www.jfdaily.com/news/detail?id=1102121,2026-04-24 13:48:21,自采原创
福建海警位金门附近海域依法开展常态执法巡查,https://www.jfdaily.com/news/detail?id=1102451,2026-04-24 13:48:06,转载摘编
以“情感共鸣”抵达“在一起”，这场当代艺术展诠释浦东新大众文艺生动图景,https://www.jfdaily.com/news/detail?id=1102442,2026-04-24 13:47:53,自采原创
“重返”4500年前历史现场，解锁金字塔建造之谜,https://www.jfdaily.com/news/detail?id=1102438,2026-04-24 13:47:28,自采原创
东风二号甲导弹变成了秒针！一块“上海定制”腕表镌刻“独家记忆”,https://www.jfdaily.com/news/detail?id=1102123,2026-04-24 13:47:28,自采原创
以“情感共鸣”抵达“在一起”，第三届当代艺术展在浦东开幕,https://www.jfdaily.com/news/detail?id=1102446,2026-04-24 13:46:45,自采原创
探索“传统水墨当代化”，上海市文史馆馆员书画系列丛书再添新作,https://www.jfdaily.com/news/detail?id=1101867,2026-04-24 13:46:42,自采原创
上次是姚明时代！23连胜收官CBA常规赛，上海久事男篮剑指总冠军？,https://www.jfdaily.com/news/detail?id=1102450,2026-04-24 13:43:56,自采原创
6岁男孩夜间打鼾竟是咽旁长了肿瘤，复旦儿科医生微创切除拳头大罕见畸胎瘤,https://www.jfdaily.com/news/detail?id=1102112,2026-04-24 13:43:35,自采原创
16岁少女心跳飙至223次/分，东方医院医生凭两个动作紧急“刹车”,https://www.jfdaily.com/news/detail?id=1102126,2026-04-24 13:43:25,自采原创
从课本走向历史现场，这场沉浸式读书会在红色场馆举行,https://www.jfdaily.com/news/detail?id=1102429,2026-04-24 13:36:35,自采原创
50年前，他踢了我一脚,https://www.jfdaily.com/news/detail?id=1102418,2026-04-24 13:36:23,自采原创
CBA常规赛收官，上海大鲨鱼勇夺23连胜，追平24年前纪录,https://www.jfdaily.com/news/detail?id=1102439,2026-04-24 13:34:44,自采原创
拼创意、比口碑，嘉定咖啡文化节堪比“文化展示大会”,https://www.jfdaily.com/news/detail?id=1102359,2026-04-24 13:32:06,自采原创
慈善“入圈”又“入心”！关注一老一小，让慈善走进家庭,https://www.jfdaily.com/news/detail?id=1102433,2026-04-24 13:31:54,自采原创
第十一个“中国航天日”，上海“金牌火箭”成功发射一颗重要卫星,https://www.jfdaily.com/news/detail?id=1102235,2026-04-24 13:27:24,自采原创
展现中华大家庭灿烂文化，“璀璨56——民族艺术珠宝展”在沪举办,https://www.jfdaily.com/news/detail?id=1102373,2026-04-24 13:24:31,自采原创
伊朗外长将前往伊斯兰堡、马斯喀特和莫斯科,https://www.jfdaily.com/news/detail?id=1102435,2026-04-24 13:18:35,转载摘编
上海外摆特色区域超过500处，规范商户营业额提升20%以上,https://www.jfdaily.com/news/detail?id=1102392,2026-04-24 13:18:26,自采原创
五天2.42亿元，上海国际花卉节把赏花流量变成经济增量,https://www.jfdaily.com/news/detail?id=1102331,2026-04-24 13:16:33,自采原创
为赚2000元流水酬劳被骗135万，嘉定警方捣毁购房诈骗团伙,https://www.jfdaily.com/news/detail?id=1102273,2026-04-24 13:16:20,自采原创
上观时评｜“一人食”兴起，餐饮业准备好了吗？,https://www.jfdaily.com/news/detail?id=1102390,2026-04-24 13:15:16,自采原创
十年间他们走遍山河大川，只为重新发现山水,https://www.jfdaily.com/news/detail?id=1100722,2026-04-24 13:13:59,约组外稿
累计追回1700余万！嘉定检察亮出三年“知产保护成绩单”,https://www.jfdaily.com/news/detail?id=1102394,2026-04-24 13:12:29,自采原创
超万张环球美食消费券来了！静安推出美洲风情嘉年华与比利时精酿啤酒节,https://www.jfdaily.com/news/detail?id=1102427,2026-04-24 13:11:15,自采原创
春日限定萌宠上线，浦东文明养宠主题活动举办,https://www.jfdaily.com/news/detail?id=1102430,2026-04-24 13:09:41,自采原创
涉案3000万！盗版《灌篮高手》等手办团伙覆灭,https://www.jfdaily.com/news/detail?id=1102421,2026-04-24 13:09:09,自采原创
全国首位！上海海关2025年查扣侵权商品4900余批,https://www.jfdaily.com/news/detail?id=1102405,2026-04-24 13:06:52,自采原创
让老字号“潮”起来！上海国企品牌焕新释放消费新活力,https://www.jfdaily.com/news/detail?id=1102426,2026-04-24 13:00:48,自采原创
第34届白玉兰戏剧奖揭晓，于佩尔江珊等获主角奖，韩秀一谭一梅等获配角奖,https://www.jfdaily.com/news/detail?id=1102400,2026-04-24 13:00:01,自采原创
进一步促进全民阅读，上海要做这些事,https://www.jfdaily.com/news/detail?id=1102106,2026-04-24 12:59:45,自采原创
中国政府中东问题特使翟隽会见印度外交部秘书马尔霍特拉,https://www.jfdaily.com/news/detail?id=1102424,2026-04-24 12:58:13,转载摘编
美军在中东摆出三航母阵形！特朗普突然感叹：这世界疯了,https://www.jfdaily.com/news/detail?id=1102389,2026-04-24 12:57:31,整合改编
事发一立体车库！一声巨响，宝马车突然坠落侧翻，四脚朝天,https://www.jfdaily.com/news/detail?id=1102386,2026-04-24 12:57:21,整合改编
浦东“青创15条”全面升级：青年人才居住创业福利更多更优,https://www.jfdaily.com/news/detail?id=1102422,2026-04-24 12:55:50,自采原创
伤愈逆转前澳网冠军赢开门红，郑钦文马德里试剑，法网之路能否重续惊喜？,https://www.jfdaily.com/news/detail?id=1102384,2026-04-24 12:55:03,自采原创
联动全城，2026上海国际咖啡文化节30日热力开启,https://www.jfdaily.com/news/detail?id=1102408,2026-04-24 12:54:49,自采原创
制造业稳、新动能强、消费升温，增值税发票数据透视一季度上海经济,https://www.jfdaily.com/news/detail?id=1102397,2026-04-24 12:54:13,自采原创
海报荐读｜上海科学家找到阿尔茨海默病认知损伤开关；从三尺讲台到开办公益图书馆，一位年近八旬老人的书香公益路,https://www.jfdaily.com/news/detail?id=1102395,2026-04-24 12:49:53,自采原创
人形机器人马拉松从遥控走向自主，“具身时空大脑”成幕后英雄,https://www.jfdaily.com/news/detail?id=1102336,2026-04-24 12:44:14,自采原创
给融媒体留言反映问题也管用，这个“许愿回音壁”满100期,https://www.jfdaily.com/news/detail?id=1102379,2026-04-24 12:44:03,自采原创
还能顺手做公益，金山直采草莓番茄“直通”静安办公楼下,https://www.jfdaily.com/news/detail?id=1102396,2026-04-24 12:43:37,自采原创
再现奥尼尔笔下理想与现实的矛盾，人艺新剧《天边外》直击当代人困境,https://www.jfdaily.com/news/detail?id=1102361,2026-04-24 12:39:46,自采原创
第34届上海白玉兰戏剧表演艺术奖揭晓，伊莎贝拉·于佩尔、江珊等人获主角奖,https://www.jfdaily.com/news/detail?id=1102230,2026-04-24 12:35:55,自采原创
昆剧全本《牡丹亭》获中国版权金奖，上海版权工作乘风破浪,https://www.jfdaily.com/news/detail?id=1102370,2026-04-24 12:35:31,自采原创
联合国前秘书长潘基文出席“上海论坛”，透露两段鲜为人知的往事,https://www.jfdaily.com/news/detail?id=1102351,2026-04-24 12:34:15,自采原创
文学名著改编成电影为何“难”？听戴锦华、双雪涛对谈文学与影像的转换,https://www.jfdaily.com/news/detail?id=1102236,2026-04-24 12:33:52,自采原创
假冒渴望、爱肯拿宠物粮流入市场，松江警方侦破百万大案,https://www.jfdaily.com/news/detail?id=1102251,2026-04-24 12:30:15,自采原创
胡廷楣：走城墙,https://www.jfdaily.com/news/detail?id=1101944,2026-04-24 12:30:03,自采原创
巴基斯坦媒体：美国代表团或将于明日抵达伊斯兰堡,https://www.jfdaily.com/news/detail?id=1102399,2026-04-24 12:29:21,转载摘编
联合国亚太经社会宣布明年年会在中国上海举行,https://www.jfdaily.com/news/detail?id=1102398,2026-04-24 12:28:49,转载摘编
对剧本杀、密室逃脱等展开调研后，闵行一群高中生的“建议”变成了“法条”,https://www.jfdaily.com/news/detail?id=1102109,2026-04-24 12:28:41,自采原创
松江消防验收与开业检查“一次办成”，实现“验收即发证”,https://www.jfdaily.com/news/detail?id=1102311,2026-04-24 12:28:29,自采原创
嘉兴路街道发布五项街区治理重点项目，“我嘉市集”焕新季启动,https://www.jfdaily.com/news/detail?id=1102322,2026-04-24 12:20:49,自采原创
76岁内塔尼亚胡患癌！特地推迟公布，以避开“战争高峰期”，曾做过多个手术,https://www.jfdaily.com/news/detail?id=1102387,2026-04-24 12:13:37,整合改编
出险真能赔(含黑客入侵)！全国首批具身智能保险理赔落地，单机保费只要……,https://www.jfdaily.com/news/detail?id=1102383,2026-04-24 12:11:50,自采原创
OPC好工具+1！天鹜科技发布对话式蛋白质研发智能体，湿实验“个人可用”,https://www.jfdaily.com/news/detail?id=1101788,2026-04-24 12:11:41,自采原创
