title,url,time,source
小陆家嘴更新规划启动公示，将在商务功能基础上大幅拓展文旅、商业、休闲功能,https://www.jfdaily.com/news/detail?id=1140801,2026-07-07 14:29:08,自采原创
这部爽剧戳中教师痛点！没有“教权局”的现实世界如何守住教育底线？,https://www.jfdaily.com/news/detail?id=1140310,2026-07-07 14:26:54,自采原创
无人“超级科研工厂”落沪，直播AI做科研！科研OPC时代来了！,https://www.jfdaily.com/news/detail?id=1140773,2026-07-07 14:26:41,自采原创
建设国际一流再保险中心，上海迎来重磅政策支持,https://www.jfdaily.com/news/detail?id=1140770,2026-07-07 14:25:41,自采原创
【演界】黯声合唱团亚洲首秀惊艳沪上,https://www.jfdaily.com/news/detail?id=1140796,2026-07-07 14:18:38,自采原创
天路二十载，复兴正当时,https://www.jfdaily.com/news/detail?id=1140815,2026-07-07 14:17:30,转载摘编
两岸青年以科技为桥  携手创未来（两岸观察）,https://www.jfdaily.com/news/detail?id=1140816,2026-07-07 14:17:24,转载摘编
视频丨日本学者：日本应正视侵略历史 返还中国文物,https://www.jfdaily.com/news/detail?id=1140813,2026-07-07 14:16:06,转载摘编
高市早苗政府“再军事化”动作频频，引发日本国内强烈批评,https://www.jfdaily.com/news/detail?id=1140812,2026-07-07 14:16:00,转载摘编
视频丨日本扩军逆流敲响亚太和平警钟,https://www.jfdaily.com/news/detail?id=1140814,2026-07-07 14:15:53,转载摘编
全球瞭望丨卢旺达媒体：中国减贫经验启迪非洲,https://www.jfdaily.com/news/detail?id=1140808,2026-07-07 14:13:30,转载摘编
国际人士盛赞“中国之治”：赋能全球共同繁荣,https://www.jfdaily.com/news/detail?id=1140809,2026-07-07 14:13:24,转载摘编
数字光影复原乾隆花园胜景！“归心一园”光影展在国图启幕,https://www.jfdaily.com/news/detail?id=1140782,2026-07-07 14:02:45,自采原创
为什么《太平年》之后，我们还需要一部《吴越国》？,https://www.jfdaily.com/news/detail?id=1140497,2026-07-07 13:58:21,约组外稿
上海大歌剧院开幕演季发布，史依弘许忠张国勇余隆等大咖“安利”了哪些剧目？,https://www.jfdaily.com/news/detail?id=1140794,2026-07-07 13:53:01,自采原创
靠“保险费”实施诈骗！警惕以高薪招工为幌子的诈骗手段,https://www.jfdaily.com/news/detail?id=1140792,2026-07-07 13:51:59,转载摘编
快看视频 | 刚访完欧洲，又奔赴亚太三国：莫迪“四处出击”有何考量？,https://www.jfdaily.com/news/detail?id=1140778,2026-07-07 13:42:40,自采原创
上海火车站地区党群服务站揭牌，为全市铁路客运枢纽首个综合性服务阵地,https://www.jfdaily.com/news/detail?id=1140741,2026-07-07 13:36:36,自采原创
“美莎克”为何给广西带来持续强降雨？中国气象局回应,https://www.jfdaily.com/news/detail?id=1140779,2026-07-07 13:36:32,自采原创
长三角692支队伍三轮角逐！少年开发者训练AI完成真实任务,https://www.jfdaily.com/news/detail?id=1140772,2026-07-07 13:30:04,自采原创
海报荐读｜年轻人发论文，卡在哪里？高度老龄化彭浦新村为何吸引2000名青年扎根？,https://www.jfdaily.com/news/detail?id=1140694,2026-07-07 13:23:34,自采原创
共享单车围城、医院门口堵成“一锅粥”？北京“变”出停车空间破解出行痛点,https://www.jfdaily.com/news/detail?id=1140728,2026-07-07 13:21:58,自采原创
判了！法国极右翼女强人可以戴罪参选，再续总统梦？,https://www.jfdaily.com/news/detail?id=1140505,2026-07-07 13:10:20,自采原创
深度 | 告别外交舒适区，莫迪六天三国落子印太，印度“东进”走到哪一步？,https://www.jfdaily.com/news/detail?id=1140683,2026-07-07 13:03:35,自采原创
提炼“新善治128工作法”，今年上海最大旧改项目跑出加速度,https://www.jfdaily.com/news/detail?id=1140769,2026-07-07 13:02:51,自采原创
直击广西横州救灾一线！受影响群众安全转移 “水上+空中”打通物资通道,https://www.jfdaily.com/news/detail?id=1140767,2026-07-07 12:58:24,转载摘编
教育强国建设开新局见实效（“十五五”开好局起好步）,https://www.jfdaily.com/news/detail?id=1140765,2026-07-07 12:58:16,转载摘编
视频丨踏寻红色足迹 各地开展“七七事变”89周年纪念活动,https://www.jfdaily.com/news/detail?id=1140766,2026-07-07 12:58:09,转载摘编
国防部就中国海军组织潜射战略导弹试射答记者问,https://www.jfdaily.com/news/detail?id=1140763,2026-07-07 12:55:38,转载摘编
“救援途中确实看到蛇”，广西被淹村屯最新情况：医院有完备抗蛇毒血清储备,https://www.jfdaily.com/news/detail?id=1140750,2026-07-07 12:54:13,整合改编
证监会对安某编造传播涉中公教育虚假信息立案调查,https://www.jfdaily.com/news/detail?id=1140762,2026-07-07 12:50:14,转载摘编
市场监管总局：上半年整治“内卷式”竞争共对7家电商平台罚款35.97亿元,https://www.jfdaily.com/news/detail?id=1140699,2026-07-07 12:43:34,自采原创
北京细化55项平台“反内卷”情形，出台外卖平台10条硬举措,https://www.jfdaily.com/news/detail?id=1140700,2026-07-07 12:43:24,自采原创
出梅首日高温高湿来袭，上海郊区已有老人突发重症中暑入院,https://www.jfdaily.com/news/detail?id=1140739,2026-07-07 12:41:39,自采原创
广西强降雨已致6人死亡11人失联，已紧急转移安置13万人,https://www.jfdaily.com/news/detail?id=1140754,2026-07-07 12:38:48,转载摘编
“哈兰德食谱”，靠谱吗？,https://www.jfdaily.com/news/detail?id=1140751,2026-07-07 12:37:06,转载摘编
全市铁路客运枢纽首个！上海火车站地区党群服务站揭牌,https://www.jfdaily.com/news/detail?id=1140743,2026-07-07 12:37:02,自采原创
《文汇报》“笔会”创刊80周年，未忘初心风华正茂！,https://www.jfdaily.com/news/detail?id=1140717,2026-07-07 12:36:32,自采原创
把生产线搬进校园，推动学生与企业“双向选择”,https://www.jfdaily.com/news/detail?id=1140627,2026-07-07 12:36:18,自采原创
安排！京剧大师请台胞看电影,https://www.jfdaily.com/news/detail?id=1140637,2026-07-07 12:36:05,自采原创
半导体硅片进入新一轮涨价周期：板块集体走强，多家公司回应价格走势,https://www.jfdaily.com/news/detail?id=1140748,2026-07-07 12:33:17,转载摘编
破解研发周期长等难题，上海发布国内首个零人工介入物质科学“智能研发工厂”,https://www.jfdaily.com/news/detail?id=1140643,2026-07-07 12:32:05,自采原创
科普｜流脑与麦加朝觐：一场信仰与细菌的交锋,https://www.jfdaily.com/news/detail?id=1139696,2026-07-07 12:31:39,约组外稿
危急时刻，公交驾驶员挺身扑救路上火情,https://www.jfdaily.com/news/detail?id=1140510,2026-07-07 12:30:43,自采原创
夏令热线 副市长接电 千园之城 如何“全龄友好”,https://www.jfdaily.com/news/detail?id=1140685,2026-07-07 12:29:58,自采原创
第三十四届新民晚报夏令热线 新民直播,https://www.jfdaily.com/news/detail?id=1140545,2026-07-07 12:29:50,自采原创
自己起诉自己？上海这场消极循环官司怎么判,https://www.jfdaily.com/news/detail?id=1140690,2026-07-07 12:29:46,自采原创
夏令热线 副市长接电 毕业来沪 如何申请保租房,https://www.jfdaily.com/news/detail?id=1140688,2026-07-07 12:29:43,自采原创
夏令热线 副市长接电 台风来袭 道路如何不积水,https://www.jfdaily.com/news/detail?id=1140689,2026-07-07 12:29:37,自采原创
业界最大规模超节点华为Atlas 950真机将亮相2026WAIC,https://www.jfdaily.com/news/detail?id=1140540,2026-07-07 12:28:48,自采原创
上观时评丨浙大注册“求是鹰”，给企业的版权保护上了一课,https://www.jfdaily.com/news/detail?id=1140711,2026-07-07 12:26:46,自采原创
《繁花》等4000余部影视作品遭境外平台侵权，“幽灵抗辩”如何击破,https://www.jfdaily.com/news/detail?id=1140704,2026-07-07 12:26:35,自采原创
上海暴雨夜：老夫妇摔车，店家、保安、外卖小哥合力施救！背后有段唏嘘故事…,https://www.jfdaily.com/news/detail?id=1140698,2026-07-07 12:25:30,整合改编
“你喝的茉莉奶绿泡在洪水中”，广西茉莉花农受损严重：下半年可能无花可摘,https://www.jfdaily.com/news/detail?id=1140695,2026-07-07 12:25:20,整合改编
上海一独居老人全身赤裸在楼道晃！两年来儿子只管饭不照料，居委：背后有原因,https://www.jfdaily.com/news/detail?id=1140696,2026-07-07 12:25:10,整合改编
文章为刃，原创话剧《一张报纸的抗战》聚焦抗战时期报人群像,https://www.jfdaily.com/news/detail?id=1140731,2026-07-07 12:21:04,自采原创
泽普县精品网纹瓜丰产，借力上海援疆销往香港及海外,https://www.jfdaily.com/news/detail?id=1140715,2026-07-07 12:13:49,转载摘编
上海援疆筑梦绿茵场，足球特色教育焕发新活力,https://www.jfdaily.com/news/detail?id=1140710,2026-07-07 12:13:29,转载摘编
“闵·泽”同心全民放歌，“超级村声·唱响泽普”群众K歌大赛落幕,https://www.jfdaily.com/news/detail?id=1140712,2026-07-07 12:13:18,转载摘编
国际魔术界大咖来沪，与国内新秀一对一“实战训练”,https://www.jfdaily.com/news/detail?id=1140261,2026-07-07 12:12:49,自采原创
